Sheet: Descripción
A1: Título | B1: Cálculo de filtro pi
A2: Autor | B2: Gustavo V. Diaz
A3: Referencia | B3: Principios de electrotécnia 2 (Strajov)
A4: Capítulo | B4: 2
A5: Fecha | B5: 2020-05-21
A7: Objetivo 1 | B7: Primer cálculo de filtro pi para aplicar en circuito de sensado de velocidad
A8: Requerimientos | B8: Disminuir ruido por acople de línea (50 Hz)
A10: f0 | B10: 50 | C10: Hz
A11: Zomáx | B11: of:=12/0.001 -> 12000 | C11: Ohms
A12: Zomin | B12: of:=12/0.02 -> 600 | C12: Ohms
A15: Objetivo 2 | B15: Primer cálculo de filtro T para aplicar en circuito de sensado de velocidad
A16: Requerimientos | B16: Disminuir ruido por acople de línea (50 Hz)
A18: f0 | B18: 50 | C18: Hz
A19: Zomáx | B19: 12000 | C19: Ohms
A20: Zomin | B20: 600 | C20: Ohms

Sheet: Cálculo L y C filtro pi
A1: Cálculos para circuito pi
A3: Para impedancia mínima
A5: LC | B5: of:=POWER(2/(2*PI()*[$Descripción.B10]);2) -> 0.0000405284734569351 | C5: x
A6: L/C | B6: of:=POWER([$Descripción.B12];2) -> 360000 | C6: y
A8: C | B8: of:=SQRT([.B5]/[.B6]) -> 0.0000106103295394597 | C8: of:=[.B8]/2 -> 0.00000530516476972985
A9: L | B9: of:=[.B5]/[.B8] -> 3.81971863420549 | C9: of:=[.B9]/2 -> 1.90985931710274
A10: L | B10: of:=[.B6]*[.B8] -> 3.81971863420549
A12: Para impedancia máxima
A14: LC | B14: of:=POWER(2/(2*PI()*[$Descripción.B10]);2) -> 0.0000405284734569351 | C14: x
A15: L/C | B15: of:=POWER([$Descripción.B11];2) -> 144000000 | C15: y
A17: C | B17: of:=SQRT([.B14]/[.B15]) -> 0.000000530516476972985
A18: L | B18: of:=[.B14]/[.B17] -> 76.3943726841098
B19: of:=[.B15]*[.B17] -> 76.3943726841098

Sheet: Curvas de valores filtro pi
A1: Curvas de salida
A3: Frecuencia (Hz) | B3: Pulsación | C3: w/w0 | D3: Impedancia mínima | E3: Impedancia máxima
A4: 1 | B4: of:=2*PI()*[.A4] -> 6.28318530717959 | C4: of:=[.B4]/(2*PI()*[$Descripción.B$10]) -> 0.02 | D4: of:=POWER(IMABS(IMSQRT(1-POWER([.C4];2)));-1)*SQRT([$'Cálculo L y C filtro pi'.B$9]/[$'Cálculo L y C filtro pi'.B$8]) -> 600.120036012004 | E4: of:=POWER(IMABS(IMSQRT(1-POWER([.C4];2)));-1)*SQRT([$'Cálculo L y C filtro pi'.B$18]/[$'Cálculo L y C filtro pi'.B$17]) -> 12002.4007202401
A5: 2 | B5: of:=2*PI()*[.A5] -> 12.5663706143592 | C5: of:=[.B5]/(2*PI()*[$Descripción.B$10]) -> 0.0400000000000001 | D5: of:=POWER(IMABS(IMSQRT(1-POWER([.C5];2)));-1)*SQRT([$'Cálculo L y C filtro pi'.B$9]/[$'Cálculo L y C filtro pi'.B$8]) -> 600.480576769077 | E5: of:=POWER(IMABS(IMSQRT(1-POWER([.C5];2)));-1)*SQRT([$'Cálculo L y C filtro pi'.B$18]/[$'Cálculo L y C filtro pi'.B$17]) -> 12009.6115353815
A6: 3 | B6: of:=2*PI()*[.A6] -> 18.8495559215388 | C6: of:=[.B6]/(2*PI()*[$Descripción.B$10]) -> 0.0600000000000001 | D6: of:=POWER(IMABS(IMSQRT(1-POWER([.C6];2)));-1)*SQRT([$'Cálculo L y C filtro pi'.B$9]/[$'Cálculo L y C filtro pi'.B$8]) -> 601.082924775646 | E6: of:=POWER(IMABS(IMSQRT(1-POWER([.C6];2)));-1)*SQRT([$'Cálculo L y C filtro pi'.B$18]/[$'Cálculo L y C filtro pi'.B$17]) -> 12021.6584955129
A7: 4 | B7: of:=2*PI()*[.A7] -> 25.1327412287183 | C7: of:=[.B7]/(2*PI()*[$Descripción.B$10]) -> 0.0799999999999999 | D7: of:=POWER(IMABS(IMSQRT(1-POWER([.C7];2)));-1)*SQRT([$'Cálculo L y C filtro pi'.B$9]/[$'Cálculo L y C filtro pi'.B$8]) -> 601.929265428846 | E7: of:=POWER(IMABS(IMSQRT(1-POWER([.C7];2)));-1)*SQRT([$'Cálculo L y C filtro pi'.B$18]/[$'Cálculo L y C filtro pi'.B$17]) -> 12038.5853085769
A8: 5 | B8: of:=2*PI()*[.A8] -> 31.4159265358979 | C8: of:=[.B8]/(2*PI()*[$Descripción.B$10]) -> 0.0999999999999999 | D8: of:=POWER(IMABS(IMSQRT(1-POWER([.C8];2)));-1)*SQRT([$'Cálculo L y C filtro pi'.B$9]/[$'Cálculo L y C filtro pi'.B$8]) -> 603.022689155527 | E8: of:=POWER(IMABS(IMSQRT(1-POWER([.C8];2)));-1)*SQRT([$'Cálculo L y C filtro pi'.B$18]/[$'Cálculo L y C filtro pi'.B$17]) -> 12060.4537831105
A9: 6 | B9: of:=2*PI()*[.A9] -> 37.6991118430775 | C9: of:=[.B9]/(2*PI()*[$Descripción.B$10]) -> 0.12 | D9: of:=POWER(IMABS(IMSQRT(1-POWER([.C9];2)));-1)*SQRT([$'Cálculo L y C filtro pi'.B$9]/[$'Cálculo L y C filtro pi'.B$8]) -> 604.367223019036 | E9: of:=POWER(IMABS(IMSQRT(1-POWER([.C9];2)));-1)*SQRT([$'Cálculo L y C filtro pi'.B$18]/[$'Cálculo L y C filtro pi'.B$17]) -> 12087.3444603807
A10: 7 | B10: of:=2*PI()*[.A10] -> 43.9822971502571 | C10: of:=[.B10]/(2*PI()*[$Descripción.B$10]) -> 0.14 | D10: of:=POWER(IMABS(IMSQRT(1-POWER([.C10];2)));-1)*SQRT([$'Cálculo L y C filtro pi'.B$9]/[$'Cálculo L y C filtro pi'.B$8]) -> 605.967872435083 | E10: of:=POWER(IMABS(IMSQRT(1-POWER([.C10];2)));-1)*SQRT([$'Cálculo L y C filtro pi'.B$18]/[$'Cálculo L y C filtro pi'.B$17]) -> 12119.3574487017
A11: 8 | B11: of:=2*PI()*[.A11] -> 50.2654824574367 | C11: of:=[.B11]/(2*PI()*[$Descripción.B$10]) -> 0.16 | D11: of:=POWER(IMABS(IMSQRT(1-POWER([.C11];2)));-1)*SQRT([$'Cálculo L y C filtro pi'.B$9]/[$'Cálculo L y C filtro pi'.B$8]) -> 607.830673854831 | E11: of:=POWER(IMABS(IMSQRT(1-POWER([.C11];2)));-1)*SQRT([$'Cálculo L y C filtro pi'.B$18]/[$'Cálculo L y C filtro pi'.B$17]) -> 12156.6134770966
A12: 9 | B12: of:=2*PI()*[.A12] -> 56.5486677646163 | C12: of:=[.B12]/(2*PI()*[$Descripción.B$10]) -> 0.18 | D12: of:=POWER(IMABS(IMSQRT(1-POWER([.C12];2)));-1)*SQRT([$'Cálculo L y C filtro pi'.B$9]/[$'Cálculo L y C filtro pi'.B$8]) -> 609.962759521684 | E12: of:=POWER(IMABS(IMSQRT(1-POWER([.C12];2)));-1)*SQRT([$'Cálculo L y C filtro pi'.B$18]/[$'Cálculo L y C filtro pi'.B$17]) -> 12199.2551904337
A13: 10 | B13: of:=2*PI()*[.A13] -> 62.8318530717959 | C13: of:=[.B13]/(2*PI()*[$Descripción.B$10]) -> 0.2 | D13: of:=POWER(IMABS(IMSQRT(1-POWER([.C13];2)));-1)*SQRT([$'Cálculo L y C filtro pi'.B$9]/[$'Cálculo L y C filtro pi'.B$8]) -> 612.372435695795 | E13: of:=POWER(IMABS(IMSQRT(1-POWER([.C13];2)));-1)*SQRT([$'Cálculo L y C filtro pi'.B$18]/[$'Cálculo L y C filtro pi'.B$17]) -> 12247.4487139159
A14: 11 | B14: of:=2*PI()*[.A14] -> 69.1150383789754 | C14: of:=[.B14]/(2*PI()*[$Descripción.B$10]) -> 0.22 | D14: of:=POWER(IMABS(IMSQRT(1-POWER([.C14];2)));-1)*SQRT([$'Cálculo L y C filtro pi'.B$9]/[$'Cálculo L y C filtro pi'.B$8]) -> 615.069276078547 | E14: of:=POWER(IMABS(IMSQRT(1-POWER([.C14];2)));-1)*SQRT([$'Cálculo L y C filtro pi'.B$18]/[$'Cálculo L y C filtro pi'.B$17]) -> 12301.3855215709
A15: 12 | B15: of:=2*PI()*[.A15] -> 75.398223686155 | C15: of:=[.B15]/(2*PI()*[$Descripción.B$10]) -> 0.24 | D15: of:=POWER(IMABS(IMSQRT(1-POWER([.C15];2)));-1)*SQRT([$'Cálculo L y C filtro pi'.B$9]/[$'Cálculo L y C filtro pi'.B$8]) -> 618.064232572747 | E15: of:=POWER(IMABS(IMSQRT(1-POWER([.C15];2)));-1)*SQRT([$'Cálculo L y C filtro pi'.B$18]/[$'Cálculo L y C filtro pi'.B$17]) -> 12361.2846514549
A16: 13 | B16: of:=2*PI()*[.A16] -> 81.6814089933346 | C16: of:=[.B16]/(2*PI()*[$Descripción.B$10]) -> 0.26 | D16: of:=POWER(IMABS(IMSQRT(1-POWER([.C16];2)));-1)*SQRT([$'Cálculo L y C filtro pi'.B$9]/[$'Cálculo L y C filtro pi'.B$8]) -> 621.3697660012 | E16: of:=POWER(IMABS(IMSQRT(1-POWER([.C16];2)));-1)*SQRT([$'Cálculo L y C filtro pi'.B$18]/[$'Cálculo L y C filtro pi'.B$17]) -> 12427.395320024
A17: 14 | B17: of:=2*PI()*[.A17] -> 87.9645943005142 | C17: of:=[.B17]/(2*PI()*[$Descripción.B$10]) -> 0.28 | D17: of:=POWER(IMABS(IMSQRT(1-POWER([.C17];2)));-1)*SQRT([$'Cálculo L y C filtro pi'.B$9]/[$'Cálculo L y C filtro pi'.B$8]) -> 625 | E17: of:=POWER(IMABS(IMSQRT(1-POWER([.C17];2)));-1)*SQRT([$'Cálculo L y C filtro pi'.B$18]/[$'Cálculo L y C filtro pi'.B$17]) -> 12500
A18: 15 | B18: of:=2*PI()*[.A18] -> 94.2477796076938 | C18: of:=[.B18]/(2*PI()*[$Descripción.B$10]) -> 0.3 | D18: of:=POWER(IMABS(IMSQRT(1-POWER([.C18];2)));-1)*SQRT([$'Cálculo L y C filtro pi'.B$9]/[$'Cálculo L y C filtro pi'.B$8]) -> 628.970902033151 | E18: of:=POWER(IMABS(IMSQRT(1-POWER([.C18];2)));-1)*SQRT([$'Cálculo L y C filtro pi'.B$18]/[$'Cálculo L y C filtro pi'.B$17]) -> 12579.418040663
A19: 16 | B19: of:=2*PI()*[.A19] -> 100.530964914873 | C19: of:=[.B19]/(2*PI()*[$Descripción.B$10]) -> 0.319999999999999 | D19: of:=POWER(IMABS(IMSQRT(1-POWER([.C19];2)));-1)*SQRT([$'Cálculo L y C filtro pi'.B$9]/[$'Cálculo L y C filtro pi'.B$8]) -> 633.300496381124 | E19: of:=POWER(IMABS(IMSQRT(1-POWER([.C19];2)));-1)*SQRT([$'Cálculo L y C filtro pi'.B$18]/[$'Cálculo L y C filtro pi'.B$17]) -> 12666.0099276225
A20: 17 | B20: of:=2*PI()*[.A20] -> 106.814150222053 | C20: of:=[.B20]/(2*PI()*[$Descripción.B$10]) -> 0.34 | D20: of:=POWER(IMABS(IMSQRT(1-POWER([.C20];2)));-1)*SQRT([$'Cálculo L y C filtro pi'.B$9]/[$'Cálculo L y C filtro pi'.B$8]) -> 638.00911508867 | E20: of:=POWER(IMABS(IMSQRT(1-POWER([.C20];2)));-1)*SQRT([$'Cálculo L y C filtro pi'.B$18]/[$'Cálculo L y C filtro pi'.B$17]) -> 12760.1823017734
A21: 18 | B21: of:=2*PI()*[.A21] -> 113.097335529233 | C21: of:=[.B21]/(2*PI()*[$Descripción.B$10]) -> 0.360000000000001 | D21: of:=POWER(IMABS(IMSQRT(1-POWER([.C21];2)));-1)*SQRT([$'Cálculo L y C filtro pi'.B$9]/[$'Cálculo L y C filtro pi'.B$8]) -> 643.119694284409 | E21: of:=POWER(IMABS(IMSQRT(1-POWER([.C21];2)));-1)*SQRT([$'Cálculo L y C filtro pi'.B$18]/[$'Cálculo L y C filtro pi'.B$17]) -> 12862.3938856882
A22: 19 | B22: of:=2*PI()*[.A22] -> 119.380520836412 | C22: of:=[.B22]/(2*PI()*[$Descripción.B$10]) -> 0.38 | D22: of:=POWER(IMABS(IMSQRT(1-POWER([.C22];2)));-1)*SQRT([$'Cálculo L y C filtro pi'.B$9]/[$'Cálculo L y C filtro pi'.B$8]) -> 648.658125096616 | E22: of:=POWER(IMABS(IMSQRT(1-POWER([.C22];2)));-1)*SQRT([$'Cálculo L y C filtro pi'.B$18]/[$'Cálculo L y C filtro pi'.B$17]) -> 12973.1625019323
A23: 20 | B23: of:=2*PI()*[.A23] -> 125.663706143592 | C23: of:=[.B23]/(2*PI()*[$Descripción.B$10]) -> 0.400000000000001 | D23: of:=POWER(IMABS(IMSQRT(1-POWER([.C23];2)));-1)*SQRT([$'Cálculo L y C filtro pi'.B$9]/[$'Cálculo L y C filtro pi'.B$8]) -> 654.653670707978 | E23: of:=POWER(IMABS(IMSQRT(1-POWER([.C23];2)));-1)*SQRT([$'Cálculo L y C filtro pi'.B$18]/[$'Cálculo L y C filtro pi'.B$17]) -> 13093.0734141596
A24: 21 | B24: of:=2*PI()*[.A24] -> 131.946891450771 | C24: of:=[.B24]/(2*PI()*[$Descripción.B$10]) -> 0.419999999999999 | D24: of:=POWER(IMABS(IMSQRT(1-POWER([.C24];2)));-1)*SQRT([$'Cálculo L y C filtro pi'.B$9]/[$'Cálculo L y C filtro pi'.B$8]) -> 661.139464081889 | E24: of:=POWER(IMABS(IMSQRT(1-POWER([.C24];2)));-1)*SQRT([$'Cálculo L y C filtro pi'.B$18]/[$'Cálculo L y C filtro pi'.B$17]) -> 13222.7892816378
A25: 22 | B25: of:=2*PI()*[.A25] -> 138.230076757951 | C25: of:=[.B25]/(2*PI()*[$Descripción.B$10]) -> 0.44 | D25: of:=POWER(IMABS(IMSQRT(1-POWER([.C25];2)));-1)*SQRT([$'Cálculo L y C filtro pi'.B$9]/[$'Cálculo L y C filtro pi'.B$8]) -> 668.153104781061 | E25: of:=POWER(IMABS(IMSQRT(1-POWER([.C25];2)));-1)*SQRT([$'Cálculo L y C filtro pi'.B$18]/[$'Cálculo L y C filtro pi'.B$17]) -> 13363.0620956212
A26: 23 | B26: of:=2*PI()*[.A26] -> 144.51326206513 | C26: of:=[.B26]/(2*PI()*[$Descripción.B$10]) -> 0.459999999999998 | D26: of:=POWER(IMABS(IMSQRT(1-POWER([.C26];2)));-1)*SQRT([$'Cálculo L y C filtro pi'.B$9]/[$'Cálculo L y C filtro pi'.B$8]) -> 675.737378399485 | E26: of:=POWER(IMABS(IMSQRT(1-POWER([.C26];2)));-1)*SQRT([$'Cálculo L y C filtro pi'.B$18]/[$'Cálculo L y C filtro pi'.B$17]) -> 13514.7475679897
A27: 24 | B27: of:=2*PI()*[.A27] -> 150.79644737231 | C27: of:=[.B27]/(2*PI()*[$Descripción.B$10]) -> 0.48 | D27: of:=POWER(IMABS(IMSQRT(1-POWER([.C27];2)));-1)*SQRT([$'Cálculo L y C filtro pi'.B$9]/[$'Cálculo L y C filtro pi'.B$8]) -> 683.94112888133 | E27: of:=POWER(IMABS(IMSQRT(1-POWER([.C27];2)));-1)*SQRT([$'Cálculo L y C filtro pi'.B$18]/[$'Cálculo L y C filtro pi'.B$17]) -> 13678.8225776266
A28: 25 | B28: of:=2*PI()*[.A28] -> 157.07963267949 | C28: of:=[.B28]/(2*PI()*[$Descripción.B$10]) -> 0.500000000000001 | D28: of:=POWER(IMABS(IMSQRT(1-POWER([.C28];2)));-1)*SQRT([$'Cálculo L y C filtro pi'.B$9]/[$'Cálculo L y C filtro pi'.B$8]) -> 692.820323027551 | E28: of:=POWER(IMABS(IMSQRT(1-POWER([.C28];2)));-1)*SQRT([$'Cálculo L y C filtro pi'.B$18]/[$'Cálculo L y C filtro pi'.B$17]) -> 13856.406460551
A29: 26 | B29: of:=2*PI()*[.A29] -> 163.362817986669 | C29: of:=[.B29]/(2*PI()*[$Descripción.B$10]) -> 0.519999999999999 | D29: of:=POWER(IMABS(IMSQRT(1-POWER([.C29];2)));-1)*SQRT([$'Cálculo L y C filtro pi'.B$9]/[$'Cálculo L y C filtro pi'.B$8]) -> 702.43935868627 | E29: of:=POWER(IMABS(IMSQRT(1-POWER([.C29];2)));-1)*SQRT([$'Cálculo L y C filtro pi'.B$18]/[$'Cálculo L y C filtro pi'.B$17]) -> 14048.7871737254
A30: 27 | B30: of:=2*PI()*[.A30] -> 169.646003293849 | C30: of:=[.B30]/(2*PI()*[$Descripción.B$10]) -> 0.540000000000001 | D30: of:=POWER(IMABS(IMSQRT(1-POWER([.C30];2)));-1)*SQRT([$'Cálculo L y C filtro pi'.B$9]/[$'Cálculo L y C filtro pi'.B$8]) -> 712.872684782637 | E30: of:=POWER(IMABS(IMSQRT(1-POWER([.C30];2)));-1)*SQRT([$'Cálculo L y C filtro pi'.B$18]/[$'Cálculo L y C filtro pi'.B$17]) -> 14257.4536956527
A31: 28 | B31: of:=2*PI()*[.A31] -> 175.929188601028 | C31: of:=[.B31]/(2*PI()*[$Descripción.B$10]) -> 0.559999999999999 | D31: of:=POWER(IMABS(IMSQRT(1-POWER([.C31];2)));-1)*SQRT([$'Cálculo L y C filtro pi'.B$9]/[$'Cálculo L y C filtro pi'.B$8]) -> 724.206824377901 | E31: of:=POWER(IMABS(IMSQRT(1-POWER([.C31];2)));-1)*SQRT([$'Cálculo L y C filtro pi'.B$18]/[$'Cálculo L y C filtro pi'.B$17]) -> 14484.136487558
A32: 29 | B32: of:=2*PI()*[.A32] -> 182.212373908208 | C32: of:=[.B32]/(2*PI()*[$Descripción.B$10]) -> 0.58 | D32: of:=POWER(IMABS(IMSQRT(1-POWER([.C32];2)));-1)*SQRT([$'Cálculo L y C filtro pi'.B$9]/[$'Cálculo L y C filtro pi'.B$8]) -> 736.542924210355 | E32: of:=POWER(IMABS(IMSQRT(1-POWER([.C32];2)));-1)*SQRT([$'Cálculo L y C filtro pi'.B$18]/[$'Cálculo L y C filtro pi'.B$17]) -> 14730.8584842071
A33: 30 | B33: of:=2*PI()*[.A33] -> 188.495559215388 | C33: of:=[.B33]/(2*PI()*[$Descripción.B$10]) -> 0.600000000000001 | D33: of:=POWER(IMABS(IMSQRT(1-POWER([.C33];2)));-1)*SQRT([$'Cálculo L y C filtro pi'.B$9]/[$'Cálculo L y C filtro pi'.B$8]) -> 750.000000000001 | E33: of:=POWER(IMABS(IMSQRT(1-POWER([.C33];2)));-1)*SQRT([$'Cálculo L y C filtro pi'.B$18]/[$'Cálculo L y C filtro pi'.B$17]) -> 15000
A34: 31 | B34: of:=2*PI()*[.A34] -> 194.778744522567 | C34: of:=[.B34]/(2*PI()*[$Descripción.B$10]) -> 0.619999999999999 | D34: of:=POWER(IMABS(IMSQRT(1-POWER([.C34];2)));-1)*SQRT([$'Cálculo L y C filtro pi'.B$9]/[$'Cálculo L y C filtro pi'.B$8]) -> 764.719112901872 | E34: of:=POWER(IMABS(IMSQRT(1-POWER([.C34];2)));-1)*SQRT([$'Cálculo L y C filtro pi'.B$18]/[$'Cálculo L y C filtro pi'.B$17]) -> 15294.3822580374
A35: 32 | B35: of:=2*PI()*[.A35] -> 201.061929829747 | C35: of:=[.B35]/(2*PI()*[$Descripción.B$10]) -> 0.640000000000001 | D35: of:=POWER(IMABS(IMSQRT(1-POWER([.C35];2)));-1)*SQRT([$'Cálculo L y C filtro pi'.B$9]/[$'Cálculo L y C filtro pi'.B$8]) -> 780.868809443031 | E35: of:=POWER(IMABS(IMSQRT(1-POWER([.C35];2)));-1)*SQRT([$'Cálculo L y C filtro pi'.B$18]/[$'Cálculo L y C filtro pi'.B$17]) -> 15617.3761888606
A36: 33 | B36: of:=2*PI()*[.A36] -> 207.345115136926 | C36: of:=[.B36]/(2*PI()*[$Descripción.B$10]) -> 0.659999999999999 | D36: of:=POWER(IMABS(IMSQRT(1-POWER([.C36];2)));-1)*SQRT([$'Cálculo L y C filtro pi'.B$9]/[$'Cálculo L y C filtro pi'.B$8]) -> 798.652302097502 | E36: of:=POWER(IMABS(IMSQRT(1-POWER([.C36];2)));-1)*SQRT([$'Cálculo L y C filtro pi'.B$18]/[$'Cálculo L y C filtro pi'.B$17]) -> 15973.04604195
A37: 34 | B37: of:=2*PI()*[.A37] -> 213.628300444106 | C37: of:=[.B37]/(2*PI()*[$Descripción.B$10]) -> 0.68 | D37: of:=POWER(IMABS(IMSQRT(1-POWER([.C37];2)));-1)*SQRT([$'Cálculo L y C filtro pi'.B$9]/[$'Cálculo L y C filtro pi'.B$8]) -> 818.317088384972 | E37: of:=POWER(IMABS(IMSQRT(1-POWER([.C37];2)));-1)*SQRT([$'Cálculo L y C filtro pi'.B$18]/[$'Cálculo L y C filtro pi'.B$17]) -> 16366.3417676994
A38: 35 | B38: of:=2*PI()*[.A38] -> 219.911485751286 | C38: of:=[.B38]/(2*PI()*[$Descripción.B$10]) -> 0.700000000000002 | D38: of:=POWER(IMABS(IMSQRT(1-POWER([.C38];2)));-1)*SQRT([$'Cálculo L y C filtro pi'.B$9]/[$'Cálculo L y C filtro pi'.B$8]) -> 840.168050416807 | E38: of:=POWER(IMABS(IMSQRT(1-POWER([.C38];2)));-1)*SQRT([$'Cálculo L y C filtro pi'.B$18]/[$'Cálculo L y C filtro pi'.B$17]) -> 16803.3610083361
A39: 36 | B39: of:=2*PI()*[.A39] -> 226.194671058465 | C39: of:=[.B39]/(2*PI()*[$Descripción.B$10]) -> 0.72 | D39: of:=POWER(IMABS(IMSQRT(1-POWER([.C39];2)));-1)*SQRT([$'Cálculo L y C filtro pi'.B$9]/[$'Cálculo L y C filtro pi'.B$8]) -> 864.585626556352 | E39: of:=POWER(IMABS(IMSQRT(1-POWER([.C39];2)));-1)*SQRT([$'Cálculo L y C filtro pi'.B$18]/[$'Cálculo L y C filtro pi'.B$17]) -> 17291.712531127
A40: 37 | B40: of:=2*PI()*[.A40] -> 232.477856365645 | C40: of:=[.B40]/(2*PI()*[$Descripción.B$10]) -> 0.740000000000001 | D40: of:=POWER(IMABS(IMSQRT(1-POWER([.C40];2)));-1)*SQRT([$'Cálculo L y C filtro pi'.B$9]/[$'Cálculo L y C filtro pi'.B$8]) -> 892.051550175079 | E40: of:=POWER(IMABS(IMSQRT(1-POWER([.C40];2)));-1)*SQRT([$'Cálculo L y C filtro pi'.B$18]/[$'Cálculo L y C filtro pi'.B$17]) -> 17841.0310035016
A41: 38 | B41: of:=2*PI()*[.A41] -> 238.761041672824 | C41: of:=[.B41]/(2*PI()*[$Descripción.B$10]) -> 0.759999999999999 | D41: of:=POWER(IMABS(IMSQRT(1-POWER([.C41];2)));-1)*SQRT([$'Cálculo L y C filtro pi'.B$9]/[$'Cálculo L y C filtro pi'.B$8]) -> 923.186182344993 | E41: of:=POWER(IMABS(IMSQRT(1-POWER([.C41];2)));-1)*SQRT([$'Cálculo L y C filtro pi'.B$18]/[$'Cálculo L y C filtro pi'.B$17]) -> 18463.7236468999
A42: 39 | B42: of:=2*PI()*[.A42] -> 245.044226980004 | C42: of:=[.B42]/(2*PI()*[$Descripción.B$10]) -> 0.78 | D42: of:=POWER(IMABS(IMSQRT(1-POWER([.C42];2)));-1)*SQRT([$'Cálculo L y C filtro pi'.B$9]/[$'Cálculo L y C filtro pi'.B$8]) -> 958.80415815089 | E42: of:=POWER(IMABS(IMSQRT(1-POWER([.C42];2)));-1)*SQRT([$'Cálculo L y C filtro pi'.B$18]/[$'Cálculo L y C filtro pi'.B$17]) -> 19176.0831630178
A43: 40 | B43: of:=2*PI()*[.A43] -> 251.327412287183 | C43: of:=[.B43]/(2*PI()*[$Descripción.B$10]) -> 0.799999999999999 | D43: of:=POWER(IMABS(IMSQRT(1-POWER([.C43];2)));-1)*SQRT([$'Cálculo L y C filtro pi'.B$9]/[$'Cálculo L y C filtro pi'.B$8]) -> 999.999999999997 | E43: of:=POWER(IMABS(IMSQRT(1-POWER([.C43];2)));-1)*SQRT([$'Cálculo L y C filtro pi'.B$18]/[$'Cálculo L y C filtro pi'.B$17]) -> 19999.9999999999
A44: 41 | B44: of:=2*PI()*[.A44] -> 257.610597594363 | C44: of:=[.B44]/(2*PI()*[$Descripción.B$10]) -> 0.82 | D44: of:=POWER(IMABS(IMSQRT(1-POWER([.C44];2)));-1)*SQRT([$'Cálculo L y C filtro pi'.B$9]/[$'Cálculo L y C filtro pi'.B$8]) -> 1048.28483672192 | E44: of:=POWER(IMABS(IMSQRT(1-POWER([.C44];2)));-1)*SQRT([$'Cálculo L y C filtro pi'.B$18]/[$'Cálculo L y C filtro pi'.B$17]) -> 20965.6967344384
A45: 42 | B45: of:=2*PI()*[.A45] -> 263.893782901543 | C45: of:=[.B45]/(2*PI()*[$Descripción.B$10]) -> 0.840000000000001 | D45: of:=POWER(IMABS(IMSQRT(1-POWER([.C45];2)));-1)*SQRT([$'Cálculo L y C filtro pi'.B$9]/[$'Cálculo L y C filtro pi'.B$8]) -> 1105.81467116173 | E45: of:=POWER(IMABS(IMSQRT(1-POWER([.C45];2)));-1)*SQRT([$'Cálculo L y C filtro pi'.B$18]/[$'Cálculo L y C filtro pi'.B$17]) -> 22116.2934232346
A46: 43 | B46: of:=2*PI()*[.A46] -> 270.176968208722 | C46: of:=[.B46]/(2*PI()*[$Descripción.B$10]) -> 0.859999999999999 | D46: of:=POWER(IMABS(IMSQRT(1-POWER([.C46];2)));-1)*SQRT([$'Cálculo L y C filtro pi'.B$9]/[$'Cálculo L y C filtro pi'.B$8]) -> 1175.79270250443 | E46: of:=POWER(IMABS(IMSQRT(1-POWER([.C46];2)));-1)*SQRT([$'Cálculo L y C filtro pi'.B$18]/[$'Cálculo L y C filtro pi'.B$17]) -> 23515.8540500886
A47: 44 | B47: of:=2*PI()*[.A47] -> 276.460153515902 | C47: of:=[.B47]/(2*PI()*[$Descripción.B$10]) -> 0.88 | D47: of:=POWER(IMABS(IMSQRT(1-POWER([.C47];2)));-1)*SQRT([$'Cálculo L y C filtro pi'.B$9]/[$'Cálculo L y C filtro pi'.B$8]) -> 1263.22788159978 | E47: of:=POWER(IMABS(IMSQRT(1-POWER([.C47];2)));-1)*SQRT([$'Cálculo L y C filtro pi'.B$18]/[$'Cálculo L y C filtro pi'.B$17]) -> 25264.5576319956
A48: 45 | B48: of:=2*PI()*[.A48] -> 282.743338823081 | C48: of:=[.B48]/(2*PI()*[$Descripción.B$10]) -> 0.899999999999999 | D48: of:=POWER(IMABS(IMSQRT(1-POWER([.C48];2)));-1)*SQRT([$'Cálculo L y C filtro pi'.B$9]/[$'Cálculo L y C filtro pi'.B$8]) -> 1376.49440322336 | E48: of:=POWER(IMABS(IMSQRT(1-POWER([.C48];2)));-1)*SQRT([$'Cálculo L y C filtro pi'.B$18]/[$'Cálculo L y C filtro pi'.B$17]) -> 27529.8880644672
A49: 46 | B49: of:=2*PI()*[.A49] -> 289.026524130261 | C49: of:=[.B49]/(2*PI()*[$Descripción.B$10]) -> 0.92 | D49: of:=POWER(IMABS(IMSQRT(1-POWER([.C49];2)));-1)*SQRT([$'Cálculo L y C filtro pi'.B$9]/[$'Cálculo L y C filtro pi'.B$8]) -> 1530.93108923949 | E49: of:=POWER(IMABS(IMSQRT(1-POWER([.C49];2)));-1)*SQRT([$'Cálculo L y C filtro pi'.B$18]/[$'Cálculo L y C filtro pi'.B$17]) -> 30618.6217847898
A50: 47 | B50: of:=2*PI()*[.A50] -> 295.309709437441 | C50: of:=[.B50]/(2*PI()*[$Descripción.B$10]) -> 0.940000000000001 | D50: of:=POWER(IMABS(IMSQRT(1-POWER([.C50];2)));-1)*SQRT([$'Cálculo L y C filtro pi'.B$9]/[$'Cálculo L y C filtro pi'.B$8]) -> 1758.63114528166 | E50: of:=POWER(IMABS(IMSQRT(1-POWER([.C50];2)));-1)*SQRT([$'Cálculo L y C filtro pi'.B$18]/[$'Cálculo L y C filtro pi'.B$17]) -> 35172.6229056332
A51: 48 | B51: of:=2*PI()*[.A51] -> 301.59289474462 | C51: of:=[.B51]/(2*PI()*[$Descripción.B$10]) -> 0.96 | D51: of:=POWER(IMABS(IMSQRT(1-POWER([.C51];2)));-1)*SQRT([$'Cálculo L y C filtro pi'.B$9]/[$'Cálculo L y C filtro pi'.B$8]) -> 2142.85714285713 | E51: of:=POWER(IMABS(IMSQRT(1-POWER([.C51];2)));-1)*SQRT([$'Cálculo L y C filtro pi'.B$18]/[$'Cálculo L y C filtro pi'.B$17]) -> 42857.1428571427
A52: 49 | B52: of:=2*PI()*[.A52] -> 307.8760800518 | C52: of:=[.B52]/(2*PI()*[$Descripción.B$10]) -> 0.980000000000001 | D52: of:=POWER(IMABS(IMSQRT(1-POWER([.C52];2)));-1)*SQRT([$'Cálculo L y C filtro pi'.B$9]/[$'Cálculo L y C filtro pi'.B$8]) -> 3015.11344577769 | E52: of:=POWER(IMABS(IMSQRT(1-POWER([.C52];2)));-1)*SQRT([$'Cálculo L y C filtro pi'.B$18]/[$'Cálculo L y C filtro pi'.B$17]) -> 60302.2689155539
A53: 50 | B53: of:=2*PI()*[.A53] -> 314.159265358979 | C53: of:=[.B53]/(2*PI()*[$Descripción.B$10]) -> 0.999999999999999 | D53: of:=POWER(IMABS(IMSQRT(1-POWER([.C53];2)));-1)*SQRT([$'Cálculo L y C filtro pi'.B$9]/[$'Cálculo L y C filtro pi'.B$8]) ->  | E53: of:=POWER(IMABS(IMSQRT(1-POWER([.C53];2)));-1)*SQRT([$'Cálculo L y C filtro pi'.B$18]/[$'Cálculo L y C filtro pi'.B$17]) -> 
A54: 51 | B54: of:=2*PI()*[.A54] -> 320.442450666159 | C54: of:=[.B54]/(2*PI()*[$Descripción.B$10]) -> 1.02 | D54: of:=POWER(IMABS(IMSQRT(1-POWER([.C54];2)));-1)*SQRT([$'Cálculo L y C filtro pi'.B$9]/[$'Cálculo L y C filtro pi'.B$8]) -> 2985.11157062995 | E54: of:=POWER(IMABS(IMSQRT(1-POWER([.C54];2)));-1)*SQRT([$'Cálculo L y C filtro pi'.B$18]/[$'Cálculo L y C filtro pi'.B$17]) -> 59702.231412599
A55: 52 | B55: of:=2*PI()*[.A55] -> 326.725635973338 | C55: of:=[.B55]/(2*PI()*[$Descripción.B$10]) -> 1.04 | D55: of:=POWER(IMABS(IMSQRT(1-POWER([.C55];2)));-1)*SQRT([$'Cálculo L y C filtro pi'.B$9]/[$'Cálculo L y C filtro pi'.B$8]) -> 2100.42012604206 | E55: of:=POWER(IMABS(IMSQRT(1-POWER([.C55];2)));-1)*SQRT([$'Cálculo L y C filtro pi'.B$18]/[$'Cálculo L y C filtro pi'.B$17]) -> 42008.4025208412
A56: 53 | B56: of:=2*PI()*[.A56] -> 333.008821280518 | C56: of:=[.B56]/(2*PI()*[$Descripción.B$10]) -> 1.06 | D56: of:=POWER(IMABS(IMSQRT(1-POWER([.C56];2)));-1)*SQRT([$'Cálculo L y C filtro pi'.B$9]/[$'Cálculo L y C filtro pi'.B$8]) -> 1706.64037196572 | E56: of:=POWER(IMABS(IMSQRT(1-POWER([.C56];2)));-1)*SQRT([$'Cálculo L y C filtro pi'.B$18]/[$'Cálculo L y C filtro pi'.B$17]) -> 34132.8074393145
A57: 54 | B57: of:=2*PI()*[.A57] -> 339.292006587698 | C57: of:=[.B57]/(2*PI()*[$Descripción.B$10]) -> 1.08 | D57: of:=POWER(IMABS(IMSQRT(1-POWER([.C57];2)));-1)*SQRT([$'Cálculo L y C filtro pi'.B$9]/[$'Cálculo L y C filtro pi'.B$8]) -> 1470.87101353637 | E57: of:=POWER(IMABS(IMSQRT(1-POWER([.C57];2)));-1)*SQRT([$'Cálculo L y C filtro pi'.B$18]/[$'Cálculo L y C filtro pi'.B$17]) -> 29417.4202707274
A58: 55 | B58: of:=2*PI()*[.A58] -> 345.575191894877 | C58: of:=[.B58]/(2*PI()*[$Descripción.B$10]) -> 1.1 | D58: of:=POWER(IMABS(IMSQRT(1-POWER([.C58];2)));-1)*SQRT([$'Cálculo L y C filtro pi'.B$9]/[$'Cálculo L y C filtro pi'.B$8]) -> 1309.30734141596 | E58: of:=POWER(IMABS(IMSQRT(1-POWER([.C58];2)));-1)*SQRT([$'Cálculo L y C filtro pi'.B$18]/[$'Cálculo L y C filtro pi'.B$17]) -> 26186.1468283192
A59: 56 | B59: of:=2*PI()*[.A59] -> 351.858377202057 | C59: of:=[.B59]/(2*PI()*[$Descripción.B$10]) -> 1.12 | D59: of:=POWER(IMABS(IMSQRT(1-POWER([.C59];2)));-1)*SQRT([$'Cálculo L y C filtro pi'.B$9]/[$'Cálculo L y C filtro pi'.B$8]) -> 1189.57737857721 | E59: of:=POWER(IMABS(IMSQRT(1-POWER([.C59];2)));-1)*SQRT([$'Cálculo L y C filtro pi'.B$18]/[$'Cálculo L y C filtro pi'.B$17]) -> 23791.5475715443
A60: 57 | B60: of:=2*PI()*[.A60] -> 358.141562509236 | C60: of:=[.B60]/(2*PI()*[$Descripción.B$10]) -> 1.14 | D60: of:=POWER(IMABS(IMSQRT(1-POWER([.C60];2)));-1)*SQRT([$'Cálculo L y C filtro pi'.B$9]/[$'Cálculo L y C filtro pi'.B$8]) -> 1096.17614286281 | E60: of:=POWER(IMABS(IMSQRT(1-POWER([.C60];2)));-1)*SQRT([$'Cálculo L y C filtro pi'.B$18]/[$'Cálculo L y C filtro pi'.B$17]) -> 21923.5228572562
A61: 58 | B61: of:=2*PI()*[.A61] -> 364.424747816416 | C61: of:=[.B61]/(2*PI()*[$Descripción.B$10]) -> 1.16 | D61: of:=POWER(IMABS(IMSQRT(1-POWER([.C61];2)));-1)*SQRT([$'Cálculo L y C filtro pi'.B$9]/[$'Cálculo L y C filtro pi'.B$8]) -> 1020.62072615966 | E61: of:=POWER(IMABS(IMSQRT(1-POWER([.C61];2)));-1)*SQRT([$'Cálculo L y C filtro pi'.B$18]/[$'Cálculo L y C filtro pi'.B$17]) -> 20412.4145231931
A62: 59 | B62: of:=2*PI()*[.A62] -> 370.707933123596 | C62: of:=[.B62]/(2*PI()*[$Descripción.B$10]) -> 1.18 | D62: of:=POWER(IMABS(IMSQRT(1-POWER([.C62];2)));-1)*SQRT([$'Cálculo L y C filtro pi'.B$9]/[$'Cálculo L y C filtro pi'.B$8]) -> 957.826285221148 | E62: of:=POWER(IMABS(IMSQRT(1-POWER([.C62];2)));-1)*SQRT([$'Cálculo L y C filtro pi'.B$18]/[$'Cálculo L y C filtro pi'.B$17]) -> 19156.525704423
A63: 60 | B63: of:=2*PI()*[.A63] -> 376.991118430775 | C63: of:=[.B63]/(2*PI()*[$Descripción.B$10]) -> 1.2 | D63: of:=POWER(IMABS(IMSQRT(1-POWER([.C63];2)));-1)*SQRT([$'Cálculo L y C filtro pi'.B$9]/[$'Cálculo L y C filtro pi'.B$8]) -> 904.534033733293 | E63: of:=POWER(IMABS(IMSQRT(1-POWER([.C63];2)));-1)*SQRT([$'Cálculo L y C filtro pi'.B$18]/[$'Cálculo L y C filtro pi'.B$17]) -> 18090.6806746659
A64: 61 | B64: of:=2*PI()*[.A64] -> 383.274303737955 | C64: of:=[.B64]/(2*PI()*[$Descripción.B$10]) -> 1.22 | D64: of:=POWER(IMABS(IMSQRT(1-POWER([.C64];2)));-1)*SQRT([$'Cálculo L y C filtro pi'.B$9]/[$'Cálculo L y C filtro pi'.B$8]) -> 858.545710548212 | E64: of:=POWER(IMABS(IMSQRT(1-POWER([.C64];2)));-1)*SQRT([$'Cálculo L y C filtro pi'.B$18]/[$'Cálculo L y C filtro pi'.B$17]) -> 17170.9142109643
A65: 62 | B65: of:=2*PI()*[.A65] -> 389.557489045134 | C65: of:=[.B65]/(2*PI()*[$Descripción.B$10]) -> 1.24 | D65: of:=POWER(IMABS(IMSQRT(1-POWER([.C65];2)));-1)*SQRT([$'Cálculo L y C filtro pi'.B$9]/[$'Cálculo L y C filtro pi'.B$8]) -> 818.317088384974 | E65: of:=POWER(IMABS(IMSQRT(1-POWER([.C65];2)));-1)*SQRT([$'Cálculo L y C filtro pi'.B$18]/[$'Cálculo L y C filtro pi'.B$17]) -> 16366.3417676995
A66: 63 | B66: of:=2*PI()*[.A66] -> 395.840674352314 | C66: of:=[.B66]/(2*PI()*[$Descripción.B$10]) -> 1.26 | D66: of:=POWER(IMABS(IMSQRT(1-POWER([.C66];2)));-1)*SQRT([$'Cálculo L y C filtro pi'.B$9]/[$'Cálculo L y C filtro pi'.B$8]) -> 782.727075428323 | E66: of:=POWER(IMABS(IMSQRT(1-POWER([.C66];2)));-1)*SQRT([$'Cálculo L y C filtro pi'.B$18]/[$'Cálculo L y C filtro pi'.B$17]) -> 15654.5415085665
A67: 64 | B67: of:=2*PI()*[.A67] -> 402.123859659494 | C67: of:=[.B67]/(2*PI()*[$Descripción.B$10]) -> 1.28 | D67: of:=POWER(IMABS(IMSQRT(1-POWER([.C67];2)));-1)*SQRT([$'Cálculo L y C filtro pi'.B$9]/[$'Cálculo L y C filtro pi'.B$8]) -> 750.939261482637 | E67: of:=POWER(IMABS(IMSQRT(1-POWER([.C67];2)));-1)*SQRT([$'Cálculo L y C filtro pi'.B$18]/[$'Cálculo L y C filtro pi'.B$17]) -> 15018.7852296527
A68: 65 | B68: of:=2*PI()*[.A68] -> 408.407044966673 | C68: of:=[.B68]/(2*PI()*[$Descripción.B$10]) -> 1.3 | D68: of:=POWER(IMABS(IMSQRT(1-POWER([.C68];2)));-1)*SQRT([$'Cálculo L y C filtro pi'.B$9]/[$'Cálculo L y C filtro pi'.B$8]) -> 722.315118514616 | E68: of:=POWER(IMABS(IMSQRT(1-POWER([.C68];2)));-1)*SQRT([$'Cálculo L y C filtro pi'.B$18]/[$'Cálculo L y C filtro pi'.B$17]) -> 14446.3023702923
A69: 66 | B69: of:=2*PI()*[.A69] -> 414.690230273853 | C69: of:=[.B69]/(2*PI()*[$Descripción.B$10]) -> 1.32 | D69: of:=POWER(IMABS(IMSQRT(1-POWER([.C69];2)));-1)*SQRT([$'Cálculo L y C filtro pi'.B$9]/[$'Cálculo L y C filtro pi'.B$8]) -> 696.357518163943 | E69: of:=POWER(IMABS(IMSQRT(1-POWER([.C69];2)));-1)*SQRT([$'Cálculo L y C filtro pi'.B$18]/[$'Cálculo L y C filtro pi'.B$17]) -> 13927.1503632789
A70: 67 | B70: of:=2*PI()*[.A70] -> 420.973415581032 | C70: of:=[.B70]/(2*PI()*[$Descripción.B$10]) -> 1.34 | D70: of:=POWER(IMABS(IMSQRT(1-POWER([.C70];2)));-1)*SQRT([$'Cálculo L y C filtro pi'.B$9]/[$'Cálculo L y C filtro pi'.B$8]) -> 672.672793996313 | E70: of:=POWER(IMABS(IMSQRT(1-POWER([.C70];2)));-1)*SQRT([$'Cálculo L y C filtro pi'.B$18]/[$'Cálculo L y C filtro pi'.B$17]) -> 13453.4558799263
A71: 68 | B71: of:=2*PI()*[.A71] -> 427.256600888212 | C71: of:=[.B71]/(2*PI()*[$Descripción.B$10]) -> 1.36 | D71: of:=POWER(IMABS(IMSQRT(1-POWER([.C71];2)));-1)*SQRT([$'Cálculo L y C filtro pi'.B$9]/[$'Cálculo L y C filtro pi'.B$8]) -> 650.944554904119 | E71: of:=POWER(IMABS(IMSQRT(1-POWER([.C71];2)));-1)*SQRT([$'Cálculo L y C filtro pi'.B$18]/[$'Cálculo L y C filtro pi'.B$17]) -> 13018.8910980824
A72: 69 | B72: of:=2*PI()*[.A72] -> 433.539786195392 | C72: of:=[.B72]/(2*PI()*[$Descripción.B$10]) -> 1.38 | D72: of:=POWER(IMABS(IMSQRT(1-POWER([.C72];2)));-1)*SQRT([$'Cálculo L y C filtro pi'.B$9]/[$'Cálculo L y C filtro pi'.B$8]) -> 630.915175301302 | E72: of:=POWER(IMABS(IMSQRT(1-POWER([.C72];2)));-1)*SQRT([$'Cálculo L y C filtro pi'.B$18]/[$'Cálculo L y C filtro pi'.B$17]) -> 12618.303506026
A73: 70 | B73: of:=2*PI()*[.A73] -> 439.822971502571 | C73: of:=[.B73]/(2*PI()*[$Descripción.B$10]) -> 1.4 | D73: of:=POWER(IMABS(IMSQRT(1-POWER([.C73];2)));-1)*SQRT([$'Cálculo L y C filtro pi'.B$9]/[$'Cálculo L y C filtro pi'.B$8]) -> 612.372435695795 | E73: of:=POWER(IMABS(IMSQRT(1-POWER([.C73];2)));-1)*SQRT([$'Cálculo L y C filtro pi'.B$18]/[$'Cálculo L y C filtro pi'.B$17]) -> 12247.4487139159
A74: 71 | B74: of:=2*PI()*[.A74] -> 446.106156809751 | C74: of:=[.B74]/(2*PI()*[$Descripción.B$10]) -> 1.42 | D74: of:=POWER(IMABS(IMSQRT(1-POWER([.C74];2)));-1)*SQRT([$'Cálculo L y C filtro pi'.B$9]/[$'Cálculo L y C filtro pi'.B$8]) -> 595.139700643618 | E74: of:=POWER(IMABS(IMSQRT(1-POWER([.C74];2)));-1)*SQRT([$'Cálculo L y C filtro pi'.B$18]/[$'Cálculo L y C filtro pi'.B$17]) -> 11902.7940128724
A75: 72 | B75: of:=2*PI()*[.A75] -> 452.38934211693 | C75: of:=[.B75]/(2*PI()*[$Descripción.B$10]) -> 1.44 | D75: of:=POWER(IMABS(IMSQRT(1-POWER([.C75];2)));-1)*SQRT([$'Cálculo L y C filtro pi'.B$9]/[$'Cálculo L y C filtro pi'.B$8]) -> 579.068577361637 | E75: of:=POWER(IMABS(IMSQRT(1-POWER([.C75];2)));-1)*SQRT([$'Cálculo L y C filtro pi'.B$18]/[$'Cálculo L y C filtro pi'.B$17]) -> 11581.3715472327
A76: 73 | B76: of:=2*PI()*[.A76] -> 458.67252742411 | C76: of:=[.B76]/(2*PI()*[$Descripción.B$10]) -> 1.46 | D76: of:=POWER(IMABS(IMSQRT(1-POWER([.C76];2)));-1)*SQRT([$'Cálculo L y C filtro pi'.B$9]/[$'Cálculo L y C filtro pi'.B$8]) -> 564.033346637207 | E76: of:=POWER(IMABS(IMSQRT(1-POWER([.C76];2)));-1)*SQRT([$'Cálculo L y C filtro pi'.B$18]/[$'Cálculo L y C filtro pi'.B$17]) -> 11280.6669327441
A77: 74 | B77: of:=2*PI()*[.A77] -> 464.955712731289 | C77: of:=[.B77]/(2*PI()*[$Descripción.B$10]) -> 1.48 | D77: of:=POWER(IMABS(IMSQRT(1-POWER([.C77];2)));-1)*SQRT([$'Cálculo L y C filtro pi'.B$9]/[$'Cálculo L y C filtro pi'.B$8]) -> 549.926681330074 | E77: of:=POWER(IMABS(IMSQRT(1-POWER([.C77];2)));-1)*SQRT([$'Cálculo L y C filtro pi'.B$18]/[$'Cálculo L y C filtro pi'.B$17]) -> 10998.5336266015
A78: 75 | B78: of:=2*PI()*[.A78] -> 471.238898038469 | C78: of:=[.B78]/(2*PI()*[$Descripción.B$10]) -> 1.5 | D78: of:=POWER(IMABS(IMSQRT(1-POWER([.C78];2)));-1)*SQRT([$'Cálculo L y C filtro pi'.B$9]/[$'Cálculo L y C filtro pi'.B$8]) -> 536.656314599952 | E78: of:=POWER(IMABS(IMSQRT(1-POWER([.C78];2)));-1)*SQRT([$'Cálculo L y C filtro pi'.B$18]/[$'Cálculo L y C filtro pi'.B$17]) -> 10733.126291999
A79: 76 | B79: of:=2*PI()*[.A79] -> 477.522083345649 | C79: of:=[.B79]/(2*PI()*[$Descripción.B$10]) -> 1.52 | D79: of:=POWER(IMABS(IMSQRT(1-POWER([.C79];2)));-1)*SQRT([$'Cálculo L y C filtro pi'.B$9]/[$'Cálculo L y C filtro pi'.B$8]) -> 524.142418360961 | E79: of:=POWER(IMABS(IMSQRT(1-POWER([.C79];2)));-1)*SQRT([$'Cálculo L y C filtro pi'.B$18]/[$'Cálculo L y C filtro pi'.B$17]) -> 10482.8483672192
A80: 77 | B80: of:=2*PI()*[.A80] -> 483.805268652828 | C80: of:=[.B80]/(2*PI()*[$Descripción.B$10]) -> 1.54 | D80: of:=POWER(IMABS(IMSQRT(1-POWER([.C80];2)));-1)*SQRT([$'Cálculo L y C filtro pi'.B$9]/[$'Cálculo L y C filtro pi'.B$8]) -> 512.315519578559 | E80: of:=POWER(IMABS(IMSQRT(1-POWER([.C80];2)));-1)*SQRT([$'Cálculo L y C filtro pi'.B$18]/[$'Cálculo L y C filtro pi'.B$17]) -> 10246.3103915712
A81: 78 | B81: of:=2*PI()*[.A81] -> 490.088453960008 | C81: of:=[.B81]/(2*PI()*[$Descripción.B$10]) -> 1.56 | D81: of:=POWER(IMABS(IMSQRT(1-POWER([.C81];2)));-1)*SQRT([$'Cálculo L y C filtro pi'.B$9]/[$'Cálculo L y C filtro pi'.B$8]) -> 501.114828585796 | E81: of:=POWER(IMABS(IMSQRT(1-POWER([.C81];2)));-1)*SQRT([$'Cálculo L y C filtro pi'.B$18]/[$'Cálculo L y C filtro pi'.B$17]) -> 10022.2965717159
A82: 79 | B82: of:=2*PI()*[.A82] -> 496.371639267187 | C82: of:=[.B82]/(2*PI()*[$Descripción.B$10]) -> 1.58 | D82: of:=POWER(IMABS(IMSQRT(1-POWER([.C82];2)));-1)*SQRT([$'Cálculo L y C filtro pi'.B$9]/[$'Cálculo L y C filtro pi'.B$8]) -> 490.486886395287 | E82: of:=POWER(IMABS(IMSQRT(1-POWER([.C82];2)));-1)*SQRT([$'Cálculo L y C filtro pi'.B$18]/[$'Cálculo L y C filtro pi'.B$17]) -> 9809.73772790573
A83: 80 | B83: of:=2*PI()*[.A83] -> 502.654824574367 | C83: of:=[.B83]/(2*PI()*[$Descripción.B$10]) -> 1.6 | D83: of:=POWER(IMABS(IMSQRT(1-POWER([.C83];2)));-1)*SQRT([$'Cálculo L y C filtro pi'.B$9]/[$'Cálculo L y C filtro pi'.B$8]) -> 480.384461415261 | E83: of:=POWER(IMABS(IMSQRT(1-POWER([.C83];2)));-1)*SQRT([$'Cálculo L y C filtro pi'.B$18]/[$'Cálculo L y C filtro pi'.B$17]) -> 9607.68922830523
A84: 81 | B84: of:=2*PI()*[.A84] -> 508.938009881546 | C84: of:=[.B84]/(2*PI()*[$Descripción.B$10]) -> 1.62 | D84: of:=POWER(IMABS(IMSQRT(1-POWER([.C84];2)));-1)*SQRT([$'Cálculo L y C filtro pi'.B$9]/[$'Cálculo L y C filtro pi'.B$8]) -> 470.765642935875 | E84: of:=POWER(IMABS(IMSQRT(1-POWER([.C84];2)));-1)*SQRT([$'Cálculo L y C filtro pi'.B$18]/[$'Cálculo L y C filtro pi'.B$17]) -> 9415.31285871749
A85: 82 | B85: of:=2*PI()*[.A85] -> 515.221195188726 | C85: of:=[.B85]/(2*PI()*[$Descripción.B$10]) -> 1.64 | D85: of:=POWER(IMABS(IMSQRT(1-POWER([.C85];2)));-1)*SQRT([$'Cálculo L y C filtro pi'.B$9]/[$'Cálculo L y C filtro pi'.B$8]) -> 461.593091172499 | E85: of:=POWER(IMABS(IMSQRT(1-POWER([.C85];2)));-1)*SQRT([$'Cálculo L y C filtro pi'.B$18]/[$'Cálculo L y C filtro pi'.B$17]) -> 9231.86182344998
A86: 83 | B86: of:=2*PI()*[.A86] -> 521.504380495906 | C86: of:=[.B86]/(2*PI()*[$Descripción.B$10]) -> 1.66 | D86: of:=POWER(IMABS(IMSQRT(1-POWER([.C86];2)));-1)*SQRT([$'Cálculo L y C filtro pi'.B$9]/[$'Cálculo L y C filtro pi'.B$8]) -> 452.833412851726 | E86: of:=POWER(IMABS(IMSQRT(1-POWER([.C86];2)));-1)*SQRT([$'Cálculo L y C filtro pi'.B$18]/[$'Cálculo L y C filtro pi'.B$17]) -> 9056.66825703453
A87: 84 | B87: of:=2*PI()*[.A87] -> 527.787565803085 | C87: of:=[.B87]/(2*PI()*[$Descripción.B$10]) -> 1.68 | D87: of:=POWER(IMABS(IMSQRT(1-POWER([.C87];2)));-1)*SQRT([$'Cálculo L y C filtro pi'.B$9]/[$'Cálculo L y C filtro pi'.B$8]) -> 444.456638209469 | E87: of:=POWER(IMABS(IMSQRT(1-POWER([.C87];2)));-1)*SQRT([$'Cálculo L y C filtro pi'.B$18]/[$'Cálculo L y C filtro pi'.B$17]) -> 8889.13276418937
A88: 85 | B88: of:=2*PI()*[.A88] -> 534.070751110265 | C88: of:=[.B88]/(2*PI()*[$Descripción.B$10]) -> 1.7 | D88: of:=POWER(IMABS(IMSQRT(1-POWER([.C88];2)));-1)*SQRT([$'Cálculo L y C filtro pi'.B$9]/[$'Cálculo L y C filtro pi'.B$8]) -> 436.435780471985 | E88: of:=POWER(IMABS(IMSQRT(1-POWER([.C88];2)));-1)*SQRT([$'Cálculo L y C filtro pi'.B$18]/[$'Cálculo L y C filtro pi'.B$17]) -> 8728.71560943971
A89: 86 | B89: of:=2*PI()*[.A89] -> 540.353936417444 | C89: of:=[.B89]/(2*PI()*[$Descripción.B$10]) -> 1.72 | D89: of:=POWER(IMABS(IMSQRT(1-POWER([.C89];2)));-1)*SQRT([$'Cálculo L y C filtro pi'.B$9]/[$'Cálculo L y C filtro pi'.B$8]) -> 428.746462856273 | E89: of:=POWER(IMABS(IMSQRT(1-POWER([.C89];2)));-1)*SQRT([$'Cálculo L y C filtro pi'.B$18]/[$'Cálculo L y C filtro pi'.B$17]) -> 8574.92925712546
A90: 87 | B90: of:=2*PI()*[.A90] -> 546.637121724624 | C90: of:=[.B90]/(2*PI()*[$Descripción.B$10]) -> 1.74 | D90: of:=POWER(IMABS(IMSQRT(1-POWER([.C90];2)));-1)*SQRT([$'Cálculo L y C filtro pi'.B$9]/[$'Cálculo L y C filtro pi'.B$8]) -> 421.366601175636 | E90: of:=POWER(IMABS(IMSQRT(1-POWER([.C90];2)));-1)*SQRT([$'Cálculo L y C filtro pi'.B$18]/[$'Cálculo L y C filtro pi'.B$17]) -> 8427.33202351273
A91: 88 | B91: of:=2*PI()*[.A91] -> 552.920307031804 | C91: of:=[.B91]/(2*PI()*[$Descripción.B$10]) -> 1.76 | D91: of:=POWER(IMABS(IMSQRT(1-POWER([.C91];2)));-1)*SQRT([$'Cálculo L y C filtro pi'.B$9]/[$'Cálculo L y C filtro pi'.B$8]) -> 414.276132499582 | E91: of:=POWER(IMABS(IMSQRT(1-POWER([.C91];2)));-1)*SQRT([$'Cálculo L y C filtro pi'.B$18]/[$'Cálculo L y C filtro pi'.B$17]) -> 8285.52264999164
A92: 89 | B92: of:=2*PI()*[.A92] -> 559.203492338983 | C92: of:=[.B92]/(2*PI()*[$Descripción.B$10]) -> 1.78 | D92: of:=POWER(IMABS(IMSQRT(1-POWER([.C92];2)));-1)*SQRT([$'Cálculo L y C filtro pi'.B$9]/[$'Cálculo L y C filtro pi'.B$8]) -> 407.456782162699 | E92: of:=POWER(IMABS(IMSQRT(1-POWER([.C92];2)));-1)*SQRT([$'Cálculo L y C filtro pi'.B$18]/[$'Cálculo L y C filtro pi'.B$17]) -> 8149.13564325398
A93: 90 | B93: of:=2*PI()*[.A93] -> 565.486677646163 | C93: of:=[.B93]/(2*PI()*[$Descripción.B$10]) -> 1.8 | D93: of:=POWER(IMABS(IMSQRT(1-POWER([.C93];2)));-1)*SQRT([$'Cálculo L y C filtro pi'.B$9]/[$'Cálculo L y C filtro pi'.B$8]) -> 400.891862868636 | E93: of:=POWER(IMABS(IMSQRT(1-POWER([.C93];2)));-1)*SQRT([$'Cálculo L y C filtro pi'.B$18]/[$'Cálculo L y C filtro pi'.B$17]) -> 8017.83725737271
A94: 91 | B94: of:=2*PI()*[.A94] -> 571.769862953342 | C94: of:=[.B94]/(2*PI()*[$Descripción.B$10]) -> 1.82 | D94: of:=POWER(IMABS(IMSQRT(1-POWER([.C94];2)));-1)*SQRT([$'Cálculo L y C filtro pi'.B$9]/[$'Cálculo L y C filtro pi'.B$8]) -> 394.566100784024 | E94: of:=POWER(IMABS(IMSQRT(1-POWER([.C94];2)));-1)*SQRT([$'Cálculo L y C filtro pi'.B$18]/[$'Cálculo L y C filtro pi'.B$17]) -> 7891.32201568048
A95: 92 | B95: of:=2*PI()*[.A95] -> 578.053048260522 | C95: of:=[.B95]/(2*PI()*[$Descripción.B$10]) -> 1.84 | D95: of:=POWER(IMABS(IMSQRT(1-POWER([.C95];2)));-1)*SQRT([$'Cálculo L y C filtro pi'.B$9]/[$'Cálculo L y C filtro pi'.B$8]) -> 388.465484432752 | E95: of:=POWER(IMABS(IMSQRT(1-POWER([.C95];2)));-1)*SQRT([$'Cálculo L y C filtro pi'.B$18]/[$'Cálculo L y C filtro pi'.B$17]) -> 7769.30968865504
A96: 93 | B96: of:=2*PI()*[.A96] -> 584.336233567702 | C96: of:=[.B96]/(2*PI()*[$Descripción.B$10]) -> 1.86 | D96: of:=POWER(IMABS(IMSQRT(1-POWER([.C96];2)));-1)*SQRT([$'Cálculo L y C filtro pi'.B$9]/[$'Cálculo L y C filtro pi'.B$8]) -> 382.577132934434 | E96: of:=POWER(IMABS(IMSQRT(1-POWER([.C96];2)));-1)*SQRT([$'Cálculo L y C filtro pi'.B$18]/[$'Cálculo L y C filtro pi'.B$17]) -> 7651.54265868869
A97: 94 | B97: of:=2*PI()*[.A97] -> 590.619418874881 | C97: of:=[.B97]/(2*PI()*[$Descripción.B$10]) -> 1.88 | D97: of:=POWER(IMABS(IMSQRT(1-POWER([.C97];2)));-1)*SQRT([$'Cálculo L y C filtro pi'.B$9]/[$'Cálculo L y C filtro pi'.B$8]) -> 376.889180722205 | E97: of:=POWER(IMABS(IMSQRT(1-POWER([.C97];2)));-1)*SQRT([$'Cálculo L y C filtro pi'.B$18]/[$'Cálculo L y C filtro pi'.B$17]) -> 7537.7836144441
A98: 95 | B98: of:=2*PI()*[.A98] -> 596.902604182061 | C98: of:=[.B98]/(2*PI()*[$Descripción.B$10]) -> 1.9 | D98: of:=POWER(IMABS(IMSQRT(1-POWER([.C98];2)));-1)*SQRT([$'Cálculo L y C filtro pi'.B$9]/[$'Cálculo L y C filtro pi'.B$8]) -> 371.390676354104 | E98: of:=POWER(IMABS(IMSQRT(1-POWER([.C98];2)));-1)*SQRT([$'Cálculo L y C filtro pi'.B$18]/[$'Cálculo L y C filtro pi'.B$17]) -> 7427.81352708208
A99: 96 | B99: of:=2*PI()*[.A99] -> 603.18578948924 | C99: of:=[.B99]/(2*PI()*[$Descripción.B$10]) -> 1.92 | D99: of:=POWER(IMABS(IMSQRT(1-POWER([.C99];2)));-1)*SQRT([$'Cálculo L y C filtro pi'.B$9]/[$'Cálculo L y C filtro pi'.B$8]) -> 366.071493422535 | E99: of:=POWER(IMABS(IMSQRT(1-POWER([.C99];2)));-1)*SQRT([$'Cálculo L y C filtro pi'.B$18]/[$'Cálculo L y C filtro pi'.B$17]) -> 7321.4298684507
A100: 97 | B100: of:=2*PI()*[.A100] -> 609.46897479642 | C100: of:=[.B100]/(2*PI()*[$Descripción.B$10]) -> 1.94 | D100: of:=POWER(IMABS(IMSQRT(1-POWER([.C100];2)));-1)*SQRT([$'Cálculo L y C filtro pi'.B$9]/[$'Cálculo L y C filtro pi'.B$8]) -> 360.922251885651 | E100: of:=POWER(IMABS(IMSQRT(1-POWER([.C100];2)));-1)*SQRT([$'Cálculo L y C filtro pi'.B$18]/[$'Cálculo L y C filtro pi'.B$17]) -> 7218.44503771301
A101: 98 | B101: of:=2*PI()*[.A101] -> 615.752160103599 | C101: of:=[.B101]/(2*PI()*[$Descripción.B$10]) -> 1.96 | D101: of:=POWER(IMABS(IMSQRT(1-POWER([.C101];2)));-1)*SQRT([$'Cálculo L y C filtro pi'.B$9]/[$'Cálculo L y C filtro pi'.B$8]) -> 355.934248407187 | E101: of:=POWER(IMABS(IMSQRT(1-POWER([.C101];2)));-1)*SQRT([$'Cálculo L y C filtro pi'.B$18]/[$'Cálculo L y C filtro pi'.B$17]) -> 7118.68496814373
A102: 99 | B102: of:=2*PI()*[.A102] -> 622.035345410779 | C102: of:=[.B102]/(2*PI()*[$Descripción.B$10]) -> 1.98 | D102: of:=POWER(IMABS(IMSQRT(1-POWER([.C102];2)));-1)*SQRT([$'Cálculo L y C filtro pi'.B$9]/[$'Cálculo L y C filtro pi'.B$8]) -> 351.09939450816 | E102: of:=POWER(IMABS(IMSQRT(1-POWER([.C102];2)));-1)*SQRT([$'Cálculo L y C filtro pi'.B$18]/[$'Cálculo L y C filtro pi'.B$17]) -> 7021.9878901632
A103: 100 | B103: of:=2*PI()*[.A103] -> 628.318530717959 | C103: of:=[.B103]/(2*PI()*[$Descripción.B$10]) -> 2 | D103: of:=POWER(IMABS(IMSQRT(1-POWER([.C103];2)));-1)*SQRT([$'Cálculo L y C filtro pi'.B$9]/[$'Cálculo L y C filtro pi'.B$8]) -> 346.410161513775 | E103: of:=POWER(IMABS(IMSQRT(1-POWER([.C103];2)));-1)*SQRT([$'Cálculo L y C filtro pi'.B$18]/[$'Cálculo L y C filtro pi'.B$17]) -> 6928.2032302755
A104: 101 | B104: of:=2*PI()*[.A104] -> 634.601716025138 | C104: of:=[.B104]/(2*PI()*[$Descripción.B$10]) -> 2.02 | D104: of:=POWER(IMABS(IMSQRT(1-POWER([.C104];2)));-1)*SQRT([$'Cálculo L y C filtro pi'.B$9]/[$'Cálculo L y C filtro pi'.B$8]) -> 341.85953142873 | E104: of:=POWER(IMABS(IMSQRT(1-POWER([.C104];2)));-1)*SQRT([$'Cálculo L y C filtro pi'.B$18]/[$'Cálculo L y C filtro pi'.B$17]) -> 6837.19062857461
A105: 102 | B105: of:=2*PI()*[.A105] -> 640.884901332318 | C105: of:=[.B105]/(2*PI()*[$Descripción.B$10]) -> 2.04 | D105: of:=POWER(IMABS(IMSQRT(1-POWER([.C105];2)));-1)*SQRT([$'Cálculo L y C filtro pi'.B$9]/[$'Cálculo L y C filtro pi'.B$8]) -> 337.440952999386 | E105: of:=POWER(IMABS(IMSQRT(1-POWER([.C105];2)));-1)*SQRT([$'Cálculo L y C filtro pi'.B$18]/[$'Cálculo L y C filtro pi'.B$17]) -> 6748.81905998771
A106: 103 | B106: of:=2*PI()*[.A106] -> 647.168086639497 | C106: of:=[.B106]/(2*PI()*[$Descripción.B$10]) -> 2.06 | D106: of:=POWER(IMABS(IMSQRT(1-POWER([.C106];2)));-1)*SQRT([$'Cálculo L y C filtro pi'.B$9]/[$'Cálculo L y C filtro pi'.B$8]) -> 333.148302326386 | E106: of:=POWER(IMABS(IMSQRT(1-POWER([.C106];2)));-1)*SQRT([$'Cálculo L y C filtro pi'.B$18]/[$'Cálculo L y C filtro pi'.B$17]) -> 6662.96604652772
A107: 104 | B107: of:=2*PI()*[.A107] -> 653.451271946677 | C107: of:=[.B107]/(2*PI()*[$Descripción.B$10]) -> 2.08 | D107: of:=POWER(IMABS(IMSQRT(1-POWER([.C107];2)));-1)*SQRT([$'Cálculo L y C filtro pi'.B$9]/[$'Cálculo L y C filtro pi'.B$8]) -> 328.975847479884 | E107: of:=POWER(IMABS(IMSQRT(1-POWER([.C107];2)));-1)*SQRT([$'Cálculo L y C filtro pi'.B$18]/[$'Cálculo L y C filtro pi'.B$17]) -> 6579.51694959769
A108: 105 | B108: of:=2*PI()*[.A108] -> 659.734457253857 | C108: of:=[.B108]/(2*PI()*[$Descripción.B$10]) -> 2.1 | D108: of:=POWER(IMABS(IMSQRT(1-POWER([.C108];2)));-1)*SQRT([$'Cálculo L y C filtro pi'.B$9]/[$'Cálculo L y C filtro pi'.B$8]) -> 324.918216644329 | E108: of:=POWER(IMABS(IMSQRT(1-POWER([.C108];2)));-1)*SQRT([$'Cálculo L y C filtro pi'.B$18]/[$'Cálculo L y C filtro pi'.B$17]) -> 6498.36433288658
A109: 106 | B109: of:=2*PI()*[.A109] -> 666.017642561036 | C109: of:=[.B109]/(2*PI()*[$Descripción.B$10]) -> 2.12 | D109: of:=POWER(IMABS(IMSQRT(1-POWER([.C109];2)));-1)*SQRT([$'Cálculo L y C filtro pi'.B$9]/[$'Cálculo L y C filtro pi'.B$8]) -> 320.970369383184 | E109: of:=POWER(IMABS(IMSQRT(1-POWER([.C109];2)));-1)*SQRT([$'Cálculo L y C filtro pi'.B$18]/[$'Cálculo L y C filtro pi'.B$17]) -> 6419.40738766369
A110: 107 | B110: of:=2*PI()*[.A110] -> 672.300827868216 | C110: of:=[.B110]/(2*PI()*[$Descripción.B$10]) -> 2.14 | D110: of:=POWER(IMABS(IMSQRT(1-POWER([.C110];2)));-1)*SQRT([$'Cálculo L y C filtro pi'.B$9]/[$'Cálculo L y C filtro pi'.B$8]) -> 317.12757066798 | E110: of:=POWER(IMABS(IMSQRT(1-POWER([.C110];2)));-1)*SQRT([$'Cálculo L y C filtro pi'.B$18]/[$'Cálculo L y C filtro pi'.B$17]) -> 6342.55141335959
A111: 108 | B111: of:=2*PI()*[.A111] -> 678.584013175395 | C111: of:=[.B111]/(2*PI()*[$Descripción.B$10]) -> 2.16 | D111: of:=POWER(IMABS(IMSQRT(1-POWER([.C111];2)));-1)*SQRT([$'Cálculo L y C filtro pi'.B$9]/[$'Cálculo L y C filtro pi'.B$8]) -> 313.385367362051 | E111: of:=POWER(IMABS(IMSQRT(1-POWER([.C111];2)));-1)*SQRT([$'Cálculo L y C filtro pi'.B$18]/[$'Cálculo L y C filtro pi'.B$17]) -> 6267.70734724103
A112: 109 | B112: of:=2*PI()*[.A112] -> 684.867198482575 | C112: of:=[.B112]/(2*PI()*[$Descripción.B$10]) -> 2.18 | D112: of:=POWER(IMABS(IMSQRT(1-POWER([.C112];2)));-1)*SQRT([$'Cálculo L y C filtro pi'.B$9]/[$'Cálculo L y C filtro pi'.B$8]) -> 309.739566888782 | E112: of:=POWER(IMABS(IMSQRT(1-POWER([.C112];2)));-1)*SQRT([$'Cálculo L y C filtro pi'.B$18]/[$'Cálculo L y C filtro pi'.B$17]) -> 6194.79133777565
A113: 110 | B113: of:=2*PI()*[.A113] -> 691.150383789755 | C113: of:=[.B113]/(2*PI()*[$Descripción.B$10]) -> 2.2 | D113: of:=POWER(IMABS(IMSQRT(1-POWER([.C113];2)));-1)*SQRT([$'Cálculo L y C filtro pi'.B$9]/[$'Cálculo L y C filtro pi'.B$8]) -> 306.186217847898 | E113: of:=POWER(IMABS(IMSQRT(1-POWER([.C113];2)));-1)*SQRT([$'Cálculo L y C filtro pi'.B$18]/[$'Cálculo L y C filtro pi'.B$17]) -> 6123.72435695795
A114: 111 | B114: of:=2*PI()*[.A114] -> 697.433569096934 | C114: of:=[.B114]/(2*PI()*[$Descripción.B$10]) -> 2.22 | D114: of:=POWER(IMABS(IMSQRT(1-POWER([.C114];2)));-1)*SQRT([$'Cálculo L y C filtro pi'.B$9]/[$'Cálculo L y C filtro pi'.B$8]) -> 302.721592372504 | E114: of:=POWER(IMABS(IMSQRT(1-POWER([.C114];2)));-1)*SQRT([$'Cálculo L y C filtro pi'.B$18]/[$'Cálculo L y C filtro pi'.B$17]) -> 6054.43184745009
A115: 112 | B115: of:=2*PI()*[.A115] -> 703.716754404114 | C115: of:=[.B115]/(2*PI()*[$Descripción.B$10]) -> 2.24 | D115: of:=POWER(IMABS(IMSQRT(1-POWER([.C115];2)));-1)*SQRT([$'Cálculo L y C filtro pi'.B$9]/[$'Cálculo L y C filtro pi'.B$8]) -> 299.342170044625 | E115: of:=POWER(IMABS(IMSQRT(1-POWER([.C115];2)));-1)*SQRT([$'Cálculo L y C filtro pi'.B$18]/[$'Cálculo L y C filtro pi'.B$17]) -> 5986.84340089249
A116: 113 | B116: of:=2*PI()*[.A116] -> 709.999939711293 | C116: of:=[.B116]/(2*PI()*[$Descripción.B$10]) -> 2.26 | D116: of:=POWER(IMABS(IMSQRT(1-POWER([.C116];2)));-1)*SQRT([$'Cálculo L y C filtro pi'.B$9]/[$'Cálculo L y C filtro pi'.B$8]) -> 296.044623208669 | E116: of:=POWER(IMABS(IMSQRT(1-POWER([.C116];2)));-1)*SQRT([$'Cálculo L y C filtro pi'.B$18]/[$'Cálculo L y C filtro pi'.B$17]) -> 5920.89246417338
A117: 114 | B117: of:=2*PI()*[.A117] -> 716.283125018473 | C117: of:=[.B117]/(2*PI()*[$Descripción.B$10]) -> 2.28 | D117: of:=POWER(IMABS(IMSQRT(1-POWER([.C117];2)));-1)*SQRT([$'Cálculo L y C filtro pi'.B$9]/[$'Cálculo L y C filtro pi'.B$8]) -> 292.825803541137 | E117: of:=POWER(IMABS(IMSQRT(1-POWER([.C117];2)));-1)*SQRT([$'Cálculo L y C filtro pi'.B$18]/[$'Cálculo L y C filtro pi'.B$17]) -> 5856.51607082273
A118: 115 | B118: of:=2*PI()*[.A118] -> 722.566310325653 | C118: of:=[.B118]/(2*PI()*[$Descripción.B$10]) -> 2.3 | D118: of:=POWER(IMABS(IMSQRT(1-POWER([.C118];2)));-1)*SQRT([$'Cálculo L y C filtro pi'.B$9]/[$'Cálculo L y C filtro pi'.B$8]) -> 289.68272975116 | E118: of:=POWER(IMABS(IMSQRT(1-POWER([.C118];2)));-1)*SQRT([$'Cálculo L y C filtro pi'.B$18]/[$'Cálculo L y C filtro pi'.B$17]) -> 5793.65459502321
A119: 116 | B119: of:=2*PI()*[.A119] -> 728.849495632832 | C119: of:=[.B119]/(2*PI()*[$Descripción.B$10]) -> 2.32 | D119: of:=POWER(IMABS(IMSQRT(1-POWER([.C119];2)));-1)*SQRT([$'Cálculo L y C filtro pi'.B$9]/[$'Cálculo L y C filtro pi'.B$8]) -> 286.612576300757 | E119: of:=POWER(IMABS(IMSQRT(1-POWER([.C119];2)));-1)*SQRT([$'Cálculo L y C filtro pi'.B$18]/[$'Cálculo L y C filtro pi'.B$17]) -> 5732.25152601514
A120: 117 | B120: of:=2*PI()*[.A120] -> 735.132680940012 | C120: of:=[.B120]/(2*PI()*[$Descripción.B$10]) -> 2.34 | D120: of:=POWER(IMABS(IMSQRT(1-POWER([.C120];2)));-1)*SQRT([$'Cálculo L y C filtro pi'.B$9]/[$'Cálculo L y C filtro pi'.B$8]) -> 283.612663046086 | E120: of:=POWER(IMABS(IMSQRT(1-POWER([.C120];2)));-1)*SQRT([$'Cálculo L y C filtro pi'.B$18]/[$'Cálculo L y C filtro pi'.B$17]) -> 5672.25326092172
A121: 118 | B121: of:=2*PI()*[.A121] -> 741.415866247191 | C121: of:=[.B121]/(2*PI()*[$Descripción.B$10]) -> 2.36 | D121: of:=POWER(IMABS(IMSQRT(1-POWER([.C121];2)));-1)*SQRT([$'Cálculo L y C filtro pi'.B$9]/[$'Cálculo L y C filtro pi'.B$8]) -> 280.68044571192 | E121: of:=POWER(IMABS(IMSQRT(1-POWER([.C121];2)));-1)*SQRT([$'Cálculo L y C filtro pi'.B$18]/[$'Cálculo L y C filtro pi'.B$17]) -> 5613.6089142384
A122: 119 | B122: of:=2*PI()*[.A122] -> 747.699051554371 | C122: of:=[.B122]/(2*PI()*[$Descripción.B$10]) -> 2.38 | D122: of:=POWER(IMABS(IMSQRT(1-POWER([.C122];2)));-1)*SQRT([$'Cálculo L y C filtro pi'.B$9]/[$'Cálculo L y C filtro pi'.B$8]) -> 277.813507121006 | E122: of:=POWER(IMABS(IMSQRT(1-POWER([.C122];2)));-1)*SQRT([$'Cálculo L y C filtro pi'.B$18]/[$'Cálculo L y C filtro pi'.B$17]) -> 5556.27014242012
A123: 120 | B123: of:=2*PI()*[.A123] -> 753.98223686155 | C123: of:=[.B123]/(2*PI()*[$Descripción.B$10]) -> 2.4 | D123: of:=POWER(IMABS(IMSQRT(1-POWER([.C123];2)));-1)*SQRT([$'Cálculo L y C filtro pi'.B$9]/[$'Cálculo L y C filtro pi'.B$8]) -> 275.009549108464 | E123: of:=POWER(IMABS(IMSQRT(1-POWER([.C123];2)));-1)*SQRT([$'Cálculo L y C filtro pi'.B$18]/[$'Cálculo L y C filtro pi'.B$17]) -> 5500.19098216928
A124: 121 | B124: of:=2*PI()*[.A124] -> 760.26542216873 | C124: of:=[.B124]/(2*PI()*[$Descripción.B$10]) -> 2.42 | D124: of:=POWER(IMABS(IMSQRT(1-POWER([.C124];2)));-1)*SQRT([$'Cálculo L y C filtro pi'.B$9]/[$'Cálculo L y C filtro pi'.B$8]) -> 272.266385058666 | E124: of:=POWER(IMABS(IMSQRT(1-POWER([.C124];2)));-1)*SQRT([$'Cálculo L y C filtro pi'.B$18]/[$'Cálculo L y C filtro pi'.B$17]) -> 5445.32770117332
A125: 122 | B125: of:=2*PI()*[.A125] -> 766.54860747591 | C125: of:=[.B125]/(2*PI()*[$Descripción.B$10]) -> 2.44 | D125: of:=POWER(IMABS(IMSQRT(1-POWER([.C125];2)));-1)*SQRT([$'Cálculo L y C filtro pi'.B$9]/[$'Cálculo L y C filtro pi'.B$8]) -> 269.581933008596 | E125: of:=POWER(IMABS(IMSQRT(1-POWER([.C125];2)));-1)*SQRT([$'Cálculo L y C filtro pi'.B$18]/[$'Cálculo L y C filtro pi'.B$17]) -> 5391.63866017192
A126: 123 | B126: of:=2*PI()*[.A126] -> 772.831792783089 | C126: of:=[.B126]/(2*PI()*[$Descripción.B$10]) -> 2.46 | D126: of:=POWER(IMABS(IMSQRT(1-POWER([.C126];2)));-1)*SQRT([$'Cálculo L y C filtro pi'.B$9]/[$'Cálculo L y C filtro pi'.B$8]) -> 266.95420926742 | E126: of:=POWER(IMABS(IMSQRT(1-POWER([.C126];2)));-1)*SQRT([$'Cálculo L y C filtro pi'.B$18]/[$'Cálculo L y C filtro pi'.B$17]) -> 5339.08418534841
A127: 124 | B127: of:=2*PI()*[.A127] -> 779.114978090269 | C127: of:=[.B127]/(2*PI()*[$Descripción.B$10]) -> 2.48 | D127: of:=POWER(IMABS(IMSQRT(1-POWER([.C127];2)));-1)*SQRT([$'Cálculo L y C filtro pi'.B$9]/[$'Cálculo L y C filtro pi'.B$8]) -> 264.381322507069 | E127: of:=POWER(IMABS(IMSQRT(1-POWER([.C127];2)));-1)*SQRT([$'Cálculo L y C filtro pi'.B$18]/[$'Cálculo L y C filtro pi'.B$17]) -> 5287.62645014138
A128: 125 | B128: of:=2*PI()*[.A128] -> 785.398163397448 | C128: of:=[.B128]/(2*PI()*[$Descripción.B$10]) -> 2.5 | D128: of:=POWER(IMABS(IMSQRT(1-POWER([.C128];2)));-1)*SQRT([$'Cálculo L y C filtro pi'.B$9]/[$'Cálculo L y C filtro pi'.B$8]) -> 261.861468283191 | E128: of:=POWER(IMABS(IMSQRT(1-POWER([.C128];2)));-1)*SQRT([$'Cálculo L y C filtro pi'.B$18]/[$'Cálculo L y C filtro pi'.B$17]) -> 5237.22936566382
A129: 126 | B129: of:=2*PI()*[.A129] -> 791.681348704628 | C129: of:=[.B129]/(2*PI()*[$Descripción.B$10]) -> 2.52 | D129: of:=POWER(IMABS(IMSQRT(1-POWER([.C129];2)));-1)*SQRT([$'Cálculo L y C filtro pi'.B$9]/[$'Cálculo L y C filtro pi'.B$8]) -> 259.392923949778 | E129: of:=POWER(IMABS(IMSQRT(1-POWER([.C129];2)));-1)*SQRT([$'Cálculo L y C filtro pi'.B$18]/[$'Cálculo L y C filtro pi'.B$17]) -> 5187.85847899557
A130: 127 | B130: of:=2*PI()*[.A130] -> 797.964534011808 | C130: of:=[.B130]/(2*PI()*[$Descripción.B$10]) -> 2.54 | D130: of:=POWER(IMABS(IMSQRT(1-POWER([.C130];2)));-1)*SQRT([$'Cálculo L y C filtro pi'.B$9]/[$'Cálculo L y C filtro pi'.B$8]) -> 256.974043934398 | E130: of:=POWER(IMABS(IMSQRT(1-POWER([.C130];2)));-1)*SQRT([$'Cálculo L y C filtro pi'.B$18]/[$'Cálculo L y C filtro pi'.B$17]) -> 5139.48087868797
A131: 128 | B131: of:=2*PI()*[.A131] -> 804.247719318987 | C131: of:=[.B131]/(2*PI()*[$Descripción.B$10]) -> 2.56 | D131: of:=POWER(IMABS(IMSQRT(1-POWER([.C131];2)));-1)*SQRT([$'Cálculo L y C filtro pi'.B$9]/[$'Cálculo L y C filtro pi'.B$8]) -> 254.603255344087 | E131: of:=POWER(IMABS(IMSQRT(1-POWER([.C131];2)));-1)*SQRT([$'Cálculo L y C filtro pi'.B$18]/[$'Cálculo L y C filtro pi'.B$17]) -> 5092.06510688174
A132: 129 | B132: of:=2*PI()*[.A132] -> 810.530904626167 | C132: of:=[.B132]/(2*PI()*[$Descripción.B$10]) -> 2.58 | D132: of:=POWER(IMABS(IMSQRT(1-POWER([.C132];2)));-1)*SQRT([$'Cálculo L y C filtro pi'.B$9]/[$'Cálculo L y C filtro pi'.B$8]) -> 252.279053874817 | E132: of:=POWER(IMABS(IMSQRT(1-POWER([.C132];2)));-1)*SQRT([$'Cálculo L y C filtro pi'.B$18]/[$'Cálculo L y C filtro pi'.B$17]) -> 5045.58107749634
A133: 130 | B133: of:=2*PI()*[.A133] -> 816.814089933346 | C133: of:=[.B133]/(2*PI()*[$Descripción.B$10]) -> 2.6 | D133: of:=POWER(IMABS(IMSQRT(1-POWER([.C133];2)));-1)*SQRT([$'Cálculo L y C filtro pi'.B$9]/[$'Cálculo L y C filtro pi'.B$8]) -> 250 | E133: of:=POWER(IMABS(IMSQRT(1-POWER([.C133];2)));-1)*SQRT([$'Cálculo L y C filtro pi'.B$18]/[$'Cálculo L y C filtro pi'.B$17]) -> 5000
A134: 131 | B134: of:=2*PI()*[.A134] -> 823.097275240526 | C134: of:=[.B134]/(2*PI()*[$Descripción.B$10]) -> 2.62 | D134: of:=POWER(IMABS(IMSQRT(1-POWER([.C134];2)));-1)*SQRT([$'Cálculo L y C filtro pi'.B$9]/[$'Cálculo L y C filtro pi'.B$8]) -> 247.764715415722 | E134: of:=POWER(IMABS(IMSQRT(1-POWER([.C134];2)));-1)*SQRT([$'Cálculo L y C filtro pi'.B$18]/[$'Cálculo L y C filtro pi'.B$17]) -> 4955.29430831444
A135: 132 | B135: of:=2*PI()*[.A135] -> 829.380460547706 | C135: of:=[.B135]/(2*PI()*[$Descripción.B$10]) -> 2.64 | D135: of:=POWER(IMABS(IMSQRT(1-POWER([.C135];2)));-1)*SQRT([$'Cálculo L y C filtro pi'.B$9]/[$'Cálculo L y C filtro pi'.B$8]) -> 245.571879722468 | E135: of:=POWER(IMABS(IMSQRT(1-POWER([.C135];2)));-1)*SQRT([$'Cálculo L y C filtro pi'.B$18]/[$'Cálculo L y C filtro pi'.B$17]) -> 4911.43759444936
A136: 133 | B136: of:=2*PI()*[.A136] -> 835.663645854885 | C136: of:=[.B136]/(2*PI()*[$Descripción.B$10]) -> 2.66 | D136: of:=POWER(IMABS(IMSQRT(1-POWER([.C136];2)));-1)*SQRT([$'Cálculo L y C filtro pi'.B$9]/[$'Cálculo L y C filtro pi'.B$8]) -> 243.420227324901 | E136: of:=POWER(IMABS(IMSQRT(1-POWER([.C136];2)));-1)*SQRT([$'Cálculo L y C filtro pi'.B$18]/[$'Cálculo L y C filtro pi'.B$17]) -> 4868.40454649802
A137: 134 | B137: of:=2*PI()*[.A137] -> 841.946831162065 | C137: of:=[.B137]/(2*PI()*[$Descripción.B$10]) -> 2.68 | D137: of:=POWER(IMABS(IMSQRT(1-POWER([.C137];2)));-1)*SQRT([$'Cálculo L y C filtro pi'.B$9]/[$'Cálculo L y C filtro pi'.B$8]) -> 241.30854453292 | E137: of:=POWER(IMABS(IMSQRT(1-POWER([.C137];2)));-1)*SQRT([$'Cálculo L y C filtro pi'.B$18]/[$'Cálculo L y C filtro pi'.B$17]) -> 4826.1708906584
A138: 135 | B138: of:=2*PI()*[.A138] -> 848.230016469244 | C138: of:=[.B138]/(2*PI()*[$Descripción.B$10]) -> 2.7 | D138: of:=POWER(IMABS(IMSQRT(1-POWER([.C138];2)));-1)*SQRT([$'Cálculo L y C filtro pi'.B$9]/[$'Cálculo L y C filtro pi'.B$8]) -> 239.23566684867 | E138: of:=POWER(IMABS(IMSQRT(1-POWER([.C138];2)));-1)*SQRT([$'Cálculo L y C filtro pi'.B$18]/[$'Cálculo L y C filtro pi'.B$17]) -> 4784.7133369734
A139: 136 | B139: of:=2*PI()*[.A139] -> 854.513201776424 | C139: of:=[.B139]/(2*PI()*[$Descripción.B$10]) -> 2.72 | D139: of:=POWER(IMABS(IMSQRT(1-POWER([.C139];2)));-1)*SQRT([$'Cálculo L y C filtro pi'.B$9]/[$'Cálculo L y C filtro pi'.B$8]) -> 237.200476425542 | E139: of:=POWER(IMABS(IMSQRT(1-POWER([.C139];2)));-1)*SQRT([$'Cálculo L y C filtro pi'.B$18]/[$'Cálculo L y C filtro pi'.B$17]) -> 4744.00952851084
A140: 137 | B140: of:=2*PI()*[.A140] -> 860.796387083603 | C140: of:=[.B140]/(2*PI()*[$Descripción.B$10]) -> 2.74 | D140: of:=POWER(IMABS(IMSQRT(1-POWER([.C140];2)));-1)*SQRT([$'Cálculo L y C filtro pi'.B$9]/[$'Cálculo L y C filtro pi'.B$8]) -> 235.201899686375 | E140: of:=POWER(IMABS(IMSQRT(1-POWER([.C140];2)));-1)*SQRT([$'Cálculo L y C filtro pi'.B$18]/[$'Cálculo L y C filtro pi'.B$17]) -> 4704.03799372751
A141: 138 | B141: of:=2*PI()*[.A141] -> 867.079572390783 | C141: of:=[.B141]/(2*PI()*[$Descripción.B$10]) -> 2.76 | D141: of:=POWER(IMABS(IMSQRT(1-POWER([.C141];2)));-1)*SQRT([$'Cálculo L y C filtro pi'.B$9]/[$'Cálculo L y C filtro pi'.B$8]) -> 233.238905089171 | E141: of:=POWER(IMABS(IMSQRT(1-POWER([.C141];2)));-1)*SQRT([$'Cálculo L y C filtro pi'.B$18]/[$'Cálculo L y C filtro pi'.B$17]) -> 4664.77810178343
A142: 139 | B142: of:=2*PI()*[.A142] -> 873.362757697963 | C142: of:=[.B142]/(2*PI()*[$Descripción.B$10]) -> 2.78 | D142: of:=POWER(IMABS(IMSQRT(1-POWER([.C142];2)));-1)*SQRT([$'Cálculo L y C filtro pi'.B$9]/[$'Cálculo L y C filtro pi'.B$8]) -> 231.310501029612 | E142: of:=POWER(IMABS(IMSQRT(1-POWER([.C142];2)));-1)*SQRT([$'Cálculo L y C filtro pi'.B$18]/[$'Cálculo L y C filtro pi'.B$17]) -> 4626.21002059224
A143: 140 | B143: of:=2*PI()*[.A143] -> 879.645943005142 | C143: of:=[.B143]/(2*PI()*[$Descripción.B$10]) -> 2.8 | D143: of:=POWER(IMABS(IMSQRT(1-POWER([.C143];2)));-1)*SQRT([$'Cálculo L y C filtro pi'.B$9]/[$'Cálculo L y C filtro pi'.B$8]) -> 229.415733870562 | E143: of:=POWER(IMABS(IMSQRT(1-POWER([.C143];2)));-1)*SQRT([$'Cálculo L y C filtro pi'.B$18]/[$'Cálculo L y C filtro pi'.B$17]) -> 4588.31467741124
A144: 141 | B144: of:=2*PI()*[.A144] -> 885.929128312322 | C144: of:=[.B144]/(2*PI()*[$Descripción.B$10]) -> 2.82 | D144: of:=POWER(IMABS(IMSQRT(1-POWER([.C144];2)));-1)*SQRT([$'Cálculo L y C filtro pi'.B$9]/[$'Cálculo L y C filtro pi'.B$8]) -> 227.553686089528 | E144: of:=POWER(IMABS(IMSQRT(1-POWER([.C144];2)));-1)*SQRT([$'Cálculo L y C filtro pi'.B$18]/[$'Cálculo L y C filtro pi'.B$17]) -> 4551.07372179057
A145: 142 | B145: of:=2*PI()*[.A145] -> 892.212313619501 | C145: of:=[.B145]/(2*PI()*[$Descripción.B$10]) -> 2.84 | D145: of:=POWER(IMABS(IMSQRT(1-POWER([.C145];2)));-1)*SQRT([$'Cálculo L y C filtro pi'.B$9]/[$'Cálculo L y C filtro pi'.B$8]) -> 225.723474535818 | E145: of:=POWER(IMABS(IMSQRT(1-POWER([.C145];2)));-1)*SQRT([$'Cálculo L y C filtro pi'.B$18]/[$'Cálculo L y C filtro pi'.B$17]) -> 4514.46949071635
A146: 143 | B146: of:=2*PI()*[.A146] -> 898.495498926681 | C146: of:=[.B146]/(2*PI()*[$Descripción.B$10]) -> 2.86 | D146: of:=POWER(IMABS(IMSQRT(1-POWER([.C146];2)));-1)*SQRT([$'Cálculo L y C filtro pi'.B$9]/[$'Cálculo L y C filtro pi'.B$8]) -> 223.924248789754 | E146: of:=POWER(IMABS(IMSQRT(1-POWER([.C146];2)));-1)*SQRT([$'Cálculo L y C filtro pi'.B$18]/[$'Cálculo L y C filtro pi'.B$17]) -> 4478.48497579508
A147: 144 | B147: of:=2*PI()*[.A147] -> 904.77868423386 | C147: of:=[.B147]/(2*PI()*[$Descripción.B$10]) -> 2.88 | D147: of:=POWER(IMABS(IMSQRT(1-POWER([.C147];2)));-1)*SQRT([$'Cálculo L y C filtro pi'.B$9]/[$'Cálculo L y C filtro pi'.B$8]) -> 222.155189616952 | E147: of:=POWER(IMABS(IMSQRT(1-POWER([.C147];2)));-1)*SQRT([$'Cálculo L y C filtro pi'.B$18]/[$'Cálculo L y C filtro pi'.B$17]) -> 4443.10379233905
A148: 145 | B148: of:=2*PI()*[.A148] -> 911.06186954104 | C148: of:=[.B148]/(2*PI()*[$Descripción.B$10]) -> 2.9 | D148: of:=POWER(IMABS(IMSQRT(1-POWER([.C148];2)));-1)*SQRT([$'Cálculo L y C filtro pi'.B$9]/[$'Cálculo L y C filtro pi'.B$8]) -> 220.415507511193 | E148: of:=POWER(IMABS(IMSQRT(1-POWER([.C148];2)));-1)*SQRT([$'Cálculo L y C filtro pi'.B$18]/[$'Cálculo L y C filtro pi'.B$17]) -> 4408.31015022387
A149: 146 | B149: of:=2*PI()*[.A149] -> 917.34505484822 | C149: of:=[.B149]/(2*PI()*[$Descripción.B$10]) -> 2.92 | D149: of:=POWER(IMABS(IMSQRT(1-POWER([.C149];2)));-1)*SQRT([$'Cálculo L y C filtro pi'.B$9]/[$'Cálculo L y C filtro pi'.B$8]) -> 218.704441319927 | E149: of:=POWER(IMABS(IMSQRT(1-POWER([.C149];2)));-1)*SQRT([$'Cálculo L y C filtro pi'.B$18]/[$'Cálculo L y C filtro pi'.B$17]) -> 4374.08882639853
A150: 147 | B150: of:=2*PI()*[.A150] -> 923.628240155399 | C150: of:=[.B150]/(2*PI()*[$Descripción.B$10]) -> 2.94 | D150: of:=POWER(IMABS(IMSQRT(1-POWER([.C150];2)));-1)*SQRT([$'Cálculo L y C filtro pi'.B$9]/[$'Cálculo L y C filtro pi'.B$8]) -> 217.021256946922 | E150: of:=POWER(IMABS(IMSQRT(1-POWER([.C150];2)));-1)*SQRT([$'Cálculo L y C filtro pi'.B$18]/[$'Cálculo L y C filtro pi'.B$17]) -> 4340.42513893844
A151: 148 | B151: of:=2*PI()*[.A151] -> 929.911425462579 | C151: of:=[.B151]/(2*PI()*[$Descripción.B$10]) -> 2.96 | D151: of:=POWER(IMABS(IMSQRT(1-POWER([.C151];2)));-1)*SQRT([$'Cálculo L y C filtro pi'.B$9]/[$'Cálculo L y C filtro pi'.B$8]) -> 215.365246126974 | E151: of:=POWER(IMABS(IMSQRT(1-POWER([.C151];2)));-1)*SQRT([$'Cálculo L y C filtro pi'.B$18]/[$'Cálculo L y C filtro pi'.B$17]) -> 4307.30492253947
A152: 149 | B152: of:=2*PI()*[.A152] -> 936.194610769758 | C152: of:=[.B152]/(2*PI()*[$Descripción.B$10]) -> 2.98 | D152: of:=POWER(IMABS(IMSQRT(1-POWER([.C152];2)));-1)*SQRT([$'Cálculo L y C filtro pi'.B$9]/[$'Cálculo L y C filtro pi'.B$8]) -> 213.735725267969 | E152: of:=POWER(IMABS(IMSQRT(1-POWER([.C152];2)));-1)*SQRT([$'Cálculo L y C filtro pi'.B$18]/[$'Cálculo L y C filtro pi'.B$17]) -> 4274.71450535937
A153: 150 | B153: of:=2*PI()*[.A153] -> 942.477796076938 | C153: of:=[.B153]/(2*PI()*[$Descripción.B$10]) -> 3 | D153: of:=POWER(IMABS(IMSQRT(1-POWER([.C153];2)));-1)*SQRT([$'Cálculo L y C filtro pi'.B$9]/[$'Cálculo L y C filtro pi'.B$8]) -> 212.132034355964 | E153: of:=POWER(IMABS(IMSQRT(1-POWER([.C153];2)));-1)*SQRT([$'Cálculo L y C filtro pi'.B$18]/[$'Cálculo L y C filtro pi'.B$17]) -> 4242.64068711929
A154: 151 | B154: of:=2*PI()*[.A154] -> 948.760981384118 | C154: of:=[.B154]/(2*PI()*[$Descripción.B$10]) -> 3.02 | D154: of:=POWER(IMABS(IMSQRT(1-POWER([.C154];2)));-1)*SQRT([$'Cálculo L y C filtro pi'.B$9]/[$'Cálculo L y C filtro pi'.B$8]) -> 210.553535919262 | E154: of:=POWER(IMABS(IMSQRT(1-POWER([.C154];2)));-1)*SQRT([$'Cálculo L y C filtro pi'.B$18]/[$'Cálculo L y C filtro pi'.B$17]) -> 4211.07071838524
A155: 152 | B155: of:=2*PI()*[.A155] -> 955.044166691297 | C155: of:=[.B155]/(2*PI()*[$Descripción.B$10]) -> 3.04 | D155: of:=POWER(IMABS(IMSQRT(1-POWER([.C155];2)));-1)*SQRT([$'Cálculo L y C filtro pi'.B$9]/[$'Cálculo L y C filtro pi'.B$8]) -> 208.999614047736 | E155: of:=POWER(IMABS(IMSQRT(1-POWER([.C155];2)));-1)*SQRT([$'Cálculo L y C filtro pi'.B$18]/[$'Cálculo L y C filtro pi'.B$17]) -> 4179.99228095471
A156: 153 | B156: of:=2*PI()*[.A156] -> 961.327351998477 | C156: of:=[.B156]/(2*PI()*[$Descripción.B$10]) -> 3.06 | D156: of:=POWER(IMABS(IMSQRT(1-POWER([.C156];2)));-1)*SQRT([$'Cálculo L y C filtro pi'.B$9]/[$'Cálculo L y C filtro pi'.B$8]) -> 207.469673463957 | E156: of:=POWER(IMABS(IMSQRT(1-POWER([.C156];2)));-1)*SQRT([$'Cálculo L y C filtro pi'.B$18]/[$'Cálculo L y C filtro pi'.B$17]) -> 4149.39346927913
A157: 154 | B157: of:=2*PI()*[.A157] -> 967.610537305656 | C157: of:=[.B157]/(2*PI()*[$Descripción.B$10]) -> 3.08 | D157: of:=POWER(IMABS(IMSQRT(1-POWER([.C157];2)));-1)*SQRT([$'Cálculo L y C filtro pi'.B$9]/[$'Cálculo L y C filtro pi'.B$8]) -> 205.963138642909 | E157: of:=POWER(IMABS(IMSQRT(1-POWER([.C157];2)));-1)*SQRT([$'Cálculo L y C filtro pi'.B$18]/[$'Cálculo L y C filtro pi'.B$17]) -> 4119.26277285817
A158: 155 | B158: of:=2*PI()*[.A158] -> 973.893722612836 | C158: of:=[.B158]/(2*PI()*[$Descripción.B$10]) -> 3.1 | D158: of:=POWER(IMABS(IMSQRT(1-POWER([.C158];2)));-1)*SQRT([$'Cálculo L y C filtro pi'.B$9]/[$'Cálculo L y C filtro pi'.B$8]) -> 204.479452977299 | E158: of:=POWER(IMABS(IMSQRT(1-POWER([.C158];2)));-1)*SQRT([$'Cálculo L y C filtro pi'.B$18]/[$'Cálculo L y C filtro pi'.B$17]) -> 4089.58905954599
A159: 156 | B159: of:=2*PI()*[.A159] -> 980.176907920015 | C159: of:=[.B159]/(2*PI()*[$Descripción.B$10]) -> 3.12 | D159: of:=POWER(IMABS(IMSQRT(1-POWER([.C159];2)));-1)*SQRT([$'Cálculo L y C filtro pi'.B$9]/[$'Cálculo L y C filtro pi'.B$8]) -> 203.018077985703 | E159: of:=POWER(IMABS(IMSQRT(1-POWER([.C159];2)));-1)*SQRT([$'Cálculo L y C filtro pi'.B$18]/[$'Cálculo L y C filtro pi'.B$17]) -> 4060.36155971406
A160: 157 | B160: of:=2*PI()*[.A160] -> 986.460093227195 | C160: of:=[.B160]/(2*PI()*[$Descripción.B$10]) -> 3.14 | D160: of:=POWER(IMABS(IMSQRT(1-POWER([.C160];2)));-1)*SQRT([$'Cálculo L y C filtro pi'.B$9]/[$'Cálculo L y C filtro pi'.B$8]) -> 201.57849256095 | E160: of:=POWER(IMABS(IMSQRT(1-POWER([.C160];2)));-1)*SQRT([$'Cálculo L y C filtro pi'.B$18]/[$'Cálculo L y C filtro pi'.B$17]) -> 4031.56985121901
A161: 158 | B161: of:=2*PI()*[.A161] -> 992.743278534375 | C161: of:=[.B161]/(2*PI()*[$Descripción.B$10]) -> 3.16 | D161: of:=POWER(IMABS(IMSQRT(1-POWER([.C161];2)));-1)*SQRT([$'Cálculo L y C filtro pi'.B$9]/[$'Cálculo L y C filtro pi'.B$8]) -> 200.160192256359 | E161: of:=POWER(IMABS(IMSQRT(1-POWER([.C161];2)));-1)*SQRT([$'Cálculo L y C filtro pi'.B$18]/[$'Cálculo L y C filtro pi'.B$17]) -> 4003.20384512718
A162: 159 | B162: of:=2*PI()*[.A162] -> 999.026463841554 | C162: of:=[.B162]/(2*PI()*[$Descripción.B$10]) -> 3.18 | D162: of:=POWER(IMABS(IMSQRT(1-POWER([.C162];2)));-1)*SQRT([$'Cálculo L y C filtro pi'.B$9]/[$'Cálculo L y C filtro pi'.B$8]) -> 198.762688607575 | E162: of:=POWER(IMABS(IMSQRT(1-POWER([.C162];2)));-1)*SQRT([$'Cálculo L y C filtro pi'.B$18]/[$'Cálculo L y C filtro pi'.B$17]) -> 3975.2537721515
A163: 160 | B163: of:=2*PI()*[.A163] -> 1005.30964914873 | C163: of:=[.B163]/(2*PI()*[$Descripción.B$10]) -> 3.19999999999999 | D163: of:=POWER(IMABS(IMSQRT(1-POWER([.C163];2)));-1)*SQRT([$'Cálculo L y C filtro pi'.B$9]/[$'Cálculo L y C filtro pi'.B$8]) -> 197.385508487932 | E163: of:=POWER(IMABS(IMSQRT(1-POWER([.C163];2)));-1)*SQRT([$'Cálculo L y C filtro pi'.B$18]/[$'Cálculo L y C filtro pi'.B$17]) -> 3947.71016975863
A164: 161 | B164: of:=2*PI()*[.A164] -> 1011.59283445591 | C164: of:=[.B164]/(2*PI()*[$Descripción.B$10]) -> 3.21999999999999 | D164: of:=POWER(IMABS(IMSQRT(1-POWER([.C164];2)));-1)*SQRT([$'Cálculo L y C filtro pi'.B$9]/[$'Cálculo L y C filtro pi'.B$8]) -> 196.028193495381 | E164: of:=POWER(IMABS(IMSQRT(1-POWER([.C164];2)));-1)*SQRT([$'Cálculo L y C filtro pi'.B$18]/[$'Cálculo L y C filtro pi'.B$17]) -> 3920.56386990762
A165: 162 | B165: of:=2*PI()*[.A165] -> 1017.87601976309 | C165: of:=[.B165]/(2*PI()*[$Descripción.B$10]) -> 3.23999999999999 | D165: of:=POWER(IMABS(IMSQRT(1-POWER([.C165];2)));-1)*SQRT([$'Cálculo L y C filtro pi'.B$9]/[$'Cálculo L y C filtro pi'.B$8]) -> 194.690299369187 | E165: of:=POWER(IMABS(IMSQRT(1-POWER([.C165];2)));-1)*SQRT([$'Cálculo L y C filtro pi'.B$18]/[$'Cálculo L y C filtro pi'.B$17]) -> 3893.80598738374
A166: 163 | B166: of:=2*PI()*[.A166] -> 1024.15920507027 | C166: of:=[.B166]/(2*PI()*[$Descripción.B$10]) -> 3.25999999999999 | D166: of:=POWER(IMABS(IMSQRT(1-POWER([.C166];2)));-1)*SQRT([$'Cálculo L y C filtro pi'.B$9]/[$'Cálculo L y C filtro pi'.B$8]) -> 193.371395434678 | E166: of:=POWER(IMABS(IMSQRT(1-POWER([.C166];2)));-1)*SQRT([$'Cálculo L y C filtro pi'.B$18]/[$'Cálculo L y C filtro pi'.B$17]) -> 3867.42790869356
A167: 164 | B167: of:=2*PI()*[.A167] -> 1030.44239037745 | C167: of:=[.B167]/(2*PI()*[$Descripción.B$10]) -> 3.27999999999999 | D167: of:=POWER(IMABS(IMSQRT(1-POWER([.C167];2)));-1)*SQRT([$'Cálculo L y C filtro pi'.B$9]/[$'Cálculo L y C filtro pi'.B$8]) -> 192.071064074466 | E167: of:=POWER(IMABS(IMSQRT(1-POWER([.C167];2)));-1)*SQRT([$'Cálculo L y C filtro pi'.B$18]/[$'Cálculo L y C filtro pi'.B$17]) -> 3841.42128148933
A168: 165 | B168: of:=2*PI()*[.A168] -> 1036.72557568463 | C168: of:=[.B168]/(2*PI()*[$Descripción.B$10]) -> 3.29999999999999 | D168: of:=POWER(IMABS(IMSQRT(1-POWER([.C168];2)));-1)*SQRT([$'Cálculo L y C filtro pi'.B$9]/[$'Cálculo L y C filtro pi'.B$8]) -> 190.788900224668 | E168: of:=POWER(IMABS(IMSQRT(1-POWER([.C168];2)));-1)*SQRT([$'Cálculo L y C filtro pi'.B$18]/[$'Cálculo L y C filtro pi'.B$17]) -> 3815.77800449337
A169: 166 | B169: of:=2*PI()*[.A169] -> 1043.00876099181 | C169: of:=[.B169]/(2*PI()*[$Descripción.B$10]) -> 3.32 | D169: of:=POWER(IMABS(IMSQRT(1-POWER([.C169];2)));-1)*SQRT([$'Cálculo L y C filtro pi'.B$9]/[$'Cálculo L y C filtro pi'.B$8]) -> 189.524510894726 | E169: of:=POWER(IMABS(IMSQRT(1-POWER([.C169];2)));-1)*SQRT([$'Cálculo L y C filtro pi'.B$18]/[$'Cálculo L y C filtro pi'.B$17]) -> 3790.49021789452
A170: 167 | B170: of:=2*PI()*[.A170] -> 1049.29194629899 | C170: of:=[.B170]/(2*PI()*[$Descripción.B$10]) -> 3.34 | D170: of:=POWER(IMABS(IMSQRT(1-POWER([.C170];2)));-1)*SQRT([$'Cálculo L y C filtro pi'.B$9]/[$'Cálculo L y C filtro pi'.B$8]) -> 188.277514709529 | E170: of:=POWER(IMABS(IMSQRT(1-POWER([.C170];2)));-1)*SQRT([$'Cálculo L y C filtro pi'.B$18]/[$'Cálculo L y C filtro pi'.B$17]) -> 3765.55029419057
A171: 168 | B171: of:=2*PI()*[.A171] -> 1055.57513160617 | C171: of:=[.B171]/(2*PI()*[$Descripción.B$10]) -> 3.36 | D171: of:=POWER(IMABS(IMSQRT(1-POWER([.C171];2)));-1)*SQRT([$'Cálculo L y C filtro pi'.B$9]/[$'Cálculo L y C filtro pi'.B$8]) -> 187.047541472624 | E171: of:=POWER(IMABS(IMSQRT(1-POWER([.C171];2)));-1)*SQRT([$'Cálculo L y C filtro pi'.B$18]/[$'Cálculo L y C filtro pi'.B$17]) -> 3740.95082945249
A172: 169 | B172: of:=2*PI()*[.A172] -> 1061.85831691335 | C172: of:=[.B172]/(2*PI()*[$Descripción.B$10]) -> 3.38 | D172: of:=POWER(IMABS(IMSQRT(1-POWER([.C172];2)));-1)*SQRT([$'Cálculo L y C filtro pi'.B$9]/[$'Cálculo L y C filtro pi'.B$8]) -> 185.834231749378 | E172: of:=POWER(IMABS(IMSQRT(1-POWER([.C172];2)));-1)*SQRT([$'Cálculo L y C filtro pi'.B$18]/[$'Cálculo L y C filtro pi'.B$17]) -> 3716.68463498755
A173: 170 | B173: of:=2*PI()*[.A173] -> 1068.14150222053 | C173: of:=[.B173]/(2*PI()*[$Descripción.B$10]) -> 3.4 | D173: of:=POWER(IMABS(IMSQRT(1-POWER([.C173];2)));-1)*SQRT([$'Cálculo L y C filtro pi'.B$9]/[$'Cálculo L y C filtro pi'.B$8]) -> 184.637236468999 | E173: of:=POWER(IMABS(IMSQRT(1-POWER([.C173];2)));-1)*SQRT([$'Cálculo L y C filtro pi'.B$18]/[$'Cálculo L y C filtro pi'.B$17]) -> 3692.74472937999
A174: 171 | B174: of:=2*PI()*[.A174] -> 1074.42468752771 | C174: of:=[.B174]/(2*PI()*[$Descripción.B$10]) -> 3.42 | D174: of:=POWER(IMABS(IMSQRT(1-POWER([.C174];2)));-1)*SQRT([$'Cálculo L y C filtro pi'.B$9]/[$'Cálculo L y C filtro pi'.B$8]) -> 183.456216544449 | E174: of:=POWER(IMABS(IMSQRT(1-POWER([.C174];2)));-1)*SQRT([$'Cálculo L y C filtro pi'.B$18]/[$'Cálculo L y C filtro pi'.B$17]) -> 3669.12433088898
A175: 172 | B175: of:=2*PI()*[.A175] -> 1080.70787283489 | C175: of:=[.B175]/(2*PI()*[$Descripción.B$10]) -> 3.44 | D175: of:=POWER(IMABS(IMSQRT(1-POWER([.C175];2)));-1)*SQRT([$'Cálculo L y C filtro pi'.B$9]/[$'Cálculo L y C filtro pi'.B$8]) -> 182.290842509267 | E175: of:=POWER(IMABS(IMSQRT(1-POWER([.C175];2)));-1)*SQRT([$'Cálculo L y C filtro pi'.B$18]/[$'Cálculo L y C filtro pi'.B$17]) -> 3645.81685018533
A176: 173 | B176: of:=2*PI()*[.A176] -> 1086.99105814207 | C176: of:=[.B176]/(2*PI()*[$Descripción.B$10]) -> 3.46 | D176: of:=POWER(IMABS(IMSQRT(1-POWER([.C176];2)));-1)*SQRT([$'Cálculo L y C filtro pi'.B$9]/[$'Cálculo L y C filtro pi'.B$8]) -> 181.140794170442 | E176: of:=POWER(IMABS(IMSQRT(1-POWER([.C176];2)));-1)*SQRT([$'Cálculo L y C filtro pi'.B$18]/[$'Cálculo L y C filtro pi'.B$17]) -> 3622.81588340883
A177: 174 | B177: of:=2*PI()*[.A177] -> 1093.27424344925 | C177: of:=[.B177]/(2*PI()*[$Descripción.B$10]) -> 3.48000000000001 | D177: of:=POWER(IMABS(IMSQRT(1-POWER([.C177];2)));-1)*SQRT([$'Cálculo L y C filtro pi'.B$9]/[$'Cálculo L y C filtro pi'.B$8]) -> 180.005760276495 | E177: of:=POWER(IMABS(IMSQRT(1-POWER([.C177];2)));-1)*SQRT([$'Cálculo L y C filtro pi'.B$18]/[$'Cálculo L y C filtro pi'.B$17]) -> 3600.11520552989
A178: 175 | B178: of:=2*PI()*[.A178] -> 1099.55742875643 | C178: of:=[.B178]/(2*PI()*[$Descripción.B$10]) -> 3.50000000000001 | D178: of:=POWER(IMABS(IMSQRT(1-POWER([.C178];2)));-1)*SQRT([$'Cálculo L y C filtro pi'.B$9]/[$'Cálculo L y C filtro pi'.B$8]) -> 178.885438199982 | E178: of:=POWER(IMABS(IMSQRT(1-POWER([.C178];2)));-1)*SQRT([$'Cálculo L y C filtro pi'.B$18]/[$'Cálculo L y C filtro pi'.B$17]) -> 3577.70876399965
A179: 176 | B179: of:=2*PI()*[.A179] -> 1105.84061406361 | C179: of:=[.B179]/(2*PI()*[$Descripción.B$10]) -> 3.52000000000001 | D179: of:=POWER(IMABS(IMSQRT(1-POWER([.C179];2)));-1)*SQRT([$'Cálculo L y C filtro pi'.B$9]/[$'Cálculo L y C filtro pi'.B$8]) -> 177.779533633694 | E179: of:=POWER(IMABS(IMSQRT(1-POWER([.C179];2)));-1)*SQRT([$'Cálculo L y C filtro pi'.B$18]/[$'Cálculo L y C filtro pi'.B$17]) -> 3555.59067267388
A180: 177 | B180: of:=2*PI()*[.A180] -> 1112.12379937079 | C180: of:=[.B180]/(2*PI()*[$Descripción.B$10]) -> 3.54000000000001 | D180: of:=POWER(IMABS(IMSQRT(1-POWER([.C180];2)));-1)*SQRT([$'Cálculo L y C filtro pi'.B$9]/[$'Cálculo L y C filtro pi'.B$8]) -> 176.687760299836 | E180: of:=POWER(IMABS(IMSQRT(1-POWER([.C180];2)));-1)*SQRT([$'Cálculo L y C filtro pi'.B$18]/[$'Cálculo L y C filtro pi'.B$17]) -> 3533.75520599671
A181: 178 | B181: of:=2*PI()*[.A181] -> 1118.40698467797 | C181: of:=[.B181]/(2*PI()*[$Descripción.B$10]) -> 3.56000000000001 | D181: of:=POWER(IMABS(IMSQRT(1-POWER([.C181];2)));-1)*SQRT([$'Cálculo L y C filtro pi'.B$9]/[$'Cálculo L y C filtro pi'.B$8]) -> 175.609839671567 | E181: of:=POWER(IMABS(IMSQRT(1-POWER([.C181];2)));-1)*SQRT([$'Cálculo L y C filtro pi'.B$18]/[$'Cálculo L y C filtro pi'.B$17]) -> 3512.19679343134
A182: 179 | B182: of:=2*PI()*[.A182] -> 1124.69016998515 | C182: of:=[.B182]/(2*PI()*[$Descripción.B$10]) -> 3.58000000000001 | D182: of:=POWER(IMABS(IMSQRT(1-POWER([.C182];2)));-1)*SQRT([$'Cálculo L y C filtro pi'.B$9]/[$'Cálculo L y C filtro pi'.B$8]) -> 174.545500706253 | E182: of:=POWER(IMABS(IMSQRT(1-POWER([.C182];2)));-1)*SQRT([$'Cálculo L y C filtro pi'.B$18]/[$'Cálculo L y C filtro pi'.B$17]) -> 3490.91001412507
A183: 180 | B183: of:=2*PI()*[.A183] -> 1130.97335529233 | C183: of:=[.B183]/(2*PI()*[$Descripción.B$10]) -> 3.60000000000001 | D183: of:=POWER(IMABS(IMSQRT(1-POWER([.C183];2)));-1)*SQRT([$'Cálculo L y C filtro pi'.B$9]/[$'Cálculo L y C filtro pi'.B$8]) -> 173.494479589871 | E183: of:=POWER(IMABS(IMSQRT(1-POWER([.C183];2)));-1)*SQRT([$'Cálculo L y C filtro pi'.B$18]/[$'Cálculo L y C filtro pi'.B$17]) -> 3469.88959179743
A184: 181 | B184: of:=2*PI()*[.A184] -> 1137.25654059951 | C184: of:=[.B184]/(2*PI()*[$Descripción.B$10]) -> 3.62000000000002 | D184: of:=POWER(IMABS(IMSQRT(1-POWER([.C184];2)));-1)*SQRT([$'Cálculo L y C filtro pi'.B$9]/[$'Cálculo L y C filtro pi'.B$8]) -> 172.456519492006 | E184: of:=POWER(IMABS(IMSQRT(1-POWER([.C184];2)));-1)*SQRT([$'Cálculo L y C filtro pi'.B$18]/[$'Cálculo L y C filtro pi'.B$17]) -> 3449.13038984012
A185: 182 | B185: of:=2*PI()*[.A185] -> 1143.53972590668 | C185: of:=[.B185]/(2*PI()*[$Descripción.B$10]) -> 3.63999999999998 | D185: of:=POWER(IMABS(IMSQRT(1-POWER([.C185];2)));-1)*SQRT([$'Cálculo L y C filtro pi'.B$9]/[$'Cálculo L y C filtro pi'.B$8]) -> 171.431370330936 | E185: of:=POWER(IMABS(IMSQRT(1-POWER([.C185];2)));-1)*SQRT([$'Cálculo L y C filtro pi'.B$18]/[$'Cálculo L y C filtro pi'.B$17]) -> 3428.62740661873
A186: 183 | B186: of:=2*PI()*[.A186] -> 1149.82291121386 | C186: of:=[.B186]/(2*PI()*[$Descripción.B$10]) -> 3.65999999999999 | D186: of:=POWER(IMABS(IMSQRT(1-POWER([.C186];2)));-1)*SQRT([$'Cálculo L y C filtro pi'.B$9]/[$'Cálculo L y C filtro pi'.B$8]) -> 170.418788548302 | E186: of:=POWER(IMABS(IMSQRT(1-POWER([.C186];2)));-1)*SQRT([$'Cálculo L y C filtro pi'.B$18]/[$'Cálculo L y C filtro pi'.B$17]) -> 3408.37577096605
A187: 184 | B187: of:=2*PI()*[.A187] -> 1156.10609652104 | C187: of:=[.B187]/(2*PI()*[$Descripción.B$10]) -> 3.67999999999999 | D187: of:=POWER(IMABS(IMSQRT(1-POWER([.C187];2)));-1)*SQRT([$'Cálculo L y C filtro pi'.B$9]/[$'Cálculo L y C filtro pi'.B$8]) -> 169.418536892925 | E187: of:=POWER(IMABS(IMSQRT(1-POWER([.C187];2)));-1)*SQRT([$'Cálculo L y C filtro pi'.B$18]/[$'Cálculo L y C filtro pi'.B$17]) -> 3388.37073785849
A188: 185 | B188: of:=2*PI()*[.A188] -> 1162.38928182822 | C188: of:=[.B188]/(2*PI()*[$Descripción.B$10]) -> 3.69999999999999 | D188: of:=POWER(IMABS(IMSQRT(1-POWER([.C188];2)));-1)*SQRT([$'Cálculo L y C filtro pi'.B$9]/[$'Cálculo L y C filtro pi'.B$8]) -> 168.430384213305 | E188: of:=POWER(IMABS(IMSQRT(1-POWER([.C188];2)));-1)*SQRT([$'Cálculo L y C filtro pi'.B$18]/[$'Cálculo L y C filtro pi'.B$17]) -> 3368.60768426609
A189: 186 | B189: of:=2*PI()*[.A189] -> 1168.6724671354 | C189: of:=[.B189]/(2*PI()*[$Descripción.B$10]) -> 3.71999999999999 | D189: of:=POWER(IMABS(IMSQRT(1-POWER([.C189];2)));-1)*SQRT([$'Cálculo L y C filtro pi'.B$9]/[$'Cálculo L y C filtro pi'.B$8]) -> 167.454105258415 | E189: of:=POWER(IMABS(IMSQRT(1-POWER([.C189];2)));-1)*SQRT([$'Cálculo L y C filtro pi'.B$18]/[$'Cálculo L y C filtro pi'.B$17]) -> 3349.08210516831
A190: 187 | B190: of:=2*PI()*[.A190] -> 1174.95565244258 | C190: of:=[.B190]/(2*PI()*[$Descripción.B$10]) -> 3.73999999999999 | D190: of:=POWER(IMABS(IMSQRT(1-POWER([.C190];2)));-1)*SQRT([$'Cálculo L y C filtro pi'.B$9]/[$'Cálculo L y C filtro pi'.B$8]) -> 166.489480486398 | E190: of:=POWER(IMABS(IMSQRT(1-POWER([.C190];2)));-1)*SQRT([$'Cálculo L y C filtro pi'.B$18]/[$'Cálculo L y C filtro pi'.B$17]) -> 3329.78960972797
A191: 188 | B191: of:=2*PI()*[.A191] -> 1181.23883774976 | C191: of:=[.B191]/(2*PI()*[$Descripción.B$10]) -> 3.75999999999999 | D191: of:=POWER(IMABS(IMSQRT(1-POWER([.C191];2)));-1)*SQRT([$'Cálculo L y C filtro pi'.B$9]/[$'Cálculo L y C filtro pi'.B$8]) -> 165.536295880776 | E191: of:=POWER(IMABS(IMSQRT(1-POWER([.C191];2)));-1)*SQRT([$'Cálculo L y C filtro pi'.B$18]/[$'Cálculo L y C filtro pi'.B$17]) -> 3310.72591761552
A192: 189 | B192: of:=2*PI()*[.A192] -> 1187.52202305694 | C192: of:=[.B192]/(2*PI()*[$Descripción.B$10]) -> 3.77999999999999 | D192: of:=POWER(IMABS(IMSQRT(1-POWER([.C192];2)));-1)*SQRT([$'Cálculo L y C filtro pi'.B$9]/[$'Cálculo L y C filtro pi'.B$8]) -> 164.594342773859 | E192: of:=POWER(IMABS(IMSQRT(1-POWER([.C192];2)));-1)*SQRT([$'Cálculo L y C filtro pi'.B$18]/[$'Cálculo L y C filtro pi'.B$17]) -> 3291.88685547717
A193: 190 | B193: of:=2*PI()*[.A193] -> 1193.80520836412 | C193: of:=[.B193]/(2*PI()*[$Descripción.B$10]) -> 3.8 | D193: of:=POWER(IMABS(IMSQRT(1-POWER([.C193];2)));-1)*SQRT([$'Cálculo L y C filtro pi'.B$9]/[$'Cálculo L y C filtro pi'.B$8]) -> 163.663417676994 | E193: of:=POWER(IMABS(IMSQRT(1-POWER([.C193];2)));-1)*SQRT([$'Cálculo L y C filtro pi'.B$18]/[$'Cálculo L y C filtro pi'.B$17]) -> 3273.26835353989
A194: 191 | B194: of:=2*PI()*[.A194] -> 1200.0883936713 | C194: of:=[.B194]/(2*PI()*[$Descripción.B$10]) -> 3.82 | D194: of:=POWER(IMABS(IMSQRT(1-POWER([.C194];2)));-1)*SQRT([$'Cálculo L y C filtro pi'.B$9]/[$'Cálculo L y C filtro pi'.B$8]) -> 162.743322117356 | E194: of:=POWER(IMABS(IMSQRT(1-POWER([.C194];2)));-1)*SQRT([$'Cálculo L y C filtro pi'.B$18]/[$'Cálculo L y C filtro pi'.B$17]) -> 3254.86644234712
A195: 192 | B195: of:=2*PI()*[.A195] -> 1206.37157897848 | C195: of:=[.B195]/(2*PI()*[$Descripción.B$10]) -> 3.84 | D195: of:=POWER(IMABS(IMSQRT(1-POWER([.C195];2)));-1)*SQRT([$'Cálculo L y C filtro pi'.B$9]/[$'Cálculo L y C filtro pi'.B$8]) -> 161.83386248098 | E195: of:=POWER(IMABS(IMSQRT(1-POWER([.C195];2)));-1)*SQRT([$'Cálculo L y C filtro pi'.B$18]/[$'Cálculo L y C filtro pi'.B$17]) -> 3236.6772496196
A196: 193 | B196: of:=2*PI()*[.A196] -> 1212.65476428566 | C196: of:=[.B196]/(2*PI()*[$Descripción.B$10]) -> 3.86 | D196: of:=POWER(IMABS(IMSQRT(1-POWER([.C196];2)));-1)*SQRT([$'Cálculo L y C filtro pi'.B$9]/[$'Cálculo L y C filtro pi'.B$8]) -> 160.934849861756 | E196: of:=POWER(IMABS(IMSQRT(1-POWER([.C196];2)));-1)*SQRT([$'Cálculo L y C filtro pi'.B$18]/[$'Cálculo L y C filtro pi'.B$17]) -> 3218.69699723511
A197: 194 | B197: of:=2*PI()*[.A197] -> 1218.93794959284 | C197: of:=[.B197]/(2*PI()*[$Descripción.B$10]) -> 3.88 | D197: of:=POWER(IMABS(IMSQRT(1-POWER([.C197];2)));-1)*SQRT([$'Cálculo L y C filtro pi'.B$9]/[$'Cálculo L y C filtro pi'.B$8]) -> 160.04609991612 | E197: of:=POWER(IMABS(IMSQRT(1-POWER([.C197];2)));-1)*SQRT([$'Cálculo L y C filtro pi'.B$18]/[$'Cálculo L y C filtro pi'.B$17]) -> 3200.9219983224
A198: 195 | B198: of:=2*PI()*[.A198] -> 1225.22113490002 | C198: of:=[.B198]/(2*PI()*[$Descripción.B$10]) -> 3.9 | D198: of:=POWER(IMABS(IMSQRT(1-POWER([.C198];2)));-1)*SQRT([$'Cálculo L y C filtro pi'.B$9]/[$'Cálculo L y C filtro pi'.B$8]) -> 159.167432723187 | E198: of:=POWER(IMABS(IMSQRT(1-POWER([.C198];2)));-1)*SQRT([$'Cálculo L y C filtro pi'.B$18]/[$'Cálculo L y C filtro pi'.B$17]) -> 3183.34865446375
A199: 196 | B199: of:=2*PI()*[.A199] -> 1231.5043202072 | C199: of:=[.B199]/(2*PI()*[$Descripción.B$10]) -> 3.92 | D199: of:=POWER(IMABS(IMSQRT(1-POWER([.C199];2)));-1)*SQRT([$'Cálculo L y C filtro pi'.B$9]/[$'Cálculo L y C filtro pi'.B$8]) -> 158.298672650089 | E199: of:=POWER(IMABS(IMSQRT(1-POWER([.C199];2)));-1)*SQRT([$'Cálculo L y C filtro pi'.B$18]/[$'Cálculo L y C filtro pi'.B$17]) -> 3165.97345300177
A200: 197 | B200: of:=2*PI()*[.A200] -> 1237.78750551438 | C200: of:=[.B200]/(2*PI()*[$Descripción.B$10]) -> 3.94 | D200: of:=POWER(IMABS(IMSQRT(1-POWER([.C200];2)));-1)*SQRT([$'Cálculo L y C filtro pi'.B$9]/[$'Cálculo L y C filtro pi'.B$8]) -> 157.439648222281 | E200: of:=POWER(IMABS(IMSQRT(1-POWER([.C200];2)));-1)*SQRT([$'Cálculo L y C filtro pi'.B$18]/[$'Cálculo L y C filtro pi'.B$17]) -> 3148.79296444562
A201: 198 | B201: of:=2*PI()*[.A201] -> 1244.07069082156 | C201: of:=[.B201]/(2*PI()*[$Descripción.B$10]) -> 3.96000000000001 | D201: of:=POWER(IMABS(IMSQRT(1-POWER([.C201];2)));-1)*SQRT([$'Cálculo L y C filtro pi'.B$9]/[$'Cálculo L y C filtro pi'.B$8]) -> 156.590191998623 | E201: of:=POWER(IMABS(IMSQRT(1-POWER([.C201];2)));-1)*SQRT([$'Cálculo L y C filtro pi'.B$18]/[$'Cálculo L y C filtro pi'.B$17]) -> 3131.80383997247
A202: 199 | B202: of:=2*PI()*[.A202] -> 1250.35387612874 | C202: of:=[.B202]/(2*PI()*[$Descripción.B$10]) -> 3.98000000000001 | D202: of:=POWER(IMABS(IMSQRT(1-POWER([.C202];2)));-1)*SQRT([$'Cálculo L y C filtro pi'.B$9]/[$'Cálculo L y C filtro pi'.B$8]) -> 155.750140450997 | E202: of:=POWER(IMABS(IMSQRT(1-POWER([.C202];2)));-1)*SQRT([$'Cálculo L y C filtro pi'.B$18]/[$'Cálculo L y C filtro pi'.B$17]) -> 3115.00280901993
A203: 200 | B203: of:=2*PI()*[.A203] -> 1256.63706143592 | C203: of:=[.B203]/(2*PI()*[$Descripción.B$10]) -> 4.00000000000001 | D203: of:=POWER(IMABS(IMSQRT(1-POWER([.C203];2)));-1)*SQRT([$'Cálculo L y C filtro pi'.B$9]/[$'Cálculo L y C filtro pi'.B$8]) -> 154.919333848296 | E203: of:=POWER(IMABS(IMSQRT(1-POWER([.C203];2)));-1)*SQRT([$'Cálculo L y C filtro pi'.B$18]/[$'Cálculo L y C filtro pi'.B$17]) -> 3098.38667696592
A204: 201 | B204: of:=2*PI()*[.A204] -> 1262.9202467431 | C204: of:=[.B204]/(2*PI()*[$Descripción.B$10]) -> 4.02000000000001 | D204: of:=POWER(IMABS(IMSQRT(1-POWER([.C204];2)));-1)*SQRT([$'Cálculo L y C filtro pi'.B$9]/[$'Cálculo L y C filtro pi'.B$8]) -> 154.097616144582 | E204: of:=POWER(IMABS(IMSQRT(1-POWER([.C204];2)));-1)*SQRT([$'Cálculo L y C filtro pi'.B$18]/[$'Cálculo L y C filtro pi'.B$17]) -> 3081.95232289165
A205: 202 | B205: of:=2*PI()*[.A205] -> 1269.20343205028 | C205: of:=[.B205]/(2*PI()*[$Descripción.B$10]) -> 4.04000000000001 | D205: of:=POWER(IMABS(IMSQRT(1-POWER([.C205];2)));-1)*SQRT([$'Cálculo L y C filtro pi'.B$9]/[$'Cálculo L y C filtro pi'.B$8]) -> 153.284834871241 | E205: of:=POWER(IMABS(IMSQRT(1-POWER([.C205];2)));-1)*SQRT([$'Cálculo L y C filtro pi'.B$18]/[$'Cálculo L y C filtro pi'.B$17]) -> 3065.69669742482
A206: 203 | B206: of:=2*PI()*[.A206] -> 1275.48661735746 | C206: of:=[.B206]/(2*PI()*[$Descripción.B$10]) -> 4.06000000000001 | D206: of:=POWER(IMABS(IMSQRT(1-POWER([.C206];2)));-1)*SQRT([$'Cálculo L y C filtro pi'.B$9]/[$'Cálculo L y C filtro pi'.B$8]) -> 152.480841032965 | E206: of:=POWER(IMABS(IMSQRT(1-POWER([.C206];2)));-1)*SQRT([$'Cálculo L y C filtro pi'.B$18]/[$'Cálculo L y C filtro pi'.B$17]) -> 3049.61682065929
A207: 204 | B207: of:=2*PI()*[.A207] -> 1281.76980266464 | C207: of:=[.B207]/(2*PI()*[$Descripción.B$10]) -> 4.08000000000001 | D207: of:=POWER(IMABS(IMSQRT(1-POWER([.C207];2)));-1)*SQRT([$'Cálculo L y C filtro pi'.B$9]/[$'Cálculo L y C filtro pi'.B$8]) -> 151.685489007408 | E207: of:=POWER(IMABS(IMSQRT(1-POWER([.C207];2)));-1)*SQRT([$'Cálculo L y C filtro pi'.B$18]/[$'Cálculo L y C filtro pi'.B$17]) -> 3033.70978014816
A208: 205 | B208: of:=2*PI()*[.A208] -> 1288.05298797182 | C208: of:=[.B208]/(2*PI()*[$Descripción.B$10]) -> 4.10000000000002 | D208: of:=POWER(IMABS(IMSQRT(1-POWER([.C208];2)));-1)*SQRT([$'Cálculo L y C filtro pi'.B$9]/[$'Cálculo L y C filtro pi'.B$8]) -> 150.898636448357 | E208: of:=POWER(IMABS(IMSQRT(1-POWER([.C208];2)));-1)*SQRT([$'Cálculo L y C filtro pi'.B$18]/[$'Cálculo L y C filtro pi'.B$17]) -> 3017.97272896713
A209: 206 | B209: of:=2*PI()*[.A209] -> 1294.33617327899 | C209: of:=[.B209]/(2*PI()*[$Descripción.B$10]) -> 4.11999999999998 | D209: of:=POWER(IMABS(IMSQRT(1-POWER([.C209];2)));-1)*SQRT([$'Cálculo L y C filtro pi'.B$9]/[$'Cálculo L y C filtro pi'.B$8]) -> 150.12014419227 | E209: of:=POWER(IMABS(IMSQRT(1-POWER([.C209];2)));-1)*SQRT([$'Cálculo L y C filtro pi'.B$18]/[$'Cálculo L y C filtro pi'.B$17]) -> 3002.4028838454
A210: 207 | B210: of:=2*PI()*[.A210] -> 1300.61935858617 | C210: of:=[.B210]/(2*PI()*[$Descripción.B$10]) -> 4.13999999999999 | D210: of:=POWER(IMABS(IMSQRT(1-POWER([.C210];2)));-1)*SQRT([$'Cálculo L y C filtro pi'.B$9]/[$'Cálculo L y C filtro pi'.B$8]) -> 149.349876168054 | E210: of:=POWER(IMABS(IMSQRT(1-POWER([.C210];2)));-1)*SQRT([$'Cálculo L y C filtro pi'.B$18]/[$'Cálculo L y C filtro pi'.B$17]) -> 2986.99752336108
A211: 208 | B211: of:=2*PI()*[.A211] -> 1306.90254389335 | C211: of:=[.B211]/(2*PI()*[$Descripción.B$10]) -> 4.15999999999999 | D211: of:=POWER(IMABS(IMSQRT(1-POWER([.C211];2)));-1)*SQRT([$'Cálculo L y C filtro pi'.B$9]/[$'Cálculo L y C filtro pi'.B$8]) -> 148.587699309947 | E211: of:=POWER(IMABS(IMSQRT(1-POWER([.C211];2)));-1)*SQRT([$'Cálculo L y C filtro pi'.B$18]/[$'Cálculo L y C filtro pi'.B$17]) -> 2971.75398619894
A212: 209 | B212: of:=2*PI()*[.A212] -> 1313.18572920053 | C212: of:=[.B212]/(2*PI()*[$Descripción.B$10]) -> 4.17999999999999 | D212: of:=POWER(IMABS(IMSQRT(1-POWER([.C212];2)));-1)*SQRT([$'Cálculo L y C filtro pi'.B$9]/[$'Cálculo L y C filtro pi'.B$8]) -> 147.83348347337 | E212: of:=POWER(IMABS(IMSQRT(1-POWER([.C212];2)));-1)*SQRT([$'Cálculo L y C filtro pi'.B$18]/[$'Cálculo L y C filtro pi'.B$17]) -> 2956.6696694674
A213: 210 | B213: of:=2*PI()*[.A213] -> 1319.46891450771 | C213: of:=[.B213]/(2*PI()*[$Descripción.B$10]) -> 4.19999999999999 | D213: of:=POWER(IMABS(IMSQRT(1-POWER([.C213];2)));-1)*SQRT([$'Cálculo L y C filtro pi'.B$9]/[$'Cálculo L y C filtro pi'.B$8]) -> 147.087101353638 | E213: of:=POWER(IMABS(IMSQRT(1-POWER([.C213];2)));-1)*SQRT([$'Cálculo L y C filtro pi'.B$18]/[$'Cálculo L y C filtro pi'.B$17]) -> 2941.74202707277
A214: 211 | B214: of:=2*PI()*[.A214] -> 1325.75209981489 | C214: of:=[.B214]/(2*PI()*[$Descripción.B$10]) -> 4.21999999999999 | D214: of:=POWER(IMABS(IMSQRT(1-POWER([.C214];2)));-1)*SQRT([$'Cálculo L y C filtro pi'.B$9]/[$'Cálculo L y C filtro pi'.B$8]) -> 146.348428407424 | E214: of:=POWER(IMABS(IMSQRT(1-POWER([.C214];2)));-1)*SQRT([$'Cálculo L y C filtro pi'.B$18]/[$'Cálculo L y C filtro pi'.B$17]) -> 2926.96856814848
A215: 212 | B215: of:=2*PI()*[.A215] -> 1332.03528512207 | C215: of:=[.B215]/(2*PI()*[$Descripción.B$10]) -> 4.23999999999999 | D215: of:=POWER(IMABS(IMSQRT(1-POWER([.C215];2)));-1)*SQRT([$'Cálculo L y C filtro pi'.B$9]/[$'Cálculo L y C filtro pi'.B$8]) -> 145.61734277684 | E215: of:=POWER(IMABS(IMSQRT(1-POWER([.C215];2)));-1)*SQRT([$'Cálculo L y C filtro pi'.B$18]/[$'Cálculo L y C filtro pi'.B$17]) -> 2912.3468555368
A216: 213 | B216: of:=2*PI()*[.A216] -> 1338.31847042925 | C216: of:=[.B216]/(2*PI()*[$Descripción.B$10]) -> 4.25999999999999 | D216: of:=POWER(IMABS(IMSQRT(1-POWER([.C216];2)));-1)*SQRT([$'Cálculo L y C filtro pi'.B$9]/[$'Cálculo L y C filtro pi'.B$8]) -> 144.893725216066 | E216: of:=POWER(IMABS(IMSQRT(1-POWER([.C216];2)));-1)*SQRT([$'Cálculo L y C filtro pi'.B$18]/[$'Cálculo L y C filtro pi'.B$17]) -> 2897.87450432132
A217: 214 | B217: of:=2*PI()*[.A217] -> 1344.60165573643 | C217: of:=[.B217]/(2*PI()*[$Descripción.B$10]) -> 4.28 | D217: of:=POWER(IMABS(IMSQRT(1-POWER([.C217];2)));-1)*SQRT([$'Cálculo L y C filtro pi'.B$9]/[$'Cálculo L y C filtro pi'.B$8]) -> 144.177459020399 | E217: of:=POWER(IMABS(IMSQRT(1-POWER([.C217];2)));-1)*SQRT([$'Cálculo L y C filtro pi'.B$18]/[$'Cálculo L y C filtro pi'.B$17]) -> 2883.54918040798
A218: 215 | B218: of:=2*PI()*[.A218] -> 1350.88484104361 | C218: of:=[.B218]/(2*PI()*[$Descripción.B$10]) -> 4.3 | D218: of:=POWER(IMABS(IMSQRT(1-POWER([.C218];2)));-1)*SQRT([$'Cálculo L y C filtro pi'.B$9]/[$'Cálculo L y C filtro pi'.B$8]) -> 143.468429957643 | E218: of:=POWER(IMABS(IMSQRT(1-POWER([.C218];2)));-1)*SQRT([$'Cálculo L y C filtro pi'.B$18]/[$'Cálculo L y C filtro pi'.B$17]) -> 2869.36859915286
A219: 216 | B219: of:=2*PI()*[.A219] -> 1357.16802635079 | C219: of:=[.B219]/(2*PI()*[$Descripción.B$10]) -> 4.32 | D219: of:=POWER(IMABS(IMSQRT(1-POWER([.C219];2)));-1)*SQRT([$'Cálculo L y C filtro pi'.B$9]/[$'Cálculo L y C filtro pi'.B$8]) -> 142.766526201747 | E219: of:=POWER(IMABS(IMSQRT(1-POWER([.C219];2)));-1)*SQRT([$'Cálculo L y C filtro pi'.B$18]/[$'Cálculo L y C filtro pi'.B$17]) -> 2855.33052403494
A220: 217 | B220: of:=2*PI()*[.A220] -> 1363.45121165797 | C220: of:=[.B220]/(2*PI()*[$Descripción.B$10]) -> 4.34 | D220: of:=POWER(IMABS(IMSQRT(1-POWER([.C220];2)));-1)*SQRT([$'Cálculo L y C filtro pi'.B$9]/[$'Cálculo L y C filtro pi'.B$8]) -> 142.071638268597 | E220: of:=POWER(IMABS(IMSQRT(1-POWER([.C220];2)));-1)*SQRT([$'Cálculo L y C filtro pi'.B$18]/[$'Cálculo L y C filtro pi'.B$17]) -> 2841.43276537193
A221: 218 | B221: of:=2*PI()*[.A221] -> 1369.73439696515 | C221: of:=[.B221]/(2*PI()*[$Descripción.B$10]) -> 4.36 | D221: of:=POWER(IMABS(IMSQRT(1-POWER([.C221];2)));-1)*SQRT([$'Cálculo L y C filtro pi'.B$9]/[$'Cálculo L y C filtro pi'.B$8]) -> 141.38365895389 | E221: of:=POWER(IMABS(IMSQRT(1-POWER([.C221];2)));-1)*SQRT([$'Cálculo L y C filtro pi'.B$18]/[$'Cálculo L y C filtro pi'.B$17]) -> 2827.67317907779
A222: 219 | B222: of:=2*PI()*[.A222] -> 1376.01758227233 | C222: of:=[.B222]/(2*PI()*[$Descripción.B$10]) -> 4.38 | D222: of:=POWER(IMABS(IMSQRT(1-POWER([.C222];2)));-1)*SQRT([$'Cálculo L y C filtro pi'.B$9]/[$'Cálculo L y C filtro pi'.B$8]) -> 140.702483273006 | E222: of:=POWER(IMABS(IMSQRT(1-POWER([.C222];2)));-1)*SQRT([$'Cálculo L y C filtro pi'.B$18]/[$'Cálculo L y C filtro pi'.B$17]) -> 2814.04966546012
A223: 220 | B223: of:=2*PI()*[.A223] -> 1382.30076757951 | C223: of:=[.B223]/(2*PI()*[$Descripción.B$10]) -> 4.4 | D223: of:=POWER(IMABS(IMSQRT(1-POWER([.C223];2)));-1)*SQRT([$'Cálculo L y C filtro pi'.B$9]/[$'Cálculo L y C filtro pi'.B$8]) -> 140.028008402801 | E223: of:=POWER(IMABS(IMSQRT(1-POWER([.C223];2)));-1)*SQRT([$'Cálculo L y C filtro pi'.B$18]/[$'Cálculo L y C filtro pi'.B$17]) -> 2800.56016805602
A224: 221 | B224: of:=2*PI()*[.A224] -> 1388.58395288669 | C224: of:=[.B224]/(2*PI()*[$Descripción.B$10]) -> 4.42 | D224: of:=POWER(IMABS(IMSQRT(1-POWER([.C224];2)));-1)*SQRT([$'Cálculo L y C filtro pi'.B$9]/[$'Cálculo L y C filtro pi'.B$8]) -> 139.360133625249 | E224: of:=POWER(IMABS(IMSQRT(1-POWER([.C224];2)));-1)*SQRT([$'Cálculo L y C filtro pi'.B$18]/[$'Cálculo L y C filtro pi'.B$17]) -> 2787.20267250499
A225: 222 | B225: of:=2*PI()*[.A225] -> 1394.86713819387 | C225: of:=[.B225]/(2*PI()*[$Descripción.B$10]) -> 4.44000000000001 | D225: of:=POWER(IMABS(IMSQRT(1-POWER([.C225];2)));-1)*SQRT([$'Cálculo L y C filtro pi'.B$9]/[$'Cálculo L y C filtro pi'.B$8]) -> 138.69876027287 | E225: of:=POWER(IMABS(IMSQRT(1-POWER([.C225];2)));-1)*SQRT([$'Cálculo L y C filtro pi'.B$18]/[$'Cálculo L y C filtro pi'.B$17]) -> 2773.9752054574
A226: 223 | B226: of:=2*PI()*[.A226] -> 1401.15032350105 | C226: of:=[.B226]/(2*PI()*[$Descripción.B$10]) -> 4.46000000000001 | D226: of:=POWER(IMABS(IMSQRT(1-POWER([.C226];2)));-1)*SQRT([$'Cálculo L y C filtro pi'.B$9]/[$'Cálculo L y C filtro pi'.B$8]) -> 138.043791675867 | E226: of:=POWER(IMABS(IMSQRT(1-POWER([.C226];2)));-1)*SQRT([$'Cálculo L y C filtro pi'.B$18]/[$'Cálculo L y C filtro pi'.B$17]) -> 2760.87583351734
A227: 224 | B227: of:=2*PI()*[.A227] -> 1407.43350880823 | C227: of:=[.B227]/(2*PI()*[$Descripción.B$10]) -> 4.48000000000001 | D227: of:=POWER(IMABS(IMSQRT(1-POWER([.C227];2)));-1)*SQRT([$'Cálculo L y C filtro pi'.B$9]/[$'Cálculo L y C filtro pi'.B$8]) -> 137.395133110919 | E227: of:=POWER(IMABS(IMSQRT(1-POWER([.C227];2)));-1)*SQRT([$'Cálculo L y C filtro pi'.B$18]/[$'Cálculo L y C filtro pi'.B$17]) -> 2747.90266221839
A228: 225 | B228: of:=2*PI()*[.A228] -> 1413.71669411541 | C228: of:=[.B228]/(2*PI()*[$Descripción.B$10]) -> 4.50000000000001 | D228: of:=POWER(IMABS(IMSQRT(1-POWER([.C228];2)));-1)*SQRT([$'Cálculo L y C filtro pi'.B$9]/[$'Cálculo L y C filtro pi'.B$8]) -> 136.752691751565 | E228: of:=POWER(IMABS(IMSQRT(1-POWER([.C228];2)));-1)*SQRT([$'Cálculo L y C filtro pi'.B$18]/[$'Cálculo L y C filtro pi'.B$17]) -> 2735.05383503131
A229: 226 | B229: of:=2*PI()*[.A229] -> 1419.99987942259 | C229: of:=[.B229]/(2*PI()*[$Descripción.B$10]) -> 4.52000000000001 | D229: of:=POWER(IMABS(IMSQRT(1-POWER([.C229];2)));-1)*SQRT([$'Cálculo L y C filtro pi'.B$9]/[$'Cálculo L y C filtro pi'.B$8]) -> 136.116376620117 | E229: of:=POWER(IMABS(IMSQRT(1-POWER([.C229];2)));-1)*SQRT([$'Cálculo L y C filtro pi'.B$18]/[$'Cálculo L y C filtro pi'.B$17]) -> 2722.32753240235
A230: 227 | B230: of:=2*PI()*[.A230] -> 1426.28306472977 | C230: of:=[.B230]/(2*PI()*[$Descripción.B$10]) -> 4.54000000000001 | D230: of:=POWER(IMABS(IMSQRT(1-POWER([.C230];2)));-1)*SQRT([$'Cálculo L y C filtro pi'.B$9]/[$'Cálculo L y C filtro pi'.B$8]) -> 135.486098541056 | E230: of:=POWER(IMABS(IMSQRT(1-POWER([.C230];2)));-1)*SQRT([$'Cálculo L y C filtro pi'.B$18]/[$'Cálculo L y C filtro pi'.B$17]) -> 2709.72197082112
A231: 228 | B231: of:=2*PI()*[.A231] -> 1432.56625003695 | C231: of:=[.B231]/(2*PI()*[$Descripción.B$10]) -> 4.56000000000001 | D231: of:=POWER(IMABS(IMSQRT(1-POWER([.C231];2)));-1)*SQRT([$'Cálculo L y C filtro pi'.B$9]/[$'Cálculo L y C filtro pi'.B$8]) -> 134.861770095845 | E231: of:=POWER(IMABS(IMSQRT(1-POWER([.C231];2)));-1)*SQRT([$'Cálculo L y C filtro pi'.B$18]/[$'Cálculo L y C filtro pi'.B$17]) -> 2697.23540191689
A232: 229 | B232: of:=2*PI()*[.A232] -> 1438.84943534413 | C232: of:=[.B232]/(2*PI()*[$Descripción.B$10]) -> 4.58000000000001 | D232: of:=POWER(IMABS(IMSQRT(1-POWER([.C232];2)));-1)*SQRT([$'Cálculo L y C filtro pi'.B$9]/[$'Cálculo L y C filtro pi'.B$8]) -> 134.243305579122 | E232: of:=POWER(IMABS(IMSQRT(1-POWER([.C232];2)));-1)*SQRT([$'Cálculo L y C filtro pi'.B$18]/[$'Cálculo L y C filtro pi'.B$17]) -> 2684.86611158243
A233: 230 | B233: of:=2*PI()*[.A233] -> 1445.1326206513 | C233: of:=[.B233]/(2*PI()*[$Descripción.B$10]) -> 4.59999999999998 | D233: of:=POWER(IMABS(IMSQRT(1-POWER([.C233];2)));-1)*SQRT([$'Cálculo L y C filtro pi'.B$9]/[$'Cálculo L y C filtro pi'.B$8]) -> 133.630620956212 | E233: of:=POWER(IMABS(IMSQRT(1-POWER([.C233];2)));-1)*SQRT([$'Cálculo L y C filtro pi'.B$18]/[$'Cálculo L y C filtro pi'.B$17]) -> 2672.61241912425
A234: 231 | B234: of:=2*PI()*[.A234] -> 1451.41580595848 | C234: of:=[.B234]/(2*PI()*[$Descripción.B$10]) -> 4.61999999999999 | D234: of:=POWER(IMABS(IMSQRT(1-POWER([.C234];2)));-1)*SQRT([$'Cálculo L y C filtro pi'.B$9]/[$'Cálculo L y C filtro pi'.B$8]) -> 133.023633821918 | E234: of:=POWER(IMABS(IMSQRT(1-POWER([.C234];2)));-1)*SQRT([$'Cálculo L y C filtro pi'.B$18]/[$'Cálculo L y C filtro pi'.B$17]) -> 2660.47267643836
A235: 232 | B235: of:=2*PI()*[.A235] -> 1457.69899126566 | C235: of:=[.B235]/(2*PI()*[$Descripción.B$10]) -> 4.63999999999999 | D235: of:=POWER(IMABS(IMSQRT(1-POWER([.C235];2)));-1)*SQRT([$'Cálculo L y C filtro pi'.B$9]/[$'Cálculo L y C filtro pi'.B$8]) -> 132.42226336054 | E235: of:=POWER(IMABS(IMSQRT(1-POWER([.C235];2)));-1)*SQRT([$'Cálculo L y C filtro pi'.B$18]/[$'Cálculo L y C filtro pi'.B$17]) -> 2648.4452672108
A236: 233 | B236: of:=2*PI()*[.A236] -> 1463.98217657284 | C236: of:=[.B236]/(2*PI()*[$Descripción.B$10]) -> 4.65999999999999 | D236: of:=POWER(IMABS(IMSQRT(1-POWER([.C236];2)));-1)*SQRT([$'Cálculo L y C filtro pi'.B$9]/[$'Cálculo L y C filtro pi'.B$8]) -> 131.826430307089 | E236: of:=POWER(IMABS(IMSQRT(1-POWER([.C236];2)));-1)*SQRT([$'Cálculo L y C filtro pi'.B$18]/[$'Cálculo L y C filtro pi'.B$17]) -> 2636.52860614178
A237: 234 | B237: of:=2*PI()*[.A237] -> 1470.26536188002 | C237: of:=[.B237]/(2*PI()*[$Descripción.B$10]) -> 4.67999999999999 | D237: of:=POWER(IMABS(IMSQRT(1-POWER([.C237];2)));-1)*SQRT([$'Cálculo L y C filtro pi'.B$9]/[$'Cálculo L y C filtro pi'.B$8]) -> 131.236056909641 | E237: of:=POWER(IMABS(IMSQRT(1-POWER([.C237];2)));-1)*SQRT([$'Cálculo L y C filtro pi'.B$18]/[$'Cálculo L y C filtro pi'.B$17]) -> 2624.72113819282
A238: 235 | B238: of:=2*PI()*[.A238] -> 1476.5485471872 | C238: of:=[.B238]/(2*PI()*[$Descripción.B$10]) -> 4.69999999999999 | D238: of:=POWER(IMABS(IMSQRT(1-POWER([.C238];2)));-1)*SQRT([$'Cálculo L y C filtro pi'.B$9]/[$'Cálculo L y C filtro pi'.B$8]) -> 130.651066892803 | E238: of:=POWER(IMABS(IMSQRT(1-POWER([.C238];2)));-1)*SQRT([$'Cálculo L y C filtro pi'.B$18]/[$'Cálculo L y C filtro pi'.B$17]) -> 2613.02133785606
A239: 236 | B239: of:=2*PI()*[.A239] -> 1482.83173249438 | C239: of:=[.B239]/(2*PI()*[$Descripción.B$10]) -> 4.71999999999999 | D239: of:=POWER(IMABS(IMSQRT(1-POWER([.C239];2)));-1)*SQRT([$'Cálculo L y C filtro pi'.B$9]/[$'Cálculo L y C filtro pi'.B$8]) -> 130.071385422245 | E239: of:=POWER(IMABS(IMSQRT(1-POWER([.C239];2)));-1)*SQRT([$'Cálculo L y C filtro pi'.B$18]/[$'Cálculo L y C filtro pi'.B$17]) -> 2601.4277084449
A240: 237 | B240: of:=2*PI()*[.A240] -> 1489.11491780156 | C240: of:=[.B240]/(2*PI()*[$Descripción.B$10]) -> 4.73999999999999 | D240: of:=POWER(IMABS(IMSQRT(1-POWER([.C240];2)));-1)*SQRT([$'Cálculo L y C filtro pi'.B$9]/[$'Cálculo L y C filtro pi'.B$8]) -> 129.496939070264 | E240: of:=POWER(IMABS(IMSQRT(1-POWER([.C240];2)));-1)*SQRT([$'Cálculo L y C filtro pi'.B$18]/[$'Cálculo L y C filtro pi'.B$17]) -> 2589.93878140529
A241: 238 | B241: of:=2*PI()*[.A241] -> 1495.39810310874 | C241: of:=[.B241]/(2*PI()*[$Descripción.B$10]) -> 4.76 | D241: of:=POWER(IMABS(IMSQRT(1-POWER([.C241];2)));-1)*SQRT([$'Cálculo L y C filtro pi'.B$9]/[$'Cálculo L y C filtro pi'.B$8]) -> 128.927655782349 | E241: of:=POWER(IMABS(IMSQRT(1-POWER([.C241];2)));-1)*SQRT([$'Cálculo L y C filtro pi'.B$18]/[$'Cálculo L y C filtro pi'.B$17]) -> 2578.55311564699
A242: 239 | B242: of:=2*PI()*[.A242] -> 1501.68128841592 | C242: of:=[.B242]/(2*PI()*[$Descripción.B$10]) -> 4.78 | D242: of:=POWER(IMABS(IMSQRT(1-POWER([.C242];2)));-1)*SQRT([$'Cálculo L y C filtro pi'.B$9]/[$'Cálculo L y C filtro pi'.B$8]) -> 128.363464844701 | E242: of:=POWER(IMABS(IMSQRT(1-POWER([.C242];2)));-1)*SQRT([$'Cálculo L y C filtro pi'.B$18]/[$'Cálculo L y C filtro pi'.B$17]) -> 2567.26929689403
A243: 240 | B243: of:=2*PI()*[.A243] -> 1507.9644737231 | C243: of:=[.B243]/(2*PI()*[$Descripción.B$10]) -> 4.8 | D243: of:=POWER(IMABS(IMSQRT(1-POWER([.C243];2)));-1)*SQRT([$'Cálculo L y C filtro pi'.B$9]/[$'Cálculo L y C filtro pi'.B$8]) -> 127.804296852692 | E243: of:=POWER(IMABS(IMSQRT(1-POWER([.C243];2)));-1)*SQRT([$'Cálculo L y C filtro pi'.B$18]/[$'Cálculo L y C filtro pi'.B$17]) -> 2556.08593705383
A244: 241 | B244: of:=2*PI()*[.A244] -> 1514.24765903028 | C244: of:=[.B244]/(2*PI()*[$Descripción.B$10]) -> 4.82 | D244: of:=POWER(IMABS(IMSQRT(1-POWER([.C244];2)));-1)*SQRT([$'Cálculo L y C filtro pi'.B$9]/[$'Cálculo L y C filtro pi'.B$8]) -> 127.250083680213 | E244: of:=POWER(IMABS(IMSQRT(1-POWER([.C244];2)));-1)*SQRT([$'Cálculo L y C filtro pi'.B$18]/[$'Cálculo L y C filtro pi'.B$17]) -> 2545.00167360426
A245: 242 | B245: of:=2*PI()*[.A245] -> 1520.53084433746 | C245: of:=[.B245]/(2*PI()*[$Descripción.B$10]) -> 4.84 | D245: of:=POWER(IMABS(IMSQRT(1-POWER([.C245];2)));-1)*SQRT([$'Cálculo L y C filtro pi'.B$9]/[$'Cálculo L y C filtro pi'.B$8]) -> 126.700758449904 | E245: of:=POWER(IMABS(IMSQRT(1-POWER([.C245];2)));-1)*SQRT([$'Cálculo L y C filtro pi'.B$18]/[$'Cálculo L y C filtro pi'.B$17]) -> 2534.01516899807
A246: 243 | B246: of:=2*PI()*[.A246] -> 1526.81402964464 | C246: of:=[.B246]/(2*PI()*[$Descripción.B$10]) -> 4.86 | D246: of:=POWER(IMABS(IMSQRT(1-POWER([.C246];2)));-1)*SQRT([$'Cálculo L y C filtro pi'.B$9]/[$'Cálculo L y C filtro pi'.B$8]) -> 126.15625550421 | E246: of:=POWER(IMABS(IMSQRT(1-POWER([.C246];2)));-1)*SQRT([$'Cálculo L y C filtro pi'.B$18]/[$'Cálculo L y C filtro pi'.B$17]) -> 2523.1251100842
A247: 244 | B247: of:=2*PI()*[.A247] -> 1533.09721495182 | C247: of:=[.B247]/(2*PI()*[$Descripción.B$10]) -> 4.88 | D247: of:=POWER(IMABS(IMSQRT(1-POWER([.C247];2)));-1)*SQRT([$'Cálculo L y C filtro pi'.B$9]/[$'Cálculo L y C filtro pi'.B$8]) -> 125.616510377261 | E247: of:=POWER(IMABS(IMSQRT(1-POWER([.C247];2)));-1)*SQRT([$'Cálculo L y C filtro pi'.B$18]/[$'Cálculo L y C filtro pi'.B$17]) -> 2512.33020754521
A248: 245 | B248: of:=2*PI()*[.A248] -> 1539.380400259 | C248: of:=[.B248]/(2*PI()*[$Descripción.B$10]) -> 4.9 | D248: of:=POWER(IMABS(IMSQRT(1-POWER([.C248];2)));-1)*SQRT([$'Cálculo L y C filtro pi'.B$9]/[$'Cálculo L y C filtro pi'.B$8]) -> 125.081459767525 | E248: of:=POWER(IMABS(IMSQRT(1-POWER([.C248];2)));-1)*SQRT([$'Cálculo L y C filtro pi'.B$18]/[$'Cálculo L y C filtro pi'.B$17]) -> 2501.6291953505
A249: 246 | B249: of:=2*PI()*[.A249] -> 1545.66358556618 | C249: of:=[.B249]/(2*PI()*[$Descripción.B$10]) -> 4.92000000000001 | D249: of:=POWER(IMABS(IMSQRT(1-POWER([.C249];2)));-1)*SQRT([$'Cálculo L y C filtro pi'.B$9]/[$'Cálculo L y C filtro pi'.B$8]) -> 124.551041511235 | E249: of:=POWER(IMABS(IMSQRT(1-POWER([.C249];2)));-1)*SQRT([$'Cálculo L y C filtro pi'.B$18]/[$'Cálculo L y C filtro pi'.B$17]) -> 2491.02083022469
A250: 247 | B250: of:=2*PI()*[.A250] -> 1551.94677087336 | C250: of:=[.B250]/(2*PI()*[$Descripción.B$10]) -> 4.94000000000001 | D250: of:=POWER(IMABS(IMSQRT(1-POWER([.C250];2)));-1)*SQRT([$'Cálculo L y C filtro pi'.B$9]/[$'Cálculo L y C filtro pi'.B$8]) -> 124.025194556537 | E250: of:=POWER(IMABS(IMSQRT(1-POWER([.C250];2)));-1)*SQRT([$'Cálculo L y C filtro pi'.B$18]/[$'Cálculo L y C filtro pi'.B$17]) -> 2480.50389113074
A251: 248 | B251: of:=2*PI()*[.A251] -> 1558.22995618054 | C251: of:=[.B251]/(2*PI()*[$Descripción.B$10]) -> 4.96000000000001 | D251: of:=POWER(IMABS(IMSQRT(1-POWER([.C251];2)));-1)*SQRT([$'Cálculo L y C filtro pi'.B$9]/[$'Cálculo L y C filtro pi'.B$8]) -> 123.503858938359 | E251: of:=POWER(IMABS(IMSQRT(1-POWER([.C251];2)));-1)*SQRT([$'Cálculo L y C filtro pi'.B$18]/[$'Cálculo L y C filtro pi'.B$17]) -> 2470.07717876719
A252: 249 | B252: of:=2*PI()*[.A252] -> 1564.51314148772 | C252: of:=[.B252]/(2*PI()*[$Descripción.B$10]) -> 4.98000000000001 | D252: of:=POWER(IMABS(IMSQRT(1-POWER([.C252];2)));-1)*SQRT([$'Cálculo L y C filtro pi'.B$9]/[$'Cálculo L y C filtro pi'.B$8]) -> 122.986975753962 | E252: of:=POWER(IMABS(IMSQRT(1-POWER([.C252];2)));-1)*SQRT([$'Cálculo L y C filtro pi'.B$18]/[$'Cálculo L y C filtro pi'.B$17]) -> 2459.73951507925
A253: 250 | B253: of:=2*PI()*[.A253] -> 1570.7963267949 | C253: of:=[.B253]/(2*PI()*[$Descripción.B$10]) -> 5.00000000000001 | D253: of:=POWER(IMABS(IMSQRT(1-POWER([.C253];2)));-1)*SQRT([$'Cálculo L y C filtro pi'.B$9]/[$'Cálculo L y C filtro pi'.B$8]) -> 122.474487139159 | E253: of:=POWER(IMABS(IMSQRT(1-POWER([.C253];2)));-1)*SQRT([$'Cálculo L y C filtro pi'.B$18]/[$'Cálculo L y C filtro pi'.B$17]) -> 2449.48974278317
A254: 251 | B254: of:=2*PI()*[.A254] -> 1577.07951210208 | C254: of:=[.B254]/(2*PI()*[$Descripción.B$10]) -> 5.02000000000001 | D254: of:=POWER(IMABS(IMSQRT(1-POWER([.C254];2)));-1)*SQRT([$'Cálculo L y C filtro pi'.B$9]/[$'Cálculo L y C filtro pi'.B$8]) -> 121.966336245176 | E254: of:=POWER(IMABS(IMSQRT(1-POWER([.C254];2)));-1)*SQRT([$'Cálculo L y C filtro pi'.B$18]/[$'Cálculo L y C filtro pi'.B$17]) -> 2439.32672490352
A255: 252 | B255: of:=2*PI()*[.A255] -> 1583.36269740926 | C255: of:=[.B255]/(2*PI()*[$Descripción.B$10]) -> 5.04000000000001 | D255: of:=POWER(IMABS(IMSQRT(1-POWER([.C255];2)));-1)*SQRT([$'Cálculo L y C filtro pi'.B$9]/[$'Cálculo L y C filtro pi'.B$8]) -> 121.462467216145 | E255: of:=POWER(IMABS(IMSQRT(1-POWER([.C255];2)));-1)*SQRT([$'Cálculo L y C filtro pi'.B$18]/[$'Cálculo L y C filtro pi'.B$17]) -> 2429.24934432291
A256: 253 | B256: of:=2*PI()*[.A256] -> 1589.64588271644 | C256: of:=[.B256]/(2*PI()*[$Descripción.B$10]) -> 5.06000000000002 | D256: of:=POWER(IMABS(IMSQRT(1-POWER([.C256];2)));-1)*SQRT([$'Cálculo L y C filtro pi'.B$9]/[$'Cálculo L y C filtro pi'.B$8]) -> 120.962825167191 | E256: of:=POWER(IMABS(IMSQRT(1-POWER([.C256];2)));-1)*SQRT([$'Cálculo L y C filtro pi'.B$18]/[$'Cálculo L y C filtro pi'.B$17]) -> 2419.25650334381
A257: 254 | B257: of:=2*PI()*[.A257] -> 1595.92906802362 | C257: of:=[.B257]/(2*PI()*[$Descripción.B$10]) -> 5.08000000000002 | D257: of:=POWER(IMABS(IMSQRT(1-POWER([.C257];2)));-1)*SQRT([$'Cálculo L y C filtro pi'.B$9]/[$'Cálculo L y C filtro pi'.B$8]) -> 120.467356163106 | E257: of:=POWER(IMABS(IMSQRT(1-POWER([.C257];2)));-1)*SQRT([$'Cálculo L y C filtro pi'.B$18]/[$'Cálculo L y C filtro pi'.B$17]) -> 2409.34712326212
A258: 255 | B258: of:=2*PI()*[.A258] -> 1602.21225333079 | C258: of:=[.B258]/(2*PI()*[$Descripción.B$10]) -> 5.09999999999999 | D258: of:=POWER(IMABS(IMSQRT(1-POWER([.C258];2)));-1)*SQRT([$'Cálculo L y C filtro pi'.B$9]/[$'Cálculo L y C filtro pi'.B$8]) -> 119.976007197601 | E258: of:=POWER(IMABS(IMSQRT(1-POWER([.C258];2)));-1)*SQRT([$'Cálculo L y C filtro pi'.B$18]/[$'Cálculo L y C filtro pi'.B$17]) -> 2399.52014395202
A259: 256 | B259: of:=2*PI()*[.A259] -> 1608.49543863797 | C259: of:=[.B259]/(2*PI()*[$Descripción.B$10]) -> 5.11999999999999 | D259: of:=POWER(IMABS(IMSQRT(1-POWER([.C259];2)));-1)*SQRT([$'Cálculo L y C filtro pi'.B$9]/[$'Cálculo L y C filtro pi'.B$8]) -> 119.488726173088 | E259: of:=POWER(IMABS(IMSQRT(1-POWER([.C259];2)));-1)*SQRT([$'Cálculo L y C filtro pi'.B$18]/[$'Cálculo L y C filtro pi'.B$17]) -> 2389.77452346176
A260: 257 | B260: of:=2*PI()*[.A260] -> 1614.77862394515 | C260: of:=[.B260]/(2*PI()*[$Descripción.B$10]) -> 5.13999999999999 | D260: of:=POWER(IMABS(IMSQRT(1-POWER([.C260];2)));-1)*SQRT([$'Cálculo L y C filtro pi'.B$9]/[$'Cálculo L y C filtro pi'.B$8]) -> 119.005461881013 | E260: of:=POWER(IMABS(IMSQRT(1-POWER([.C260];2)));-1)*SQRT([$'Cálculo L y C filtro pi'.B$18]/[$'Cálculo L y C filtro pi'.B$17]) -> 2380.10923762025
A261: 258 | B261: of:=2*PI()*[.A261] -> 1621.06180925233 | C261: of:=[.B261]/(2*PI()*[$Descripción.B$10]) -> 5.15999999999999 | D261: of:=POWER(IMABS(IMSQRT(1-POWER([.C261];2)));-1)*SQRT([$'Cálculo L y C filtro pi'.B$9]/[$'Cálculo L y C filtro pi'.B$8]) -> 118.52616398269 | E261: of:=POWER(IMABS(IMSQRT(1-POWER([.C261];2)));-1)*SQRT([$'Cálculo L y C filtro pi'.B$18]/[$'Cálculo L y C filtro pi'.B$17]) -> 2370.52327965381
A262: 259 | B262: of:=2*PI()*[.A262] -> 1627.34499455951 | C262: of:=[.B262]/(2*PI()*[$Descripción.B$10]) -> 5.17999999999999 | D262: of:=POWER(IMABS(IMSQRT(1-POWER([.C262];2)));-1)*SQRT([$'Cálculo L y C filtro pi'.B$9]/[$'Cálculo L y C filtro pi'.B$8]) -> 118.050782990647 | E262: of:=POWER(IMABS(IMSQRT(1-POWER([.C262];2)));-1)*SQRT([$'Cálculo L y C filtro pi'.B$18]/[$'Cálculo L y C filtro pi'.B$17]) -> 2361.01565981294
A263: 260 | B263: of:=2*PI()*[.A263] -> 1633.62817986669 | C263: of:=[.B263]/(2*PI()*[$Descripción.B$10]) -> 5.19999999999999 | D263: of:=POWER(IMABS(IMSQRT(1-POWER([.C263];2)));-1)*SQRT([$'Cálculo L y C filtro pi'.B$9]/[$'Cálculo L y C filtro pi'.B$8]) -> 117.579270250443 | E263: of:=POWER(IMABS(IMSQRT(1-POWER([.C263];2)));-1)*SQRT([$'Cálculo L y C filtro pi'.B$18]/[$'Cálculo L y C filtro pi'.B$17]) -> 2351.58540500887
A264: 261 | B264: of:=2*PI()*[.A264] -> 1639.91136517387 | C264: of:=[.B264]/(2*PI()*[$Descripción.B$10]) -> 5.21999999999999 | D264: of:=POWER(IMABS(IMSQRT(1-POWER([.C264];2)));-1)*SQRT([$'Cálculo L y C filtro pi'.B$9]/[$'Cálculo L y C filtro pi'.B$8]) -> 117.111577922968 | E264: of:=POWER(IMABS(IMSQRT(1-POWER([.C264];2)));-1)*SQRT([$'Cálculo L y C filtro pi'.B$18]/[$'Cálculo L y C filtro pi'.B$17]) -> 2342.23155845936
A265: 262 | B265: of:=2*PI()*[.A265] -> 1646.19455048105 | C265: of:=[.B265]/(2*PI()*[$Descripción.B$10]) -> 5.24 | D265: of:=POWER(IMABS(IMSQRT(1-POWER([.C265];2)));-1)*SQRT([$'Cálculo L y C filtro pi'.B$9]/[$'Cálculo L y C filtro pi'.B$8]) -> 116.647658967188 | E265: of:=POWER(IMABS(IMSQRT(1-POWER([.C265];2)));-1)*SQRT([$'Cálculo L y C filtro pi'.B$18]/[$'Cálculo L y C filtro pi'.B$17]) -> 2332.95317934377
A266: 263 | B266: of:=2*PI()*[.A266] -> 1652.47773578823 | C266: of:=[.B266]/(2*PI()*[$Descripción.B$10]) -> 5.26 | D266: of:=POWER(IMABS(IMSQRT(1-POWER([.C266];2)));-1)*SQRT([$'Cálculo L y C filtro pi'.B$9]/[$'Cálculo L y C filtro pi'.B$8]) -> 116.187467123339 | E266: of:=POWER(IMABS(IMSQRT(1-POWER([.C266];2)));-1)*SQRT([$'Cálculo L y C filtro pi'.B$18]/[$'Cálculo L y C filtro pi'.B$17]) -> 2323.74934246678
A267: 264 | B267: of:=2*PI()*[.A267] -> 1658.76092109541 | C267: of:=[.B267]/(2*PI()*[$Descripción.B$10]) -> 5.28 | D267: of:=POWER(IMABS(IMSQRT(1-POWER([.C267];2)));-1)*SQRT([$'Cálculo L y C filtro pi'.B$9]/[$'Cálculo L y C filtro pi'.B$8]) -> 115.730956896543 | E267: of:=POWER(IMABS(IMSQRT(1-POWER([.C267];2)));-1)*SQRT([$'Cálculo L y C filtro pi'.B$18]/[$'Cálculo L y C filtro pi'.B$17]) -> 2314.61913793086
A268: 265 | B268: of:=2*PI()*[.A268] -> 1665.04410640259 | C268: of:=[.B268]/(2*PI()*[$Descripción.B$10]) -> 5.3 | D268: of:=POWER(IMABS(IMSQRT(1-POWER([.C268];2)));-1)*SQRT([$'Cálculo L y C filtro pi'.B$9]/[$'Cálculo L y C filtro pi'.B$8]) -> 115.278083540847 | E268: of:=POWER(IMABS(IMSQRT(1-POWER([.C268];2)));-1)*SQRT([$'Cálculo L y C filtro pi'.B$18]/[$'Cálculo L y C filtro pi'.B$17]) -> 2305.56167081694
A269: 266 | B269: of:=2*PI()*[.A269] -> 1671.32729170977 | C269: of:=[.B269]/(2*PI()*[$Descripción.B$10]) -> 5.32 | D269: of:=POWER(IMABS(IMSQRT(1-POWER([.C269];2)));-1)*SQRT([$'Cálculo L y C filtro pi'.B$9]/[$'Cálculo L y C filtro pi'.B$8]) -> 114.828803043656 | E269: of:=POWER(IMABS(IMSQRT(1-POWER([.C269];2)));-1)*SQRT([$'Cálculo L y C filtro pi'.B$18]/[$'Cálculo L y C filtro pi'.B$17]) -> 2296.57606087313
A270: 267 | B270: of:=2*PI()*[.A270] -> 1677.61047701695 | C270: of:=[.B270]/(2*PI()*[$Descripción.B$10]) -> 5.34 | D270: of:=POWER(IMABS(IMSQRT(1-POWER([.C270];2)));-1)*SQRT([$'Cálculo L y C filtro pi'.B$9]/[$'Cálculo L y C filtro pi'.B$8]) -> 114.383072110567 | E270: of:=POWER(IMABS(IMSQRT(1-POWER([.C270];2)));-1)*SQRT([$'Cálculo L y C filtro pi'.B$18]/[$'Cálculo L y C filtro pi'.B$17]) -> 2287.66144221134
A271: 268 | B271: of:=2*PI()*[.A271] -> 1683.89366232413 | C271: of:=[.B271]/(2*PI()*[$Descripción.B$10]) -> 5.36 | D271: of:=POWER(IMABS(IMSQRT(1-POWER([.C271];2)));-1)*SQRT([$'Cálculo L y C filtro pi'.B$9]/[$'Cálculo L y C filtro pi'.B$8]) -> 113.940848150573 | E271: of:=POWER(IMABS(IMSQRT(1-POWER([.C271];2)));-1)*SQRT([$'Cálculo L y C filtro pi'.B$18]/[$'Cálculo L y C filtro pi'.B$17]) -> 2278.81696301146
A272: 269 | B272: of:=2*PI()*[.A272] -> 1690.17684763131 | C272: of:=[.B272]/(2*PI()*[$Descripción.B$10]) -> 5.38 | D272: of:=POWER(IMABS(IMSQRT(1-POWER([.C272];2)));-1)*SQRT([$'Cálculo L y C filtro pi'.B$9]/[$'Cálculo L y C filtro pi'.B$8]) -> 113.502089261644 | E272: of:=POWER(IMABS(IMSQRT(1-POWER([.C272];2)));-1)*SQRT([$'Cálculo L y C filtro pi'.B$18]/[$'Cálculo L y C filtro pi'.B$17]) -> 2270.04178523289
A273: 270 | B273: of:=2*PI()*[.A273] -> 1696.46003293849 | C273: of:=[.B273]/(2*PI()*[$Descripción.B$10]) -> 5.40000000000001 | D273: of:=POWER(IMABS(IMSQRT(1-POWER([.C273];2)));-1)*SQRT([$'Cálculo L y C filtro pi'.B$9]/[$'Cálculo L y C filtro pi'.B$8]) -> 113.066754216661 | E273: of:=POWER(IMABS(IMSQRT(1-POWER([.C273];2)));-1)*SQRT([$'Cálculo L y C filtro pi'.B$18]/[$'Cálculo L y C filtro pi'.B$17]) -> 2261.33508433322
A274: 271 | B274: of:=2*PI()*[.A274] -> 1702.74321824567 | C274: of:=[.B274]/(2*PI()*[$Descripción.B$10]) -> 5.42000000000001 | D274: of:=POWER(IMABS(IMSQRT(1-POWER([.C274];2)));-1)*SQRT([$'Cálculo L y C filtro pi'.B$9]/[$'Cálculo L y C filtro pi'.B$8]) -> 112.634802449697 | E274: of:=POWER(IMABS(IMSQRT(1-POWER([.C274];2)));-1)*SQRT([$'Cálculo L y C filtro pi'.B$18]/[$'Cálculo L y C filtro pi'.B$17]) -> 2252.69604899395
A275: 272 | B275: of:=2*PI()*[.A275] -> 1709.02640355285 | C275: of:=[.B275]/(2*PI()*[$Descripción.B$10]) -> 5.44000000000001 | D275: of:=POWER(IMABS(IMSQRT(1-POWER([.C275];2)));-1)*SQRT([$'Cálculo L y C filtro pi'.B$9]/[$'Cálculo L y C filtro pi'.B$8]) -> 112.206194042639 | E275: of:=POWER(IMABS(IMSQRT(1-POWER([.C275];2)));-1)*SQRT([$'Cálculo L y C filtro pi'.B$18]/[$'Cálculo L y C filtro pi'.B$17]) -> 2244.12388085277
A276: 273 | B276: of:=2*PI()*[.A276] -> 1715.30958886003 | C276: of:=[.B276]/(2*PI()*[$Descripción.B$10]) -> 5.46000000000001 | D276: of:=POWER(IMABS(IMSQRT(1-POWER([.C276];2)));-1)*SQRT([$'Cálculo L y C filtro pi'.B$9]/[$'Cálculo L y C filtro pi'.B$8]) -> 111.780889712131 | E276: of:=POWER(IMABS(IMSQRT(1-POWER([.C276];2)));-1)*SQRT([$'Cálculo L y C filtro pi'.B$18]/[$'Cálculo L y C filtro pi'.B$17]) -> 2235.61779424261
A277: 274 | B277: of:=2*PI()*[.A277] -> 1721.59277416721 | C277: of:=[.B277]/(2*PI()*[$Descripción.B$10]) -> 5.48000000000001 | D277: of:=POWER(IMABS(IMSQRT(1-POWER([.C277];2)));-1)*SQRT([$'Cálculo L y C filtro pi'.B$9]/[$'Cálculo L y C filtro pi'.B$8]) -> 111.358850796843 | E277: of:=POWER(IMABS(IMSQRT(1-POWER([.C277];2)));-1)*SQRT([$'Cálculo L y C filtro pi'.B$18]/[$'Cálculo L y C filtro pi'.B$17]) -> 2227.17701593687
A278: 275 | B278: of:=2*PI()*[.A278] -> 1727.87595947439 | C278: of:=[.B278]/(2*PI()*[$Descripción.B$10]) -> 5.50000000000001 | D278: of:=POWER(IMABS(IMSQRT(1-POWER([.C278];2)));-1)*SQRT([$'Cálculo L y C filtro pi'.B$9]/[$'Cálculo L y C filtro pi'.B$8]) -> 110.940039245046 | E278: of:=POWER(IMABS(IMSQRT(1-POWER([.C278];2)));-1)*SQRT([$'Cálculo L y C filtro pi'.B$18]/[$'Cálculo L y C filtro pi'.B$17]) -> 2218.80078490091
A279: 276 | B279: of:=2*PI()*[.A279] -> 1734.15914478157 | C279: of:=[.B279]/(2*PI()*[$Descripción.B$10]) -> 5.52000000000001 | D279: of:=POWER(IMABS(IMSQRT(1-POWER([.C279];2)));-1)*SQRT([$'Cálculo L y C filtro pi'.B$9]/[$'Cálculo L y C filtro pi'.B$8]) -> 110.52441760248 | E279: of:=POWER(IMABS(IMSQRT(1-POWER([.C279];2)));-1)*SQRT([$'Cálculo L y C filtro pi'.B$18]/[$'Cálculo L y C filtro pi'.B$17]) -> 2210.48835204959
A280: 277 | B280: of:=2*PI()*[.A280] -> 1740.44233008875 | C280: of:=[.B280]/(2*PI()*[$Descripción.B$10]) -> 5.54000000000001 | D280: of:=POWER(IMABS(IMSQRT(1-POWER([.C280];2)));-1)*SQRT([$'Cálculo L y C filtro pi'.B$9]/[$'Cálculo L y C filtro pi'.B$8]) -> 110.111949000526 | E280: of:=POWER(IMABS(IMSQRT(1-POWER([.C280];2)));-1)*SQRT([$'Cálculo L y C filtro pi'.B$18]/[$'Cálculo L y C filtro pi'.B$17]) -> 2202.23898001052
A281: 278 | B281: of:=2*PI()*[.A281] -> 1746.72551539593 | C281: of:=[.B281]/(2*PI()*[$Descripción.B$10]) -> 5.56000000000002 | D281: of:=POWER(IMABS(IMSQRT(1-POWER([.C281];2)));-1)*SQRT([$'Cálculo L y C filtro pi'.B$9]/[$'Cálculo L y C filtro pi'.B$8]) -> 109.702597144654 | E281: of:=POWER(IMABS(IMSQRT(1-POWER([.C281];2)));-1)*SQRT([$'Cálculo L y C filtro pi'.B$18]/[$'Cálculo L y C filtro pi'.B$17]) -> 2194.05194289309
A282: 279 | B282: of:=2*PI()*[.A282] -> 1753.0087007031 | C282: of:=[.B282]/(2*PI()*[$Descripción.B$10]) -> 5.57999999999999 | D282: of:=POWER(IMABS(IMSQRT(1-POWER([.C282];2)));-1)*SQRT([$'Cálculo L y C filtro pi'.B$9]/[$'Cálculo L y C filtro pi'.B$8]) -> 109.296326303148 | E282: of:=POWER(IMABS(IMSQRT(1-POWER([.C282];2)));-1)*SQRT([$'Cálculo L y C filtro pi'.B$18]/[$'Cálculo L y C filtro pi'.B$17]) -> 2185.92652606296
A283: 280 | B283: of:=2*PI()*[.A283] -> 1759.29188601028 | C283: of:=[.B283]/(2*PI()*[$Descripción.B$10]) -> 5.59999999999999 | D283: of:=POWER(IMABS(IMSQRT(1-POWER([.C283];2)));-1)*SQRT([$'Cálculo L y C filtro pi'.B$9]/[$'Cálculo L y C filtro pi'.B$8]) -> 108.893101296094 | E283: of:=POWER(IMABS(IMSQRT(1-POWER([.C283];2)));-1)*SQRT([$'Cálculo L y C filtro pi'.B$18]/[$'Cálculo L y C filtro pi'.B$17]) -> 2177.86202592189
A284: 281 | B284: of:=2*PI()*[.A284] -> 1765.57507131746 | C284: of:=[.B284]/(2*PI()*[$Descripción.B$10]) -> 5.61999999999999 | D284: of:=POWER(IMABS(IMSQRT(1-POWER([.C284];2)));-1)*SQRT([$'Cálculo L y C filtro pi'.B$9]/[$'Cálculo L y C filtro pi'.B$8]) -> 108.492887484641 | E284: of:=POWER(IMABS(IMSQRT(1-POWER([.C284];2)));-1)*SQRT([$'Cálculo L y C filtro pi'.B$18]/[$'Cálculo L y C filtro pi'.B$17]) -> 2169.85774969282
A285: 282 | B285: of:=2*PI()*[.A285] -> 1771.85825662464 | C285: of:=[.B285]/(2*PI()*[$Descripción.B$10]) -> 5.63999999999999 | D285: of:=POWER(IMABS(IMSQRT(1-POWER([.C285];2)));-1)*SQRT([$'Cálculo L y C filtro pi'.B$9]/[$'Cálculo L y C filtro pi'.B$8]) -> 108.095650760501 | E285: of:=POWER(IMABS(IMSQRT(1-POWER([.C285];2)));-1)*SQRT([$'Cálculo L y C filtro pi'.B$18]/[$'Cálculo L y C filtro pi'.B$17]) -> 2161.91301521001
A286: 283 | B286: of:=2*PI()*[.A286] -> 1778.14144193182 | C286: of:=[.B286]/(2*PI()*[$Descripción.B$10]) -> 5.65999999999999 | D286: of:=POWER(IMABS(IMSQRT(1-POWER([.C286];2)));-1)*SQRT([$'Cálculo L y C filtro pi'.B$9]/[$'Cálculo L y C filtro pi'.B$8]) -> 107.701357535702 | E286: of:=POWER(IMABS(IMSQRT(1-POWER([.C286];2)));-1)*SQRT([$'Cálculo L y C filtro pi'.B$18]/[$'Cálculo L y C filtro pi'.B$17]) -> 2154.02715071404
A287: 284 | B287: of:=2*PI()*[.A287] -> 1784.424627239 | C287: of:=[.B287]/(2*PI()*[$Descripción.B$10]) -> 5.67999999999999 | D287: of:=POWER(IMABS(IMSQRT(1-POWER([.C287];2)));-1)*SQRT([$'Cálculo L y C filtro pi'.B$9]/[$'Cálculo L y C filtro pi'.B$8]) -> 107.309974732582 | E287: of:=POWER(IMABS(IMSQRT(1-POWER([.C287];2)));-1)*SQRT([$'Cálculo L y C filtro pi'.B$18]/[$'Cálculo L y C filtro pi'.B$17]) -> 2146.19949465164
A288: 285 | B288: of:=2*PI()*[.A288] -> 1790.70781254618 | C288: of:=[.B288]/(2*PI()*[$Descripción.B$10]) -> 5.69999999999999 | D288: of:=POWER(IMABS(IMSQRT(1-POWER([.C288];2)));-1)*SQRT([$'Cálculo L y C filtro pi'.B$9]/[$'Cálculo L y C filtro pi'.B$8]) -> 106.92146977401 | E288: of:=POWER(IMABS(IMSQRT(1-POWER([.C288];2)));-1)*SQRT([$'Cálculo L y C filtro pi'.B$18]/[$'Cálculo L y C filtro pi'.B$17]) -> 2138.4293954802
A289: 286 | B289: of:=2*PI()*[.A289] -> 1796.99099785336 | C289: of:=[.B289]/(2*PI()*[$Descripción.B$10]) -> 5.71999999999999 | D289: of:=POWER(IMABS(IMSQRT(1-POWER([.C289];2)));-1)*SQRT([$'Cálculo L y C filtro pi'.B$9]/[$'Cálculo L y C filtro pi'.B$8]) -> 106.535810573838 | E289: of:=POWER(IMABS(IMSQRT(1-POWER([.C289];2)));-1)*SQRT([$'Cálculo L y C filtro pi'.B$18]/[$'Cálculo L y C filtro pi'.B$17]) -> 2130.71621147677
A290: 287 | B290: of:=2*PI()*[.A290] -> 1803.27418316054 | C290: of:=[.B290]/(2*PI()*[$Descripción.B$10]) -> 5.74 | D290: of:=POWER(IMABS(IMSQRT(1-POWER([.C290];2)));-1)*SQRT([$'Cálculo L y C filtro pi'.B$9]/[$'Cálculo L y C filtro pi'.B$8]) -> 106.152965527572 | E290: of:=POWER(IMABS(IMSQRT(1-POWER([.C290];2)));-1)*SQRT([$'Cálculo L y C filtro pi'.B$18]/[$'Cálculo L y C filtro pi'.B$17]) -> 2123.05931055144
A291: 288 | B291: of:=2*PI()*[.A291] -> 1809.55736846772 | C291: of:=[.B291]/(2*PI()*[$Descripción.B$10]) -> 5.76 | D291: of:=POWER(IMABS(IMSQRT(1-POWER([.C291];2)));-1)*SQRT([$'Cálculo L y C filtro pi'.B$9]/[$'Cálculo L y C filtro pi'.B$8]) -> 105.772903503255 | E291: of:=POWER(IMABS(IMSQRT(1-POWER([.C291];2)));-1)*SQRT([$'Cálculo L y C filtro pi'.B$18]/[$'Cálculo L y C filtro pi'.B$17]) -> 2115.4580700651
A292: 289 | B292: of:=2*PI()*[.A292] -> 1815.8405537749 | C292: of:=[.B292]/(2*PI()*[$Descripción.B$10]) -> 5.78 | D292: of:=POWER(IMABS(IMSQRT(1-POWER([.C292];2)));-1)*SQRT([$'Cálculo L y C filtro pi'.B$9]/[$'Cálculo L y C filtro pi'.B$8]) -> 105.395593832564 | E292: of:=POWER(IMABS(IMSQRT(1-POWER([.C292];2)));-1)*SQRT([$'Cálculo L y C filtro pi'.B$18]/[$'Cálculo L y C filtro pi'.B$17]) -> 2107.91187665127
A293: 290 | B293: of:=2*PI()*[.A293] -> 1822.12373908208 | C293: of:=[.B293]/(2*PI()*[$Descripción.B$10]) -> 5.8 | D293: of:=POWER(IMABS(IMSQRT(1-POWER([.C293];2)));-1)*SQRT([$'Cálculo L y C filtro pi'.B$9]/[$'Cálculo L y C filtro pi'.B$8]) -> 105.021006302101 | E293: of:=POWER(IMABS(IMSQRT(1-POWER([.C293];2)));-1)*SQRT([$'Cálculo L y C filtro pi'.B$18]/[$'Cálculo L y C filtro pi'.B$17]) -> 2100.42012604201
A294: 291 | B294: of:=2*PI()*[.A294] -> 1828.40692438926 | C294: of:=[.B294]/(2*PI()*[$Descripción.B$10]) -> 5.82 | D294: of:=POWER(IMABS(IMSQRT(1-POWER([.C294];2)));-1)*SQRT([$'Cálculo L y C filtro pi'.B$9]/[$'Cálculo L y C filtro pi'.B$8]) -> 104.649111144893 | E294: of:=POWER(IMABS(IMSQRT(1-POWER([.C294];2)));-1)*SQRT([$'Cálculo L y C filtro pi'.B$18]/[$'Cálculo L y C filtro pi'.B$17]) -> 2092.98222289785
A295: 292 | B295: of:=2*PI()*[.A295] -> 1834.69010969644 | C295: of:=[.B295]/(2*PI()*[$Descripción.B$10]) -> 5.84 | D295: of:=POWER(IMABS(IMSQRT(1-POWER([.C295];2)));-1)*SQRT([$'Cálculo L y C filtro pi'.B$9]/[$'Cálculo L y C filtro pi'.B$8]) -> 104.279879032074 | E295: of:=POWER(IMABS(IMSQRT(1-POWER([.C295];2)));-1)*SQRT([$'Cálculo L y C filtro pi'.B$18]/[$'Cálculo L y C filtro pi'.B$17]) -> 2085.59758064147
A296: 293 | B296: of:=2*PI()*[.A296] -> 1840.97329500362 | C296: of:=[.B296]/(2*PI()*[$Descripción.B$10]) -> 5.86 | D296: of:=POWER(IMABS(IMSQRT(1-POWER([.C296];2)));-1)*SQRT([$'Cálculo L y C filtro pi'.B$9]/[$'Cálculo L y C filtro pi'.B$8]) -> 103.913281064758 | E296: of:=POWER(IMABS(IMSQRT(1-POWER([.C296];2)));-1)*SQRT([$'Cálculo L y C filtro pi'.B$18]/[$'Cálculo L y C filtro pi'.B$17]) -> 2078.26562129517
A297: 294 | B297: of:=2*PI()*[.A297] -> 1847.2564803108 | C297: of:=[.B297]/(2*PI()*[$Descripción.B$10]) -> 5.88000000000001 | D297: of:=POWER(IMABS(IMSQRT(1-POWER([.C297];2)));-1)*SQRT([$'Cálculo L y C filtro pi'.B$9]/[$'Cálculo L y C filtro pi'.B$8]) -> 103.549288766099 | E297: of:=POWER(IMABS(IMSQRT(1-POWER([.C297];2)));-1)*SQRT([$'Cálculo L y C filtro pi'.B$18]/[$'Cálculo L y C filtro pi'.B$17]) -> 2070.98577532197
A298: 295 | B298: of:=2*PI()*[.A298] -> 1853.53966561798 | C298: of:=[.B298]/(2*PI()*[$Descripción.B$10]) -> 5.90000000000001 | D298: of:=POWER(IMABS(IMSQRT(1-POWER([.C298];2)));-1)*SQRT([$'Cálculo L y C filtro pi'.B$9]/[$'Cálculo L y C filtro pi'.B$8]) -> 103.187874073516 | E298: of:=POWER(IMABS(IMSQRT(1-POWER([.C298];2)));-1)*SQRT([$'Cálculo L y C filtro pi'.B$18]/[$'Cálculo L y C filtro pi'.B$17]) -> 2063.75748147033
A299: 296 | B299: of:=2*PI()*[.A299] -> 1859.82285092516 | C299: of:=[.B299]/(2*PI()*[$Descripción.B$10]) -> 5.92000000000001 | D299: of:=POWER(IMABS(IMSQRT(1-POWER([.C299];2)));-1)*SQRT([$'Cálculo L y C filtro pi'.B$9]/[$'Cálculo L y C filtro pi'.B$8]) -> 102.829009331107 | E299: of:=POWER(IMABS(IMSQRT(1-POWER([.C299];2)));-1)*SQRT([$'Cálculo L y C filtro pi'.B$18]/[$'Cálculo L y C filtro pi'.B$17]) -> 2056.58018662214
A300: 297 | B300: of:=2*PI()*[.A300] -> 1866.10603623234 | C300: of:=[.B300]/(2*PI()*[$Descripción.B$10]) -> 5.94000000000001 | D300: of:=POWER(IMABS(IMSQRT(1-POWER([.C300];2)));-1)*SQRT([$'Cálculo L y C filtro pi'.B$9]/[$'Cálculo L y C filtro pi'.B$8]) -> 102.472667282215 | E300: of:=POWER(IMABS(IMSQRT(1-POWER([.C300];2)));-1)*SQRT([$'Cálculo L y C filtro pi'.B$18]/[$'Cálculo L y C filtro pi'.B$17]) -> 2049.45334564431
A301: 298 | B301: of:=2*PI()*[.A301] -> 1872.38922153952 | C301: of:=[.B301]/(2*PI()*[$Descripción.B$10]) -> 5.96000000000001 | D301: of:=POWER(IMABS(IMSQRT(1-POWER([.C301];2)));-1)*SQRT([$'Cálculo L y C filtro pi'.B$9]/[$'Cálculo L y C filtro pi'.B$8]) -> 102.118821062172 | E301: of:=POWER(IMABS(IMSQRT(1-POWER([.C301];2)));-1)*SQRT([$'Cálculo L y C filtro pi'.B$18]/[$'Cálculo L y C filtro pi'.B$17]) -> 2042.37642124344
A302: 299 | B302: of:=2*PI()*[.A302] -> 1878.6724068467 | C302: of:=[.B302]/(2*PI()*[$Descripción.B$10]) -> 5.98000000000001 | D302: of:=POWER(IMABS(IMSQRT(1-POWER([.C302];2)));-1)*SQRT([$'Cálculo L y C filtro pi'.B$9]/[$'Cálculo L y C filtro pi'.B$8]) -> 101.767444191191 | E302: of:=POWER(IMABS(IMSQRT(1-POWER([.C302];2)));-1)*SQRT([$'Cálculo L y C filtro pi'.B$18]/[$'Cálculo L y C filtro pi'.B$17]) -> 2035.34888382382
A303: 300 | B303: of:=2*PI()*[.A303] -> 1884.95559215388 | C303: of:=[.B303]/(2*PI()*[$Descripción.B$10]) -> 6.00000000000001 | D303: of:=POWER(IMABS(IMSQRT(1-POWER([.C303];2)));-1)*SQRT([$'Cálculo L y C filtro pi'.B$9]/[$'Cálculo L y C filtro pi'.B$8]) -> 101.418510567422 | E303: of:=POWER(IMABS(IMSQRT(1-POWER([.C303];2)));-1)*SQRT([$'Cálculo L y C filtro pi'.B$18]/[$'Cálculo L y C filtro pi'.B$17]) -> 2028.37021134844
A304: 301 | B304: of:=2*PI()*[.A304] -> 1891.23877746106 | C304: of:=[.B304]/(2*PI()*[$Descripción.B$10]) -> 6.02000000000001 | D304: of:=POWER(IMABS(IMSQRT(1-POWER([.C304];2)));-1)*SQRT([$'Cálculo L y C filtro pi'.B$9]/[$'Cálculo L y C filtro pi'.B$8]) -> 101.071994460155 | E304: of:=POWER(IMABS(IMSQRT(1-POWER([.C304];2)));-1)*SQRT([$'Cálculo L y C filtro pi'.B$18]/[$'Cálculo L y C filtro pi'.B$17]) -> 2021.4398892031
A305: 302 | B305: of:=2*PI()*[.A305] -> 1897.52196276823 | C305: of:=[.B305]/(2*PI()*[$Descripción.B$10]) -> 6.03999999999998 | D305: of:=POWER(IMABS(IMSQRT(1-POWER([.C305];2)));-1)*SQRT([$'Cálculo L y C filtro pi'.B$9]/[$'Cálculo L y C filtro pi'.B$8]) -> 100.727870503173 | E305: of:=POWER(IMABS(IMSQRT(1-POWER([.C305];2)));-1)*SQRT([$'Cálculo L y C filtro pi'.B$18]/[$'Cálculo L y C filtro pi'.B$17]) -> 2014.55741006346
A306: 303 | B306: of:=2*PI()*[.A306] -> 1903.80514807541 | C306: of:=[.B306]/(2*PI()*[$Descripción.B$10]) -> 6.05999999999999 | D306: of:=POWER(IMABS(IMSQRT(1-POWER([.C306];2)));-1)*SQRT([$'Cálculo L y C filtro pi'.B$9]/[$'Cálculo L y C filtro pi'.B$8]) -> 100.386113688244 | E306: of:=POWER(IMABS(IMSQRT(1-POWER([.C306];2)));-1)*SQRT([$'Cálculo L y C filtro pi'.B$18]/[$'Cálculo L y C filtro pi'.B$17]) -> 2007.72227376488
A307: 304 | B307: of:=2*PI()*[.A307] -> 1910.08833338259 | C307: of:=[.B307]/(2*PI()*[$Descripción.B$10]) -> 6.07999999999999 | D307: of:=POWER(IMABS(IMSQRT(1-POWER([.C307];2)));-1)*SQRT([$'Cálculo L y C filtro pi'.B$9]/[$'Cálculo L y C filtro pi'.B$8]) -> 100.046699358762 | E307: of:=POWER(IMABS(IMSQRT(1-POWER([.C307];2)));-1)*SQRT([$'Cálculo L y C filtro pi'.B$18]/[$'Cálculo L y C filtro pi'.B$17]) -> 2000.93398717524
A308: 305 | B308: of:=2*PI()*[.A308] -> 1916.37151868977 | C308: of:=[.B308]/(2*PI()*[$Descripción.B$10]) -> 6.09999999999999 | D308: of:=POWER(IMABS(IMSQRT(1-POWER([.C308];2)));-1)*SQRT([$'Cálculo L y C filtro pi'.B$9]/[$'Cálculo L y C filtro pi'.B$8]) -> 99.7096032035156 | E308: of:=POWER(IMABS(IMSQRT(1-POWER([.C308];2)));-1)*SQRT([$'Cálculo L y C filtro pi'.B$18]/[$'Cálculo L y C filtro pi'.B$17]) -> 1994.19206407031
A309: 306 | B309: of:=2*PI()*[.A309] -> 1922.65470399695 | C309: of:=[.B309]/(2*PI()*[$Descripción.B$10]) -> 6.11999999999999 | D309: of:=POWER(IMABS(IMSQRT(1-POWER([.C309];2)));-1)*SQRT([$'Cálculo L y C filtro pi'.B$9]/[$'Cálculo L y C filtro pi'.B$8]) -> 99.3748012505964 | E309: of:=POWER(IMABS(IMSQRT(1-POWER([.C309];2)));-1)*SQRT([$'Cálculo L y C filtro pi'.B$18]/[$'Cálculo L y C filtro pi'.B$17]) -> 1987.49602501193
A310: 307 | B310: of:=2*PI()*[.A310] -> 1928.93788930413 | C310: of:=[.B310]/(2*PI()*[$Descripción.B$10]) -> 6.13999999999999 | D310: of:=POWER(IMABS(IMSQRT(1-POWER([.C310];2)));-1)*SQRT([$'Cálculo L y C filtro pi'.B$9]/[$'Cálculo L y C filtro pi'.B$8]) -> 99.0422698614327 | E310: of:=POWER(IMABS(IMSQRT(1-POWER([.C310];2)));-1)*SQRT([$'Cálculo L y C filtro pi'.B$18]/[$'Cálculo L y C filtro pi'.B$17]) -> 1980.84539722866
A311: 308 | B311: of:=2*PI()*[.A311] -> 1935.22107461131 | C311: of:=[.B311]/(2*PI()*[$Descripción.B$10]) -> 6.15999999999999 | D311: of:=POWER(IMABS(IMSQRT(1-POWER([.C311];2)));-1)*SQRT([$'Cálculo L y C filtro pi'.B$9]/[$'Cálculo L y C filtro pi'.B$8]) -> 98.711985724953 | E311: of:=POWER(IMABS(IMSQRT(1-POWER([.C311];2)));-1)*SQRT([$'Cálculo L y C filtro pi'.B$18]/[$'Cálculo L y C filtro pi'.B$17]) -> 1974.23971449906
A312: 309 | B312: of:=2*PI()*[.A312] -> 1941.50425991849 | C312: of:=[.B312]/(2*PI()*[$Descripción.B$10]) -> 6.17999999999999 | D312: of:=POWER(IMABS(IMSQRT(1-POWER([.C312];2)));-1)*SQRT([$'Cálculo L y C filtro pi'.B$9]/[$'Cálculo L y C filtro pi'.B$8]) -> 98.3839258518709 | E312: of:=POWER(IMABS(IMSQRT(1-POWER([.C312];2)));-1)*SQRT([$'Cálculo L y C filtro pi'.B$18]/[$'Cálculo L y C filtro pi'.B$17]) -> 1967.67851703742
A313: 310 | B313: of:=2*PI()*[.A313] -> 1947.78744522567 | C313: of:=[.B313]/(2*PI()*[$Descripción.B$10]) -> 6.19999999999999 | D313: of:=POWER(IMABS(IMSQRT(1-POWER([.C313];2)));-1)*SQRT([$'Cálculo L y C filtro pi'.B$9]/[$'Cálculo L y C filtro pi'.B$8]) -> 98.0580675690922 | E313: of:=POWER(IMABS(IMSQRT(1-POWER([.C313];2)));-1)*SQRT([$'Cálculo L y C filtro pi'.B$18]/[$'Cálculo L y C filtro pi'.B$17]) -> 1961.16135138184
A314: 311 | B314: of:=2*PI()*[.A314] -> 1954.07063053285 | C314: of:=[.B314]/(2*PI()*[$Descripción.B$10]) -> 6.22 | D314: of:=POWER(IMABS(IMSQRT(1-POWER([.C314];2)));-1)*SQRT([$'Cálculo L y C filtro pi'.B$9]/[$'Cálculo L y C filtro pi'.B$8]) -> 97.7343885142379 | E314: of:=POWER(IMABS(IMSQRT(1-POWER([.C314];2)));-1)*SQRT([$'Cálculo L y C filtro pi'.B$18]/[$'Cálculo L y C filtro pi'.B$17]) -> 1954.68777028476
A315: 312 | B315: of:=2*PI()*[.A315] -> 1960.35381584003 | C315: of:=[.B315]/(2*PI()*[$Descripción.B$10]) -> 6.24 | D315: of:=POWER(IMABS(IMSQRT(1-POWER([.C315];2)));-1)*SQRT([$'Cálculo L y C filtro pi'.B$9]/[$'Cálculo L y C filtro pi'.B$8]) -> 97.4128666302829 | E315: of:=POWER(IMABS(IMSQRT(1-POWER([.C315];2)));-1)*SQRT([$'Cálculo L y C filtro pi'.B$18]/[$'Cálculo L y C filtro pi'.B$17]) -> 1948.25733260566
A316: 313 | B316: of:=2*PI()*[.A316] -> 1966.63700114721 | C316: of:=[.B316]/(2*PI()*[$Descripción.B$10]) -> 6.26 | D316: of:=POWER(IMABS(IMSQRT(1-POWER([.C316];2)));-1)*SQRT([$'Cálculo L y C filtro pi'.B$9]/[$'Cálculo L y C filtro pi'.B$8]) -> 97.0934801603052 | E316: of:=POWER(IMABS(IMSQRT(1-POWER([.C316];2)));-1)*SQRT([$'Cálculo L y C filtro pi'.B$18]/[$'Cálculo L y C filtro pi'.B$17]) -> 1941.8696032061
A317: 314 | B317: of:=2*PI()*[.A317] -> 1972.92018645439 | C317: of:=[.B317]/(2*PI()*[$Descripción.B$10]) -> 6.28 | D317: of:=POWER(IMABS(IMSQRT(1-POWER([.C317];2)));-1)*SQRT([$'Cálculo L y C filtro pi'.B$9]/[$'Cálculo L y C filtro pi'.B$8]) -> 96.7762076423455 | E317: of:=POWER(IMABS(IMSQRT(1-POWER([.C317];2)));-1)*SQRT([$'Cálculo L y C filtro pi'.B$18]/[$'Cálculo L y C filtro pi'.B$17]) -> 1935.52415284691
A318: 315 | B318: of:=2*PI()*[.A318] -> 1979.20337176157 | C318: of:=[.B318]/(2*PI()*[$Descripción.B$10]) -> 6.3 | D318: of:=POWER(IMABS(IMSQRT(1-POWER([.C318];2)));-1)*SQRT([$'Cálculo L y C filtro pi'.B$9]/[$'Cálculo L y C filtro pi'.B$8]) -> 96.4610279043722 | E318: of:=POWER(IMABS(IMSQRT(1-POWER([.C318];2)));-1)*SQRT([$'Cálculo L y C filtro pi'.B$18]/[$'Cálculo L y C filtro pi'.B$17]) -> 1929.22055808744
A319: 316 | B319: of:=2*PI()*[.A319] -> 1985.48655706875 | C319: of:=[.B319]/(2*PI()*[$Descripción.B$10]) -> 6.32 | D319: of:=POWER(IMABS(IMSQRT(1-POWER([.C319];2)));-1)*SQRT([$'Cálculo L y C filtro pi'.B$9]/[$'Cálculo L y C filtro pi'.B$8]) -> 96.1479200593501 | E319: of:=POWER(IMABS(IMSQRT(1-POWER([.C319];2)));-1)*SQRT([$'Cálculo L y C filtro pi'.B$18]/[$'Cálculo L y C filtro pi'.B$17]) -> 1922.958401187
A320: 317 | B320: of:=2*PI()*[.A320] -> 1991.76974237593 | C320: of:=[.B320]/(2*PI()*[$Descripción.B$10]) -> 6.34 | D320: of:=POWER(IMABS(IMSQRT(1-POWER([.C320];2)));-1)*SQRT([$'Cálculo L y C filtro pi'.B$9]/[$'Cálculo L y C filtro pi'.B$8]) -> 95.8368635004118 | E320: of:=POWER(IMABS(IMSQRT(1-POWER([.C320];2)));-1)*SQRT([$'Cálculo L y C filtro pi'.B$18]/[$'Cálculo L y C filtro pi'.B$17]) -> 1916.73727000824
A321: 318 | B321: of:=2*PI()*[.A321] -> 1998.05292768311 | C321: of:=[.B321]/(2*PI()*[$Descripción.B$10]) -> 6.36000000000001 | D321: of:=POWER(IMABS(IMSQRT(1-POWER([.C321];2)));-1)*SQRT([$'Cálculo L y C filtro pi'.B$9]/[$'Cálculo L y C filtro pi'.B$8]) -> 95.5278378961251 | E321: of:=POWER(IMABS(IMSQRT(1-POWER([.C321];2)));-1)*SQRT([$'Cálculo L y C filtro pi'.B$18]/[$'Cálculo L y C filtro pi'.B$17]) -> 1910.5567579225
A322: 319 | B322: of:=2*PI()*[.A322] -> 2004.33611299029 | C322: of:=[.B322]/(2*PI()*[$Descripción.B$10]) -> 6.38000000000001 | D322: of:=POWER(IMABS(IMSQRT(1-POWER([.C322];2)));-1)*SQRT([$'Cálculo L y C filtro pi'.B$9]/[$'Cálculo L y C filtro pi'.B$8]) -> 95.2208231858606 | E322: of:=POWER(IMABS(IMSQRT(1-POWER([.C322];2)));-1)*SQRT([$'Cálculo L y C filtro pi'.B$18]/[$'Cálculo L y C filtro pi'.B$17]) -> 1904.41646371721
A323: 320 | B323: of:=2*PI()*[.A323] -> 2010.61929829747 | C323: of:=[.B323]/(2*PI()*[$Descripción.B$10]) -> 6.40000000000001 | D323: of:=POWER(IMABS(IMSQRT(1-POWER([.C323];2)));-1)*SQRT([$'Cálculo L y C filtro pi'.B$9]/[$'Cálculo L y C filtro pi'.B$8]) -> 94.9157995752498 | E323: of:=POWER(IMABS(IMSQRT(1-POWER([.C323];2)));-1)*SQRT([$'Cálculo L y C filtro pi'.B$18]/[$'Cálculo L y C filtro pi'.B$17]) -> 1898.315991505
A324: 321 | B324: of:=2*PI()*[.A324] -> 2016.90248360465 | C324: of:=[.B324]/(2*PI()*[$Descripción.B$10]) -> 6.42000000000001 | D324: of:=POWER(IMABS(IMSQRT(1-POWER([.C324];2)));-1)*SQRT([$'Cálculo L y C filtro pi'.B$9]/[$'Cálculo L y C filtro pi'.B$8]) -> 94.6127475317376 | E324: of:=POWER(IMABS(IMSQRT(1-POWER([.C324];2)));-1)*SQRT([$'Cálculo L y C filtro pi'.B$18]/[$'Cálculo L y C filtro pi'.B$17]) -> 1892.25495063475
A325: 322 | B325: of:=2*PI()*[.A325] -> 2023.18566891183 | C325: of:=[.B325]/(2*PI()*[$Descripción.B$10]) -> 6.44000000000001 | D325: of:=POWER(IMABS(IMSQRT(1-POWER([.C325];2)));-1)*SQRT([$'Cálculo L y C filtro pi'.B$9]/[$'Cálculo L y C filtro pi'.B$8]) -> 94.3116477802231 | E325: of:=POWER(IMABS(IMSQRT(1-POWER([.C325];2)));-1)*SQRT([$'Cálculo L y C filtro pi'.B$18]/[$'Cálculo L y C filtro pi'.B$17]) -> 1886.23295560446
A326: 323 | B326: of:=2*PI()*[.A326] -> 2029.46885421901 | C326: of:=[.B326]/(2*PI()*[$Descripción.B$10]) -> 6.46000000000001 | D326: of:=POWER(IMABS(IMSQRT(1-POWER([.C326];2)));-1)*SQRT([$'Cálculo L y C filtro pi'.B$9]/[$'Cálculo L y C filtro pi'.B$8]) -> 94.0124812987891 | E326: of:=POWER(IMABS(IMSQRT(1-POWER([.C326];2)));-1)*SQRT([$'Cálculo L y C filtro pi'.B$18]/[$'Cálculo L y C filtro pi'.B$17]) -> 1880.24962597578
A327: 324 | B327: of:=2*PI()*[.A327] -> 2035.75203952619 | C327: of:=[.B327]/(2*PI()*[$Descripción.B$10]) -> 6.48000000000001 | D327: of:=POWER(IMABS(IMSQRT(1-POWER([.C327];2)));-1)*SQRT([$'Cálculo L y C filtro pi'.B$9]/[$'Cálculo L y C filtro pi'.B$8]) -> 93.7152293145168 | E327: of:=POWER(IMABS(IMSQRT(1-POWER([.C327];2)));-1)*SQRT([$'Cálculo L y C filtro pi'.B$18]/[$'Cálculo L y C filtro pi'.B$17]) -> 1874.30458629034
A328: 325 | B328: of:=2*PI()*[.A328] -> 2042.03522483337 | C328: of:=[.B328]/(2*PI()*[$Descripción.B$10]) -> 6.50000000000001 | D328: of:=POWER(IMABS(IMSQRT(1-POWER([.C328];2)));-1)*SQRT([$'Cálculo L y C filtro pi'.B$9]/[$'Cálculo L y C filtro pi'.B$8]) -> 93.4198732993825 | E328: of:=POWER(IMABS(IMSQRT(1-POWER([.C328];2)));-1)*SQRT([$'Cálculo L y C filtro pi'.B$18]/[$'Cálculo L y C filtro pi'.B$17]) -> 1868.39746598765
A329: 326 | B329: of:=2*PI()*[.A329] -> 2048.31841014055 | C329: of:=[.B329]/(2*PI()*[$Descripción.B$10]) -> 6.52000000000002 | D329: of:=POWER(IMABS(IMSQRT(1-POWER([.C329];2)));-1)*SQRT([$'Cálculo L y C filtro pi'.B$9]/[$'Cálculo L y C filtro pi'.B$8]) -> 93.1263949662388 | E329: of:=POWER(IMABS(IMSQRT(1-POWER([.C329];2)));-1)*SQRT([$'Cálculo L y C filtro pi'.B$18]/[$'Cálculo L y C filtro pi'.B$17]) -> 1862.52789932478
A330: 327 | B330: of:=2*PI()*[.A330] -> 2054.60159544772 | C330: of:=[.B330]/(2*PI()*[$Descripción.B$10]) -> 6.53999999999998 | D330: of:=POWER(IMABS(IMSQRT(1-POWER([.C330];2)));-1)*SQRT([$'Cálculo L y C filtro pi'.B$9]/[$'Cálculo L y C filtro pi'.B$8]) -> 92.8347762648733 | E330: of:=POWER(IMABS(IMSQRT(1-POWER([.C330];2)));-1)*SQRT([$'Cálculo L y C filtro pi'.B$18]/[$'Cálculo L y C filtro pi'.B$17]) -> 1856.69552529747
A331: 328 | B331: of:=2*PI()*[.A331] -> 2060.8847807549 | C331: of:=[.B331]/(2*PI()*[$Descripción.B$10]) -> 6.55999999999999 | D331: of:=POWER(IMABS(IMSQRT(1-POWER([.C331];2)));-1)*SQRT([$'Cálculo L y C filtro pi'.B$9]/[$'Cálculo L y C filtro pi'.B$8]) -> 92.5449993781441 | E331: of:=POWER(IMABS(IMSQRT(1-POWER([.C331];2)));-1)*SQRT([$'Cálculo L y C filtro pi'.B$18]/[$'Cálculo L y C filtro pi'.B$17]) -> 1850.89998756288
A332: 329 | B332: of:=2*PI()*[.A332] -> 2067.16796606208 | C332: of:=[.B332]/(2*PI()*[$Descripción.B$10]) -> 6.57999999999999 | D332: of:=POWER(IMABS(IMSQRT(1-POWER([.C332];2)));-1)*SQRT([$'Cálculo L y C filtro pi'.B$9]/[$'Cálculo L y C filtro pi'.B$8]) -> 92.2570467181958 | E332: of:=POWER(IMABS(IMSQRT(1-POWER([.C332];2)));-1)*SQRT([$'Cálculo L y C filtro pi'.B$18]/[$'Cálculo L y C filtro pi'.B$17]) -> 1845.14093436392
A333: 330 | B333: of:=2*PI()*[.A333] -> 2073.45115136926 | C333: of:=[.B333]/(2*PI()*[$Descripción.B$10]) -> 6.59999999999999 | D333: of:=POWER(IMABS(IMSQRT(1-POWER([.C333];2)));-1)*SQRT([$'Cálculo L y C filtro pi'.B$9]/[$'Cálculo L y C filtro pi'.B$8]) -> 91.970900922745 | E333: of:=POWER(IMABS(IMSQRT(1-POWER([.C333];2)));-1)*SQRT([$'Cálculo L y C filtro pi'.B$18]/[$'Cálculo L y C filtro pi'.B$17]) -> 1839.4180184549
A334: 331 | B334: of:=2*PI()*[.A334] -> 2079.73433667644 | C334: of:=[.B334]/(2*PI()*[$Descripción.B$10]) -> 6.61999999999999 | D334: of:=POWER(IMABS(IMSQRT(1-POWER([.C334];2)));-1)*SQRT([$'Cálculo L y C filtro pi'.B$9]/[$'Cálculo L y C filtro pi'.B$8]) -> 91.6865448514405 | E334: of:=POWER(IMABS(IMSQRT(1-POWER([.C334];2)));-1)*SQRT([$'Cálculo L y C filtro pi'.B$18]/[$'Cálculo L y C filtro pi'.B$17]) -> 1833.73089702881
A335: 332 | B335: of:=2*PI()*[.A335] -> 2086.01752198362 | C335: of:=[.B335]/(2*PI()*[$Descripción.B$10]) -> 6.63999999999999 | D335: of:=POWER(IMABS(IMSQRT(1-POWER([.C335];2)));-1)*SQRT([$'Cálculo L y C filtro pi'.B$9]/[$'Cálculo L y C filtro pi'.B$8]) -> 91.4039615822943 | E335: of:=POWER(IMABS(IMSQRT(1-POWER([.C335];2)));-1)*SQRT([$'Cálculo L y C filtro pi'.B$18]/[$'Cálculo L y C filtro pi'.B$17]) -> 1828.07923164589
A336: 333 | B336: of:=2*PI()*[.A336] -> 2092.3007072908 | C336: of:=[.B336]/(2*PI()*[$Descripción.B$10]) -> 6.65999999999999 | D336: of:=POWER(IMABS(IMSQRT(1-POWER([.C336];2)));-1)*SQRT([$'Cálculo L y C filtro pi'.B$9]/[$'Cálculo L y C filtro pi'.B$8]) -> 91.1231344081815 | E336: of:=POWER(IMABS(IMSQRT(1-POWER([.C336];2)));-1)*SQRT([$'Cálculo L y C filtro pi'.B$18]/[$'Cálculo L y C filtro pi'.B$17]) -> 1822.46268816363
A337: 334 | B337: of:=2*PI()*[.A337] -> 2098.58389259798 | C337: of:=[.B337]/(2*PI()*[$Descripción.B$10]) -> 6.67999999999999 | D337: of:=POWER(IMABS(IMSQRT(1-POWER([.C337];2)));-1)*SQRT([$'Cálculo L y C filtro pi'.B$9]/[$'Cálculo L y C filtro pi'.B$8]) -> 90.844046833408 | E337: of:=POWER(IMABS(IMSQRT(1-POWER([.C337];2)));-1)*SQRT([$'Cálculo L y C filtro pi'.B$18]/[$'Cálculo L y C filtro pi'.B$17]) -> 1816.88093666816
A338: 335 | B338: of:=2*PI()*[.A338] -> 2104.86707790516 | C338: of:=[.B338]/(2*PI()*[$Descripción.B$10]) -> 6.7 | D338: of:=POWER(IMABS(IMSQRT(1-POWER([.C338];2)));-1)*SQRT([$'Cálculo L y C filtro pi'.B$9]/[$'Cálculo L y C filtro pi'.B$8]) -> 90.5666825703453 | E338: of:=POWER(IMABS(IMSQRT(1-POWER([.C338];2)));-1)*SQRT([$'Cálculo L y C filtro pi'.B$18]/[$'Cálculo L y C filtro pi'.B$17]) -> 1811.33365140691
A339: 336 | B339: of:=2*PI()*[.A339] -> 2111.15026321234 | C339: of:=[.B339]/(2*PI()*[$Descripción.B$10]) -> 6.72 | D339: of:=POWER(IMABS(IMSQRT(1-POWER([.C339];2)));-1)*SQRT([$'Cálculo L y C filtro pi'.B$9]/[$'Cálculo L y C filtro pi'.B$8]) -> 90.2910255361278 | E339: of:=POWER(IMABS(IMSQRT(1-POWER([.C339];2)));-1)*SQRT([$'Cálculo L y C filtro pi'.B$18]/[$'Cálculo L y C filtro pi'.B$17]) -> 1805.82051072256
A340: 337 | B340: of:=2*PI()*[.A340] -> 2117.43344851952 | C340: of:=[.B340]/(2*PI()*[$Descripción.B$10]) -> 6.74 | D340: of:=POWER(IMABS(IMSQRT(1-POWER([.C340];2)));-1)*SQRT([$'Cálculo L y C filtro pi'.B$9]/[$'Cálculo L y C filtro pi'.B$8]) -> 90.0170598494154 | E340: of:=POWER(IMABS(IMSQRT(1-POWER([.C340];2)));-1)*SQRT([$'Cálculo L y C filtro pi'.B$18]/[$'Cálculo L y C filtro pi'.B$17]) -> 1800.34119698831
A341: 338 | B341: of:=2*PI()*[.A341] -> 2123.7166338267 | C341: of:=[.B341]/(2*PI()*[$Descripción.B$10]) -> 6.76 | D341: of:=POWER(IMABS(IMSQRT(1-POWER([.C341];2)));-1)*SQRT([$'Cálculo L y C filtro pi'.B$9]/[$'Cálculo L y C filtro pi'.B$8]) -> 89.7447698272172 | E341: of:=POWER(IMABS(IMSQRT(1-POWER([.C341];2)));-1)*SQRT([$'Cálculo L y C filtro pi'.B$18]/[$'Cálculo L y C filtro pi'.B$17]) -> 1794.89539654434
A342: 339 | B342: of:=2*PI()*[.A342] -> 2129.99981913388 | C342: of:=[.B342]/(2*PI()*[$Descripción.B$10]) -> 6.78 | D342: of:=POWER(IMABS(IMSQRT(1-POWER([.C342];2)));-1)*SQRT([$'Cálculo L y C filtro pi'.B$9]/[$'Cálculo L y C filtro pi'.B$8]) -> 89.4741399817753 | E342: of:=POWER(IMABS(IMSQRT(1-POWER([.C342];2)));-1)*SQRT([$'Cálculo L y C filtro pi'.B$18]/[$'Cálculo L y C filtro pi'.B$17]) -> 1789.48279963551
A343: 340 | B343: of:=2*PI()*[.A343] -> 2136.28300444106 | C343: of:=[.B343]/(2*PI()*[$Descripción.B$10]) -> 6.8 | D343: of:=POWER(IMABS(IMSQRT(1-POWER([.C343];2)));-1)*SQRT([$'Cálculo L y C filtro pi'.B$9]/[$'Cálculo L y C filtro pi'.B$8]) -> 89.205155017508 | E343: of:=POWER(IMABS(IMSQRT(1-POWER([.C343];2)));-1)*SQRT([$'Cálculo L y C filtro pi'.B$18]/[$'Cálculo L y C filtro pi'.B$17]) -> 1784.10310035016
A344: 341 | B344: of:=2*PI()*[.A344] -> 2142.56618974824 | C344: of:=[.B344]/(2*PI()*[$Descripción.B$10]) -> 6.82 | D344: of:=POWER(IMABS(IMSQRT(1-POWER([.C344];2)));-1)*SQRT([$'Cálculo L y C filtro pi'.B$9]/[$'Cálculo L y C filtro pi'.B$8]) -> 88.93779982801 | E344: of:=POWER(IMABS(IMSQRT(1-POWER([.C344];2)));-1)*SQRT([$'Cálculo L y C filtro pi'.B$18]/[$'Cálculo L y C filtro pi'.B$17]) -> 1778.7559965602
A345: 342 | B345: of:=2*PI()*[.A345] -> 2148.84937505542 | C345: of:=[.B345]/(2*PI()*[$Descripción.B$10]) -> 6.84 | D345: of:=POWER(IMABS(IMSQRT(1-POWER([.C345];2)));-1)*SQRT([$'Cálculo L y C filtro pi'.B$9]/[$'Cálculo L y C filtro pi'.B$8]) -> 88.6720594931107 | E345: of:=POWER(IMABS(IMSQRT(1-POWER([.C345];2)));-1)*SQRT([$'Cálculo L y C filtro pi'.B$18]/[$'Cálculo L y C filtro pi'.B$17]) -> 1773.44118986221
A346: 343 | B346: of:=2*PI()*[.A346] -> 2155.1325603626 | C346: of:=[.B346]/(2*PI()*[$Descripción.B$10]) -> 6.86000000000001 | D346: of:=POWER(IMABS(IMSQRT(1-POWER([.C346];2)));-1)*SQRT([$'Cálculo L y C filtro pi'.B$9]/[$'Cálculo L y C filtro pi'.B$8]) -> 88.4079192759869 | E346: of:=POWER(IMABS(IMSQRT(1-POWER([.C346];2)));-1)*SQRT([$'Cálculo L y C filtro pi'.B$18]/[$'Cálculo L y C filtro pi'.B$17]) -> 1768.15838551974
A347: 344 | B347: of:=2*PI()*[.A347] -> 2161.41574566978 | C347: of:=[.B347]/(2*PI()*[$Descripción.B$10]) -> 6.88000000000001 | D347: of:=POWER(IMABS(IMSQRT(1-POWER([.C347];2)));-1)*SQRT([$'Cálculo L y C filtro pi'.B$9]/[$'Cálculo L y C filtro pi'.B$8]) -> 88.1453646203278 | E347: of:=POWER(IMABS(IMSQRT(1-POWER([.C347];2)));-1)*SQRT([$'Cálculo L y C filtro pi'.B$18]/[$'Cálculo L y C filtro pi'.B$17]) -> 1762.90729240656
A348: 345 | B348: of:=2*PI()*[.A348] -> 2167.69893097696 | C348: of:=[.B348]/(2*PI()*[$Descripción.B$10]) -> 6.90000000000001 | D348: of:=POWER(IMABS(IMSQRT(1-POWER([.C348];2)));-1)*SQRT([$'Cálculo L y C filtro pi'.B$9]/[$'Cálculo L y C filtro pi'.B$8]) -> 87.884381147556 | E348: of:=POWER(IMABS(IMSQRT(1-POWER([.C348];2)));-1)*SQRT([$'Cálculo L y C filtro pi'.B$18]/[$'Cálculo L y C filtro pi'.B$17]) -> 1757.68762295112
A349: 346 | B349: of:=2*PI()*[.A349] -> 2173.98211628414 | C349: of:=[.B349]/(2*PI()*[$Descripción.B$10]) -> 6.92000000000001 | D349: of:=POWER(IMABS(IMSQRT(1-POWER([.C349];2)));-1)*SQRT([$'Cálculo L y C filtro pi'.B$9]/[$'Cálculo L y C filtro pi'.B$8]) -> 87.6249546540976 | E349: of:=POWER(IMABS(IMSQRT(1-POWER([.C349];2)));-1)*SQRT([$'Cálculo L y C filtro pi'.B$18]/[$'Cálculo L y C filtro pi'.B$17]) -> 1752.49909308195
A350: 347 | B350: of:=2*PI()*[.A350] -> 2180.26530159132 | C350: of:=[.B350]/(2*PI()*[$Descripción.B$10]) -> 6.94000000000001 | D350: of:=POWER(IMABS(IMSQRT(1-POWER([.C350];2)));-1)*SQRT([$'Cálculo L y C filtro pi'.B$9]/[$'Cálculo L y C filtro pi'.B$8]) -> 87.3670711087043 | E350: of:=POWER(IMABS(IMSQRT(1-POWER([.C350];2)));-1)*SQRT([$'Cálculo L y C filtro pi'.B$18]/[$'Cálculo L y C filtro pi'.B$17]) -> 1747.34142217409
A351: 348 | B351: of:=2*PI()*[.A351] -> 2186.5484868985 | C351: of:=[.B351]/(2*PI()*[$Descripción.B$10]) -> 6.96000000000001 | D351: of:=POWER(IMABS(IMSQRT(1-POWER([.C351];2)));-1)*SQRT([$'Cálculo L y C filtro pi'.B$9]/[$'Cálculo L y C filtro pi'.B$8]) -> 87.1107166498244 | E351: of:=POWER(IMABS(IMSQRT(1-POWER([.C351];2)));-1)*SQRT([$'Cálculo L y C filtro pi'.B$18]/[$'Cálculo L y C filtro pi'.B$17]) -> 1742.21433299649
A352: 349 | B352: of:=2*PI()*[.A352] -> 2192.83167220568 | C352: of:=[.B352]/(2*PI()*[$Descripción.B$10]) -> 6.98000000000001 | D352: of:=POWER(IMABS(IMSQRT(1-POWER([.C352];2)));-1)*SQRT([$'Cálculo L y C filtro pi'.B$9]/[$'Cálculo L y C filtro pi'.B$8]) -> 86.8558775830219 | E352: of:=POWER(IMABS(IMSQRT(1-POWER([.C352];2)));-1)*SQRT([$'Cálculo L y C filtro pi'.B$18]/[$'Cálculo L y C filtro pi'.B$17]) -> 1737.11755166044
A353: 350 | B353: of:=2*PI()*[.A353] -> 2199.11485751286 | C353: of:=[.B353]/(2*PI()*[$Descripción.B$10]) -> 7.00000000000002 | D353: of:=POWER(IMABS(IMSQRT(1-POWER([.C353];2)));-1)*SQRT([$'Cálculo L y C filtro pi'.B$9]/[$'Cálculo L y C filtro pi'.B$8]) -> 86.6025403784437 | E353: of:=POWER(IMABS(IMSQRT(1-POWER([.C353];2)));-1)*SQRT([$'Cálculo L y C filtro pi'.B$18]/[$'Cálculo L y C filtro pi'.B$17]) -> 1732.05080756887
A354: 351 | B354: of:=2*PI()*[.A354] -> 2205.39804282003 | C354: of:=[.B354]/(2*PI()*[$Descripción.B$10]) -> 7.01999999999998 | D354: of:=POWER(IMABS(IMSQRT(1-POWER([.C354];2)));-1)*SQRT([$'Cálculo L y C filtro pi'.B$9]/[$'Cálculo L y C filtro pi'.B$8]) -> 86.3506916683325 | E354: of:=POWER(IMABS(IMSQRT(1-POWER([.C354];2)));-1)*SQRT([$'Cálculo L y C filtro pi'.B$18]/[$'Cálculo L y C filtro pi'.B$17]) -> 1727.01383336665
A355: 352 | B355: of:=2*PI()*[.A355] -> 2211.68122812721 | C355: of:=[.B355]/(2*PI()*[$Descripción.B$10]) -> 7.03999999999999 | D355: of:=POWER(IMABS(IMSQRT(1-POWER([.C355];2)));-1)*SQRT([$'Cálculo L y C filtro pi'.B$9]/[$'Cálculo L y C filtro pi'.B$8]) -> 86.1003182445846 | E355: of:=POWER(IMABS(IMSQRT(1-POWER([.C355];2)));-1)*SQRT([$'Cálculo L y C filtro pi'.B$18]/[$'Cálculo L y C filtro pi'.B$17]) -> 1722.00636489169
A356: 353 | B356: of:=2*PI()*[.A356] -> 2217.96441343439 | C356: of:=[.B356]/(2*PI()*[$Descripción.B$10]) -> 7.05999999999999 | D356: of:=POWER(IMABS(IMSQRT(1-POWER([.C356];2)));-1)*SQRT([$'Cálculo L y C filtro pi'.B$9]/[$'Cálculo L y C filtro pi'.B$8]) -> 85.8514070563541 | E356: of:=POWER(IMABS(IMSQRT(1-POWER([.C356];2)));-1)*SQRT([$'Cálculo L y C filtro pi'.B$18]/[$'Cálculo L y C filtro pi'.B$17]) -> 1717.02814112708
A357: 354 | B357: of:=2*PI()*[.A357] -> 2224.24759874157 | C357: of:=[.B357]/(2*PI()*[$Descripción.B$10]) -> 7.07999999999999 | D357: of:=POWER(IMABS(IMSQRT(1-POWER([.C357];2)));-1)*SQRT([$'Cálculo L y C filtro pi'.B$9]/[$'Cálculo L y C filtro pi'.B$8]) -> 85.6039452076976 | E357: of:=POWER(IMABS(IMSQRT(1-POWER([.C357];2)));-1)*SQRT([$'Cálculo L y C filtro pi'.B$18]/[$'Cálculo L y C filtro pi'.B$17]) -> 1712.07890415395
A358: 355 | B358: of:=2*PI()*[.A358] -> 2230.53078404875 | C358: of:=[.B358]/(2*PI()*[$Descripción.B$10]) -> 7.09999999999999 | D358: of:=POWER(IMABS(IMSQRT(1-POWER([.C358];2)));-1)*SQRT([$'Cálculo L y C filtro pi'.B$9]/[$'Cálculo L y C filtro pi'.B$8]) -> 85.3579199552642 | E358: of:=POWER(IMABS(IMSQRT(1-POWER([.C358];2)));-1)*SQRT([$'Cálculo L y C filtro pi'.B$18]/[$'Cálculo L y C filtro pi'.B$17]) -> 1707.15839910528
A359: 356 | B359: of:=2*PI()*[.A359] -> 2236.81396935593 | C359: of:=[.B359]/(2*PI()*[$Descripción.B$10]) -> 7.11999999999999 | D359: of:=POWER(IMABS(IMSQRT(1-POWER([.C359];2)));-1)*SQRT([$'Cálculo L y C filtro pi'.B$9]/[$'Cálculo L y C filtro pi'.B$8]) -> 85.1133187060245 | E359: of:=POWER(IMABS(IMSQRT(1-POWER([.C359];2)));-1)*SQRT([$'Cálculo L y C filtro pi'.B$18]/[$'Cálculo L y C filtro pi'.B$17]) -> 1702.26637412049
A360: 357 | B360: of:=2*PI()*[.A360] -> 2243.09715466311 | C360: of:=[.B360]/(2*PI()*[$Descripción.B$10]) -> 7.13999999999999 | D360: of:=POWER(IMABS(IMSQRT(1-POWER([.C360];2)));-1)*SQRT([$'Cálculo L y C filtro pi'.B$9]/[$'Cálculo L y C filtro pi'.B$8]) -> 84.8701290150429 | E360: of:=POWER(IMABS(IMSQRT(1-POWER([.C360];2)));-1)*SQRT([$'Cálculo L y C filtro pi'.B$18]/[$'Cálculo L y C filtro pi'.B$17]) -> 1697.40258030086
A361: 358 | B361: of:=2*PI()*[.A361] -> 2249.38033997029 | C361: of:=[.B361]/(2*PI()*[$Descripción.B$10]) -> 7.15999999999999 | D361: of:=POWER(IMABS(IMSQRT(1-POWER([.C361];2)));-1)*SQRT([$'Cálculo L y C filtro pi'.B$9]/[$'Cálculo L y C filtro pi'.B$8]) -> 84.628338583287 | E361: of:=POWER(IMABS(IMSQRT(1-POWER([.C361];2)));-1)*SQRT([$'Cálculo L y C filtro pi'.B$18]/[$'Cálculo L y C filtro pi'.B$17]) -> 1692.56677166574
A362: 359 | B362: of:=2*PI()*[.A362] -> 2255.66352527747 | C362: of:=[.B362]/(2*PI()*[$Descripción.B$10]) -> 7.18 | D362: of:=POWER(IMABS(IMSQRT(1-POWER([.C362];2)));-1)*SQRT([$'Cálculo L y C filtro pi'.B$9]/[$'Cálculo L y C filtro pi'.B$8]) -> 84.3879352554789 | E362: of:=POWER(IMABS(IMSQRT(1-POWER([.C362];2)));-1)*SQRT([$'Cálculo L y C filtro pi'.B$18]/[$'Cálculo L y C filtro pi'.B$17]) -> 1687.75870510958
A363: 360 | B363: of:=2*PI()*[.A363] -> 2261.94671058465 | C363: of:=[.B363]/(2*PI()*[$Descripción.B$10]) -> 7.2 | D363: of:=POWER(IMABS(IMSQRT(1-POWER([.C363];2)));-1)*SQRT([$'Cálculo L y C filtro pi'.B$9]/[$'Cálculo L y C filtro pi'.B$8]) -> 84.1489070179821 | E363: of:=POWER(IMABS(IMSQRT(1-POWER([.C363];2)));-1)*SQRT([$'Cálculo L y C filtro pi'.B$18]/[$'Cálculo L y C filtro pi'.B$17]) -> 1682.97814035964
A364: 361 | B364: of:=2*PI()*[.A364] -> 2268.22989589183 | C364: of:=[.B364]/(2*PI()*[$Descripción.B$10]) -> 7.22 | D364: of:=POWER(IMABS(IMSQRT(1-POWER([.C364];2)));-1)*SQRT([$'Cálculo L y C filtro pi'.B$9]/[$'Cálculo L y C filtro pi'.B$8]) -> 83.9112419967282 | E364: of:=POWER(IMABS(IMSQRT(1-POWER([.C364];2)));-1)*SQRT([$'Cálculo L y C filtro pi'.B$18]/[$'Cálculo L y C filtro pi'.B$17]) -> 1678.22483993456
A365: 362 | B365: of:=2*PI()*[.A365] -> 2274.51308119901 | C365: of:=[.B365]/(2*PI()*[$Descripción.B$10]) -> 7.24 | D365: of:=POWER(IMABS(IMSQRT(1-POWER([.C365];2)));-1)*SQRT([$'Cálculo L y C filtro pi'.B$9]/[$'Cálculo L y C filtro pi'.B$8]) -> 83.6749284551776 | E365: of:=POWER(IMABS(IMSQRT(1-POWER([.C365];2)));-1)*SQRT([$'Cálculo L y C filtro pi'.B$18]/[$'Cálculo L y C filtro pi'.B$17]) -> 1673.49856910355
A366: 363 | B366: of:=2*PI()*[.A366] -> 2280.79626650619 | C366: of:=[.B366]/(2*PI()*[$Descripción.B$10]) -> 7.26 | D366: of:=POWER(IMABS(IMSQRT(1-POWER([.C366];2)));-1)*SQRT([$'Cálculo L y C filtro pi'.B$9]/[$'Cálculo L y C filtro pi'.B$8]) -> 83.439954792319 | E366: of:=POWER(IMABS(IMSQRT(1-POWER([.C366];2)));-1)*SQRT([$'Cálculo L y C filtro pi'.B$18]/[$'Cálculo L y C filtro pi'.B$17]) -> 1668.79909584638
A367: 364 | B367: of:=2*PI()*[.A367] -> 2287.07945181337 | C367: of:=[.B367]/(2*PI()*[$Descripción.B$10]) -> 7.28 | D367: of:=POWER(IMABS(IMSQRT(1-POWER([.C367];2)));-1)*SQRT([$'Cálculo L y C filtro pi'.B$9]/[$'Cálculo L y C filtro pi'.B$8]) -> 83.2063095407013 | E367: of:=POWER(IMABS(IMSQRT(1-POWER([.C367];2)));-1)*SQRT([$'Cálculo L y C filtro pi'.B$18]/[$'Cálculo L y C filtro pi'.B$17]) -> 1664.12619081403
A368: 365 | B368: of:=2*PI()*[.A368] -> 2293.36263712055 | C368: of:=[.B368]/(2*PI()*[$Descripción.B$10]) -> 7.3 | D368: of:=POWER(IMABS(IMSQRT(1-POWER([.C368];2)));-1)*SQRT([$'Cálculo L y C filtro pi'.B$9]/[$'Cálculo L y C filtro pi'.B$8]) -> 82.9739813645022 | E368: of:=POWER(IMABS(IMSQRT(1-POWER([.C368];2)));-1)*SQRT([$'Cálculo L y C filtro pi'.B$18]/[$'Cálculo L y C filtro pi'.B$17]) -> 1659.47962729005
A369: 366 | B369: of:=2*PI()*[.A369] -> 2299.64582242773 | C369: of:=[.B369]/(2*PI()*[$Descripción.B$10]) -> 7.32 | D369: of:=POWER(IMABS(IMSQRT(1-POWER([.C369];2)));-1)*SQRT([$'Cálculo L y C filtro pi'.B$9]/[$'Cálculo L y C filtro pi'.B$8]) -> 82.7429590576289 | E369: of:=POWER(IMABS(IMSQRT(1-POWER([.C369];2)));-1)*SQRT([$'Cálculo L y C filtro pi'.B$18]/[$'Cálculo L y C filtro pi'.B$17]) -> 1654.85918115258
A370: 367 | B370: of:=2*PI()*[.A370] -> 2305.92900773491 | C370: of:=[.B370]/(2*PI()*[$Descripción.B$10]) -> 7.34000000000001 | D370: of:=POWER(IMABS(IMSQRT(1-POWER([.C370];2)));-1)*SQRT([$'Cálculo L y C filtro pi'.B$9]/[$'Cálculo L y C filtro pi'.B$8]) -> 82.5132315418525 | E370: of:=POWER(IMABS(IMSQRT(1-POWER([.C370];2)));-1)*SQRT([$'Cálculo L y C filtro pi'.B$18]/[$'Cálculo L y C filtro pi'.B$17]) -> 1650.26463083705
A371: 368 | B371: of:=2*PI()*[.A371] -> 2312.21219304209 | C371: of:=[.B371]/(2*PI()*[$Descripción.B$10]) -> 7.36000000000001 | D371: of:=POWER(IMABS(IMSQRT(1-POWER([.C371];2)));-1)*SQRT([$'Cálculo L y C filtro pi'.B$9]/[$'Cálculo L y C filtro pi'.B$8]) -> 82.2847878649749 | E371: of:=POWER(IMABS(IMSQRT(1-POWER([.C371];2)));-1)*SQRT([$'Cálculo L y C filtro pi'.B$18]/[$'Cálculo L y C filtro pi'.B$17]) -> 1645.6957572995
A372: 369 | B372: of:=2*PI()*[.A372] -> 2318.49537834927 | C372: of:=[.B372]/(2*PI()*[$Descripción.B$10]) -> 7.38000000000001 | D372: of:=POWER(IMABS(IMSQRT(1-POWER([.C372];2)));-1)*SQRT([$'Cálculo L y C filtro pi'.B$9]/[$'Cálculo L y C filtro pi'.B$8]) -> 82.0576171990267 | E372: of:=POWER(IMABS(IMSQRT(1-POWER([.C372];2)));-1)*SQRT([$'Cálculo L y C filtro pi'.B$18]/[$'Cálculo L y C filtro pi'.B$17]) -> 1641.15234398053
A373: 370 | B373: of:=2*PI()*[.A373] -> 2324.77856365645 | C373: of:=[.B373]/(2*PI()*[$Descripción.B$10]) -> 7.40000000000001 | D373: of:=POWER(IMABS(IMSQRT(1-POWER([.C373];2)));-1)*SQRT([$'Cálculo L y C filtro pi'.B$9]/[$'Cálculo L y C filtro pi'.B$8]) -> 81.8317088384971 | E373: of:=POWER(IMABS(IMSQRT(1-POWER([.C373];2)));-1)*SQRT([$'Cálculo L y C filtro pi'.B$18]/[$'Cálculo L y C filtro pi'.B$17]) -> 1636.63417676994
A374: 371 | B374: of:=2*PI()*[.A374] -> 2331.06174896363 | C374: of:=[.B374]/(2*PI()*[$Descripción.B$10]) -> 7.42000000000001 | D374: of:=POWER(IMABS(IMSQRT(1-POWER([.C374];2)));-1)*SQRT([$'Cálculo L y C filtro pi'.B$9]/[$'Cálculo L y C filtro pi'.B$8]) -> 81.6070521985933 | E374: of:=POWER(IMABS(IMSQRT(1-POWER([.C374];2)));-1)*SQRT([$'Cálculo L y C filtro pi'.B$18]/[$'Cálculo L y C filtro pi'.B$17]) -> 1632.14104397187
A375: 372 | B375: of:=2*PI()*[.A375] -> 2337.34493427081 | C375: of:=[.B375]/(2*PI()*[$Descripción.B$10]) -> 7.44000000000001 | D375: of:=POWER(IMABS(IMSQRT(1-POWER([.C375];2)));-1)*SQRT([$'Cálculo L y C filtro pi'.B$9]/[$'Cálculo L y C filtro pi'.B$8]) -> 81.3836368135309 | E375: of:=POWER(IMABS(IMSQRT(1-POWER([.C375];2)));-1)*SQRT([$'Cálculo L y C filtro pi'.B$18]/[$'Cálculo L y C filtro pi'.B$17]) -> 1627.67273627062
A376: 373 | B376: of:=2*PI()*[.A376] -> 2343.62811957799 | C376: of:=[.B376]/(2*PI()*[$Descripción.B$10]) -> 7.46000000000001 | D376: of:=POWER(IMABS(IMSQRT(1-POWER([.C376];2)));-1)*SQRT([$'Cálculo L y C filtro pi'.B$9]/[$'Cálculo L y C filtro pi'.B$8]) -> 81.1614523348517 | E376: of:=POWER(IMABS(IMSQRT(1-POWER([.C376];2)));-1)*SQRT([$'Cálculo L y C filtro pi'.B$18]/[$'Cálculo L y C filtro pi'.B$17]) -> 1623.22904669703
A377: 374 | B377: of:=2*PI()*[.A377] -> 2349.91130488517 | C377: of:=[.B377]/(2*PI()*[$Descripción.B$10]) -> 7.48000000000001 | D377: of:=POWER(IMABS(IMSQRT(1-POWER([.C377];2)));-1)*SQRT([$'Cálculo L y C filtro pi'.B$9]/[$'Cálculo L y C filtro pi'.B$8]) -> 80.9404885297719 | E377: of:=POWER(IMABS(IMSQRT(1-POWER([.C377];2)));-1)*SQRT([$'Cálculo L y C filtro pi'.B$18]/[$'Cálculo L y C filtro pi'.B$17]) -> 1618.80977059544
A378: 375 | B378: of:=2*PI()*[.A378] -> 2356.19449019234 | C378: of:=[.B378]/(2*PI()*[$Descripción.B$10]) -> 7.49999999999998 | D378: of:=POWER(IMABS(IMSQRT(1-POWER([.C378];2)));-1)*SQRT([$'Cálculo L y C filtro pi'.B$9]/[$'Cálculo L y C filtro pi'.B$8]) -> 80.7207352795576 | E378: of:=POWER(IMABS(IMSQRT(1-POWER([.C378];2)));-1)*SQRT([$'Cálculo L y C filtro pi'.B$18]/[$'Cálculo L y C filtro pi'.B$17]) -> 1614.41470559115
A379: 376 | B379: of:=2*PI()*[.A379] -> 2362.47767549952 | C379: of:=[.B379]/(2*PI()*[$Descripción.B$10]) -> 7.51999999999999 | D379: of:=POWER(IMABS(IMSQRT(1-POWER([.C379];2)));-1)*SQRT([$'Cálculo L y C filtro pi'.B$9]/[$'Cálculo L y C filtro pi'.B$8]) -> 80.5021825779273 | E379: of:=POWER(IMABS(IMSQRT(1-POWER([.C379];2)));-1)*SQRT([$'Cálculo L y C filtro pi'.B$18]/[$'Cálculo L y C filtro pi'.B$17]) -> 1610.04365155855
A380: 377 | B380: of:=2*PI()*[.A380] -> 2368.7608608067 | C380: of:=[.B380]/(2*PI()*[$Descripción.B$10]) -> 7.53999999999999 | D380: of:=POWER(IMABS(IMSQRT(1-POWER([.C380];2)));-1)*SQRT([$'Cálculo L y C filtro pi'.B$9]/[$'Cálculo L y C filtro pi'.B$8]) -> 80.2848205294824 | E380: of:=POWER(IMABS(IMSQRT(1-POWER([.C380];2)));-1)*SQRT([$'Cálculo L y C filtro pi'.B$18]/[$'Cálculo L y C filtro pi'.B$17]) -> 1605.69641058965
A381: 378 | B381: of:=2*PI()*[.A381] -> 2375.04404611388 | C381: of:=[.B381]/(2*PI()*[$Descripción.B$10]) -> 7.55999999999999 | D381: of:=POWER(IMABS(IMSQRT(1-POWER([.C381];2)));-1)*SQRT([$'Cálculo L y C filtro pi'.B$9]/[$'Cálculo L y C filtro pi'.B$8]) -> 80.068639348164 | E381: of:=POWER(IMABS(IMSQRT(1-POWER([.C381];2)));-1)*SQRT([$'Cálculo L y C filtro pi'.B$18]/[$'Cálculo L y C filtro pi'.B$17]) -> 1601.37278696328
A382: 379 | B382: of:=2*PI()*[.A382] -> 2381.32723142106 | C382: of:=[.B382]/(2*PI()*[$Descripción.B$10]) -> 7.57999999999999 | D382: of:=POWER(IMABS(IMSQRT(1-POWER([.C382];2)));-1)*SQRT([$'Cálculo L y C filtro pi'.B$9]/[$'Cálculo L y C filtro pi'.B$8]) -> 79.8536293557343 | E382: of:=POWER(IMABS(IMSQRT(1-POWER([.C382];2)));-1)*SQRT([$'Cálculo L y C filtro pi'.B$18]/[$'Cálculo L y C filtro pi'.B$17]) -> 1597.07258711469
A383: 380 | B383: of:=2*PI()*[.A383] -> 2387.61041672824 | C383: of:=[.B383]/(2*PI()*[$Descripción.B$10]) -> 7.59999999999999 | D383: of:=POWER(IMABS(IMSQRT(1-POWER([.C383];2)));-1)*SQRT([$'Cálculo L y C filtro pi'.B$9]/[$'Cálculo L y C filtro pi'.B$8]) -> 79.6397809802849 | E383: of:=POWER(IMABS(IMSQRT(1-POWER([.C383];2)));-1)*SQRT([$'Cálculo L y C filtro pi'.B$18]/[$'Cálculo L y C filtro pi'.B$17]) -> 1592.7956196057
A384: 381 | B384: of:=2*PI()*[.A384] -> 2393.89360203542 | C384: of:=[.B384]/(2*PI()*[$Descripción.B$10]) -> 7.61999999999999 | D384: of:=POWER(IMABS(IMSQRT(1-POWER([.C384];2)));-1)*SQRT([$'Cálculo L y C filtro pi'.B$9]/[$'Cálculo L y C filtro pi'.B$8]) -> 79.4270847547693 | E384: of:=POWER(IMABS(IMSQRT(1-POWER([.C384];2)));-1)*SQRT([$'Cálculo L y C filtro pi'.B$18]/[$'Cálculo L y C filtro pi'.B$17]) -> 1588.54169509539
A385: 382 | B385: of:=2*PI()*[.A385] -> 2400.1767873426 | C385: of:=[.B385]/(2*PI()*[$Descripción.B$10]) -> 7.63999999999999 | D385: of:=POWER(IMABS(IMSQRT(1-POWER([.C385];2)));-1)*SQRT([$'Cálculo L y C filtro pi'.B$9]/[$'Cálculo L y C filtro pi'.B$8]) -> 79.2155313155598 | E385: of:=POWER(IMABS(IMSQRT(1-POWER([.C385];2)));-1)*SQRT([$'Cálculo L y C filtro pi'.B$18]/[$'Cálculo L y C filtro pi'.B$17]) -> 1584.3106263112
A386: 383 | B386: of:=2*PI()*[.A386] -> 2406.45997264978 | C386: of:=[.B386]/(2*PI()*[$Descripción.B$10]) -> 7.66 | D386: of:=POWER(IMABS(IMSQRT(1-POWER([.C386];2)));-1)*SQRT([$'Cálculo L y C filtro pi'.B$9]/[$'Cálculo L y C filtro pi'.B$8]) -> 79.0051114010285 | E386: of:=POWER(IMABS(IMSQRT(1-POWER([.C386];2)));-1)*SQRT([$'Cálculo L y C filtro pi'.B$18]/[$'Cálculo L y C filtro pi'.B$17]) -> 1580.10222802057
A387: 384 | B387: of:=2*PI()*[.A387] -> 2412.74315795696 | C387: of:=[.B387]/(2*PI()*[$Descripción.B$10]) -> 7.68 | D387: of:=POWER(IMABS(IMSQRT(1-POWER([.C387];2)));-1)*SQRT([$'Cálculo L y C filtro pi'.B$9]/[$'Cálculo L y C filtro pi'.B$8]) -> 78.7958158501519 | E387: of:=POWER(IMABS(IMSQRT(1-POWER([.C387];2)));-1)*SQRT([$'Cálculo L y C filtro pi'.B$18]/[$'Cálculo L y C filtro pi'.B$17]) -> 1575.91631700304
A388: 385 | B388: of:=2*PI()*[.A388] -> 2419.02634326414 | C388: of:=[.B388]/(2*PI()*[$Descripción.B$10]) -> 7.7 | D388: of:=POWER(IMABS(IMSQRT(1-POWER([.C388];2)));-1)*SQRT([$'Cálculo L y C filtro pi'.B$9]/[$'Cálculo L y C filtro pi'.B$8]) -> 78.587635601138 | E388: of:=POWER(IMABS(IMSQRT(1-POWER([.C388];2)));-1)*SQRT([$'Cálculo L y C filtro pi'.B$18]/[$'Cálculo L y C filtro pi'.B$17]) -> 1571.75271202276
A389: 386 | B389: of:=2*PI()*[.A389] -> 2425.30952857132 | C389: of:=[.B389]/(2*PI()*[$Descripción.B$10]) -> 7.72 | D389: of:=POWER(IMABS(IMSQRT(1-POWER([.C389];2)));-1)*SQRT([$'Cálculo L y C filtro pi'.B$9]/[$'Cálculo L y C filtro pi'.B$8]) -> 78.3805616900766 | E389: of:=POWER(IMABS(IMSQRT(1-POWER([.C389];2)));-1)*SQRT([$'Cálculo L y C filtro pi'.B$18]/[$'Cálculo L y C filtro pi'.B$17]) -> 1567.61123380153
A390: 387 | B390: of:=2*PI()*[.A390] -> 2431.5927138785 | C390: of:=[.B390]/(2*PI()*[$Descripción.B$10]) -> 7.74 | D390: of:=POWER(IMABS(IMSQRT(1-POWER([.C390];2)));-1)*SQRT([$'Cálculo L y C filtro pi'.B$9]/[$'Cálculo L y C filtro pi'.B$8]) -> 78.1745852496112 | E390: of:=POWER(IMABS(IMSQRT(1-POWER([.C390];2)));-1)*SQRT([$'Cálculo L y C filtro pi'.B$18]/[$'Cálculo L y C filtro pi'.B$17]) -> 1563.49170499222
A391: 388 | B391: of:=2*PI()*[.A391] -> 2437.87589918568 | C391: of:=[.B391]/(2*PI()*[$Descripción.B$10]) -> 7.76 | D391: of:=POWER(IMABS(IMSQRT(1-POWER([.C391];2)));-1)*SQRT([$'Cálculo L y C filtro pi'.B$9]/[$'Cálculo L y C filtro pi'.B$8]) -> 77.969697507633 | E391: of:=POWER(IMABS(IMSQRT(1-POWER([.C391];2)));-1)*SQRT([$'Cálculo L y C filtro pi'.B$18]/[$'Cálculo L y C filtro pi'.B$17]) -> 1559.39395015266
A392: 389 | B392: of:=2*PI()*[.A392] -> 2444.15908449286 | C392: of:=[.B392]/(2*PI()*[$Descripción.B$10]) -> 7.78 | D392: of:=POWER(IMABS(IMSQRT(1-POWER([.C392];2)));-1)*SQRT([$'Cálculo L y C filtro pi'.B$9]/[$'Cálculo L y C filtro pi'.B$8]) -> 77.765889785996 | E392: of:=POWER(IMABS(IMSQRT(1-POWER([.C392];2)));-1)*SQRT([$'Cálculo L y C filtro pi'.B$18]/[$'Cálculo L y C filtro pi'.B$17]) -> 1555.31779571992
A393: 390 | B393: of:=2*PI()*[.A393] -> 2450.44226980004 | C393: of:=[.B393]/(2*PI()*[$Descripción.B$10]) -> 7.8 | D393: of:=POWER(IMABS(IMSQRT(1-POWER([.C393];2)));-1)*SQRT([$'Cálculo L y C filtro pi'.B$9]/[$'Cálculo L y C filtro pi'.B$8]) -> 77.5631534992528 | E393: of:=POWER(IMABS(IMSQRT(1-POWER([.C393];2)));-1)*SQRT([$'Cálculo L y C filtro pi'.B$18]/[$'Cálculo L y C filtro pi'.B$17]) -> 1551.26306998506
A394: 391 | B394: of:=2*PI()*[.A394] -> 2456.72545510722 | C394: of:=[.B394]/(2*PI()*[$Descripción.B$10]) -> 7.82000000000001 | D394: of:=POWER(IMABS(IMSQRT(1-POWER([.C394];2)));-1)*SQRT([$'Cálculo L y C filtro pi'.B$9]/[$'Cálculo L y C filtro pi'.B$8]) -> 77.3614801534117 | E394: of:=POWER(IMABS(IMSQRT(1-POWER([.C394];2)));-1)*SQRT([$'Cálculo L y C filtro pi'.B$18]/[$'Cálculo L y C filtro pi'.B$17]) -> 1547.22960306823
A395: 392 | B395: of:=2*PI()*[.A395] -> 2463.0086404144 | C395: of:=[.B395]/(2*PI()*[$Descripción.B$10]) -> 7.84000000000001 | D395: of:=POWER(IMABS(IMSQRT(1-POWER([.C395];2)));-1)*SQRT([$'Cálculo L y C filtro pi'.B$9]/[$'Cálculo L y C filtro pi'.B$8]) -> 77.1608613447126 | E395: of:=POWER(IMABS(IMSQRT(1-POWER([.C395];2)));-1)*SQRT([$'Cálculo L y C filtro pi'.B$18]/[$'Cálculo L y C filtro pi'.B$17]) -> 1543.21722689425
A396: 393 | B396: of:=2*PI()*[.A396] -> 2469.29182572158 | C396: of:=[.B396]/(2*PI()*[$Descripción.B$10]) -> 7.86000000000001 | D396: of:=POWER(IMABS(IMSQRT(1-POWER([.C396];2)));-1)*SQRT([$'Cálculo L y C filtro pi'.B$9]/[$'Cálculo L y C filtro pi'.B$8]) -> 76.9612887584237 | E396: of:=POWER(IMABS(IMSQRT(1-POWER([.C396];2)));-1)*SQRT([$'Cálculo L y C filtro pi'.B$18]/[$'Cálculo L y C filtro pi'.B$17]) -> 1539.22577516847
A397: 394 | B397: of:=2*PI()*[.A397] -> 2475.57501102876 | C397: of:=[.B397]/(2*PI()*[$Descripción.B$10]) -> 7.88000000000001 | D397: of:=POWER(IMABS(IMSQRT(1-POWER([.C397];2)));-1)*SQRT([$'Cálculo L y C filtro pi'.B$9]/[$'Cálculo L y C filtro pi'.B$8]) -> 76.7627541676569 | E397: of:=POWER(IMABS(IMSQRT(1-POWER([.C397];2)));-1)*SQRT([$'Cálculo L y C filtro pi'.B$18]/[$'Cálculo L y C filtro pi'.B$17]) -> 1535.25508335314
A398: 395 | B398: of:=2*PI()*[.A398] -> 2481.85819633594 | C398: of:=[.B398]/(2*PI()*[$Descripción.B$10]) -> 7.90000000000001 | D398: of:=POWER(IMABS(IMSQRT(1-POWER([.C398];2)));-1)*SQRT([$'Cálculo L y C filtro pi'.B$9]/[$'Cálculo L y C filtro pi'.B$8]) -> 76.5652494322033 | E398: of:=POWER(IMABS(IMSQRT(1-POWER([.C398];2)));-1)*SQRT([$'Cálculo L y C filtro pi'.B$18]/[$'Cálculo L y C filtro pi'.B$17]) -> 1531.30498864407
A399: 396 | B399: of:=2*PI()*[.A399] -> 2488.14138164312 | C399: of:=[.B399]/(2*PI()*[$Descripción.B$10]) -> 7.92000000000001 | D399: of:=POWER(IMABS(IMSQRT(1-POWER([.C399];2)));-1)*SQRT([$'Cálculo L y C filtro pi'.B$9]/[$'Cálculo L y C filtro pi'.B$8]) -> 76.3687664973854 | E399: of:=POWER(IMABS(IMSQRT(1-POWER([.C399];2)));-1)*SQRT([$'Cálculo L y C filtro pi'.B$18]/[$'Cálculo L y C filtro pi'.B$17]) -> 1527.37532994771
A400: 397 | B400: of:=2*PI()*[.A400] -> 2494.4245669503 | C400: of:=[.B400]/(2*PI()*[$Descripción.B$10]) -> 7.94000000000001 | D400: of:=POWER(IMABS(IMSQRT(1-POWER([.C400];2)));-1)*SQRT([$'Cálculo L y C filtro pi'.B$9]/[$'Cálculo L y C filtro pi'.B$8]) -> 76.1732973929292 | E400: of:=POWER(IMABS(IMSQRT(1-POWER([.C400];2)));-1)*SQRT([$'Cálculo L y C filtro pi'.B$18]/[$'Cálculo L y C filtro pi'.B$17]) -> 1523.46594785858
A401: 398 | B401: of:=2*PI()*[.A401] -> 2500.70775225748 | C401: of:=[.B401]/(2*PI()*[$Descripción.B$10]) -> 7.96000000000001 | D401: of:=POWER(IMABS(IMSQRT(1-POWER([.C401];2)));-1)*SQRT([$'Cálculo L y C filtro pi'.B$9]/[$'Cálculo L y C filtro pi'.B$8]) -> 75.9788342318538 | E401: of:=POWER(IMABS(IMSQRT(1-POWER([.C401];2)));-1)*SQRT([$'Cálculo L y C filtro pi'.B$18]/[$'Cálculo L y C filtro pi'.B$17]) -> 1519.57668463708
A402: 399 | B402: of:=2*PI()*[.A402] -> 2506.99093756465 | C402: of:=[.B402]/(2*PI()*[$Descripción.B$10]) -> 7.97999999999998 | D402: of:=POWER(IMABS(IMSQRT(1-POWER([.C402];2)));-1)*SQRT([$'Cálculo L y C filtro pi'.B$9]/[$'Cálculo L y C filtro pi'.B$8]) -> 75.7853692093783 | E402: of:=POWER(IMABS(IMSQRT(1-POWER([.C402];2)));-1)*SQRT([$'Cálculo L y C filtro pi'.B$18]/[$'Cálculo L y C filtro pi'.B$17]) -> 1515.70738418757
A403: 400 | B403: of:=2*PI()*[.A403] -> 2513.27412287183 | C403: of:=[.B403]/(2*PI()*[$Descripción.B$10]) -> 7.99999999999999 | D403: of:=POWER(IMABS(IMSQRT(1-POWER([.C403];2)));-1)*SQRT([$'Cálculo L y C filtro pi'.B$9]/[$'Cálculo L y C filtro pi'.B$8]) -> 75.5928946018456 | E403: of:=POWER(IMABS(IMSQRT(1-POWER([.C403];2)));-1)*SQRT([$'Cálculo L y C filtro pi'.B$18]/[$'Cálculo L y C filtro pi'.B$17]) -> 1511.85789203691
A404: 401 | B404: of:=2*PI()*[.A404] -> 2519.55730817901 | C404: of:=[.B404]/(2*PI()*[$Descripción.B$10]) -> 8.01999999999999 | D404: of:=POWER(IMABS(IMSQRT(1-POWER([.C404];2)));-1)*SQRT([$'Cálculo L y C filtro pi'.B$9]/[$'Cálculo L y C filtro pi'.B$8]) -> 75.4014027656654 | E404: of:=POWER(IMABS(IMSQRT(1-POWER([.C404];2)));-1)*SQRT([$'Cálculo L y C filtro pi'.B$18]/[$'Cálculo L y C filtro pi'.B$17]) -> 1508.02805531331
A405: 402 | B405: of:=2*PI()*[.A405] -> 2525.84049348619 | C405: of:=[.B405]/(2*PI()*[$Descripción.B$10]) -> 8.03999999999999 | D405: of:=POWER(IMABS(IMSQRT(1-POWER([.C405];2)));-1)*SQRT([$'Cálculo L y C filtro pi'.B$9]/[$'Cálculo L y C filtro pi'.B$8]) -> 75.2108861362707 | E405: of:=POWER(IMABS(IMSQRT(1-POWER([.C405];2)));-1)*SQRT([$'Cálculo L y C filtro pi'.B$18]/[$'Cálculo L y C filtro pi'.B$17]) -> 1504.21772272541
A406: 403 | B406: of:=2*PI()*[.A406] -> 2532.12367879337 | C406: of:=[.B406]/(2*PI()*[$Descripción.B$10]) -> 8.05999999999999 | D406: of:=POWER(IMABS(IMSQRT(1-POWER([.C406];2)));-1)*SQRT([$'Cálculo L y C filtro pi'.B$9]/[$'Cálculo L y C filtro pi'.B$8]) -> 75.0213372270926 | E406: of:=POWER(IMABS(IMSQRT(1-POWER([.C406];2)));-1)*SQRT([$'Cálculo L y C filtro pi'.B$18]/[$'Cálculo L y C filtro pi'.B$17]) -> 1500.42674454185
A407: 404 | B407: of:=2*PI()*[.A407] -> 2538.40686410055 | C407: of:=[.B407]/(2*PI()*[$Descripción.B$10]) -> 8.07999999999999 | D407: of:=POWER(IMABS(IMSQRT(1-POWER([.C407];2)));-1)*SQRT([$'Cálculo L y C filtro pi'.B$9]/[$'Cálculo L y C filtro pi'.B$8]) -> 74.8327486285505 | E407: of:=POWER(IMABS(IMSQRT(1-POWER([.C407];2)));-1)*SQRT([$'Cálculo L y C filtro pi'.B$18]/[$'Cálculo L y C filtro pi'.B$17]) -> 1496.65497257101
A408: 405 | B408: of:=2*PI()*[.A408] -> 2544.69004940773 | C408: of:=[.B408]/(2*PI()*[$Descripción.B$10]) -> 8.09999999999999 | D408: of:=POWER(IMABS(IMSQRT(1-POWER([.C408];2)));-1)*SQRT([$'Cálculo L y C filtro pi'.B$9]/[$'Cálculo L y C filtro pi'.B$8]) -> 74.6451130070587 | E408: of:=POWER(IMABS(IMSQRT(1-POWER([.C408];2)));-1)*SQRT([$'Cálculo L y C filtro pi'.B$18]/[$'Cálculo L y C filtro pi'.B$17]) -> 1492.90226014117
A409: 406 | B409: of:=2*PI()*[.A409] -> 2550.97323471491 | C409: of:=[.B409]/(2*PI()*[$Descripción.B$10]) -> 8.11999999999999 | D409: of:=POWER(IMABS(IMSQRT(1-POWER([.C409];2)));-1)*SQRT([$'Cálculo L y C filtro pi'.B$9]/[$'Cálculo L y C filtro pi'.B$8]) -> 74.4584231040474 | E409: of:=POWER(IMABS(IMSQRT(1-POWER([.C409];2)));-1)*SQRT([$'Cálculo L y C filtro pi'.B$18]/[$'Cálculo L y C filtro pi'.B$17]) -> 1489.16846208095
A410: 407 | B410: of:=2*PI()*[.A410] -> 2557.25642002209 | C410: of:=[.B410]/(2*PI()*[$Descripción.B$10]) -> 8.14 | D410: of:=POWER(IMABS(IMSQRT(1-POWER([.C410];2)));-1)*SQRT([$'Cálculo L y C filtro pi'.B$9]/[$'Cálculo L y C filtro pi'.B$8]) -> 74.2726717349998 | E410: of:=POWER(IMABS(IMSQRT(1-POWER([.C410];2)));-1)*SQRT([$'Cálculo L y C filtro pi'.B$18]/[$'Cálculo L y C filtro pi'.B$17]) -> 1485.4534347
A411: 408 | B411: of:=2*PI()*[.A411] -> 2563.53960532927 | C411: of:=[.B411]/(2*PI()*[$Descripción.B$10]) -> 8.16 | D411: of:=POWER(IMABS(IMSQRT(1-POWER([.C411];2)));-1)*SQRT([$'Cálculo L y C filtro pi'.B$9]/[$'Cálculo L y C filtro pi'.B$8]) -> 74.0878517885033 | E411: of:=POWER(IMABS(IMSQRT(1-POWER([.C411];2)));-1)*SQRT([$'Cálculo L y C filtro pi'.B$18]/[$'Cálculo L y C filtro pi'.B$17]) -> 1481.75703577007
A412: 409 | B412: of:=2*PI()*[.A412] -> 2569.82279063645 | C412: of:=[.B412]/(2*PI()*[$Descripción.B$10]) -> 8.18 | D412: of:=POWER(IMABS(IMSQRT(1-POWER([.C412];2)));-1)*SQRT([$'Cálculo L y C filtro pi'.B$9]/[$'Cálculo L y C filtro pi'.B$8]) -> 73.9039562253162 | E412: of:=POWER(IMABS(IMSQRT(1-POWER([.C412];2)));-1)*SQRT([$'Cálculo L y C filtro pi'.B$18]/[$'Cálculo L y C filtro pi'.B$17]) -> 1478.07912450632
A413: 410 | B413: of:=2*PI()*[.A413] -> 2576.10597594363 | C413: of:=[.B413]/(2*PI()*[$Descripción.B$10]) -> 8.2 | D413: of:=POWER(IMABS(IMSQRT(1-POWER([.C413];2)));-1)*SQRT([$'Cálculo L y C filtro pi'.B$9]/[$'Cálculo L y C filtro pi'.B$8]) -> 73.7209780774486 | E413: of:=POWER(IMABS(IMSQRT(1-POWER([.C413];2)));-1)*SQRT([$'Cálculo L y C filtro pi'.B$18]/[$'Cálculo L y C filtro pi'.B$17]) -> 1474.41956154897
A414: 411 | B414: of:=2*PI()*[.A414] -> 2582.38916125081 | C414: of:=[.B414]/(2*PI()*[$Descripción.B$10]) -> 8.22 | D414: of:=POWER(IMABS(IMSQRT(1-POWER([.C414];2)));-1)*SQRT([$'Cálculo L y C filtro pi'.B$9]/[$'Cálculo L y C filtro pi'.B$8]) -> 73.5389104472561 | E414: of:=POWER(IMABS(IMSQRT(1-POWER([.C414];2)));-1)*SQRT([$'Cálculo L y C filtro pi'.B$18]/[$'Cálculo L y C filtro pi'.B$17]) -> 1470.77820894512
A415: 412 | B415: of:=2*PI()*[.A415] -> 2588.67234655799 | C415: of:=[.B415]/(2*PI()*[$Descripción.B$10]) -> 8.24 | D415: of:=POWER(IMABS(IMSQRT(1-POWER([.C415];2)));-1)*SQRT([$'Cálculo L y C filtro pi'.B$9]/[$'Cálculo L y C filtro pi'.B$8]) -> 73.3577465065496 | E415: of:=POWER(IMABS(IMSQRT(1-POWER([.C415];2)));-1)*SQRT([$'Cálculo L y C filtro pi'.B$18]/[$'Cálculo L y C filtro pi'.B$17]) -> 1467.15493013099
A416: 413 | B416: of:=2*PI()*[.A416] -> 2594.95553186517 | C416: of:=[.B416]/(2*PI()*[$Descripción.B$10]) -> 8.26 | D416: of:=POWER(IMABS(IMSQRT(1-POWER([.C416];2)));-1)*SQRT([$'Cálculo L y C filtro pi'.B$9]/[$'Cálculo L y C filtro pi'.B$8]) -> 73.1774794957166 | E416: of:=POWER(IMABS(IMSQRT(1-POWER([.C416];2)));-1)*SQRT([$'Cálculo L y C filtro pi'.B$18]/[$'Cálculo L y C filtro pi'.B$17]) -> 1463.54958991433
A417: 414 | B417: of:=2*PI()*[.A417] -> 2601.23871717235 | C417: of:=[.B417]/(2*PI()*[$Descripción.B$10]) -> 8.28 | D417: of:=POWER(IMABS(IMSQRT(1-POWER([.C417];2)));-1)*SQRT([$'Cálculo L y C filtro pi'.B$9]/[$'Cálculo L y C filtro pi'.B$8]) -> 72.9981027228571 | E417: of:=POWER(IMABS(IMSQRT(1-POWER([.C417];2)));-1)*SQRT([$'Cálculo L y C filtro pi'.B$18]/[$'Cálculo L y C filtro pi'.B$17]) -> 1459.96205445714
A418: 415 | B418: of:=2*PI()*[.A418] -> 2607.52190247953 | C418: of:=[.B418]/(2*PI()*[$Descripción.B$10]) -> 8.30000000000001 | D418: of:=POWER(IMABS(IMSQRT(1-POWER([.C418];2)));-1)*SQRT([$'Cálculo L y C filtro pi'.B$9]/[$'Cálculo L y C filtro pi'.B$8]) -> 72.8196095629324 | E418: of:=POWER(IMABS(IMSQRT(1-POWER([.C418];2)));-1)*SQRT([$'Cálculo L y C filtro pi'.B$18]/[$'Cálculo L y C filtro pi'.B$17]) -> 1456.39219125865
A419: 416 | B419: of:=2*PI()*[.A419] -> 2613.80508778671 | C419: of:=[.B419]/(2*PI()*[$Descripción.B$10]) -> 8.32000000000001 | D419: of:=POWER(IMABS(IMSQRT(1-POWER([.C419];2)));-1)*SQRT([$'Cálculo L y C filtro pi'.B$9]/[$'Cálculo L y C filtro pi'.B$8]) -> 72.6419934569267 | E419: of:=POWER(IMABS(IMSQRT(1-POWER([.C419];2)));-1)*SQRT([$'Cálculo L y C filtro pi'.B$18]/[$'Cálculo L y C filtro pi'.B$17]) -> 1452.83986913853
A420: 417 | B420: of:=2*PI()*[.A420] -> 2620.08827309389 | C420: of:=[.B420]/(2*PI()*[$Descripción.B$10]) -> 8.34000000000001 | D420: of:=POWER(IMABS(IMSQRT(1-POWER([.C420];2)));-1)*SQRT([$'Cálculo L y C filtro pi'.B$9]/[$'Cálculo L y C filtro pi'.B$8]) -> 72.465247911021 | E420: of:=POWER(IMABS(IMSQRT(1-POWER([.C420];2)));-1)*SQRT([$'Cálculo L y C filtro pi'.B$18]/[$'Cálculo L y C filtro pi'.B$17]) -> 1449.30495822042
A421: 418 | B421: of:=2*PI()*[.A421] -> 2626.37145840107 | C421: of:=[.B421]/(2*PI()*[$Descripción.B$10]) -> 8.36000000000001 | D421: of:=POWER(IMABS(IMSQRT(1-POWER([.C421];2)));-1)*SQRT([$'Cálculo L y C filtro pi'.B$9]/[$'Cálculo L y C filtro pi'.B$8]) -> 72.28936649578 | E421: of:=POWER(IMABS(IMSQRT(1-POWER([.C421];2)));-1)*SQRT([$'Cálculo L y C filtro pi'.B$18]/[$'Cálculo L y C filtro pi'.B$17]) -> 1445.7873299156
A422: 419 | B422: of:=2*PI()*[.A422] -> 2632.65464370825 | C422: of:=[.B422]/(2*PI()*[$Descripción.B$10]) -> 8.38000000000001 | D422: of:=POWER(IMABS(IMSQRT(1-POWER([.C422];2)));-1)*SQRT([$'Cálculo L y C filtro pi'.B$9]/[$'Cálculo L y C filtro pi'.B$8]) -> 72.114342845351 | E422: of:=POWER(IMABS(IMSQRT(1-POWER([.C422];2)));-1)*SQRT([$'Cálculo L y C filtro pi'.B$18]/[$'Cálculo L y C filtro pi'.B$17]) -> 1442.28685690702
A423: 420 | B423: of:=2*PI()*[.A423] -> 2638.93782901543 | C423: of:=[.B423]/(2*PI()*[$Descripción.B$10]) -> 8.40000000000001 | D423: of:=POWER(IMABS(IMSQRT(1-POWER([.C423];2)));-1)*SQRT([$'Cálculo L y C filtro pi'.B$9]/[$'Cálculo L y C filtro pi'.B$8]) -> 71.9401706566751 | E423: of:=POWER(IMABS(IMSQRT(1-POWER([.C423];2)));-1)*SQRT([$'Cálculo L y C filtro pi'.B$18]/[$'Cálculo L y C filtro pi'.B$17]) -> 1438.8034131335
A424: 421 | B424: of:=2*PI()*[.A424] -> 2645.22101432261 | C424: of:=[.B424]/(2*PI()*[$Descripción.B$10]) -> 8.42000000000001 | D424: of:=POWER(IMABS(IMSQRT(1-POWER([.C424];2)));-1)*SQRT([$'Cálculo L y C filtro pi'.B$9]/[$'Cálculo L y C filtro pi'.B$8]) -> 71.7668436887093 | E424: of:=POWER(IMABS(IMSQRT(1-POWER([.C424];2)));-1)*SQRT([$'Cálculo L y C filtro pi'.B$18]/[$'Cálculo L y C filtro pi'.B$17]) -> 1435.33687377419
A425: 422 | B425: of:=2*PI()*[.A425] -> 2651.50419962979 | C425: of:=[.B425]/(2*PI()*[$Descripción.B$10]) -> 8.44000000000001 | D425: of:=POWER(IMABS(IMSQRT(1-POWER([.C425];2)));-1)*SQRT([$'Cálculo L y C filtro pi'.B$9]/[$'Cálculo L y C filtro pi'.B$8]) -> 71.5943557616609 | E425: of:=POWER(IMABS(IMSQRT(1-POWER([.C425];2)));-1)*SQRT([$'Cálculo L y C filtro pi'.B$18]/[$'Cálculo L y C filtro pi'.B$17]) -> 1431.88711523322
A426: 423 | B426: of:=2*PI()*[.A426] -> 2657.78738493696 | C426: of:=[.B426]/(2*PI()*[$Descripción.B$10]) -> 8.45999999999998 | D426: of:=POWER(IMABS(IMSQRT(1-POWER([.C426];2)));-1)*SQRT([$'Cálculo L y C filtro pi'.B$9]/[$'Cálculo L y C filtro pi'.B$8]) -> 71.4227007562341 | E426: of:=POWER(IMABS(IMSQRT(1-POWER([.C426];2)));-1)*SQRT([$'Cálculo L y C filtro pi'.B$18]/[$'Cálculo L y C filtro pi'.B$17]) -> 1428.45401512468
A427: 424 | B427: of:=2*PI()*[.A427] -> 2664.07057024414 | C427: of:=[.B427]/(2*PI()*[$Descripción.B$10]) -> 8.47999999999998 | D427: of:=POWER(IMABS(IMSQRT(1-POWER([.C427];2)));-1)*SQRT([$'Cálculo L y C filtro pi'.B$9]/[$'Cálculo L y C filtro pi'.B$8]) -> 71.2518726128849 | E427: of:=POWER(IMABS(IMSQRT(1-POWER([.C427];2)));-1)*SQRT([$'Cálculo L y C filtro pi'.B$18]/[$'Cálculo L y C filtro pi'.B$17]) -> 1425.0374522577
A428: 425 | B428: of:=2*PI()*[.A428] -> 2670.35375555132 | C428: of:=[.B428]/(2*PI()*[$Descripción.B$10]) -> 8.49999999999999 | D428: of:=POWER(IMABS(IMSQRT(1-POWER([.C428];2)));-1)*SQRT([$'Cálculo L y C filtro pi'.B$9]/[$'Cálculo L y C filtro pi'.B$8]) -> 71.0818653310912 | E428: of:=POWER(IMABS(IMSQRT(1-POWER([.C428];2)));-1)*SQRT([$'Cálculo L y C filtro pi'.B$18]/[$'Cálculo L y C filtro pi'.B$17]) -> 1421.63730662182
A429: 426 | B429: of:=2*PI()*[.A429] -> 2676.6369408585 | C429: of:=[.B429]/(2*PI()*[$Descripción.B$10]) -> 8.51999999999999 | D429: of:=POWER(IMABS(IMSQRT(1-POWER([.C429];2)));-1)*SQRT([$'Cálculo L y C filtro pi'.B$9]/[$'Cálculo L y C filtro pi'.B$8]) -> 70.9126729686302 | E429: of:=POWER(IMABS(IMSQRT(1-POWER([.C429];2)));-1)*SQRT([$'Cálculo L y C filtro pi'.B$18]/[$'Cálculo L y C filtro pi'.B$17]) -> 1418.2534593726
A430: 427 | B430: of:=2*PI()*[.A430] -> 2682.92012616568 | C430: of:=[.B430]/(2*PI()*[$Descripción.B$10]) -> 8.53999999999999 | D430: of:=POWER(IMABS(IMSQRT(1-POWER([.C430];2)));-1)*SQRT([$'Cálculo L y C filtro pi'.B$9]/[$'Cálculo L y C filtro pi'.B$8]) -> 70.7442896408676 | E430: of:=POWER(IMABS(IMSQRT(1-POWER([.C430];2)));-1)*SQRT([$'Cálculo L y C filtro pi'.B$18]/[$'Cálculo L y C filtro pi'.B$17]) -> 1414.88579281735
A431: 428 | B431: of:=2*PI()*[.A431] -> 2689.20331147286 | C431: of:=[.B431]/(2*PI()*[$Descripción.B$10]) -> 8.55999999999999 | D431: of:=POWER(IMABS(IMSQRT(1-POWER([.C431];2)));-1)*SQRT([$'Cálculo L y C filtro pi'.B$9]/[$'Cálculo L y C filtro pi'.B$8]) -> 70.5767095200579 | E431: of:=POWER(IMABS(IMSQRT(1-POWER([.C431];2)));-1)*SQRT([$'Cálculo L y C filtro pi'.B$18]/[$'Cálculo L y C filtro pi'.B$17]) -> 1411.53419040116
A432: 429 | B432: of:=2*PI()*[.A432] -> 2695.48649678004 | C432: of:=[.B432]/(2*PI()*[$Descripción.B$10]) -> 8.57999999999999 | D432: of:=POWER(IMABS(IMSQRT(1-POWER([.C432];2)));-1)*SQRT([$'Cálculo L y C filtro pi'.B$9]/[$'Cálculo L y C filtro pi'.B$8]) -> 70.409926834654 | E432: of:=POWER(IMABS(IMSQRT(1-POWER([.C432];2)));-1)*SQRT([$'Cálculo L y C filtro pi'.B$18]/[$'Cálculo L y C filtro pi'.B$17]) -> 1408.19853669308
A433: 430 | B433: of:=2*PI()*[.A433] -> 2701.76968208722 | C433: of:=[.B433]/(2*PI()*[$Descripción.B$10]) -> 8.59999999999999 | D433: of:=POWER(IMABS(IMSQRT(1-POWER([.C433];2)));-1)*SQRT([$'Cálculo L y C filtro pi'.B$9]/[$'Cálculo L y C filtro pi'.B$8]) -> 70.2439358686271 | E433: of:=POWER(IMABS(IMSQRT(1-POWER([.C433];2)));-1)*SQRT([$'Cálculo L y C filtro pi'.B$18]/[$'Cálculo L y C filtro pi'.B$17]) -> 1404.87871737254
A434: 431 | B434: of:=2*PI()*[.A434] -> 2708.0528673944 | C434: of:=[.B434]/(2*PI()*[$Descripción.B$10]) -> 8.61999999999999 | D434: of:=POWER(IMABS(IMSQRT(1-POWER([.C434];2)));-1)*SQRT([$'Cálculo L y C filtro pi'.B$9]/[$'Cálculo L y C filtro pi'.B$8]) -> 70.0787309607972 | E434: of:=POWER(IMABS(IMSQRT(1-POWER([.C434];2)));-1)*SQRT([$'Cálculo L y C filtro pi'.B$18]/[$'Cálculo L y C filtro pi'.B$17]) -> 1401.57461921594
A435: 432 | B435: of:=2*PI()*[.A435] -> 2714.33605270158 | C435: of:=[.B435]/(2*PI()*[$Descripción.B$10]) -> 8.64 | D435: of:=POWER(IMABS(IMSQRT(1-POWER([.C435];2)));-1)*SQRT([$'Cálculo L y C filtro pi'.B$9]/[$'Cálculo L y C filtro pi'.B$8]) -> 69.9143065041719 | E435: of:=POWER(IMABS(IMSQRT(1-POWER([.C435];2)));-1)*SQRT([$'Cálculo L y C filtro pi'.B$18]/[$'Cálculo L y C filtro pi'.B$17]) -> 1398.28613008344
A436: 433 | B436: of:=2*PI()*[.A436] -> 2720.61923800876 | C436: of:=[.B436]/(2*PI()*[$Descripción.B$10]) -> 8.66 | D436: of:=POWER(IMABS(IMSQRT(1-POWER([.C436];2)));-1)*SQRT([$'Cálculo L y C filtro pi'.B$9]/[$'Cálculo L y C filtro pi'.B$8]) -> 69.7506569452968 | E436: of:=POWER(IMABS(IMSQRT(1-POWER([.C436];2)));-1)*SQRT([$'Cálculo L y C filtro pi'.B$18]/[$'Cálculo L y C filtro pi'.B$17]) -> 1395.01313890594
A437: 434 | B437: of:=2*PI()*[.A437] -> 2726.90242331594 | C437: of:=[.B437]/(2*PI()*[$Descripción.B$10]) -> 8.68 | D437: of:=POWER(IMABS(IMSQRT(1-POWER([.C437];2)));-1)*SQRT([$'Cálculo L y C filtro pi'.B$9]/[$'Cálculo L y C filtro pi'.B$8]) -> 69.587776783613 | E437: of:=POWER(IMABS(IMSQRT(1-POWER([.C437];2)));-1)*SQRT([$'Cálculo L y C filtro pi'.B$18]/[$'Cálculo L y C filtro pi'.B$17]) -> 1391.75553567226
A438: 435 | B438: of:=2*PI()*[.A438] -> 2733.18560862312 | C438: of:=[.B438]/(2*PI()*[$Descripción.B$10]) -> 8.7 | D438: of:=POWER(IMABS(IMSQRT(1-POWER([.C438];2)));-1)*SQRT([$'Cálculo L y C filtro pi'.B$9]/[$'Cálculo L y C filtro pi'.B$8]) -> 69.425660570826 | E438: of:=POWER(IMABS(IMSQRT(1-POWER([.C438];2)));-1)*SQRT([$'Cálculo L y C filtro pi'.B$18]/[$'Cálculo L y C filtro pi'.B$17]) -> 1388.51321141652
A439: 436 | B439: of:=2*PI()*[.A439] -> 2739.4687939303 | C439: of:=[.B439]/(2*PI()*[$Descripción.B$10]) -> 8.72 | D439: of:=POWER(IMABS(IMSQRT(1-POWER([.C439];2)));-1)*SQRT([$'Cálculo L y C filtro pi'.B$9]/[$'Cálculo L y C filtro pi'.B$8]) -> 69.2643029102819 | E439: of:=POWER(IMABS(IMSQRT(1-POWER([.C439];2)));-1)*SQRT([$'Cálculo L y C filtro pi'.B$18]/[$'Cálculo L y C filtro pi'.B$17]) -> 1385.28605820564
A440: 437 | B440: of:=2*PI()*[.A440] -> 2745.75197923748 | C440: of:=[.B440]/(2*PI()*[$Descripción.B$10]) -> 8.74 | D440: of:=POWER(IMABS(IMSQRT(1-POWER([.C440];2)));-1)*SQRT([$'Cálculo L y C filtro pi'.B$9]/[$'Cálculo L y C filtro pi'.B$8]) -> 69.1036984563539 | E440: of:=POWER(IMABS(IMSQRT(1-POWER([.C440];2)));-1)*SQRT([$'Cálculo L y C filtro pi'.B$18]/[$'Cálculo L y C filtro pi'.B$17]) -> 1382.07396912708
A441: 438 | B441: of:=2*PI()*[.A441] -> 2752.03516454466 | C441: of:=[.B441]/(2*PI()*[$Descripción.B$10]) -> 8.76 | D441: of:=POWER(IMABS(IMSQRT(1-POWER([.C441];2)));-1)*SQRT([$'Cálculo L y C filtro pi'.B$9]/[$'Cálculo L y C filtro pi'.B$8]) -> 68.9438419138368 | E441: of:=POWER(IMABS(IMSQRT(1-POWER([.C441];2)));-1)*SQRT([$'Cálculo L y C filtro pi'.B$18]/[$'Cálculo L y C filtro pi'.B$17]) -> 1378.87683827674
A442: 439 | B442: of:=2*PI()*[.A442] -> 2758.31834985184 | C442: of:=[.B442]/(2*PI()*[$Descripción.B$10]) -> 8.78000000000001 | D442: of:=POWER(IMABS(IMSQRT(1-POWER([.C442];2)));-1)*SQRT([$'Cálculo L y C filtro pi'.B$9]/[$'Cálculo L y C filtro pi'.B$8]) -> 68.7847280373504 | E442: of:=POWER(IMABS(IMSQRT(1-POWER([.C442];2)));-1)*SQRT([$'Cálculo L y C filtro pi'.B$18]/[$'Cálculo L y C filtro pi'.B$17]) -> 1375.69456074701
A443: 440 | B443: of:=2*PI()*[.A443] -> 2764.60153515902 | C443: of:=[.B443]/(2*PI()*[$Descripción.B$10]) -> 8.80000000000001 | D443: of:=POWER(IMABS(IMSQRT(1-POWER([.C443];2)));-1)*SQRT([$'Cálculo L y C filtro pi'.B$9]/[$'Cálculo L y C filtro pi'.B$8]) -> 68.6263516307516 | E443: of:=POWER(IMABS(IMSQRT(1-POWER([.C443];2)));-1)*SQRT([$'Cálculo L y C filtro pi'.B$18]/[$'Cálculo L y C filtro pi'.B$17]) -> 1372.52703261503
A444: 441 | B444: of:=2*PI()*[.A444] -> 2770.8847204662 | C444: of:=[.B444]/(2*PI()*[$Descripción.B$10]) -> 8.82000000000001 | D444: of:=POWER(IMABS(IMSQRT(1-POWER([.C444];2)));-1)*SQRT([$'Cálculo L y C filtro pi'.B$9]/[$'Cálculo L y C filtro pi'.B$8]) -> 68.4687075465542 | E444: of:=POWER(IMABS(IMSQRT(1-POWER([.C444];2)));-1)*SQRT([$'Cálculo L y C filtro pi'.B$18]/[$'Cálculo L y C filtro pi'.B$17]) -> 1369.37415093108
A445: 442 | B445: of:=2*PI()*[.A445] -> 2777.16790577338 | C445: of:=[.B445]/(2*PI()*[$Descripción.B$10]) -> 8.84000000000001 | D445: of:=POWER(IMABS(IMSQRT(1-POWER([.C445];2)));-1)*SQRT([$'Cálculo L y C filtro pi'.B$9]/[$'Cálculo L y C filtro pi'.B$8]) -> 68.3117906853576 | E445: of:=POWER(IMABS(IMSQRT(1-POWER([.C445];2)));-1)*SQRT([$'Cálculo L y C filtro pi'.B$18]/[$'Cálculo L y C filtro pi'.B$17]) -> 1366.23581370715
A446: 443 | B446: of:=2*PI()*[.A446] -> 2783.45109108056 | C446: of:=[.B446]/(2*PI()*[$Descripción.B$10]) -> 8.86000000000001 | D446: of:=POWER(IMABS(IMSQRT(1-POWER([.C446];2)));-1)*SQRT([$'Cálculo L y C filtro pi'.B$9]/[$'Cálculo L y C filtro pi'.B$8]) -> 68.1555959952837 | E446: of:=POWER(IMABS(IMSQRT(1-POWER([.C446];2)));-1)*SQRT([$'Cálculo L y C filtro pi'.B$18]/[$'Cálculo L y C filtro pi'.B$17]) -> 1363.11191990567
A447: 444 | B447: of:=2*PI()*[.A447] -> 2789.73427638774 | C447: of:=[.B447]/(2*PI()*[$Descripción.B$10]) -> 8.88000000000001 | D447: of:=POWER(IMABS(IMSQRT(1-POWER([.C447];2)));-1)*SQRT([$'Cálculo L y C filtro pi'.B$9]/[$'Cálculo L y C filtro pi'.B$8]) -> 68.0001184714207 | E447: of:=POWER(IMABS(IMSQRT(1-POWER([.C447];2)));-1)*SQRT([$'Cálculo L y C filtro pi'.B$18]/[$'Cálculo L y C filtro pi'.B$17]) -> 1360.00236942841
A448: 445 | B448: of:=2*PI()*[.A448] -> 2796.01746169492 | C448: of:=[.B448]/(2*PI()*[$Descripción.B$10]) -> 8.90000000000001 | D448: of:=POWER(IMABS(IMSQRT(1-POWER([.C448];2)));-1)*SQRT([$'Cálculo L y C filtro pi'.B$9]/[$'Cálculo L y C filtro pi'.B$8]) -> 67.8453531552757 | E448: of:=POWER(IMABS(IMSQRT(1-POWER([.C448];2)));-1)*SQRT([$'Cálculo L y C filtro pi'.B$18]/[$'Cálculo L y C filtro pi'.B$17]) -> 1356.90706310551
A449: 446 | B449: of:=2*PI()*[.A449] -> 2802.3006470021 | C449: of:=[.B449]/(2*PI()*[$Descripción.B$10]) -> 8.92000000000001 | D449: of:=POWER(IMABS(IMSQRT(1-POWER([.C449];2)));-1)*SQRT([$'Cálculo L y C filtro pi'.B$9]/[$'Cálculo L y C filtro pi'.B$8]) -> 67.6912951342352 | E449: of:=POWER(IMABS(IMSQRT(1-POWER([.C449];2)));-1)*SQRT([$'Cálculo L y C filtro pi'.B$18]/[$'Cálculo L y C filtro pi'.B$17]) -> 1353.8259026847
A450: 447 | B450: of:=2*PI()*[.A450] -> 2808.58383230927 | C450: of:=[.B450]/(2*PI()*[$Descripción.B$10]) -> 8.93999999999998 | D450: of:=POWER(IMABS(IMSQRT(1-POWER([.C450];2)));-1)*SQRT([$'Cálculo L y C filtro pi'.B$9]/[$'Cálculo L y C filtro pi'.B$8]) -> 67.5379395410319 | E450: of:=POWER(IMABS(IMSQRT(1-POWER([.C450];2)));-1)*SQRT([$'Cálculo L y C filtro pi'.B$18]/[$'Cálculo L y C filtro pi'.B$17]) -> 1350.75879082064
A451: 448 | B451: of:=2*PI()*[.A451] -> 2814.86701761645 | C451: of:=[.B451]/(2*PI()*[$Descripción.B$10]) -> 8.95999999999999 | D451: of:=POWER(IMABS(IMSQRT(1-POWER([.C451];2)));-1)*SQRT([$'Cálculo L y C filtro pi'.B$9]/[$'Cálculo L y C filtro pi'.B$8]) -> 67.3852815532196 | E451: of:=POWER(IMABS(IMSQRT(1-POWER([.C451];2)));-1)*SQRT([$'Cálculo L y C filtro pi'.B$18]/[$'Cálculo L y C filtro pi'.B$17]) -> 1347.70563106439
A452: 449 | B452: of:=2*PI()*[.A452] -> 2821.15020292363 | C452: of:=[.B452]/(2*PI()*[$Descripción.B$10]) -> 8.97999999999999 | D452: of:=POWER(IMABS(IMSQRT(1-POWER([.C452];2)));-1)*SQRT([$'Cálculo L y C filtro pi'.B$9]/[$'Cálculo L y C filtro pi'.B$8]) -> 67.2333163926564 | E452: of:=POWER(IMABS(IMSQRT(1-POWER([.C452];2)));-1)*SQRT([$'Cálculo L y C filtro pi'.B$18]/[$'Cálculo L y C filtro pi'.B$17]) -> 1344.66632785313
A453: 450 | B453: of:=2*PI()*[.A453] -> 2827.43338823081 | C453: of:=[.B453]/(2*PI()*[$Descripción.B$10]) -> 8.99999999999999 | D453: of:=POWER(IMABS(IMSQRT(1-POWER([.C453];2)));-1)*SQRT([$'Cálculo L y C filtro pi'.B$9]/[$'Cálculo L y C filtro pi'.B$8]) -> 67.0820393249938 | E453: of:=POWER(IMABS(IMSQRT(1-POWER([.C453];2)));-1)*SQRT([$'Cálculo L y C filtro pi'.B$18]/[$'Cálculo L y C filtro pi'.B$17]) -> 1341.64078649988
A454: 451 | B454: of:=2*PI()*[.A454] -> 2833.71657353799 | C454: of:=[.B454]/(2*PI()*[$Descripción.B$10]) -> 9.01999999999999 | D454: of:=POWER(IMABS(IMSQRT(1-POWER([.C454];2)));-1)*SQRT([$'Cálculo L y C filtro pi'.B$9]/[$'Cálculo L y C filtro pi'.B$8]) -> 66.9314456591728 | E454: of:=POWER(IMABS(IMSQRT(1-POWER([.C454];2)));-1)*SQRT([$'Cálculo L y C filtro pi'.B$18]/[$'Cálculo L y C filtro pi'.B$17]) -> 1338.62891318346
A455: 452 | B455: of:=2*PI()*[.A455] -> 2839.99975884517 | C455: of:=[.B455]/(2*PI()*[$Descripción.B$10]) -> 9.03999999999999 | D455: of:=POWER(IMABS(IMSQRT(1-POWER([.C455];2)));-1)*SQRT([$'Cálculo L y C filtro pi'.B$9]/[$'Cálculo L y C filtro pi'.B$8]) -> 66.7815307469281 | E455: of:=POWER(IMABS(IMSQRT(1-POWER([.C455];2)));-1)*SQRT([$'Cálculo L y C filtro pi'.B$18]/[$'Cálculo L y C filtro pi'.B$17]) -> 1335.63061493856
A456: 453 | B456: of:=2*PI()*[.A456] -> 2846.28294415235 | C456: of:=[.B456]/(2*PI()*[$Descripción.B$10]) -> 9.05999999999999 | D456: of:=POWER(IMABS(IMSQRT(1-POWER([.C456];2)));-1)*SQRT([$'Cálculo L y C filtro pi'.B$9]/[$'Cálculo L y C filtro pi'.B$8]) -> 66.6322899822982 | E456: of:=POWER(IMABS(IMSQRT(1-POWER([.C456];2)));-1)*SQRT([$'Cálculo L y C filtro pi'.B$18]/[$'Cálculo L y C filtro pi'.B$17]) -> 1332.64579964597
A457: 454 | B457: of:=2*PI()*[.A457] -> 2852.56612945953 | C457: of:=[.B457]/(2*PI()*[$Descripción.B$10]) -> 9.07999999999999 | D457: of:=POWER(IMABS(IMSQRT(1-POWER([.C457];2)));-1)*SQRT([$'Cálculo L y C filtro pi'.B$9]/[$'Cálculo L y C filtro pi'.B$8]) -> 66.4837188011428 | E457: of:=POWER(IMABS(IMSQRT(1-POWER([.C457];2)));-1)*SQRT([$'Cálculo L y C filtro pi'.B$18]/[$'Cálculo L y C filtro pi'.B$17]) -> 1329.67437602286
A458: 455 | B458: of:=2*PI()*[.A458] -> 2858.84931476671 | C458: of:=[.B458]/(2*PI()*[$Descripción.B$10]) -> 9.09999999999999 | D458: of:=POWER(IMABS(IMSQRT(1-POWER([.C458];2)));-1)*SQRT([$'Cálculo L y C filtro pi'.B$9]/[$'Cálculo L y C filtro pi'.B$8]) -> 66.335812680666 | E458: of:=POWER(IMABS(IMSQRT(1-POWER([.C458];2)));-1)*SQRT([$'Cálculo L y C filtro pi'.B$18]/[$'Cálculo L y C filtro pi'.B$17]) -> 1326.71625361332
A459: 456 | B459: of:=2*PI()*[.A459] -> 2865.13250007389 | C459: of:=[.B459]/(2*PI()*[$Descripción.B$10]) -> 9.11999999999999 | D459: of:=POWER(IMABS(IMSQRT(1-POWER([.C459];2)));-1)*SQRT([$'Cálculo L y C filtro pi'.B$9]/[$'Cálculo L y C filtro pi'.B$8]) -> 66.1885671389473 | E459: of:=POWER(IMABS(IMSQRT(1-POWER([.C459];2)));-1)*SQRT([$'Cálculo L y C filtro pi'.B$18]/[$'Cálculo L y C filtro pi'.B$17]) -> 1323.77134277895
A460: 457 | B460: of:=2*PI()*[.A460] -> 2871.41568538107 | C460: of:=[.B460]/(2*PI()*[$Descripción.B$10]) -> 9.14 | D460: of:=POWER(IMABS(IMSQRT(1-POWER([.C460];2)));-1)*SQRT([$'Cálculo L y C filtro pi'.B$9]/[$'Cálculo L y C filtro pi'.B$8]) -> 66.041977734478 | E460: of:=POWER(IMABS(IMSQRT(1-POWER([.C460];2)));-1)*SQRT([$'Cálculo L y C filtro pi'.B$18]/[$'Cálculo L y C filtro pi'.B$17]) -> 1320.83955468956
A461: 458 | B461: of:=2*PI()*[.A461] -> 2877.69887068825 | C461: of:=[.B461]/(2*PI()*[$Descripción.B$10]) -> 9.16 | D461: of:=POWER(IMABS(IMSQRT(1-POWER([.C461];2)));-1)*SQRT([$'Cálculo L y C filtro pi'.B$9]/[$'Cálculo L y C filtro pi'.B$8]) -> 65.8960400657043 | E461: of:=POWER(IMABS(IMSQRT(1-POWER([.C461];2)));-1)*SQRT([$'Cálculo L y C filtro pi'.B$18]/[$'Cálculo L y C filtro pi'.B$17]) -> 1317.92080131409
A462: 459 | B462: of:=2*PI()*[.A462] -> 2883.98205599543 | C462: of:=[.B462]/(2*PI()*[$Descripción.B$10]) -> 9.18 | D462: of:=POWER(IMABS(IMSQRT(1-POWER([.C462];2)));-1)*SQRT([$'Cálculo L y C filtro pi'.B$9]/[$'Cálculo L y C filtro pi'.B$8]) -> 65.7507497705764 | E462: of:=POWER(IMABS(IMSQRT(1-POWER([.C462];2)));-1)*SQRT([$'Cálculo L y C filtro pi'.B$18]/[$'Cálculo L y C filtro pi'.B$17]) -> 1315.01499541153
A463: 460 | B463: of:=2*PI()*[.A463] -> 2890.26524130261 | C463: of:=[.B463]/(2*PI()*[$Descripción.B$10]) -> 9.2 | D463: of:=POWER(IMABS(IMSQRT(1-POWER([.C463];2)));-1)*SQRT([$'Cálculo L y C filtro pi'.B$9]/[$'Cálculo L y C filtro pi'.B$8]) -> 65.6061025261043 | E463: of:=POWER(IMABS(IMSQRT(1-POWER([.C463];2)));-1)*SQRT([$'Cálculo L y C filtro pi'.B$18]/[$'Cálculo L y C filtro pi'.B$17]) -> 1312.12205052209
A464: 461 | B464: of:=2*PI()*[.A464] -> 2896.54842660979 | C464: of:=[.B464]/(2*PI()*[$Descripción.B$10]) -> 9.22 | D464: of:=POWER(IMABS(IMSQRT(1-POWER([.C464];2)));-1)*SQRT([$'Cálculo L y C filtro pi'.B$9]/[$'Cálculo L y C filtro pi'.B$8]) -> 65.4620940479188 | E464: of:=POWER(IMABS(IMSQRT(1-POWER([.C464];2)));-1)*SQRT([$'Cálculo L y C filtro pi'.B$18]/[$'Cálculo L y C filtro pi'.B$17]) -> 1309.24188095838
A465: 462 | B465: of:=2*PI()*[.A465] -> 2902.83161191697 | C465: of:=[.B465]/(2*PI()*[$Descripción.B$10]) -> 9.24 | D465: of:=POWER(IMABS(IMSQRT(1-POWER([.C465];2)));-1)*SQRT([$'Cálculo L y C filtro pi'.B$9]/[$'Cálculo L y C filtro pi'.B$8]) -> 65.3187200898391 | E465: of:=POWER(IMABS(IMSQRT(1-POWER([.C465];2)));-1)*SQRT([$'Cálculo L y C filtro pi'.B$18]/[$'Cálculo L y C filtro pi'.B$17]) -> 1306.37440179678
A466: 463 | B466: of:=2*PI()*[.A466] -> 2909.11479722415 | C466: of:=[.B466]/(2*PI()*[$Descripción.B$10]) -> 9.26000000000001 | D466: of:=POWER(IMABS(IMSQRT(1-POWER([.C466];2)));-1)*SQRT([$'Cálculo L y C filtro pi'.B$9]/[$'Cálculo L y C filtro pi'.B$8]) -> 65.1759764434459 | E466: of:=POWER(IMABS(IMSQRT(1-POWER([.C466];2)));-1)*SQRT([$'Cálculo L y C filtro pi'.B$18]/[$'Cálculo L y C filtro pi'.B$17]) -> 1303.51952886892
A467: 464 | B467: of:=2*PI()*[.A467] -> 2915.39798253133 | C467: of:=[.B467]/(2*PI()*[$Descripción.B$10]) -> 9.28000000000001 | D467: of:=POWER(IMABS(IMSQRT(1-POWER([.C467];2)));-1)*SQRT([$'Cálculo L y C filtro pi'.B$9]/[$'Cálculo L y C filtro pi'.B$8]) -> 65.03385893766 | E467: of:=POWER(IMABS(IMSQRT(1-POWER([.C467];2)));-1)*SQRT([$'Cálculo L y C filtro pi'.B$18]/[$'Cálculo L y C filtro pi'.B$17]) -> 1300.6771787532
A468: 465 | B468: of:=2*PI()*[.A468] -> 2921.68116783851 | C468: of:=[.B468]/(2*PI()*[$Descripción.B$10]) -> 9.30000000000001 | D468: of:=POWER(IMABS(IMSQRT(1-POWER([.C468];2)));-1)*SQRT([$'Cálculo L y C filtro pi'.B$9]/[$'Cálculo L y C filtro pi'.B$8]) -> 64.8923634383276 | E468: of:=POWER(IMABS(IMSQRT(1-POWER([.C468];2)));-1)*SQRT([$'Cálculo L y C filtro pi'.B$18]/[$'Cálculo L y C filtro pi'.B$17]) -> 1297.84726876655
A469: 466 | B469: of:=2*PI()*[.A469] -> 2927.96435314569 | C469: of:=[.B469]/(2*PI()*[$Descripción.B$10]) -> 9.32000000000001 | D469: of:=POWER(IMABS(IMSQRT(1-POWER([.C469];2)));-1)*SQRT([$'Cálculo L y C filtro pi'.B$9]/[$'Cálculo L y C filtro pi'.B$8]) -> 64.7514858478096 | E469: of:=POWER(IMABS(IMSQRT(1-POWER([.C469];2)));-1)*SQRT([$'Cálculo L y C filtro pi'.B$18]/[$'Cálculo L y C filtro pi'.B$17]) -> 1295.02971695619
A470: 467 | B470: of:=2*PI()*[.A470] -> 2934.24753845287 | C470: of:=[.B470]/(2*PI()*[$Descripción.B$10]) -> 9.34000000000001 | D470: of:=POWER(IMABS(IMSQRT(1-POWER([.C470];2)));-1)*SQRT([$'Cálculo L y C filtro pi'.B$9]/[$'Cálculo L y C filtro pi'.B$8]) -> 64.611222104578 | E470: of:=POWER(IMABS(IMSQRT(1-POWER([.C470];2)));-1)*SQRT([$'Cálculo L y C filtro pi'.B$18]/[$'Cálculo L y C filtro pi'.B$17]) -> 1292.22444209156
A471: 468 | B471: of:=2*PI()*[.A471] -> 2940.53072376005 | C471: of:=[.B471]/(2*PI()*[$Descripción.B$10]) -> 9.36000000000001 | D471: of:=POWER(IMABS(IMSQRT(1-POWER([.C471];2)));-1)*SQRT([$'Cálculo L y C filtro pi'.B$9]/[$'Cálculo L y C filtro pi'.B$8]) -> 64.4715681828162 | E471: of:=POWER(IMABS(IMSQRT(1-POWER([.C471];2)));-1)*SQRT([$'Cálculo L y C filtro pi'.B$18]/[$'Cálculo L y C filtro pi'.B$17]) -> 1289.43136365632
A472: 469 | B472: of:=2*PI()*[.A472] -> 2946.81390906723 | C472: of:=[.B472]/(2*PI()*[$Descripción.B$10]) -> 9.38000000000001 | D472: of:=POWER(IMABS(IMSQRT(1-POWER([.C472];2)));-1)*SQRT([$'Cálculo L y C filtro pi'.B$9]/[$'Cálculo L y C filtro pi'.B$8]) -> 64.3325200920255 | E472: of:=POWER(IMABS(IMSQRT(1-POWER([.C472];2)));-1)*SQRT([$'Cálculo L y C filtro pi'.B$18]/[$'Cálculo L y C filtro pi'.B$17]) -> 1286.65040184051
A473: 470 | B473: of:=2*PI()*[.A473] -> 2953.09709437441 | C473: of:=[.B473]/(2*PI()*[$Descripción.B$10]) -> 9.40000000000001 | D473: of:=POWER(IMABS(IMSQRT(1-POWER([.C473];2)));-1)*SQRT([$'Cálculo L y C filtro pi'.B$9]/[$'Cálculo L y C filtro pi'.B$8]) -> 64.1940738766369 | E473: of:=POWER(IMABS(IMSQRT(1-POWER([.C473];2)));-1)*SQRT([$'Cálculo L y C filtro pi'.B$18]/[$'Cálculo L y C filtro pi'.B$17]) -> 1283.88147753274
A474: 471 | B474: of:=2*PI()*[.A474] -> 2959.38027968159 | C474: of:=[.B474]/(2*PI()*[$Descripción.B$10]) -> 9.42000000000001 | D474: of:=POWER(IMABS(IMSQRT(1-POWER([.C474];2)));-1)*SQRT([$'Cálculo L y C filtro pi'.B$9]/[$'Cálculo L y C filtro pi'.B$8]) -> 64.0562256156274 | E474: of:=POWER(IMABS(IMSQRT(1-POWER([.C474];2)));-1)*SQRT([$'Cálculo L y C filtro pi'.B$18]/[$'Cálculo L y C filtro pi'.B$17]) -> 1281.12451231255
A475: 472 | B475: of:=2*PI()*[.A475] -> 2965.66346498876 | C475: of:=[.B475]/(2*PI()*[$Descripción.B$10]) -> 9.43999999999999 | D475: of:=POWER(IMABS(IMSQRT(1-POWER([.C475];2)));-1)*SQRT([$'Cálculo L y C filtro pi'.B$9]/[$'Cálculo L y C filtro pi'.B$8]) -> 63.9189714221425 | E475: of:=POWER(IMABS(IMSQRT(1-POWER([.C475];2)));-1)*SQRT([$'Cálculo L y C filtro pi'.B$18]/[$'Cálculo L y C filtro pi'.B$17]) -> 1278.37942844285
A476: 473 | B476: of:=2*PI()*[.A476] -> 2971.94665029594 | C476: of:=[.B476]/(2*PI()*[$Descripción.B$10]) -> 9.45999999999999 | D476: of:=POWER(IMABS(IMSQRT(1-POWER([.C476];2)));-1)*SQRT([$'Cálculo L y C filtro pi'.B$9]/[$'Cálculo L y C filtro pi'.B$8]) -> 63.7823074431211 | E476: of:=POWER(IMABS(IMSQRT(1-POWER([.C476];2)));-1)*SQRT([$'Cálculo L y C filtro pi'.B$18]/[$'Cálculo L y C filtro pi'.B$17]) -> 1275.64614886242
A477: 474 | B477: of:=2*PI()*[.A477] -> 2978.22983560312 | C477: of:=[.B477]/(2*PI()*[$Descripción.B$10]) -> 9.47999999999999 | D477: of:=POWER(IMABS(IMSQRT(1-POWER([.C477];2)));-1)*SQRT([$'Cálculo L y C filtro pi'.B$9]/[$'Cálculo L y C filtro pi'.B$8]) -> 63.6462298589293 | E477: of:=POWER(IMABS(IMSQRT(1-POWER([.C477];2)));-1)*SQRT([$'Cálculo L y C filtro pi'.B$18]/[$'Cálculo L y C filtro pi'.B$17]) -> 1272.92459717859
A478: 475 | B478: of:=2*PI()*[.A478] -> 2984.5130209103 | C478: of:=[.B478]/(2*PI()*[$Descripción.B$10]) -> 9.49999999999999 | D478: of:=POWER(IMABS(IMSQRT(1-POWER([.C478];2)));-1)*SQRT([$'Cálculo L y C filtro pi'.B$9]/[$'Cálculo L y C filtro pi'.B$8]) -> 63.5107348829957 | E478: of:=POWER(IMABS(IMSQRT(1-POWER([.C478];2)));-1)*SQRT([$'Cálculo L y C filtro pi'.B$18]/[$'Cálculo L y C filtro pi'.B$17]) -> 1270.21469765991
A479: 476 | B479: of:=2*PI()*[.A479] -> 2990.79620621748 | C479: of:=[.B479]/(2*PI()*[$Descripción.B$10]) -> 9.51999999999999 | D479: of:=POWER(IMABS(IMSQRT(1-POWER([.C479];2)));-1)*SQRT([$'Cálculo L y C filtro pi'.B$9]/[$'Cálculo L y C filtro pi'.B$8]) -> 63.3758187614525 | E479: of:=POWER(IMABS(IMSQRT(1-POWER([.C479];2)));-1)*SQRT([$'Cálculo L y C filtro pi'.B$18]/[$'Cálculo L y C filtro pi'.B$17]) -> 1267.51637522905
A480: 477 | B480: of:=2*PI()*[.A480] -> 2997.07939152466 | C480: of:=[.B480]/(2*PI()*[$Descripción.B$10]) -> 9.53999999999999 | D480: of:=POWER(IMABS(IMSQRT(1-POWER([.C480];2)));-1)*SQRT([$'Cálculo L y C filtro pi'.B$9]/[$'Cálculo L y C filtro pi'.B$8]) -> 63.241477772782 | E480: of:=POWER(IMABS(IMSQRT(1-POWER([.C480];2)));-1)*SQRT([$'Cálculo L y C filtro pi'.B$18]/[$'Cálculo L y C filtro pi'.B$17]) -> 1264.82955545564
A481: 478 | B481: of:=2*PI()*[.A481] -> 3003.36257683184 | C481: of:=[.B481]/(2*PI()*[$Descripción.B$10]) -> 9.55999999999999 | D481: of:=POWER(IMABS(IMSQRT(1-POWER([.C481];2)));-1)*SQRT([$'Cálculo L y C filtro pi'.B$9]/[$'Cálculo L y C filtro pi'.B$8]) -> 63.1077082274664 | E481: of:=POWER(IMABS(IMSQRT(1-POWER([.C481];2)));-1)*SQRT([$'Cálculo L y C filtro pi'.B$18]/[$'Cálculo L y C filtro pi'.B$17]) -> 1262.15416454933
A482: 479 | B482: of:=2*PI()*[.A482] -> 3009.64576213902 | C482: of:=[.B482]/(2*PI()*[$Descripción.B$10]) -> 9.57999999999999 | D482: of:=POWER(IMABS(IMSQRT(1-POWER([.C482];2)));-1)*SQRT([$'Cálculo L y C filtro pi'.B$9]/[$'Cálculo L y C filtro pi'.B$8]) -> 62.9745064676437 | E482: of:=POWER(IMABS(IMSQRT(1-POWER([.C482];2)));-1)*SQRT([$'Cálculo L y C filtro pi'.B$18]/[$'Cálculo L y C filtro pi'.B$17]) -> 1259.49012935287
A483: 480 | B483: of:=2*PI()*[.A483] -> 3015.9289474462 | C483: of:=[.B483]/(2*PI()*[$Descripción.B$10]) -> 9.59999999999999 | D483: of:=POWER(IMABS(IMSQRT(1-POWER([.C483];2)));-1)*SQRT([$'Cálculo L y C filtro pi'.B$9]/[$'Cálculo L y C filtro pi'.B$8]) -> 62.8418688667662 | E483: of:=POWER(IMABS(IMSQRT(1-POWER([.C483];2)));-1)*SQRT([$'Cálculo L y C filtro pi'.B$18]/[$'Cálculo L y C filtro pi'.B$17]) -> 1256.83737733533
A484: 481 | B484: of:=2*PI()*[.A484] -> 3022.21213275338 | C484: of:=[.B484]/(2*PI()*[$Descripción.B$10]) -> 9.62 | D484: of:=POWER(IMABS(IMSQRT(1-POWER([.C484];2)));-1)*SQRT([$'Cálculo L y C filtro pi'.B$9]/[$'Cálculo L y C filtro pi'.B$8]) -> 62.7097918292655 | E484: of:=POWER(IMABS(IMSQRT(1-POWER([.C484];2)));-1)*SQRT([$'Cálculo L y C filtro pi'.B$18]/[$'Cálculo L y C filtro pi'.B$17]) -> 1254.19583658531
A485: 482 | B485: of:=2*PI()*[.A485] -> 3028.49531806056 | C485: of:=[.B485]/(2*PI()*[$Descripción.B$10]) -> 9.64 | D485: of:=POWER(IMABS(IMSQRT(1-POWER([.C485];2)));-1)*SQRT([$'Cálculo L y C filtro pi'.B$9]/[$'Cálculo L y C filtro pi'.B$8]) -> 62.5782717902199 | E485: of:=POWER(IMABS(IMSQRT(1-POWER([.C485];2)));-1)*SQRT([$'Cálculo L y C filtro pi'.B$18]/[$'Cálculo L y C filtro pi'.B$17]) -> 1251.5654358044
A486: 483 | B486: of:=2*PI()*[.A486] -> 3034.77850336774 | C486: of:=[.B486]/(2*PI()*[$Descripción.B$10]) -> 9.66 | D486: of:=POWER(IMABS(IMSQRT(1-POWER([.C486];2)));-1)*SQRT([$'Cálculo L y C filtro pi'.B$9]/[$'Cálculo L y C filtro pi'.B$8]) -> 62.4473052150273 | E486: of:=POWER(IMABS(IMSQRT(1-POWER([.C486];2)));-1)*SQRT([$'Cálculo L y C filtro pi'.B$18]/[$'Cálculo L y C filtro pi'.B$17]) -> 1248.94610430055
A487: 484 | B487: of:=2*PI()*[.A487] -> 3041.06168867492 | C487: of:=[.B487]/(2*PI()*[$Descripción.B$10]) -> 9.68 | D487: of:=POWER(IMABS(IMSQRT(1-POWER([.C487];2)));-1)*SQRT([$'Cálculo L y C filtro pi'.B$9]/[$'Cálculo L y C filtro pi'.B$8]) -> 62.3168885990822 | E487: of:=POWER(IMABS(IMSQRT(1-POWER([.C487];2)));-1)*SQRT([$'Cálculo L y C filtro pi'.B$18]/[$'Cálculo L y C filtro pi'.B$17]) -> 1246.33777198164
A488: 485 | B488: of:=2*PI()*[.A488] -> 3047.3448739821 | C488: of:=[.B488]/(2*PI()*[$Descripción.B$10]) -> 9.7 | D488: of:=POWER(IMABS(IMSQRT(1-POWER([.C488];2)));-1)*SQRT([$'Cálculo L y C filtro pi'.B$9]/[$'Cálculo L y C filtro pi'.B$8]) -> 62.1870184674562 | E488: of:=POWER(IMABS(IMSQRT(1-POWER([.C488];2)));-1)*SQRT([$'Cálculo L y C filtro pi'.B$18]/[$'Cálculo L y C filtro pi'.B$17]) -> 1243.74036934912
A489: 486 | B489: of:=2*PI()*[.A489] -> 3053.62805928928 | C489: of:=[.B489]/(2*PI()*[$Descripción.B$10]) -> 9.72 | D489: of:=POWER(IMABS(IMSQRT(1-POWER([.C489];2)));-1)*SQRT([$'Cálculo L y C filtro pi'.B$9]/[$'Cálculo L y C filtro pi'.B$8]) -> 62.0576913745829 | E489: of:=POWER(IMABS(IMSQRT(1-POWER([.C489];2)));-1)*SQRT([$'Cálculo L y C filtro pi'.B$18]/[$'Cálculo L y C filtro pi'.B$17]) -> 1241.15382749166
A490: 487 | B490: of:=2*PI()*[.A490] -> 3059.91124459646 | C490: of:=[.B490]/(2*PI()*[$Descripción.B$10]) -> 9.74000000000001 | D490: of:=POWER(IMABS(IMSQRT(1-POWER([.C490];2)));-1)*SQRT([$'Cálculo L y C filtro pi'.B$9]/[$'Cálculo L y C filtro pi'.B$8]) -> 61.9289039039474 | E490: of:=POWER(IMABS(IMSQRT(1-POWER([.C490];2)));-1)*SQRT([$'Cálculo L y C filtro pi'.B$18]/[$'Cálculo L y C filtro pi'.B$17]) -> 1238.57807807895
A491: 488 | B491: of:=2*PI()*[.A491] -> 3066.19442990364 | C491: of:=[.B491]/(2*PI()*[$Descripción.B$10]) -> 9.76000000000001 | D491: of:=POWER(IMABS(IMSQRT(1-POWER([.C491];2)));-1)*SQRT([$'Cálculo L y C filtro pi'.B$9]/[$'Cálculo L y C filtro pi'.B$8]) -> 61.8006526677791 | E491: of:=POWER(IMABS(IMSQRT(1-POWER([.C491];2)));-1)*SQRT([$'Cálculo L y C filtro pi'.B$18]/[$'Cálculo L y C filtro pi'.B$17]) -> 1236.01305335558
A492: 489 | B492: of:=2*PI()*[.A492] -> 3072.47761521082 | C492: of:=[.B492]/(2*PI()*[$Descripción.B$10]) -> 9.78000000000001 | D492: of:=POWER(IMABS(IMSQRT(1-POWER([.C492];2)));-1)*SQRT([$'Cálculo L y C filtro pi'.B$9]/[$'Cálculo L y C filtro pi'.B$8]) -> 61.672934306748 | E492: of:=POWER(IMABS(IMSQRT(1-POWER([.C492];2)));-1)*SQRT([$'Cálculo L y C filtro pi'.B$18]/[$'Cálculo L y C filtro pi'.B$17]) -> 1233.45868613496
A493: 490 | B493: of:=2*PI()*[.A493] -> 3078.760800518 | C493: of:=[.B493]/(2*PI()*[$Descripción.B$10]) -> 9.80000000000001 | D493: of:=POWER(IMABS(IMSQRT(1-POWER([.C493];2)));-1)*SQRT([$'Cálculo L y C filtro pi'.B$9]/[$'Cálculo L y C filtro pi'.B$8]) -> 61.5457454896663 | E493: of:=POWER(IMABS(IMSQRT(1-POWER([.C493];2)));-1)*SQRT([$'Cálculo L y C filtro pi'.B$18]/[$'Cálculo L y C filtro pi'.B$17]) -> 1230.91490979333
A494: 491 | B494: of:=2*PI()*[.A494] -> 3085.04398582518 | C494: of:=[.B494]/(2*PI()*[$Descripción.B$10]) -> 9.82000000000001 | D494: of:=POWER(IMABS(IMSQRT(1-POWER([.C494];2)));-1)*SQRT([$'Cálculo L y C filtro pi'.B$9]/[$'Cálculo L y C filtro pi'.B$8]) -> 61.4190829131924 | E494: of:=POWER(IMABS(IMSQRT(1-POWER([.C494];2)));-1)*SQRT([$'Cálculo L y C filtro pi'.B$18]/[$'Cálculo L y C filtro pi'.B$17]) -> 1228.38165826385
A495: 492 | B495: of:=2*PI()*[.A495] -> 3091.32717113236 | C495: of:=[.B495]/(2*PI()*[$Descripción.B$10]) -> 9.84000000000001 | D495: of:=POWER(IMABS(IMSQRT(1-POWER([.C495];2)));-1)*SQRT([$'Cálculo L y C filtro pi'.B$9]/[$'Cálculo L y C filtro pi'.B$8]) -> 61.2929433015394 | E495: of:=POWER(IMABS(IMSQRT(1-POWER([.C495];2)));-1)*SQRT([$'Cálculo L y C filtro pi'.B$18]/[$'Cálculo L y C filtro pi'.B$17]) -> 1225.85886603079
A496: 493 | B496: of:=2*PI()*[.A496] -> 3097.61035643954 | C496: of:=[.B496]/(2*PI()*[$Descripción.B$10]) -> 9.86000000000001 | D496: of:=POWER(IMABS(IMSQRT(1-POWER([.C496];2)));-1)*SQRT([$'Cálculo L y C filtro pi'.B$9]/[$'Cálculo L y C filtro pi'.B$8]) -> 61.1673234061864 | E496: of:=POWER(IMABS(IMSQRT(1-POWER([.C496];2)));-1)*SQRT([$'Cálculo L y C filtro pi'.B$18]/[$'Cálculo L y C filtro pi'.B$17]) -> 1223.34646812373
A497: 494 | B497: of:=2*PI()*[.A497] -> 3103.89354174672 | C497: of:=[.B497]/(2*PI()*[$Descripción.B$10]) -> 9.88000000000001 | D497: of:=POWER(IMABS(IMSQRT(1-POWER([.C497];2)));-1)*SQRT([$'Cálculo L y C filtro pi'.B$9]/[$'Cálculo L y C filtro pi'.B$8]) -> 61.0422200055948 | E497: of:=POWER(IMABS(IMSQRT(1-POWER([.C497];2)));-1)*SQRT([$'Cálculo L y C filtro pi'.B$18]/[$'Cálculo L y C filtro pi'.B$17]) -> 1220.8444001119
A498: 495 | B498: of:=2*PI()*[.A498] -> 3110.1767270539 | C498: of:=[.B498]/(2*PI()*[$Descripción.B$10]) -> 9.90000000000001 | D498: of:=POWER(IMABS(IMSQRT(1-POWER([.C498];2)));-1)*SQRT([$'Cálculo L y C filtro pi'.B$9]/[$'Cálculo L y C filtro pi'.B$8]) -> 60.9176299049272 | E498: of:=POWER(IMABS(IMSQRT(1-POWER([.C498];2)));-1)*SQRT([$'Cálculo L y C filtro pi'.B$18]/[$'Cálculo L y C filtro pi'.B$17]) -> 1218.35259809854
A499: 496 | B499: of:=2*PI()*[.A499] -> 3116.45991236107 | C499: of:=[.B499]/(2*PI()*[$Descripción.B$10]) -> 9.91999999999998 | D499: of:=POWER(IMABS(IMSQRT(1-POWER([.C499];2)));-1)*SQRT([$'Cálculo L y C filtro pi'.B$9]/[$'Cálculo L y C filtro pi'.B$8]) -> 60.7935499357699 | E499: of:=POWER(IMABS(IMSQRT(1-POWER([.C499];2)));-1)*SQRT([$'Cálculo L y C filtro pi'.B$18]/[$'Cálculo L y C filtro pi'.B$17]) -> 1215.8709987154
A500: 497 | B500: of:=2*PI()*[.A500] -> 3122.74309766825 | C500: of:=[.B500]/(2*PI()*[$Descripción.B$10]) -> 9.93999999999999 | D500: of:=POWER(IMABS(IMSQRT(1-POWER([.C500];2)));-1)*SQRT([$'Cálculo L y C filtro pi'.B$9]/[$'Cálculo L y C filtro pi'.B$8]) -> 60.6699769558586 | E500: of:=POWER(IMABS(IMSQRT(1-POWER([.C500];2)));-1)*SQRT([$'Cálculo L y C filtro pi'.B$18]/[$'Cálculo L y C filtro pi'.B$17]) -> 1213.39953911717
A501: 498 | B501: of:=2*PI()*[.A501] -> 3129.02628297543 | C501: of:=[.B501]/(2*PI()*[$Descripción.B$10]) -> 9.95999999999999 | D501: of:=POWER(IMABS(IMSQRT(1-POWER([.C501];2)));-1)*SQRT([$'Cálculo L y C filtro pi'.B$9]/[$'Cálculo L y C filtro pi'.B$8]) -> 60.5469078488088 | E501: of:=POWER(IMABS(IMSQRT(1-POWER([.C501];2)));-1)*SQRT([$'Cálculo L y C filtro pi'.B$18]/[$'Cálculo L y C filtro pi'.B$17]) -> 1210.93815697618
A502: 499 | B502: of:=2*PI()*[.A502] -> 3135.30946828261 | C502: of:=[.B502]/(2*PI()*[$Descripción.B$10]) -> 9.97999999999999 | D502: of:=POWER(IMABS(IMSQRT(1-POWER([.C502];2)));-1)*SQRT([$'Cálculo L y C filtro pi'.B$9]/[$'Cálculo L y C filtro pi'.B$8]) -> 60.4243395238482 | E502: of:=POWER(IMABS(IMSQRT(1-POWER([.C502];2)));-1)*SQRT([$'Cálculo L y C filtro pi'.B$18]/[$'Cálculo L y C filtro pi'.B$17]) -> 1208.48679047697
A503: 500 | B503: of:=2*PI()*[.A503] -> 3141.59265358979 | C503: of:=[.B503]/(2*PI()*[$Descripción.B$10]) -> 9.99999999999999 | D503: of:=POWER(IMABS(IMSQRT(1-POWER([.C503];2)));-1)*SQRT([$'Cálculo L y C filtro pi'.B$9]/[$'Cálculo L y C filtro pi'.B$8]) -> 60.3022689155528 | E503: of:=POWER(IMABS(IMSQRT(1-POWER([.C503];2)));-1)*SQRT([$'Cálculo L y C filtro pi'.B$18]/[$'Cálculo L y C filtro pi'.B$17]) -> 1206.04537831106
A504: 501 | B504: of:=2*PI()*[.A504] -> 3147.87583889697 | C504: of:=[.B504]/(2*PI()*[$Descripción.B$10]) -> 10.02 | D504: of:=POWER(IMABS(IMSQRT(1-POWER([.C504];2)));-1)*SQRT([$'Cálculo L y C filtro pi'.B$9]/[$'Cálculo L y C filtro pi'.B$8]) -> 60.1806929835864 | E504: of:=POWER(IMABS(IMSQRT(1-POWER([.C504];2)));-1)*SQRT([$'Cálculo L y C filtro pi'.B$18]/[$'Cálculo L y C filtro pi'.B$17]) -> 1203.61385967173
A505: 502 | B505: of:=2*PI()*[.A505] -> 3154.15902420415 | C505: of:=[.B505]/(2*PI()*[$Descripción.B$10]) -> 10.04 | D505: of:=POWER(IMABS(IMSQRT(1-POWER([.C505];2)));-1)*SQRT([$'Cálculo L y C filtro pi'.B$9]/[$'Cálculo L y C filtro pi'.B$8]) -> 60.0596087124435 | E505: of:=POWER(IMABS(IMSQRT(1-POWER([.C505];2)));-1)*SQRT([$'Cálculo L y C filtro pi'.B$18]/[$'Cálculo L y C filtro pi'.B$17]) -> 1201.19217424887
A506: 503 | B506: of:=2*PI()*[.A506] -> 3160.44220951133 | C506: of:=[.B506]/(2*PI()*[$Descripción.B$10]) -> 10.06 | D506: of:=POWER(IMABS(IMSQRT(1-POWER([.C506];2)));-1)*SQRT([$'Cálculo L y C filtro pi'.B$9]/[$'Cálculo L y C filtro pi'.B$8]) -> 59.9390131111946 | E506: of:=POWER(IMABS(IMSQRT(1-POWER([.C506];2)));-1)*SQRT([$'Cálculo L y C filtro pi'.B$18]/[$'Cálculo L y C filtro pi'.B$17]) -> 1198.78026222389
A507: 504 | B507: of:=2*PI()*[.A507] -> 3166.72539481851 | C507: of:=[.B507]/(2*PI()*[$Descripción.B$10]) -> 10.08 | D507: of:=POWER(IMABS(IMSQRT(1-POWER([.C507];2)));-1)*SQRT([$'Cálculo L y C filtro pi'.B$9]/[$'Cálculo L y C filtro pi'.B$8]) -> 59.8189032132365 | E507: of:=POWER(IMABS(IMSQRT(1-POWER([.C507];2)));-1)*SQRT([$'Cálculo L y C filtro pi'.B$18]/[$'Cálculo L y C filtro pi'.B$17]) -> 1196.37806426473
A508: 505 | B508: of:=2*PI()*[.A508] -> 3173.00858012569 | C508: of:=[.B508]/(2*PI()*[$Descripción.B$10]) -> 10.1 | D508: of:=POWER(IMABS(IMSQRT(1-POWER([.C508];2)));-1)*SQRT([$'Cálculo L y C filtro pi'.B$9]/[$'Cálculo L y C filtro pi'.B$8]) -> 59.6992760760426 | E508: of:=POWER(IMABS(IMSQRT(1-POWER([.C508];2)));-1)*SQRT([$'Cálculo L y C filtro pi'.B$18]/[$'Cálculo L y C filtro pi'.B$17]) -> 1193.98552152085
A509: 506 | B509: of:=2*PI()*[.A509] -> 3179.29176543287 | C509: of:=[.B509]/(2*PI()*[$Descripción.B$10]) -> 10.12 | D509: of:=POWER(IMABS(IMSQRT(1-POWER([.C509];2)));-1)*SQRT([$'Cálculo L y C filtro pi'.B$9]/[$'Cálculo L y C filtro pi'.B$8]) -> 59.5801287809193 | E509: of:=POWER(IMABS(IMSQRT(1-POWER([.C509];2)));-1)*SQRT([$'Cálculo L y C filtro pi'.B$18]/[$'Cálculo L y C filtro pi'.B$17]) -> 1191.60257561839
A510: 507 | B510: of:=2*PI()*[.A510] -> 3185.57495074005 | C510: of:=[.B510]/(2*PI()*[$Descripción.B$10]) -> 10.14 | D510: of:=POWER(IMABS(IMSQRT(1-POWER([.C510];2)));-1)*SQRT([$'Cálculo L y C filtro pi'.B$9]/[$'Cálculo L y C filtro pi'.B$8]) -> 59.4614584327631 | E510: of:=POWER(IMABS(IMSQRT(1-POWER([.C510];2)));-1)*SQRT([$'Cálculo L y C filtro pi'.B$18]/[$'Cálculo L y C filtro pi'.B$17]) -> 1189.22916865526
A511: 508 | B511: of:=2*PI()*[.A511] -> 3191.85813604723 | C511: of:=[.B511]/(2*PI()*[$Descripción.B$10]) -> 10.16 | D511: of:=POWER(IMABS(IMSQRT(1-POWER([.C511];2)));-1)*SQRT([$'Cálculo L y C filtro pi'.B$9]/[$'Cálculo L y C filtro pi'.B$8]) -> 59.3432621598235 | E511: of:=POWER(IMABS(IMSQRT(1-POWER([.C511];2)));-1)*SQRT([$'Cálculo L y C filtro pi'.B$18]/[$'Cálculo L y C filtro pi'.B$17]) -> 1186.86524319647
A512: 509 | B512: of:=2*PI()*[.A512] -> 3198.14132135441 | C512: of:=[.B512]/(2*PI()*[$Descripción.B$10]) -> 10.18 | D512: of:=POWER(IMABS(IMSQRT(1-POWER([.C512];2)));-1)*SQRT([$'Cálculo L y C filtro pi'.B$9]/[$'Cálculo L y C filtro pi'.B$8]) -> 59.2255371134644 | E512: of:=POWER(IMABS(IMSQRT(1-POWER([.C512];2)));-1)*SQRT([$'Cálculo L y C filtro pi'.B$18]/[$'Cálculo L y C filtro pi'.B$17]) -> 1184.51074226929
A513: 510 | B513: of:=2*PI()*[.A513] -> 3204.42450666159 | C513: of:=[.B513]/(2*PI()*[$Descripción.B$10]) -> 10.2 | D513: of:=POWER(IMABS(IMSQRT(1-POWER([.C513];2)));-1)*SQRT([$'Cálculo L y C filtro pi'.B$9]/[$'Cálculo L y C filtro pi'.B$8]) -> 59.1082804679327 | E513: of:=POWER(IMABS(IMSQRT(1-POWER([.C513];2)));-1)*SQRT([$'Cálculo L y C filtro pi'.B$18]/[$'Cálculo L y C filtro pi'.B$17]) -> 1182.16560935865
A514: 511 | B514: of:=2*PI()*[.A514] -> 3210.70769196877 | C514: of:=[.B514]/(2*PI()*[$Descripción.B$10]) -> 10.22 | D514: of:=POWER(IMABS(IMSQRT(1-POWER([.C514];2)));-1)*SQRT([$'Cálculo L y C filtro pi'.B$9]/[$'Cálculo L y C filtro pi'.B$8]) -> 58.9914894201272 | E514: of:=POWER(IMABS(IMSQRT(1-POWER([.C514];2)));-1)*SQRT([$'Cálculo L y C filtro pi'.B$18]/[$'Cálculo L y C filtro pi'.B$17]) -> 1179.82978840254
A515: 512 | B515: of:=2*PI()*[.A515] -> 3216.99087727595 | C515: of:=[.B515]/(2*PI()*[$Descripción.B$10]) -> 10.24 | D515: of:=POWER(IMABS(IMSQRT(1-POWER([.C515];2)));-1)*SQRT([$'Cálculo L y C filtro pi'.B$9]/[$'Cálculo L y C filtro pi'.B$8]) -> 58.8751611893728 | E515: of:=POWER(IMABS(IMSQRT(1-POWER([.C515];2)));-1)*SQRT([$'Cálculo L y C filtro pi'.B$18]/[$'Cálculo L y C filtro pi'.B$17]) -> 1177.50322378746
A516: 513 | B516: of:=2*PI()*[.A516] -> 3223.27406258313 | C516: of:=[.B516]/(2*PI()*[$Descripción.B$10]) -> 10.26 | D516: of:=POWER(IMABS(IMSQRT(1-POWER([.C516];2)));-1)*SQRT([$'Cálculo L y C filtro pi'.B$9]/[$'Cálculo L y C filtro pi'.B$8]) -> 58.7592930171926 | E516: of:=POWER(IMABS(IMSQRT(1-POWER([.C516];2)));-1)*SQRT([$'Cálculo L y C filtro pi'.B$18]/[$'Cálculo L y C filtro pi'.B$17]) -> 1175.18586034385
A517: 514 | B517: of:=2*PI()*[.A517] -> 3229.55724789031 | C517: of:=[.B517]/(2*PI()*[$Descripción.B$10]) -> 10.28 | D517: of:=POWER(IMABS(IMSQRT(1-POWER([.C517];2)));-1)*SQRT([$'Cálculo L y C filtro pi'.B$9]/[$'Cálculo L y C filtro pi'.B$8]) -> 58.6438821670881 | E517: of:=POWER(IMABS(IMSQRT(1-POWER([.C517];2)));-1)*SQRT([$'Cálculo L y C filtro pi'.B$18]/[$'Cálculo L y C filtro pi'.B$17]) -> 1172.87764334176
A518: 515 | B518: of:=2*PI()*[.A518] -> 3235.84043319749 | C518: of:=[.B518]/(2*PI()*[$Descripción.B$10]) -> 10.3 | D518: of:=POWER(IMABS(IMSQRT(1-POWER([.C518];2)));-1)*SQRT([$'Cálculo L y C filtro pi'.B$9]/[$'Cálculo L y C filtro pi'.B$8]) -> 58.5289259243187 | E518: of:=POWER(IMABS(IMSQRT(1-POWER([.C518];2)));-1)*SQRT([$'Cálculo L y C filtro pi'.B$18]/[$'Cálculo L y C filtro pi'.B$17]) -> 1170.57851848637
A519: 516 | B519: of:=2*PI()*[.A519] -> 3242.12361850467 | C519: of:=[.B519]/(2*PI()*[$Descripción.B$10]) -> 10.32 | D519: of:=POWER(IMABS(IMSQRT(1-POWER([.C519];2)));-1)*SQRT([$'Cálculo L y C filtro pi'.B$9]/[$'Cálculo L y C filtro pi'.B$8]) -> 58.4144215956869 | E519: of:=POWER(IMABS(IMSQRT(1-POWER([.C519];2)));-1)*SQRT([$'Cálculo L y C filtro pi'.B$18]/[$'Cálculo L y C filtro pi'.B$17]) -> 1168.28843191374
A520: 517 | B520: of:=2*PI()*[.A520] -> 3248.40680381185 | C520: of:=[.B520]/(2*PI()*[$Descripción.B$10]) -> 10.34 | D520: of:=POWER(IMABS(IMSQRT(1-POWER([.C520];2)));-1)*SQRT([$'Cálculo L y C filtro pi'.B$9]/[$'Cálculo L y C filtro pi'.B$8]) -> 58.3003665093212 | E520: of:=POWER(IMABS(IMSQRT(1-POWER([.C520];2)));-1)*SQRT([$'Cálculo L y C filtro pi'.B$18]/[$'Cálculo L y C filtro pi'.B$17]) -> 1166.00733018642
A521: 518 | B521: of:=2*PI()*[.A521] -> 3254.68998911903 | C521: of:=[.B521]/(2*PI()*[$Descripción.B$10]) -> 10.36 | D521: of:=POWER(IMABS(IMSQRT(1-POWER([.C521];2)));-1)*SQRT([$'Cálculo L y C filtro pi'.B$9]/[$'Cálculo L y C filtro pi'.B$8]) -> 58.186758014466 | E521: of:=POWER(IMABS(IMSQRT(1-POWER([.C521];2)));-1)*SQRT([$'Cálculo L y C filtro pi'.B$18]/[$'Cálculo L y C filtro pi'.B$17]) -> 1163.73516028932
A522: 519 | B522: of:=2*PI()*[.A522] -> 3260.97317442621 | C522: of:=[.B522]/(2*PI()*[$Descripción.B$10]) -> 10.38 | D522: of:=POWER(IMABS(IMSQRT(1-POWER([.C522];2)));-1)*SQRT([$'Cálculo L y C filtro pi'.B$9]/[$'Cálculo L y C filtro pi'.B$8]) -> 58.0735934812731 | E522: of:=POWER(IMABS(IMSQRT(1-POWER([.C522];2)));-1)*SQRT([$'Cálculo L y C filtro pi'.B$18]/[$'Cálculo L y C filtro pi'.B$17]) -> 1161.47186962546
A523: 520 | B523: of:=2*PI()*[.A523] -> 3267.25635973338 | C523: of:=[.B523]/(2*PI()*[$Descripción.B$10]) -> 10.4 | D523: of:=POWER(IMABS(IMSQRT(1-POWER([.C523];2)));-1)*SQRT([$'Cálculo L y C filtro pi'.B$9]/[$'Cálculo L y C filtro pi'.B$8]) -> 57.9608703005938 | E523: of:=POWER(IMABS(IMSQRT(1-POWER([.C523];2)));-1)*SQRT([$'Cálculo L y C filtro pi'.B$18]/[$'Cálculo L y C filtro pi'.B$17]) -> 1159.21740601188
A524: 521 | B524: of:=2*PI()*[.A524] -> 3273.53954504056 | C524: of:=[.B524]/(2*PI()*[$Descripción.B$10]) -> 10.42 | D524: of:=POWER(IMABS(IMSQRT(1-POWER([.C524];2)));-1)*SQRT([$'Cálculo L y C filtro pi'.B$9]/[$'Cálculo L y C filtro pi'.B$8]) -> 57.8485858837758 | E524: of:=POWER(IMABS(IMSQRT(1-POWER([.C524];2)));-1)*SQRT([$'Cálculo L y C filtro pi'.B$18]/[$'Cálculo L y C filtro pi'.B$17]) -> 1156.97171767552
A525: 522 | B525: of:=2*PI()*[.A525] -> 3279.82273034774 | C525: of:=[.B525]/(2*PI()*[$Descripción.B$10]) -> 10.44 | D525: of:=POWER(IMABS(IMSQRT(1-POWER([.C525];2)));-1)*SQRT([$'Cálculo L y C filtro pi'.B$9]/[$'Cálculo L y C filtro pi'.B$8]) -> 57.7367376624602 | E525: of:=POWER(IMABS(IMSQRT(1-POWER([.C525];2)));-1)*SQRT([$'Cálculo L y C filtro pi'.B$18]/[$'Cálculo L y C filtro pi'.B$17]) -> 1154.7347532492
A526: 523 | B526: of:=2*PI()*[.A526] -> 3286.10591565492 | C526: of:=[.B526]/(2*PI()*[$Descripción.B$10]) -> 10.46 | D526: of:=POWER(IMABS(IMSQRT(1-POWER([.C526];2)));-1)*SQRT([$'Cálculo L y C filtro pi'.B$9]/[$'Cálculo L y C filtro pi'.B$8]) -> 57.6253230883848 | E526: of:=POWER(IMABS(IMSQRT(1-POWER([.C526];2)));-1)*SQRT([$'Cálculo L y C filtro pi'.B$18]/[$'Cálculo L y C filtro pi'.B$17]) -> 1152.5064617677
A527: 524 | B527: of:=2*PI()*[.A527] -> 3292.3891009621 | C527: of:=[.B527]/(2*PI()*[$Descripción.B$10]) -> 10.48 | D527: of:=POWER(IMABS(IMSQRT(1-POWER([.C527];2)));-1)*SQRT([$'Cálculo L y C filtro pi'.B$9]/[$'Cálculo L y C filtro pi'.B$8]) -> 57.5143396331829 | E527: of:=POWER(IMABS(IMSQRT(1-POWER([.C527];2)));-1)*SQRT([$'Cálculo L y C filtro pi'.B$18]/[$'Cálculo L y C filtro pi'.B$17]) -> 1150.28679266366
A528: 525 | B528: of:=2*PI()*[.A528] -> 3298.67228626928 | C528: of:=[.B528]/(2*PI()*[$Descripción.B$10]) -> 10.5 | D528: of:=POWER(IMABS(IMSQRT(1-POWER([.C528];2)));-1)*SQRT([$'Cálculo L y C filtro pi'.B$9]/[$'Cálculo L y C filtro pi'.B$8]) -> 57.403784788193 | E528: of:=POWER(IMABS(IMSQRT(1-POWER([.C528];2)));-1)*SQRT([$'Cálculo L y C filtro pi'.B$18]/[$'Cálculo L y C filtro pi'.B$17]) -> 1148.07569576386
A529: 526 | B529: of:=2*PI()*[.A529] -> 3304.95547157646 | C529: of:=[.B529]/(2*PI()*[$Descripción.B$10]) -> 10.52 | D529: of:=POWER(IMABS(IMSQRT(1-POWER([.C529];2)));-1)*SQRT([$'Cálculo L y C filtro pi'.B$9]/[$'Cálculo L y C filtro pi'.B$8]) -> 57.2936560642631 | E529: of:=POWER(IMABS(IMSQRT(1-POWER([.C529];2)));-1)*SQRT([$'Cálculo L y C filtro pi'.B$18]/[$'Cálculo L y C filtro pi'.B$17]) -> 1145.87312128526
A530: 527 | B530: of:=2*PI()*[.A530] -> 3311.23865688364 | C530: of:=[.B530]/(2*PI()*[$Descripción.B$10]) -> 10.54 | D530: of:=POWER(IMABS(IMSQRT(1-POWER([.C530];2)));-1)*SQRT([$'Cálculo L y C filtro pi'.B$9]/[$'Cálculo L y C filtro pi'.B$8]) -> 57.1839509915634 | E530: of:=POWER(IMABS(IMSQRT(1-POWER([.C530];2)));-1)*SQRT([$'Cálculo L y C filtro pi'.B$18]/[$'Cálculo L y C filtro pi'.B$17]) -> 1143.67901983127
A531: 528 | B531: of:=2*PI()*[.A531] -> 3317.52184219082 | C531: of:=[.B531]/(2*PI()*[$Descripción.B$10]) -> 10.56 | D531: of:=POWER(IMABS(IMSQRT(1-POWER([.C531];2)));-1)*SQRT([$'Cálculo L y C filtro pi'.B$9]/[$'Cálculo L y C filtro pi'.B$8]) -> 57.0746671193957 | E531: of:=POWER(IMABS(IMSQRT(1-POWER([.C531];2)));-1)*SQRT([$'Cálculo L y C filtro pi'.B$18]/[$'Cálculo L y C filtro pi'.B$17]) -> 1141.49334238791
A532: 529 | B532: of:=2*PI()*[.A532] -> 3323.805027498 | C532: of:=[.B532]/(2*PI()*[$Descripción.B$10]) -> 10.58 | D532: of:=POWER(IMABS(IMSQRT(1-POWER([.C532];2)));-1)*SQRT([$'Cálculo L y C filtro pi'.B$9]/[$'Cálculo L y C filtro pi'.B$8]) -> 56.9658020160097 | E532: of:=POWER(IMABS(IMSQRT(1-POWER([.C532];2)));-1)*SQRT([$'Cálculo L y C filtro pi'.B$18]/[$'Cálculo L y C filtro pi'.B$17]) -> 1139.31604032019
A533: 530 | B533: of:=2*PI()*[.A533] -> 3330.08821280518 | C533: of:=[.B533]/(2*PI()*[$Descripción.B$10]) -> 10.6 | D533: of:=POWER(IMABS(IMSQRT(1-POWER([.C533];2)));-1)*SQRT([$'Cálculo L y C filtro pi'.B$9]/[$'Cálculo L y C filtro pi'.B$8]) -> 56.8573532684179 | E533: of:=POWER(IMABS(IMSQRT(1-POWER([.C533];2)));-1)*SQRT([$'Cálculo L y C filtro pi'.B$18]/[$'Cálculo L y C filtro pi'.B$17]) -> 1137.14706536836
A534: 531 | B534: of:=2*PI()*[.A534] -> 3336.37139811236 | C534: of:=[.B534]/(2*PI()*[$Descripción.B$10]) -> 10.62 | D534: of:=POWER(IMABS(IMSQRT(1-POWER([.C534];2)));-1)*SQRT([$'Cálculo L y C filtro pi'.B$9]/[$'Cálculo L y C filtro pi'.B$8]) -> 56.7493184822162 | E534: of:=POWER(IMABS(IMSQRT(1-POWER([.C534];2)));-1)*SQRT([$'Cálculo L y C filtro pi'.B$18]/[$'Cálculo L y C filtro pi'.B$17]) -> 1134.98636964432
A535: 532 | B535: of:=2*PI()*[.A535] -> 3342.65458341954 | C535: of:=[.B535]/(2*PI()*[$Descripción.B$10]) -> 10.64 | D535: of:=POWER(IMABS(IMSQRT(1-POWER([.C535];2)));-1)*SQRT([$'Cálculo L y C filtro pi'.B$9]/[$'Cálculo L y C filtro pi'.B$8]) -> 56.6416952814029 | E535: of:=POWER(IMABS(IMSQRT(1-POWER([.C535];2)));-1)*SQRT([$'Cálculo L y C filtro pi'.B$18]/[$'Cálculo L y C filtro pi'.B$17]) -> 1132.83390562806
A536: 533 | B536: of:=2*PI()*[.A536] -> 3348.93776872672 | C536: of:=[.B536]/(2*PI()*[$Descripción.B$10]) -> 10.66 | D536: of:=POWER(IMABS(IMSQRT(1-POWER([.C536];2)));-1)*SQRT([$'Cálculo L y C filtro pi'.B$9]/[$'Cálculo L y C filtro pi'.B$8]) -> 56.5344813082022 | E536: of:=POWER(IMABS(IMSQRT(1-POWER([.C536];2)));-1)*SQRT([$'Cálculo L y C filtro pi'.B$18]/[$'Cálculo L y C filtro pi'.B$17]) -> 1130.68962616404
A537: 534 | B537: of:=2*PI()*[.A537] -> 3355.2209540339 | C537: of:=[.B537]/(2*PI()*[$Descripción.B$10]) -> 10.68 | D537: of:=POWER(IMABS(IMSQRT(1-POWER([.C537];2)));-1)*SQRT([$'Cálculo L y C filtro pi'.B$9]/[$'Cálculo L y C filtro pi'.B$8]) -> 56.4276742228889 | E537: of:=POWER(IMABS(IMSQRT(1-POWER([.C537];2)));-1)*SQRT([$'Cálculo L y C filtro pi'.B$18]/[$'Cálculo L y C filtro pi'.B$17]) -> 1128.55348445778
A538: 535 | B538: of:=2*PI()*[.A538] -> 3361.50413934108 | C538: of:=[.B538]/(2*PI()*[$Descripción.B$10]) -> 10.7 | D538: of:=POWER(IMABS(IMSQRT(1-POWER([.C538];2)));-1)*SQRT([$'Cálculo L y C filtro pi'.B$9]/[$'Cálculo L y C filtro pi'.B$8]) -> 56.3212717036154 | E538: of:=POWER(IMABS(IMSQRT(1-POWER([.C538];2)));-1)*SQRT([$'Cálculo L y C filtro pi'.B$18]/[$'Cálculo L y C filtro pi'.B$17]) -> 1126.42543407231
A539: 536 | B539: of:=2*PI()*[.A539] -> 3367.78732464826 | C539: of:=[.B539]/(2*PI()*[$Descripción.B$10]) -> 10.72 | D539: of:=POWER(IMABS(IMSQRT(1-POWER([.C539];2)));-1)*SQRT([$'Cálculo L y C filtro pi'.B$9]/[$'Cálculo L y C filtro pi'.B$8]) -> 56.2152714462403 | E539: of:=POWER(IMABS(IMSQRT(1-POWER([.C539];2)));-1)*SQRT([$'Cálculo L y C filtro pi'.B$18]/[$'Cálculo L y C filtro pi'.B$17]) -> 1124.30542892481
A540: 537 | B540: of:=2*PI()*[.A540] -> 3374.07050995544 | C540: of:=[.B540]/(2*PI()*[$Descripción.B$10]) -> 10.74 | D540: of:=POWER(IMABS(IMSQRT(1-POWER([.C540];2)));-1)*SQRT([$'Cálculo L y C filtro pi'.B$9]/[$'Cálculo L y C filtro pi'.B$8]) -> 56.1096711641604 | E540: of:=POWER(IMABS(IMSQRT(1-POWER([.C540];2)));-1)*SQRT([$'Cálculo L y C filtro pi'.B$18]/[$'Cálculo L y C filtro pi'.B$17]) -> 1122.19342328321
A541: 538 | B541: of:=2*PI()*[.A541] -> 3380.35369526262 | C541: of:=[.B541]/(2*PI()*[$Descripción.B$10]) -> 10.76 | D541: of:=POWER(IMABS(IMSQRT(1-POWER([.C541];2)));-1)*SQRT([$'Cálculo L y C filtro pi'.B$9]/[$'Cálculo L y C filtro pi'.B$8]) -> 56.0044685881413 | E541: of:=POWER(IMABS(IMSQRT(1-POWER([.C541];2)));-1)*SQRT([$'Cálculo L y C filtro pi'.B$18]/[$'Cálculo L y C filtro pi'.B$17]) -> 1120.08937176283
A542: 539 | B542: of:=2*PI()*[.A542] -> 3386.6368805698 | C542: of:=[.B542]/(2*PI()*[$Descripción.B$10]) -> 10.78 | D542: of:=POWER(IMABS(IMSQRT(1-POWER([.C542];2)));-1)*SQRT([$'Cálculo L y C filtro pi'.B$9]/[$'Cálculo L y C filtro pi'.B$8]) -> 55.8996614661538 | E542: of:=POWER(IMABS(IMSQRT(1-POWER([.C542];2)));-1)*SQRT([$'Cálculo L y C filtro pi'.B$18]/[$'Cálculo L y C filtro pi'.B$17]) -> 1117.99322932308
A543: 540 | B543: of:=2*PI()*[.A543] -> 3392.92006587698 | C543: of:=[.B543]/(2*PI()*[$Descripción.B$10]) -> 10.8 | D543: of:=POWER(IMABS(IMSQRT(1-POWER([.C543];2)));-1)*SQRT([$'Cálculo L y C filtro pi'.B$9]/[$'Cálculo L y C filtro pi'.B$8]) -> 55.79524756321 | E543: of:=POWER(IMABS(IMSQRT(1-POWER([.C543];2)));-1)*SQRT([$'Cálculo L y C filtro pi'.B$18]/[$'Cálculo L y C filtro pi'.B$17]) -> 1115.9049512642
A544: 541 | B544: of:=2*PI()*[.A544] -> 3399.20325118416 | C544: of:=[.B544]/(2*PI()*[$Descripción.B$10]) -> 10.82 | D544: of:=POWER(IMABS(IMSQRT(1-POWER([.C544];2)));-1)*SQRT([$'Cálculo L y C filtro pi'.B$9]/[$'Cálculo L y C filtro pi'.B$8]) -> 55.6912246612027 | E544: of:=POWER(IMABS(IMSQRT(1-POWER([.C544];2)));-1)*SQRT([$'Cálculo L y C filtro pi'.B$18]/[$'Cálculo L y C filtro pi'.B$17]) -> 1113.82449322405
A545: 542 | B545: of:=2*PI()*[.A545] -> 3405.48643649134 | C545: of:=[.B545]/(2*PI()*[$Descripción.B$10]) -> 10.84 | D545: of:=POWER(IMABS(IMSQRT(1-POWER([.C545];2)));-1)*SQRT([$'Cálculo L y C filtro pi'.B$9]/[$'Cálculo L y C filtro pi'.B$8]) -> 55.5875905587439 | E545: of:=POWER(IMABS(IMSQRT(1-POWER([.C545];2)));-1)*SQRT([$'Cálculo L y C filtro pi'.B$18]/[$'Cálculo L y C filtro pi'.B$17]) -> 1111.75181117488
A546: 543 | B546: of:=2*PI()*[.A546] -> 3411.76962179852 | C546: of:=[.B546]/(2*PI()*[$Descripción.B$10]) -> 10.86 | D546: of:=POWER(IMABS(IMSQRT(1-POWER([.C546];2)));-1)*SQRT([$'Cálculo L y C filtro pi'.B$9]/[$'Cálculo L y C filtro pi'.B$8]) -> 55.4843430710078 | E546: of:=POWER(IMABS(IMSQRT(1-POWER([.C546];2)));-1)*SQRT([$'Cálculo L y C filtro pi'.B$18]/[$'Cálculo L y C filtro pi'.B$17]) -> 1109.68686142016
A547: 544 | B547: of:=2*PI()*[.A547] -> 3418.05280710569 | C547: of:=[.B547]/(2*PI()*[$Descripción.B$10]) -> 10.88 | D547: of:=POWER(IMABS(IMSQRT(1-POWER([.C547];2)));-1)*SQRT([$'Cálculo L y C filtro pi'.B$9]/[$'Cálculo L y C filtro pi'.B$8]) -> 55.3814800295751 | E547: of:=POWER(IMABS(IMSQRT(1-POWER([.C547];2)));-1)*SQRT([$'Cálculo L y C filtro pi'.B$18]/[$'Cálculo L y C filtro pi'.B$17]) -> 1107.6296005915
A548: 545 | B548: of:=2*PI()*[.A548] -> 3424.33599241287 | C548: of:=[.B548]/(2*PI()*[$Descripción.B$10]) -> 10.9 | D548: of:=POWER(IMABS(IMSQRT(1-POWER([.C548];2)));-1)*SQRT([$'Cálculo L y C filtro pi'.B$9]/[$'Cálculo L y C filtro pi'.B$8]) -> 55.2789992822783 | E548: of:=POWER(IMABS(IMSQRT(1-POWER([.C548];2)));-1)*SQRT([$'Cálculo L y C filtro pi'.B$18]/[$'Cálculo L y C filtro pi'.B$17]) -> 1105.57998564557
A549: 546 | B549: of:=2*PI()*[.A549] -> 3430.61917772005 | C549: of:=[.B549]/(2*PI()*[$Descripción.B$10]) -> 10.92 | D549: of:=POWER(IMABS(IMSQRT(1-POWER([.C549];2)));-1)*SQRT([$'Cálculo L y C filtro pi'.B$9]/[$'Cálculo L y C filtro pi'.B$8]) -> 55.1768986930488 | E549: of:=POWER(IMABS(IMSQRT(1-POWER([.C549];2)));-1)*SQRT([$'Cálculo L y C filtro pi'.B$18]/[$'Cálculo L y C filtro pi'.B$17]) -> 1103.53797386098
A550: 547 | B550: of:=2*PI()*[.A550] -> 3436.90236302723 | C550: of:=[.B550]/(2*PI()*[$Descripción.B$10]) -> 10.94 | D550: of:=POWER(IMABS(IMSQRT(1-POWER([.C550];2)));-1)*SQRT([$'Cálculo L y C filtro pi'.B$9]/[$'Cálculo L y C filtro pi'.B$8]) -> 55.0751761417676 | E550: of:=POWER(IMABS(IMSQRT(1-POWER([.C550];2)));-1)*SQRT([$'Cálculo L y C filtro pi'.B$18]/[$'Cálculo L y C filtro pi'.B$17]) -> 1101.50352283535
A551: 548 | B551: of:=2*PI()*[.A551] -> 3443.18554833441 | C551: of:=[.B551]/(2*PI()*[$Descripción.B$10]) -> 10.96 | D551: of:=POWER(IMABS(IMSQRT(1-POWER([.C551];2)));-1)*SQRT([$'Cálculo L y C filtro pi'.B$9]/[$'Cálculo L y C filtro pi'.B$8]) -> 54.973829524113 | E551: of:=POWER(IMABS(IMSQRT(1-POWER([.C551];2)));-1)*SQRT([$'Cálculo L y C filtro pi'.B$18]/[$'Cálculo L y C filtro pi'.B$17]) -> 1099.47659048226
A552: 549 | B552: of:=2*PI()*[.A552] -> 3449.46873364159 | C552: of:=[.B552]/(2*PI()*[$Descripción.B$10]) -> 10.98 | D552: of:=POWER(IMABS(IMSQRT(1-POWER([.C552];2)));-1)*SQRT([$'Cálculo L y C filtro pi'.B$9]/[$'Cálculo L y C filtro pi'.B$8]) -> 54.8728567514168 | E552: of:=POWER(IMABS(IMSQRT(1-POWER([.C552];2)));-1)*SQRT([$'Cálculo L y C filtro pi'.B$18]/[$'Cálculo L y C filtro pi'.B$17]) -> 1097.45713502834
A553: 550 | B553: of:=2*PI()*[.A553] -> 3455.75191894877 | C553: of:=[.B553]/(2*PI()*[$Descripción.B$10]) -> 11 | D553: of:=POWER(IMABS(IMSQRT(1-POWER([.C553];2)));-1)*SQRT([$'Cálculo L y C filtro pi'.B$9]/[$'Cálculo L y C filtro pi'.B$8]) -> 54.7722557505167 | E553: of:=POWER(IMABS(IMSQRT(1-POWER([.C553];2)));-1)*SQRT([$'Cálculo L y C filtro pi'.B$18]/[$'Cálculo L y C filtro pi'.B$17]) -> 1095.44511501033
A554: 551 | B554: of:=2*PI()*[.A554] -> 3462.03510425595 | C554: of:=[.B554]/(2*PI()*[$Descripción.B$10]) -> 11.02 | D554: of:=POWER(IMABS(IMSQRT(1-POWER([.C554];2)));-1)*SQRT([$'Cálculo L y C filtro pi'.B$9]/[$'Cálculo L y C filtro pi'.B$8]) -> 54.672024463611 | E554: of:=POWER(IMABS(IMSQRT(1-POWER([.C554];2)));-1)*SQRT([$'Cálculo L y C filtro pi'.B$18]/[$'Cálculo L y C filtro pi'.B$17]) -> 1093.44048927222
A555: 552 | B555: of:=2*PI()*[.A555] -> 3468.31828956313 | C555: of:=[.B555]/(2*PI()*[$Descripción.B$10]) -> 11.04 | D555: of:=POWER(IMABS(IMSQRT(1-POWER([.C555];2)));-1)*SQRT([$'Cálculo L y C filtro pi'.B$9]/[$'Cálculo L y C filtro pi'.B$8]) -> 54.5721608481177 | E555: of:=POWER(IMABS(IMSQRT(1-POWER([.C555];2)));-1)*SQRT([$'Cálculo L y C filtro pi'.B$18]/[$'Cálculo L y C filtro pi'.B$17]) -> 1091.44321696236
A556: 553 | B556: of:=2*PI()*[.A556] -> 3474.60147487031 | C556: of:=[.B556]/(2*PI()*[$Descripción.B$10]) -> 11.06 | D556: of:=POWER(IMABS(IMSQRT(1-POWER([.C556];2)));-1)*SQRT([$'Cálculo L y C filtro pi'.B$9]/[$'Cálculo L y C filtro pi'.B$8]) -> 54.4726628765339 | E556: of:=POWER(IMABS(IMSQRT(1-POWER([.C556];2)));-1)*SQRT([$'Cálculo L y C filtro pi'.B$18]/[$'Cálculo L y C filtro pi'.B$17]) -> 1089.45325753068
A557: 554 | B557: of:=2*PI()*[.A557] -> 3480.88466017749 | C557: of:=[.B557]/(2*PI()*[$Descripción.B$10]) -> 11.08 | D557: of:=POWER(IMABS(IMSQRT(1-POWER([.C557];2)));-1)*SQRT([$'Cálculo L y C filtro pi'.B$9]/[$'Cálculo L y C filtro pi'.B$8]) -> 54.3735285362947 | E557: of:=POWER(IMABS(IMSQRT(1-POWER([.C557];2)));-1)*SQRT([$'Cálculo L y C filtro pi'.B$18]/[$'Cálculo L y C filtro pi'.B$17]) -> 1087.47057072589
A558: 555 | B558: of:=2*PI()*[.A558] -> 3487.16784548467 | C558: of:=[.B558]/(2*PI()*[$Descripción.B$10]) -> 11.1 | D558: of:=POWER(IMABS(IMSQRT(1-POWER([.C558];2)));-1)*SQRT([$'Cálculo L y C filtro pi'.B$9]/[$'Cálculo L y C filtro pi'.B$8]) -> 54.2747558296357 | E558: of:=POWER(IMABS(IMSQRT(1-POWER([.C558];2)));-1)*SQRT([$'Cálculo L y C filtro pi'.B$18]/[$'Cálculo L y C filtro pi'.B$17]) -> 1085.49511659271
A559: 556 | B559: of:=2*PI()*[.A559] -> 3493.45103079185 | C559: of:=[.B559]/(2*PI()*[$Descripción.B$10]) -> 11.12 | D559: of:=POWER(IMABS(IMSQRT(1-POWER([.C559];2)));-1)*SQRT([$'Cálculo L y C filtro pi'.B$9]/[$'Cálculo L y C filtro pi'.B$8]) -> 54.1763427734587 | E559: of:=POWER(IMABS(IMSQRT(1-POWER([.C559];2)));-1)*SQRT([$'Cálculo L y C filtro pi'.B$18]/[$'Cálculo L y C filtro pi'.B$17]) -> 1083.52685546917
A560: 557 | B560: of:=2*PI()*[.A560] -> 3499.73421609903 | C560: of:=[.B560]/(2*PI()*[$Descripción.B$10]) -> 11.14 | D560: of:=POWER(IMABS(IMSQRT(1-POWER([.C560];2)));-1)*SQRT([$'Cálculo L y C filtro pi'.B$9]/[$'Cálculo L y C filtro pi'.B$8]) -> 54.0782873991935 | E560: of:=POWER(IMABS(IMSQRT(1-POWER([.C560];2)));-1)*SQRT([$'Cálculo L y C filtro pi'.B$18]/[$'Cálculo L y C filtro pi'.B$17]) -> 1081.56574798387
A561: 558 | B561: of:=2*PI()*[.A561] -> 3506.01740140621 | C561: of:=[.B561]/(2*PI()*[$Descripción.B$10]) -> 11.16 | D561: of:=POWER(IMABS(IMSQRT(1-POWER([.C561];2)));-1)*SQRT([$'Cálculo L y C filtro pi'.B$9]/[$'Cálculo L y C filtro pi'.B$8]) -> 53.980587752668 | E561: of:=POWER(IMABS(IMSQRT(1-POWER([.C561];2)));-1)*SQRT([$'Cálculo L y C filtro pi'.B$18]/[$'Cálculo L y C filtro pi'.B$17]) -> 1079.61175505336
A562: 559 | B562: of:=2*PI()*[.A562] -> 3512.30058671339 | C562: of:=[.B562]/(2*PI()*[$Descripción.B$10]) -> 11.18 | D562: of:=POWER(IMABS(IMSQRT(1-POWER([.C562];2)));-1)*SQRT([$'Cálculo L y C filtro pi'.B$9]/[$'Cálculo L y C filtro pi'.B$8]) -> 53.8832418939735 | E562: of:=POWER(IMABS(IMSQRT(1-POWER([.C562];2)));-1)*SQRT([$'Cálculo L y C filtro pi'.B$18]/[$'Cálculo L y C filtro pi'.B$17]) -> 1077.66483787947
A563: 560 | B563: of:=2*PI()*[.A563] -> 3518.58377202057 | C563: of:=[.B563]/(2*PI()*[$Descripción.B$10]) -> 11.2 | D563: of:=POWER(IMABS(IMSQRT(1-POWER([.C563];2)));-1)*SQRT([$'Cálculo L y C filtro pi'.B$9]/[$'Cálculo L y C filtro pi'.B$8]) -> 53.7862478973358 | E563: of:=POWER(IMABS(IMSQRT(1-POWER([.C563];2)));-1)*SQRT([$'Cálculo L y C filtro pi'.B$18]/[$'Cálculo L y C filtro pi'.B$17]) -> 1075.72495794672
A564: 561 | B564: of:=2*PI()*[.A564] -> 3524.86695732775 | C564: of:=[.B564]/(2*PI()*[$Descripción.B$10]) -> 11.22 | D564: of:=POWER(IMABS(IMSQRT(1-POWER([.C564];2)));-1)*SQRT([$'Cálculo L y C filtro pi'.B$9]/[$'Cálculo L y C filtro pi'.B$8]) -> 53.6896038509865 | E564: of:=POWER(IMABS(IMSQRT(1-POWER([.C564];2)));-1)*SQRT([$'Cálculo L y C filtro pi'.B$18]/[$'Cálculo L y C filtro pi'.B$17]) -> 1073.79207701973
A565: 562 | B565: of:=2*PI()*[.A565] -> 3531.15014263493 | C565: of:=[.B565]/(2*PI()*[$Descripción.B$10]) -> 11.24 | D565: of:=POWER(IMABS(IMSQRT(1-POWER([.C565];2)));-1)*SQRT([$'Cálculo L y C filtro pi'.B$9]/[$'Cálculo L y C filtro pi'.B$8]) -> 53.5933078570339 | E565: of:=POWER(IMABS(IMSQRT(1-POWER([.C565];2)));-1)*SQRT([$'Cálculo L y C filtro pi'.B$18]/[$'Cálculo L y C filtro pi'.B$17]) -> 1071.86615714068
A566: 563 | B566: of:=2*PI()*[.A566] -> 3537.43332794211 | C566: of:=[.B566]/(2*PI()*[$Descripción.B$10]) -> 11.26 | D566: of:=POWER(IMABS(IMSQRT(1-POWER([.C566];2)));-1)*SQRT([$'Cálculo L y C filtro pi'.B$9]/[$'Cálculo L y C filtro pi'.B$8]) -> 53.497358031339 | E566: of:=POWER(IMABS(IMSQRT(1-POWER([.C566];2)));-1)*SQRT([$'Cálculo L y C filtro pi'.B$18]/[$'Cálculo L y C filtro pi'.B$17]) -> 1069.94716062678
A567: 564 | B567: of:=2*PI()*[.A567] -> 3543.71651324929 | C567: of:=[.B567]/(2*PI()*[$Descripción.B$10]) -> 11.28 | D567: of:=POWER(IMABS(IMSQRT(1-POWER([.C567];2)));-1)*SQRT([$'Cálculo L y C filtro pi'.B$9]/[$'Cálculo L y C filtro pi'.B$8]) -> 53.401752503388 | E567: of:=POWER(IMABS(IMSQRT(1-POWER([.C567];2)));-1)*SQRT([$'Cálculo L y C filtro pi'.B$18]/[$'Cálculo L y C filtro pi'.B$17]) -> 1068.03505006776
A568: 565 | B568: of:=2*PI()*[.A568] -> 3549.99969855647 | C568: of:=[.B568]/(2*PI()*[$Descripción.B$10]) -> 11.3 | D568: of:=POWER(IMABS(IMSQRT(1-POWER([.C568];2)));-1)*SQRT([$'Cálculo L y C filtro pi'.B$9]/[$'Cálculo L y C filtro pi'.B$8]) -> 53.3064894161713 | E568: of:=POWER(IMABS(IMSQRT(1-POWER([.C568];2)));-1)*SQRT([$'Cálculo L y C filtro pi'.B$18]/[$'Cálculo L y C filtro pi'.B$17]) -> 1066.12978832343
A569: 566 | B569: of:=2*PI()*[.A569] -> 3556.28288386365 | C569: of:=[.B569]/(2*PI()*[$Descripción.B$10]) -> 11.32 | D569: of:=POWER(IMABS(IMSQRT(1-POWER([.C569];2)));-1)*SQRT([$'Cálculo L y C filtro pi'.B$9]/[$'Cálculo L y C filtro pi'.B$8]) -> 53.2115669260611 | E569: of:=POWER(IMABS(IMSQRT(1-POWER([.C569];2)));-1)*SQRT([$'Cálculo L y C filtro pi'.B$18]/[$'Cálculo L y C filtro pi'.B$17]) -> 1064.23133852122
A570: 567 | B570: of:=2*PI()*[.A570] -> 3562.56606917083 | C570: of:=[.B570]/(2*PI()*[$Descripción.B$10]) -> 11.34 | D570: of:=POWER(IMABS(IMSQRT(1-POWER([.C570];2)));-1)*SQRT([$'Cálculo L y C filtro pi'.B$9]/[$'Cálculo L y C filtro pi'.B$8]) -> 53.1169832026887 | E570: of:=POWER(IMABS(IMSQRT(1-POWER([.C570];2)));-1)*SQRT([$'Cálculo L y C filtro pi'.B$18]/[$'Cálculo L y C filtro pi'.B$17]) -> 1062.33966405377
A571: 568 | B571: of:=2*PI()*[.A571] -> 3568.849254478 | C571: of:=[.B571]/(2*PI()*[$Descripción.B$10]) -> 11.36 | D571: of:=POWER(IMABS(IMSQRT(1-POWER([.C571];2)));-1)*SQRT([$'Cálculo L y C filtro pi'.B$9]/[$'Cálculo L y C filtro pi'.B$8]) -> 53.022736428827 | E571: of:=POWER(IMABS(IMSQRT(1-POWER([.C571];2)));-1)*SQRT([$'Cálculo L y C filtro pi'.B$18]/[$'Cálculo L y C filtro pi'.B$17]) -> 1060.45472857654
A572: 569 | B572: of:=2*PI()*[.A572] -> 3575.13243978518 | C572: of:=[.B572]/(2*PI()*[$Descripción.B$10]) -> 11.38 | D572: of:=POWER(IMABS(IMSQRT(1-POWER([.C572];2)));-1)*SQRT([$'Cálculo L y C filtro pi'.B$9]/[$'Cálculo L y C filtro pi'.B$8]) -> 52.9288248002725 | E572: of:=POWER(IMABS(IMSQRT(1-POWER([.C572];2)));-1)*SQRT([$'Cálculo L y C filtro pi'.B$18]/[$'Cálculo L y C filtro pi'.B$17]) -> 1058.57649600545
A573: 570 | B573: of:=2*PI()*[.A573] -> 3581.41562509236 | C573: of:=[.B573]/(2*PI()*[$Descripción.B$10]) -> 11.4 | D573: of:=POWER(IMABS(IMSQRT(1-POWER([.C573];2)));-1)*SQRT([$'Cálculo L y C filtro pi'.B$9]/[$'Cálculo L y C filtro pi'.B$8]) -> 52.8352465257261 | E573: of:=POWER(IMABS(IMSQRT(1-POWER([.C573];2)));-1)*SQRT([$'Cálculo L y C filtro pi'.B$18]/[$'Cálculo L y C filtro pi'.B$17]) -> 1056.70493051452
A574: 571 | B574: of:=2*PI()*[.A574] -> 3587.69881039954 | C574: of:=[.B574]/(2*PI()*[$Descripción.B$10]) -> 11.42 | D574: of:=POWER(IMABS(IMSQRT(1-POWER([.C574];2)));-1)*SQRT([$'Cálculo L y C filtro pi'.B$9]/[$'Cálculo L y C filtro pi'.B$8]) -> 52.7419998266802 | E574: of:=POWER(IMABS(IMSQRT(1-POWER([.C574];2)));-1)*SQRT([$'Cálculo L y C filtro pi'.B$18]/[$'Cálculo L y C filtro pi'.B$17]) -> 1054.8399965336
A575: 572 | B575: of:=2*PI()*[.A575] -> 3593.98199570672 | C575: of:=[.B575]/(2*PI()*[$Descripción.B$10]) -> 11.44 | D575: of:=POWER(IMABS(IMSQRT(1-POWER([.C575];2)));-1)*SQRT([$'Cálculo L y C filtro pi'.B$9]/[$'Cálculo L y C filtro pi'.B$8]) -> 52.6490829373034 | E575: of:=POWER(IMABS(IMSQRT(1-POWER([.C575];2)));-1)*SQRT([$'Cálculo L y C filtro pi'.B$18]/[$'Cálculo L y C filtro pi'.B$17]) -> 1052.98165874607
A576: 573 | B576: of:=2*PI()*[.A576] -> 3600.2651810139 | C576: of:=[.B576]/(2*PI()*[$Descripción.B$10]) -> 11.46 | D576: of:=POWER(IMABS(IMSQRT(1-POWER([.C576];2)));-1)*SQRT([$'Cálculo L y C filtro pi'.B$9]/[$'Cálculo L y C filtro pi'.B$8]) -> 52.5564941043262 | E576: of:=POWER(IMABS(IMSQRT(1-POWER([.C576];2)));-1)*SQRT([$'Cálculo L y C filtro pi'.B$18]/[$'Cálculo L y C filtro pi'.B$17]) -> 1051.12988208652
A577: 574 | B577: of:=2*PI()*[.A577] -> 3606.54836632108 | C577: of:=[.B577]/(2*PI()*[$Descripción.B$10]) -> 11.48 | D577: of:=POWER(IMABS(IMSQRT(1-POWER([.C577];2)));-1)*SQRT([$'Cálculo L y C filtro pi'.B$9]/[$'Cálculo L y C filtro pi'.B$8]) -> 52.4642315869302 | E577: of:=POWER(IMABS(IMSQRT(1-POWER([.C577];2)));-1)*SQRT([$'Cálculo L y C filtro pi'.B$18]/[$'Cálculo L y C filtro pi'.B$17]) -> 1049.2846317386
A578: 575 | B578: of:=2*PI()*[.A578] -> 3612.83155162826 | C578: of:=[.B578]/(2*PI()*[$Descripción.B$10]) -> 11.5 | D578: of:=POWER(IMABS(IMSQRT(1-POWER([.C578];2)));-1)*SQRT([$'Cálculo L y C filtro pi'.B$9]/[$'Cálculo L y C filtro pi'.B$8]) -> 52.3722936566382 | E578: of:=POWER(IMABS(IMSQRT(1-POWER([.C578];2)));-1)*SQRT([$'Cálculo L y C filtro pi'.B$18]/[$'Cálculo L y C filtro pi'.B$17]) -> 1047.44587313276
A579: 576 | B579: of:=2*PI()*[.A579] -> 3619.11473693544 | C579: of:=[.B579]/(2*PI()*[$Descripción.B$10]) -> 11.52 | D579: of:=POWER(IMABS(IMSQRT(1-POWER([.C579];2)));-1)*SQRT([$'Cálculo L y C filtro pi'.B$9]/[$'Cálculo L y C filtro pi'.B$8]) -> 52.2806785972025 | E579: of:=POWER(IMABS(IMSQRT(1-POWER([.C579];2)));-1)*SQRT([$'Cálculo L y C filtro pi'.B$18]/[$'Cálculo L y C filtro pi'.B$17]) -> 1045.61357194405
A580: 577 | B580: of:=2*PI()*[.A580] -> 3625.39792224262 | C580: of:=[.B580]/(2*PI()*[$Descripción.B$10]) -> 11.54 | D580: of:=POWER(IMABS(IMSQRT(1-POWER([.C580];2)));-1)*SQRT([$'Cálculo L y C filtro pi'.B$9]/[$'Cálculo L y C filtro pi'.B$8]) -> 52.1893847044983 | E580: of:=POWER(IMABS(IMSQRT(1-POWER([.C580];2)));-1)*SQRT([$'Cálculo L y C filtro pi'.B$18]/[$'Cálculo L y C filtro pi'.B$17]) -> 1043.78769408997
A581: 578 | B581: of:=2*PI()*[.A581] -> 3631.6811075498 | C581: of:=[.B581]/(2*PI()*[$Descripción.B$10]) -> 11.56 | D581: of:=POWER(IMABS(IMSQRT(1-POWER([.C581];2)));-1)*SQRT([$'Cálculo L y C filtro pi'.B$9]/[$'Cálculo L y C filtro pi'.B$8]) -> 52.098410286416 | E581: of:=POWER(IMABS(IMSQRT(1-POWER([.C581];2)));-1)*SQRT([$'Cálculo L y C filtro pi'.B$18]/[$'Cálculo L y C filtro pi'.B$17]) -> 1041.96820572832
A582: 579 | B582: of:=2*PI()*[.A582] -> 3637.96429285698 | C582: of:=[.B582]/(2*PI()*[$Descripción.B$10]) -> 11.58 | D582: of:=POWER(IMABS(IMSQRT(1-POWER([.C582];2)));-1)*SQRT([$'Cálculo L y C filtro pi'.B$9]/[$'Cálculo L y C filtro pi'.B$8]) -> 52.0077536627543 | E582: of:=POWER(IMABS(IMSQRT(1-POWER([.C582];2)));-1)*SQRT([$'Cálculo L y C filtro pi'.B$18]/[$'Cálculo L y C filtro pi'.B$17]) -> 1040.15507325509
A583: 580 | B583: of:=2*PI()*[.A583] -> 3644.24747816416 | C583: of:=[.B583]/(2*PI()*[$Descripción.B$10]) -> 11.6 | D583: of:=POWER(IMABS(IMSQRT(1-POWER([.C583];2)));-1)*SQRT([$'Cálculo L y C filtro pi'.B$9]/[$'Cálculo L y C filtro pi'.B$8]) -> 51.9174131651167 | E583: of:=POWER(IMABS(IMSQRT(1-POWER([.C583];2)));-1)*SQRT([$'Cálculo L y C filtro pi'.B$18]/[$'Cálculo L y C filtro pi'.B$17]) -> 1038.34826330233
A584: 581 | B584: of:=2*PI()*[.A584] -> 3650.53066347134 | C584: of:=[.B584]/(2*PI()*[$Descripción.B$10]) -> 11.62 | D584: of:=POWER(IMABS(IMSQRT(1-POWER([.C584];2)));-1)*SQRT([$'Cálculo L y C filtro pi'.B$9]/[$'Cálculo L y C filtro pi'.B$8]) -> 51.8273871368057 | E584: of:=POWER(IMABS(IMSQRT(1-POWER([.C584];2)));-1)*SQRT([$'Cálculo L y C filtro pi'.B$18]/[$'Cálculo L y C filtro pi'.B$17]) -> 1036.54774273611
A585: 582 | B585: of:=2*PI()*[.A585] -> 3656.81384877852 | C585: of:=[.B585]/(2*PI()*[$Descripción.B$10]) -> 11.64 | D585: of:=POWER(IMABS(IMSQRT(1-POWER([.C585];2)));-1)*SQRT([$'Cálculo L y C filtro pi'.B$9]/[$'Cálculo L y C filtro pi'.B$8]) -> 51.7376739327231 | E585: of:=POWER(IMABS(IMSQRT(1-POWER([.C585];2)));-1)*SQRT([$'Cálculo L y C filtro pi'.B$18]/[$'Cálculo L y C filtro pi'.B$17]) -> 1034.75347865446
A586: 583 | B586: of:=2*PI()*[.A586] -> 3663.0970340857 | C586: of:=[.B586]/(2*PI()*[$Descripción.B$10]) -> 11.66 | D586: of:=POWER(IMABS(IMSQRT(1-POWER([.C586];2)));-1)*SQRT([$'Cálculo L y C filtro pi'.B$9]/[$'Cálculo L y C filtro pi'.B$8]) -> 51.648271919265 | E586: of:=POWER(IMABS(IMSQRT(1-POWER([.C586];2)));-1)*SQRT([$'Cálculo L y C filtro pi'.B$18]/[$'Cálculo L y C filtro pi'.B$17]) -> 1032.9654383853
A587: 584 | B587: of:=2*PI()*[.A587] -> 3669.38021939288 | C587: of:=[.B587]/(2*PI()*[$Descripción.B$10]) -> 11.68 | D587: of:=POWER(IMABS(IMSQRT(1-POWER([.C587];2)));-1)*SQRT([$'Cálculo L y C filtro pi'.B$9]/[$'Cálculo L y C filtro pi'.B$8]) -> 51.5591794742229 | E587: of:=POWER(IMABS(IMSQRT(1-POWER([.C587];2)));-1)*SQRT([$'Cálculo L y C filtro pi'.B$18]/[$'Cálculo L y C filtro pi'.B$17]) -> 1031.18358948446
A588: 585 | B588: of:=2*PI()*[.A588] -> 3675.66340470006 | C588: of:=[.B588]/(2*PI()*[$Descripción.B$10]) -> 11.7 | D588: of:=POWER(IMABS(IMSQRT(1-POWER([.C588];2)));-1)*SQRT([$'Cálculo L y C filtro pi'.B$9]/[$'Cálculo L y C filtro pi'.B$8]) -> 51.4703949866849 | E588: of:=POWER(IMABS(IMSQRT(1-POWER([.C588];2)));-1)*SQRT([$'Cálculo L y C filtro pi'.B$18]/[$'Cálculo L y C filtro pi'.B$17]) -> 1029.4078997337
A589: 586 | B589: of:=2*PI()*[.A589] -> 3681.94659000724 | C589: of:=[.B589]/(2*PI()*[$Descripción.B$10]) -> 11.72 | D589: of:=POWER(IMABS(IMSQRT(1-POWER([.C589];2)));-1)*SQRT([$'Cálculo L y C filtro pi'.B$9]/[$'Cálculo L y C filtro pi'.B$8]) -> 51.381916856935 | E589: of:=POWER(IMABS(IMSQRT(1-POWER([.C589];2)));-1)*SQRT([$'Cálculo L y C filtro pi'.B$18]/[$'Cálculo L y C filtro pi'.B$17]) -> 1027.6383371387
A590: 587 | B590: of:=2*PI()*[.A590] -> 3688.22977531442 | C590: of:=[.B590]/(2*PI()*[$Descripción.B$10]) -> 11.74 | D590: of:=POWER(IMABS(IMSQRT(1-POWER([.C590];2)));-1)*SQRT([$'Cálculo L y C filtro pi'.B$9]/[$'Cálculo L y C filtro pi'.B$8]) -> 51.2937434963579 | E590: of:=POWER(IMABS(IMSQRT(1-POWER([.C590];2)));-1)*SQRT([$'Cálculo L y C filtro pi'.B$18]/[$'Cálculo L y C filtro pi'.B$17]) -> 1025.87486992716
A591: 588 | B591: of:=2*PI()*[.A591] -> 3694.5129606216 | C591: of:=[.B591]/(2*PI()*[$Descripción.B$10]) -> 11.76 | D591: of:=POWER(IMABS(IMSQRT(1-POWER([.C591];2)));-1)*SQRT([$'Cálculo L y C filtro pi'.B$9]/[$'Cálculo L y C filtro pi'.B$8]) -> 51.2058733273408 | E591: of:=POWER(IMABS(IMSQRT(1-POWER([.C591];2)));-1)*SQRT([$'Cálculo L y C filtro pi'.B$18]/[$'Cálculo L y C filtro pi'.B$17]) -> 1024.11746654682
A592: 589 | B592: of:=2*PI()*[.A592] -> 3700.79614592878 | C592: of:=[.B592]/(2*PI()*[$Descripción.B$10]) -> 11.78 | D592: of:=POWER(IMABS(IMSQRT(1-POWER([.C592];2)));-1)*SQRT([$'Cálculo L y C filtro pi'.B$9]/[$'Cálculo L y C filtro pi'.B$8]) -> 51.1183047831794 | E592: of:=POWER(IMABS(IMSQRT(1-POWER([.C592];2)));-1)*SQRT([$'Cálculo L y C filtro pi'.B$18]/[$'Cálculo L y C filtro pi'.B$17]) -> 1022.36609566359
A593: 590 | B593: of:=2*PI()*[.A593] -> 3707.07933123596 | C593: of:=[.B593]/(2*PI()*[$Descripción.B$10]) -> 11.8 | D593: of:=POWER(IMABS(IMSQRT(1-POWER([.C593];2)));-1)*SQRT([$'Cálculo L y C filtro pi'.B$9]/[$'Cálculo L y C filtro pi'.B$8]) -> 51.0310363079827 | E593: of:=POWER(IMABS(IMSQRT(1-POWER([.C593];2)));-1)*SQRT([$'Cálculo L y C filtro pi'.B$18]/[$'Cálculo L y C filtro pi'.B$17]) -> 1020.62072615965
A594: 591 | B594: of:=2*PI()*[.A594] -> 3713.36251654314 | C594: of:=[.B594]/(2*PI()*[$Descripción.B$10]) -> 11.82 | D594: of:=POWER(IMABS(IMSQRT(1-POWER([.C594];2)));-1)*SQRT([$'Cálculo L y C filtro pi'.B$9]/[$'Cálculo L y C filtro pi'.B$8]) -> 50.9440663565796 | E594: of:=POWER(IMABS(IMSQRT(1-POWER([.C594];2)));-1)*SQRT([$'Cálculo L y C filtro pi'.B$18]/[$'Cálculo L y C filtro pi'.B$17]) -> 1018.88132713159
A595: 592 | B595: of:=2*PI()*[.A595] -> 3719.64570185031 | C595: of:=[.B595]/(2*PI()*[$Descripción.B$10]) -> 11.84 | D595: of:=POWER(IMABS(IMSQRT(1-POWER([.C595];2)));-1)*SQRT([$'Cálculo L y C filtro pi'.B$9]/[$'Cálculo L y C filtro pi'.B$8]) -> 50.8573933944267 | E595: of:=POWER(IMABS(IMSQRT(1-POWER([.C595];2)));-1)*SQRT([$'Cálculo L y C filtro pi'.B$18]/[$'Cálculo L y C filtro pi'.B$17]) -> 1017.14786788853
A596: 593 | B596: of:=2*PI()*[.A596] -> 3725.92888715749 | C596: of:=[.B596]/(2*PI()*[$Descripción.B$10]) -> 11.86 | D596: of:=POWER(IMABS(IMSQRT(1-POWER([.C596];2)));-1)*SQRT([$'Cálculo L y C filtro pi'.B$9]/[$'Cálculo L y C filtro pi'.B$8]) -> 50.7710158975157 | E596: of:=POWER(IMABS(IMSQRT(1-POWER([.C596];2)));-1)*SQRT([$'Cálculo L y C filtro pi'.B$18]/[$'Cálculo L y C filtro pi'.B$17]) -> 1015.42031795031
A597: 594 | B597: of:=2*PI()*[.A597] -> 3732.21207246467 | C597: of:=[.B597]/(2*PI()*[$Descripción.B$10]) -> 11.88 | D597: of:=POWER(IMABS(IMSQRT(1-POWER([.C597];2)));-1)*SQRT([$'Cálculo L y C filtro pi'.B$9]/[$'Cálculo L y C filtro pi'.B$8]) -> 50.6849323522851 | E597: of:=POWER(IMABS(IMSQRT(1-POWER([.C597];2)));-1)*SQRT([$'Cálculo L y C filtro pi'.B$18]/[$'Cálculo L y C filtro pi'.B$17]) -> 1013.6986470457
A598: 595 | B598: of:=2*PI()*[.A598] -> 3738.49525777185 | C598: of:=[.B598]/(2*PI()*[$Descripción.B$10]) -> 11.9 | D598: of:=POWER(IMABS(IMSQRT(1-POWER([.C598];2)));-1)*SQRT([$'Cálculo L y C filtro pi'.B$9]/[$'Cálculo L y C filtro pi'.B$8]) -> 50.5991412555281 | E598: of:=POWER(IMABS(IMSQRT(1-POWER([.C598];2)));-1)*SQRT([$'Cálculo L y C filtro pi'.B$18]/[$'Cálculo L y C filtro pi'.B$17]) -> 1011.98282511056
A599: 596 | B599: of:=2*PI()*[.A599] -> 3744.77844307903 | C599: of:=[.B599]/(2*PI()*[$Descripción.B$10]) -> 11.92 | D599: of:=POWER(IMABS(IMSQRT(1-POWER([.C599];2)));-1)*SQRT([$'Cálculo L y C filtro pi'.B$9]/[$'Cálculo L y C filtro pi'.B$8]) -> 50.5136411143055 | E599: of:=POWER(IMABS(IMSQRT(1-POWER([.C599];2)));-1)*SQRT([$'Cálculo L y C filtro pi'.B$18]/[$'Cálculo L y C filtro pi'.B$17]) -> 1010.27282228611
A600: 597 | B600: of:=2*PI()*[.A600] -> 3751.06162838621 | C600: of:=[.B600]/(2*PI()*[$Descripción.B$10]) -> 11.94 | D600: of:=POWER(IMABS(IMSQRT(1-POWER([.C600];2)));-1)*SQRT([$'Cálculo L y C filtro pi'.B$9]/[$'Cálculo L y C filtro pi'.B$8]) -> 50.428430445857 | E600: of:=POWER(IMABS(IMSQRT(1-POWER([.C600];2)));-1)*SQRT([$'Cálculo L y C filtro pi'.B$18]/[$'Cálculo L y C filtro pi'.B$17]) -> 1008.56860891714
A601: 598 | B601: of:=2*PI()*[.A601] -> 3757.34481369339 | C601: of:=[.B601]/(2*PI()*[$Descripción.B$10]) -> 11.96 | D601: of:=POWER(IMABS(IMSQRT(1-POWER([.C601];2)));-1)*SQRT([$'Cálculo L y C filtro pi'.B$9]/[$'Cálculo L y C filtro pi'.B$8]) -> 50.3435077775149 | E601: of:=POWER(IMABS(IMSQRT(1-POWER([.C601];2)));-1)*SQRT([$'Cálculo L y C filtro pi'.B$18]/[$'Cálculo L y C filtro pi'.B$17]) -> 1006.8701555503
A602: 599 | B602: of:=2*PI()*[.A602] -> 3763.62799900057 | C602: of:=[.B602]/(2*PI()*[$Descripción.B$10]) -> 11.98 | D602: of:=POWER(IMABS(IMSQRT(1-POWER([.C602];2)));-1)*SQRT([$'Cálculo L y C filtro pi'.B$9]/[$'Cálculo L y C filtro pi'.B$8]) -> 50.2588716466176 | E602: of:=POWER(IMABS(IMSQRT(1-POWER([.C602];2)));-1)*SQRT([$'Cálculo L y C filtro pi'.B$18]/[$'Cálculo L y C filtro pi'.B$17]) -> 1005.17743293235
A603: 600 | B603: of:=2*PI()*[.A603] -> 3769.91118430775 | C603: of:=[.B603]/(2*PI()*[$Descripción.B$10]) -> 12 | D603: of:=POWER(IMABS(IMSQRT(1-POWER([.C603];2)));-1)*SQRT([$'Cálculo L y C filtro pi'.B$9]/[$'Cálculo L y C filtro pi'.B$8]) -> 50.1745206004254 | E603: of:=POWER(IMABS(IMSQRT(1-POWER([.C603];2)));-1)*SQRT([$'Cálculo L y C filtro pi'.B$18]/[$'Cálculo L y C filtro pi'.B$17]) -> 1003.49041200851
A604: 601 | B604: of:=2*PI()*[.A604] -> 3776.19436961493 | C604: of:=[.B604]/(2*PI()*[$Descripción.B$10]) -> 12.02 | D604: of:=POWER(IMABS(IMSQRT(1-POWER([.C604];2)));-1)*SQRT([$'Cálculo L y C filtro pi'.B$9]/[$'Cálculo L y C filtro pi'.B$8]) -> 50.0904531960349 | E604: of:=POWER(IMABS(IMSQRT(1-POWER([.C604];2)));-1)*SQRT([$'Cálculo L y C filtro pi'.B$18]/[$'Cálculo L y C filtro pi'.B$17]) -> 1001.8090639207
A605: 602 | B605: of:=2*PI()*[.A605] -> 3782.47755492211 | C605: of:=[.B605]/(2*PI()*[$Descripción.B$10]) -> 12.04 | D605: of:=POWER(IMABS(IMSQRT(1-POWER([.C605];2)));-1)*SQRT([$'Cálculo L y C filtro pi'.B$9]/[$'Cálculo L y C filtro pi'.B$8]) -> 50.0066680002964 | E605: of:=POWER(IMABS(IMSQRT(1-POWER([.C605];2)));-1)*SQRT([$'Cálculo L y C filtro pi'.B$18]/[$'Cálculo L y C filtro pi'.B$17]) -> 1000.13336000593
A606: 603 | B606: of:=2*PI()*[.A606] -> 3788.76074022929 | C606: of:=[.B606]/(2*PI()*[$Descripción.B$10]) -> 12.06 | D606: of:=POWER(IMABS(IMSQRT(1-POWER([.C606];2)));-1)*SQRT([$'Cálculo L y C filtro pi'.B$9]/[$'Cálculo L y C filtro pi'.B$8]) -> 49.9231635897312 | E606: of:=POWER(IMABS(IMSQRT(1-POWER([.C606];2)));-1)*SQRT([$'Cálculo L y C filtro pi'.B$18]/[$'Cálculo L y C filtro pi'.B$17]) -> 998.463271794623
A607: 604 | B607: of:=2*PI()*[.A607] -> 3795.04392553647 | C607: of:=[.B607]/(2*PI()*[$Descripción.B$10]) -> 12.08 | D607: of:=POWER(IMABS(IMSQRT(1-POWER([.C607];2)));-1)*SQRT([$'Cálculo L y C filtro pi'.B$9]/[$'Cálculo L y C filtro pi'.B$8]) -> 49.8399385504506 | E607: of:=POWER(IMABS(IMSQRT(1-POWER([.C607];2)));-1)*SQRT([$'Cálculo L y C filtro pi'.B$18]/[$'Cálculo L y C filtro pi'.B$17]) -> 996.798771009011
A608: 605 | B608: of:=2*PI()*[.A608] -> 3801.32711084365 | C608: of:=[.B608]/(2*PI()*[$Descripción.B$10]) -> 12.1 | D608: of:=POWER(IMABS(IMSQRT(1-POWER([.C608];2)));-1)*SQRT([$'Cálculo L y C filtro pi'.B$9]/[$'Cálculo L y C filtro pi'.B$8]) -> 49.7569914780732 | E608: of:=POWER(IMABS(IMSQRT(1-POWER([.C608];2)));-1)*SQRT([$'Cálculo L y C filtro pi'.B$18]/[$'Cálculo L y C filtro pi'.B$17]) -> 995.139829561464
A609: 606 | B609: of:=2*PI()*[.A609] -> 3807.61029615083 | C609: of:=[.B609]/(2*PI()*[$Descripción.B$10]) -> 12.12 | D609: of:=POWER(IMABS(IMSQRT(1-POWER([.C609];2)));-1)*SQRT([$'Cálculo L y C filtro pi'.B$9]/[$'Cálculo L y C filtro pi'.B$8]) -> 49.674320977647 | E609: of:=POWER(IMABS(IMSQRT(1-POWER([.C609];2)));-1)*SQRT([$'Cálculo L y C filtro pi'.B$18]/[$'Cálculo L y C filtro pi'.B$17]) -> 993.48641955294
A610: 607 | B610: of:=2*PI()*[.A610] -> 3813.89348145801 | C610: of:=[.B610]/(2*PI()*[$Descripción.B$10]) -> 12.14 | D610: of:=POWER(IMABS(IMSQRT(1-POWER([.C610];2)));-1)*SQRT([$'Cálculo L y C filtro pi'.B$9]/[$'Cálculo L y C filtro pi'.B$8]) -> 49.5919256635682 | E610: of:=POWER(IMABS(IMSQRT(1-POWER([.C610];2)));-1)*SQRT([$'Cálculo L y C filtro pi'.B$18]/[$'Cálculo L y C filtro pi'.B$17]) -> 991.838513271365
A611: 608 | B611: of:=2*PI()*[.A611] -> 3820.17666676519 | C611: of:=[.B611]/(2*PI()*[$Descripción.B$10]) -> 12.16 | D611: of:=POWER(IMABS(IMSQRT(1-POWER([.C611];2)));-1)*SQRT([$'Cálculo L y C filtro pi'.B$9]/[$'Cálculo L y C filtro pi'.B$8]) -> 49.509804159505 | E611: of:=POWER(IMABS(IMSQRT(1-POWER([.C611];2)));-1)*SQRT([$'Cálculo L y C filtro pi'.B$18]/[$'Cálculo L y C filtro pi'.B$17]) -> 990.196083190101
A612: 609 | B612: of:=2*PI()*[.A612] -> 3826.45985207237 | C612: of:=[.B612]/(2*PI()*[$Descripción.B$10]) -> 12.18 | D612: of:=POWER(IMABS(IMSQRT(1-POWER([.C612];2)));-1)*SQRT([$'Cálculo L y C filtro pi'.B$9]/[$'Cálculo L y C filtro pi'.B$8]) -> 49.4279550983174 | E612: of:=POWER(IMABS(IMSQRT(1-POWER([.C612];2)));-1)*SQRT([$'Cálculo L y C filtro pi'.B$18]/[$'Cálculo L y C filtro pi'.B$17]) -> 988.559101966348
A613: 610 | B613: of:=2*PI()*[.A613] -> 3832.74303737955 | C613: of:=[.B613]/(2*PI()*[$Descripción.B$10]) -> 12.2 | D613: of:=POWER(IMABS(IMSQRT(1-POWER([.C613];2)));-1)*SQRT([$'Cálculo L y C filtro pi'.B$9]/[$'Cálculo L y C filtro pi'.B$8]) -> 49.3463771219828 | E613: of:=POWER(IMABS(IMSQRT(1-POWER([.C613];2)));-1)*SQRT([$'Cálculo L y C filtro pi'.B$18]/[$'Cálculo L y C filtro pi'.B$17]) -> 986.927542439656
A614: 611 | B614: of:=2*PI()*[.A614] -> 3839.02622268673 | C614: of:=[.B614]/(2*PI()*[$Descripción.B$10]) -> 12.22 | D614: of:=POWER(IMABS(IMSQRT(1-POWER([.C614];2)));-1)*SQRT([$'Cálculo L y C filtro pi'.B$9]/[$'Cálculo L y C filtro pi'.B$8]) -> 49.2650688815169 | E614: of:=POWER(IMABS(IMSQRT(1-POWER([.C614];2)));-1)*SQRT([$'Cálculo L y C filtro pi'.B$18]/[$'Cálculo L y C filtro pi'.B$17]) -> 985.301377630338
A615: 612 | B615: of:=2*PI()*[.A615] -> 3845.30940799391 | C615: of:=[.B615]/(2*PI()*[$Descripción.B$10]) -> 12.24 | D615: of:=POWER(IMABS(IMSQRT(1-POWER([.C615];2)));-1)*SQRT([$'Cálculo L y C filtro pi'.B$9]/[$'Cálculo L y C filtro pi'.B$8]) -> 49.1840290369022 | E615: of:=POWER(IMABS(IMSQRT(1-POWER([.C615];2)));-1)*SQRT([$'Cálculo L y C filtro pi'.B$18]/[$'Cálculo L y C filtro pi'.B$17]) -> 983.680580738044
A616: 613 | B616: of:=2*PI()*[.A616] -> 3851.59259330109 | C616: of:=[.B616]/(2*PI()*[$Descripción.B$10]) -> 12.26 | D616: of:=POWER(IMABS(IMSQRT(1-POWER([.C616];2)));-1)*SQRT([$'Cálculo L y C filtro pi'.B$9]/[$'Cálculo L y C filtro pi'.B$8]) -> 49.10325625701 | E616: of:=POWER(IMABS(IMSQRT(1-POWER([.C616];2)));-1)*SQRT([$'Cálculo L y C filtro pi'.B$18]/[$'Cálculo L y C filtro pi'.B$17]) -> 982.065125140201
A617: 614 | B617: of:=2*PI()*[.A617] -> 3857.87577860827 | C617: of:=[.B617]/(2*PI()*[$Descripción.B$10]) -> 12.28 | D617: of:=POWER(IMABS(IMSQRT(1-POWER([.C617];2)));-1)*SQRT([$'Cálculo L y C filtro pi'.B$9]/[$'Cálculo L y C filtro pi'.B$8]) -> 49.0227492195283 | E617: of:=POWER(IMABS(IMSQRT(1-POWER([.C617];2)));-1)*SQRT([$'Cálculo L y C filtro pi'.B$18]/[$'Cálculo L y C filtro pi'.B$17]) -> 980.454984390566
A618: 615 | B618: of:=2*PI()*[.A618] -> 3864.15896391545 | C618: of:=[.B618]/(2*PI()*[$Descripción.B$10]) -> 12.3 | D618: of:=POWER(IMABS(IMSQRT(1-POWER([.C618];2)));-1)*SQRT([$'Cálculo L y C filtro pi'.B$9]/[$'Cálculo L y C filtro pi'.B$8]) -> 48.9425066108883 | E618: of:=POWER(IMABS(IMSQRT(1-POWER([.C618];2)));-1)*SQRT([$'Cálculo L y C filtro pi'.B$18]/[$'Cálculo L y C filtro pi'.B$17]) -> 978.850132217766
A619: 616 | B619: of:=2*PI()*[.A619] -> 3870.44214922262 | C619: of:=[.B619]/(2*PI()*[$Descripción.B$10]) -> 12.32 | D619: of:=POWER(IMABS(IMSQRT(1-POWER([.C619];2)));-1)*SQRT([$'Cálculo L y C filtro pi'.B$9]/[$'Cálculo L y C filtro pi'.B$8]) -> 48.8625271261921 | E619: of:=POWER(IMABS(IMSQRT(1-POWER([.C619];2)));-1)*SQRT([$'Cálculo L y C filtro pi'.B$18]/[$'Cálculo L y C filtro pi'.B$17]) -> 977.250542523843
A620: 617 | B620: of:=2*PI()*[.A620] -> 3876.7253345298 | C620: of:=[.B620]/(2*PI()*[$Descripción.B$10]) -> 12.34 | D620: of:=POWER(IMABS(IMSQRT(1-POWER([.C620];2)));-1)*SQRT([$'Cálculo L y C filtro pi'.B$9]/[$'Cálculo L y C filtro pi'.B$8]) -> 48.7828094691411 | E620: of:=POWER(IMABS(IMSQRT(1-POWER([.C620];2)));-1)*SQRT([$'Cálculo L y C filtro pi'.B$18]/[$'Cálculo L y C filtro pi'.B$17]) -> 975.656189382823
A621: 618 | B621: of:=2*PI()*[.A621] -> 3883.00851983698 | C621: of:=[.B621]/(2*PI()*[$Descripción.B$10]) -> 12.36 | D621: of:=POWER(IMABS(IMSQRT(1-POWER([.C621];2)));-1)*SQRT([$'Cálculo L y C filtro pi'.B$9]/[$'Cálculo L y C filtro pi'.B$8]) -> 48.7033523519651 | E621: of:=POWER(IMABS(IMSQRT(1-POWER([.C621];2)));-1)*SQRT([$'Cálculo L y C filtro pi'.B$18]/[$'Cálculo L y C filtro pi'.B$17]) -> 974.067047039302
A622: 619 | B622: of:=2*PI()*[.A622] -> 3889.29170514416 | C622: of:=[.B622]/(2*PI()*[$Descripción.B$10]) -> 12.38 | D622: of:=POWER(IMABS(IMSQRT(1-POWER([.C622];2)));-1)*SQRT([$'Cálculo L y C filtro pi'.B$9]/[$'Cálculo L y C filtro pi'.B$8]) -> 48.6241544953507 | E622: of:=POWER(IMABS(IMSQRT(1-POWER([.C622];2)));-1)*SQRT([$'Cálculo L y C filtro pi'.B$18]/[$'Cálculo L y C filtro pi'.B$17]) -> 972.483089907014
A623: 620 | B623: of:=2*PI()*[.A623] -> 3895.57489045134 | C623: of:=[.B623]/(2*PI()*[$Descripción.B$10]) -> 12.4 | D623: of:=POWER(IMABS(IMSQRT(1-POWER([.C623];2)));-1)*SQRT([$'Cálculo L y C filtro pi'.B$9]/[$'Cálculo L y C filtro pi'.B$8]) -> 48.5452146283751 | E623: of:=POWER(IMABS(IMSQRT(1-POWER([.C623];2)));-1)*SQRT([$'Cálculo L y C filtro pi'.B$18]/[$'Cálculo L y C filtro pi'.B$17]) -> 970.904292567502
A624: 621 | B624: of:=2*PI()*[.A624] -> 3901.85807575852 | C624: of:=[.B624]/(2*PI()*[$Descripción.B$10]) -> 12.42 | D624: of:=POWER(IMABS(IMSQRT(1-POWER([.C624];2)));-1)*SQRT([$'Cálculo L y C filtro pi'.B$9]/[$'Cálculo L y C filtro pi'.B$8]) -> 48.4665314884332 | E624: of:=POWER(IMABS(IMSQRT(1-POWER([.C624];2)));-1)*SQRT([$'Cálculo L y C filtro pi'.B$18]/[$'Cálculo L y C filtro pi'.B$17]) -> 969.330629768664
A625: 622 | B625: of:=2*PI()*[.A625] -> 3908.1412610657 | C625: of:=[.B625]/(2*PI()*[$Descripción.B$10]) -> 12.44 | D625: of:=POWER(IMABS(IMSQRT(1-POWER([.C625];2)));-1)*SQRT([$'Cálculo L y C filtro pi'.B$9]/[$'Cálculo L y C filtro pi'.B$8]) -> 48.3881038211729 | E625: of:=POWER(IMABS(IMSQRT(1-POWER([.C625];2)));-1)*SQRT([$'Cálculo L y C filtro pi'.B$18]/[$'Cálculo L y C filtro pi'.B$17]) -> 967.762076423458
A626: 623 | B626: of:=2*PI()*[.A626] -> 3914.42444637288 | C626: of:=[.B626]/(2*PI()*[$Descripción.B$10]) -> 12.46 | D626: of:=POWER(IMABS(IMSQRT(1-POWER([.C626];2)));-1)*SQRT([$'Cálculo L y C filtro pi'.B$9]/[$'Cálculo L y C filtro pi'.B$8]) -> 48.3099303804242 | E626: of:=POWER(IMABS(IMSQRT(1-POWER([.C626];2)));-1)*SQRT([$'Cálculo L y C filtro pi'.B$18]/[$'Cálculo L y C filtro pi'.B$17]) -> 966.198607608483
A627: 624 | B627: of:=2*PI()*[.A627] -> 3920.70763168006 | C627: of:=[.B627]/(2*PI()*[$Descripción.B$10]) -> 12.48 | D627: of:=POWER(IMABS(IMSQRT(1-POWER([.C627];2)));-1)*SQRT([$'Cálculo L y C filtro pi'.B$9]/[$'Cálculo L y C filtro pi'.B$8]) -> 48.2320099281361 | E627: of:=POWER(IMABS(IMSQRT(1-POWER([.C627];2)));-1)*SQRT([$'Cálculo L y C filtro pi'.B$18]/[$'Cálculo L y C filtro pi'.B$17]) -> 964.640198562722
A628: 625 | B628: of:=2*PI()*[.A628] -> 3926.99081698724 | C628: of:=[.B628]/(2*PI()*[$Descripción.B$10]) -> 12.5 | D628: of:=POWER(IMABS(IMSQRT(1-POWER([.C628];2)));-1)*SQRT([$'Cálculo L y C filtro pi'.B$9]/[$'Cálculo L y C filtro pi'.B$8]) -> 48.1543412343077 | E628: of:=POWER(IMABS(IMSQRT(1-POWER([.C628];2)));-1)*SQRT([$'Cálculo L y C filtro pi'.B$18]/[$'Cálculo L y C filtro pi'.B$17]) -> 963.086824686155
A629: 626 | B629: of:=2*PI()*[.A629] -> 3933.27400229442 | C629: of:=[.B629]/(2*PI()*[$Descripción.B$10]) -> 12.52 | D629: of:=POWER(IMABS(IMSQRT(1-POWER([.C629];2)));-1)*SQRT([$'Cálculo L y C filtro pi'.B$9]/[$'Cálculo L y C filtro pi'.B$8]) -> 48.0769230769231 | E629: of:=POWER(IMABS(IMSQRT(1-POWER([.C629];2)));-1)*SQRT([$'Cálculo L y C filtro pi'.B$18]/[$'Cálculo L y C filtro pi'.B$17]) -> 961.538461538462
A630: 627 | B630: of:=2*PI()*[.A630] -> 3939.5571876016 | C630: of:=[.B630]/(2*PI()*[$Descripción.B$10]) -> 12.54 | D630: of:=POWER(IMABS(IMSQRT(1-POWER([.C630];2)));-1)*SQRT([$'Cálculo L y C filtro pi'.B$9]/[$'Cálculo L y C filtro pi'.B$8]) -> 47.9997542418873 | E630: of:=POWER(IMABS(IMSQRT(1-POWER([.C630];2)));-1)*SQRT([$'Cálculo L y C filtro pi'.B$18]/[$'Cálculo L y C filtro pi'.B$17]) -> 959.995084837746
A631: 628 | B631: of:=2*PI()*[.A631] -> 3945.84037290878 | C631: of:=[.B631]/(2*PI()*[$Descripción.B$10]) -> 12.56 | D631: of:=POWER(IMABS(IMSQRT(1-POWER([.C631];2)));-1)*SQRT([$'Cálculo L y C filtro pi'.B$9]/[$'Cálculo L y C filtro pi'.B$8]) -> 47.9228335229621 | E631: of:=POWER(IMABS(IMSQRT(1-POWER([.C631];2)));-1)*SQRT([$'Cálculo L y C filtro pi'.B$18]/[$'Cálculo L y C filtro pi'.B$17]) -> 958.456670459241
A632: 629 | B632: of:=2*PI()*[.A632] -> 3952.12355821596 | C632: of:=[.B632]/(2*PI()*[$Descripción.B$10]) -> 12.58 | D632: of:=POWER(IMABS(IMSQRT(1-POWER([.C632];2)));-1)*SQRT([$'Cálculo L y C filtro pi'.B$9]/[$'Cálculo L y C filtro pi'.B$8]) -> 47.8461597217005 | E632: of:=POWER(IMABS(IMSQRT(1-POWER([.C632];2)));-1)*SQRT([$'Cálculo L y C filtro pi'.B$18]/[$'Cálculo L y C filtro pi'.B$17]) -> 956.92319443401
A633: 630 | B633: of:=2*PI()*[.A633] -> 3958.40674352314 | C633: of:=[.B633]/(2*PI()*[$Descripción.B$10]) -> 12.6 | D633: of:=POWER(IMABS(IMSQRT(1-POWER([.C633];2)));-1)*SQRT([$'Cálculo L y C filtro pi'.B$9]/[$'Cálculo L y C filtro pi'.B$8]) -> 47.769731647386 | E633: of:=POWER(IMABS(IMSQRT(1-POWER([.C633];2)));-1)*SQRT([$'Cálculo L y C filtro pi'.B$18]/[$'Cálculo L y C filtro pi'.B$17]) -> 955.39463294772
A634: 631 | B634: of:=2*PI()*[.A634] -> 3964.68992883032 | C634: of:=[.B634]/(2*PI()*[$Descripción.B$10]) -> 12.62 | D634: of:=POWER(IMABS(IMSQRT(1-POWER([.C634];2)));-1)*SQRT([$'Cálculo L y C filtro pi'.B$9]/[$'Cálculo L y C filtro pi'.B$8]) -> 47.6935481169698 | E634: of:=POWER(IMABS(IMSQRT(1-POWER([.C634];2)));-1)*SQRT([$'Cálculo L y C filtro pi'.B$18]/[$'Cálculo L y C filtro pi'.B$17]) -> 953.870962339396
A635: 632 | B635: of:=2*PI()*[.A635] -> 3970.9731141375 | C635: of:=[.B635]/(2*PI()*[$Descripción.B$10]) -> 12.64 | D635: of:=POWER(IMABS(IMSQRT(1-POWER([.C635];2)));-1)*SQRT([$'Cálculo L y C filtro pi'.B$9]/[$'Cálculo L y C filtro pi'.B$8]) -> 47.6176079550073 | E635: of:=POWER(IMABS(IMSQRT(1-POWER([.C635];2)));-1)*SQRT([$'Cálculo L y C filtro pi'.B$18]/[$'Cálculo L y C filtro pi'.B$17]) -> 952.352159100147
A636: 633 | B636: of:=2*PI()*[.A636] -> 3977.25629944468 | C636: of:=[.B636]/(2*PI()*[$Descripción.B$10]) -> 12.66 | D636: of:=POWER(IMABS(IMSQRT(1-POWER([.C636];2)));-1)*SQRT([$'Cálculo L y C filtro pi'.B$9]/[$'Cálculo L y C filtro pi'.B$8]) -> 47.5419099935988 | E636: of:=POWER(IMABS(IMSQRT(1-POWER([.C636];2)));-1)*SQRT([$'Cálculo L y C filtro pi'.B$18]/[$'Cálculo L y C filtro pi'.B$17]) -> 950.838199871977
A637: 634 | B637: of:=2*PI()*[.A637] -> 3983.53948475186 | C637: of:=[.B637]/(2*PI()*[$Descripción.B$10]) -> 12.68 | D637: of:=POWER(IMABS(IMSQRT(1-POWER([.C637];2)));-1)*SQRT([$'Cálculo L y C filtro pi'.B$9]/[$'Cálculo L y C filtro pi'.B$8]) -> 47.4664530723278 | E637: of:=POWER(IMABS(IMSQRT(1-POWER([.C637];2)));-1)*SQRT([$'Cálculo L y C filtro pi'.B$18]/[$'Cálculo L y C filtro pi'.B$17]) -> 949.329061446557
A638: 635 | B638: of:=2*PI()*[.A638] -> 3989.82267005904 | C638: of:=[.B638]/(2*PI()*[$Descripción.B$10]) -> 12.7 | D638: of:=POWER(IMABS(IMSQRT(1-POWER([.C638];2)));-1)*SQRT([$'Cálculo L y C filtro pi'.B$9]/[$'Cálculo L y C filtro pi'.B$8]) -> 47.3912360382015 | E638: of:=POWER(IMABS(IMSQRT(1-POWER([.C638];2)));-1)*SQRT([$'Cálculo L y C filtro pi'.B$18]/[$'Cálculo L y C filtro pi'.B$17]) -> 947.82472076403
A639: 636 | B639: of:=2*PI()*[.A639] -> 3996.10585536622 | C639: of:=[.B639]/(2*PI()*[$Descripción.B$10]) -> 12.72 | D639: of:=POWER(IMABS(IMSQRT(1-POWER([.C639];2)));-1)*SQRT([$'Cálculo L y C filtro pi'.B$9]/[$'Cálculo L y C filtro pi'.B$8]) -> 47.3162577455912 | E639: of:=POWER(IMABS(IMSQRT(1-POWER([.C639];2)));-1)*SQRT([$'Cálculo L y C filtro pi'.B$18]/[$'Cálculo L y C filtro pi'.B$17]) -> 946.325154911825
A640: 637 | B640: of:=2*PI()*[.A640] -> 4002.3890406734 | C640: of:=[.B640]/(2*PI()*[$Descripción.B$10]) -> 12.74 | D640: of:=POWER(IMABS(IMSQRT(1-POWER([.C640];2)));-1)*SQRT([$'Cálculo L y C filtro pi'.B$9]/[$'Cálculo L y C filtro pi'.B$8]) -> 47.2415170561741 | E640: of:=POWER(IMABS(IMSQRT(1-POWER([.C640];2)));-1)*SQRT([$'Cálculo L y C filtro pi'.B$18]/[$'Cálculo L y C filtro pi'.B$17]) -> 944.830341123483
A641: 638 | B641: of:=2*PI()*[.A641] -> 4008.67222598058 | C641: of:=[.B641]/(2*PI()*[$Descripción.B$10]) -> 12.76 | D641: of:=POWER(IMABS(IMSQRT(1-POWER([.C641];2)));-1)*SQRT([$'Cálculo L y C filtro pi'.B$9]/[$'Cálculo L y C filtro pi'.B$8]) -> 47.1670128388728 | E641: of:=POWER(IMABS(IMSQRT(1-POWER([.C641];2)));-1)*SQRT([$'Cálculo L y C filtro pi'.B$18]/[$'Cálculo L y C filtro pi'.B$17]) -> 943.340256777455
A642: 639 | B642: of:=2*PI()*[.A642] -> 4014.95541128776 | C642: of:=[.B642]/(2*PI()*[$Descripción.B$10]) -> 12.78 | D642: of:=POWER(IMABS(IMSQRT(1-POWER([.C642];2)));-1)*SQRT([$'Cálculo L y C filtro pi'.B$9]/[$'Cálculo L y C filtro pi'.B$8]) -> 47.0927439698002 | E642: of:=POWER(IMABS(IMSQRT(1-POWER([.C642];2)));-1)*SQRT([$'Cálculo L y C filtro pi'.B$18]/[$'Cálculo L y C filtro pi'.B$17]) -> 941.854879396004
A643: 640 | B643: of:=2*PI()*[.A643] -> 4021.23859659494 | C643: of:=[.B643]/(2*PI()*[$Descripción.B$10]) -> 12.8 | D643: of:=POWER(IMABS(IMSQRT(1-POWER([.C643];2)));-1)*SQRT([$'Cálculo L y C filtro pi'.B$9]/[$'Cálculo L y C filtro pi'.B$8]) -> 47.0187093322013 | E643: of:=POWER(IMABS(IMSQRT(1-POWER([.C643];2)));-1)*SQRT([$'Cálculo L y C filtro pi'.B$18]/[$'Cálculo L y C filtro pi'.B$17]) -> 940.374186644026
A644: 641 | B644: of:=2*PI()*[.A644] -> 4027.52178190212 | C644: of:=[.B644]/(2*PI()*[$Descripción.B$10]) -> 12.82 | D644: of:=POWER(IMABS(IMSQRT(1-POWER([.C644];2)));-1)*SQRT([$'Cálculo L y C filtro pi'.B$9]/[$'Cálculo L y C filtro pi'.B$8]) -> 46.9449078163955 | E644: of:=POWER(IMABS(IMSQRT(1-POWER([.C644];2)));-1)*SQRT([$'Cálculo L y C filtro pi'.B$18]/[$'Cálculo L y C filtro pi'.B$17]) -> 938.89815632791
A645: 642 | B645: of:=2*PI()*[.A645] -> 4033.80496720929 | C645: of:=[.B645]/(2*PI()*[$Descripción.B$10]) -> 12.84 | D645: of:=POWER(IMABS(IMSQRT(1-POWER([.C645];2)));-1)*SQRT([$'Cálculo L y C filtro pi'.B$9]/[$'Cálculo L y C filtro pi'.B$8]) -> 46.8713383197228 | E645: of:=POWER(IMABS(IMSQRT(1-POWER([.C645];2)));-1)*SQRT([$'Cálculo L y C filtro pi'.B$18]/[$'Cálculo L y C filtro pi'.B$17]) -> 937.426766394455
A646: 643 | B646: of:=2*PI()*[.A646] -> 4040.08815251647 | C646: of:=[.B646]/(2*PI()*[$Descripción.B$10]) -> 12.86 | D646: of:=POWER(IMABS(IMSQRT(1-POWER([.C646];2)));-1)*SQRT([$'Cálculo L y C filtro pi'.B$9]/[$'Cálculo L y C filtro pi'.B$8]) -> 46.7979997464849 | E646: of:=POWER(IMABS(IMSQRT(1-POWER([.C646];2)));-1)*SQRT([$'Cálculo L y C filtro pi'.B$18]/[$'Cálculo L y C filtro pi'.B$17]) -> 935.959994929699
A647: 644 | B647: of:=2*PI()*[.A647] -> 4046.37133782365 | C647: of:=[.B647]/(2*PI()*[$Descripción.B$10]) -> 12.88 | D647: of:=POWER(IMABS(IMSQRT(1-POWER([.C647];2)));-1)*SQRT([$'Cálculo L y C filtro pi'.B$9]/[$'Cálculo L y C filtro pi'.B$8]) -> 46.7248910078942 | E647: of:=POWER(IMABS(IMSQRT(1-POWER([.C647];2)));-1)*SQRT([$'Cálculo L y C filtro pi'.B$18]/[$'Cálculo L y C filtro pi'.B$17]) -> 934.497820157884
A648: 645 | B648: of:=2*PI()*[.A648] -> 4052.65452313083 | C648: of:=[.B648]/(2*PI()*[$Descripción.B$10]) -> 12.9 | D648: of:=POWER(IMABS(IMSQRT(1-POWER([.C648];2)));-1)*SQRT([$'Cálculo L y C filtro pi'.B$9]/[$'Cálculo L y C filtro pi'.B$8]) -> 46.6520110220159 | E648: of:=POWER(IMABS(IMSQRT(1-POWER([.C648];2)));-1)*SQRT([$'Cálculo L y C filtro pi'.B$18]/[$'Cálculo L y C filtro pi'.B$17]) -> 933.040220440318
A649: 646 | B649: of:=2*PI()*[.A649] -> 4058.93770843801 | C649: of:=[.B649]/(2*PI()*[$Descripción.B$10]) -> 12.92 | D649: of:=POWER(IMABS(IMSQRT(1-POWER([.C649];2)));-1)*SQRT([$'Cálculo L y C filtro pi'.B$9]/[$'Cálculo L y C filtro pi'.B$8]) -> 46.5793587137155 | E649: of:=POWER(IMABS(IMSQRT(1-POWER([.C649];2)));-1)*SQRT([$'Cálculo L y C filtro pi'.B$18]/[$'Cálculo L y C filtro pi'.B$17]) -> 931.58717427431
A650: 647 | B650: of:=2*PI()*[.A650] -> 4065.22089374519 | C650: of:=[.B650]/(2*PI()*[$Descripción.B$10]) -> 12.94 | D650: of:=POWER(IMABS(IMSQRT(1-POWER([.C650];2)));-1)*SQRT([$'Cálculo L y C filtro pi'.B$9]/[$'Cálculo L y C filtro pi'.B$8]) -> 46.5069330146052 | E650: of:=POWER(IMABS(IMSQRT(1-POWER([.C650];2)));-1)*SQRT([$'Cálculo L y C filtro pi'.B$18]/[$'Cálculo L y C filtro pi'.B$17]) -> 930.138660292104
A651: 648 | B651: of:=2*PI()*[.A651] -> 4071.50407905237 | C651: of:=[.B651]/(2*PI()*[$Descripción.B$10]) -> 12.96 | D651: of:=POWER(IMABS(IMSQRT(1-POWER([.C651];2)));-1)*SQRT([$'Cálculo L y C filtro pi'.B$9]/[$'Cálculo L y C filtro pi'.B$8]) -> 46.4347328629909 | E651: of:=POWER(IMABS(IMSQRT(1-POWER([.C651];2)));-1)*SQRT([$'Cálculo L y C filtro pi'.B$18]/[$'Cálculo L y C filtro pi'.B$17]) -> 928.694657259819
A652: 649 | B652: of:=2*PI()*[.A652] -> 4077.78726435955 | C652: of:=[.B652]/(2*PI()*[$Descripción.B$10]) -> 12.98 | D652: of:=POWER(IMABS(IMSQRT(1-POWER([.C652];2)));-1)*SQRT([$'Cálculo L y C filtro pi'.B$9]/[$'Cálculo L y C filtro pi'.B$8]) -> 46.36275720382 | E652: of:=POWER(IMABS(IMSQRT(1-POWER([.C652];2)));-1)*SQRT([$'Cálculo L y C filtro pi'.B$18]/[$'Cálculo L y C filtro pi'.B$17]) -> 927.255144076401
A653: 650 | B653: of:=2*PI()*[.A653] -> 4084.07044966673 | C653: of:=[.B653]/(2*PI()*[$Descripción.B$10]) -> 13 | D653: of:=POWER(IMABS(IMSQRT(1-POWER([.C653];2)));-1)*SQRT([$'Cálculo L y C filtro pi'.B$9]/[$'Cálculo L y C filtro pi'.B$8]) -> 46.2910049886276 | E653: of:=POWER(IMABS(IMSQRT(1-POWER([.C653];2)));-1)*SQRT([$'Cálculo L y C filtro pi'.B$18]/[$'Cálculo L y C filtro pi'.B$17]) -> 925.820099772553
A654: 651 | B654: of:=2*PI()*[.A654] -> 4090.35363497391 | C654: of:=[.B654]/(2*PI()*[$Descripción.B$10]) -> 13.02 | D654: of:=POWER(IMABS(IMSQRT(1-POWER([.C654];2)));-1)*SQRT([$'Cálculo L y C filtro pi'.B$9]/[$'Cálculo L y C filtro pi'.B$8]) -> 46.2194751754879 | E654: of:=POWER(IMABS(IMSQRT(1-POWER([.C654];2)));-1)*SQRT([$'Cálculo L y C filtro pi'.B$18]/[$'Cálculo L y C filtro pi'.B$17]) -> 924.389503509757
A655: 652 | B655: of:=2*PI()*[.A655] -> 4096.63682028109 | C655: of:=[.B655]/(2*PI()*[$Descripción.B$10]) -> 13.04 | D655: of:=POWER(IMABS(IMSQRT(1-POWER([.C655];2)));-1)*SQRT([$'Cálculo L y C filtro pi'.B$9]/[$'Cálculo L y C filtro pi'.B$8]) -> 46.148166728961 | E655: of:=POWER(IMABS(IMSQRT(1-POWER([.C655];2)));-1)*SQRT([$'Cálculo L y C filtro pi'.B$18]/[$'Cálculo L y C filtro pi'.B$17]) -> 922.96333457922
A656: 653 | B656: of:=2*PI()*[.A656] -> 4102.92000558827 | C656: of:=[.B656]/(2*PI()*[$Descripción.B$10]) -> 13.06 | D656: of:=POWER(IMABS(IMSQRT(1-POWER([.C656];2)));-1)*SQRT([$'Cálculo L y C filtro pi'.B$9]/[$'Cálculo L y C filtro pi'.B$8]) -> 46.0770786200434 | E656: of:=POWER(IMABS(IMSQRT(1-POWER([.C656];2)));-1)*SQRT([$'Cálculo L y C filtro pi'.B$18]/[$'Cálculo L y C filtro pi'.B$17]) -> 921.541572400867
A657: 654 | B657: of:=2*PI()*[.A657] -> 4109.20319089545 | C657: of:=[.B657]/(2*PI()*[$Descripción.B$10]) -> 13.08 | D657: of:=POWER(IMABS(IMSQRT(1-POWER([.C657];2)));-1)*SQRT([$'Cálculo L y C filtro pi'.B$9]/[$'Cálculo L y C filtro pi'.B$8]) -> 46.0062098261171 | E657: of:=POWER(IMABS(IMSQRT(1-POWER([.C657];2)));-1)*SQRT([$'Cálculo L y C filtro pi'.B$18]/[$'Cálculo L y C filtro pi'.B$17]) -> 920.124196522343
A658: 655 | B658: of:=2*PI()*[.A658] -> 4115.48637620263 | C658: of:=[.B658]/(2*PI()*[$Descripción.B$10]) -> 13.1 | D658: of:=POWER(IMABS(IMSQRT(1-POWER([.C658];2)));-1)*SQRT([$'Cálculo L y C filtro pi'.B$9]/[$'Cálculo L y C filtro pi'.B$8]) -> 45.9355593309011 | E658: of:=POWER(IMABS(IMSQRT(1-POWER([.C658];2)));-1)*SQRT([$'Cálculo L y C filtro pi'.B$18]/[$'Cálculo L y C filtro pi'.B$17]) -> 918.711186618021
A659: 656 | B659: of:=2*PI()*[.A659] -> 4121.76956150981 | C659: of:=[.B659]/(2*PI()*[$Descripción.B$10]) -> 13.12 | D659: of:=POWER(IMABS(IMSQRT(1-POWER([.C659];2)));-1)*SQRT([$'Cálculo L y C filtro pi'.B$9]/[$'Cálculo L y C filtro pi'.B$8]) -> 45.865126124401 | E659: of:=POWER(IMABS(IMSQRT(1-POWER([.C659];2)));-1)*SQRT([$'Cálculo L y C filtro pi'.B$18]/[$'Cálculo L y C filtro pi'.B$17]) -> 917.30252248802
A660: 657 | B660: of:=2*PI()*[.A660] -> 4128.05274681699 | C660: of:=[.B660]/(2*PI()*[$Descripción.B$10]) -> 13.14 | D660: of:=POWER(IMABS(IMSQRT(1-POWER([.C660];2)));-1)*SQRT([$'Cálculo L y C filtro pi'.B$9]/[$'Cálculo L y C filtro pi'.B$8]) -> 45.7949092028614 | E660: of:=POWER(IMABS(IMSQRT(1-POWER([.C660];2)));-1)*SQRT([$'Cálculo L y C filtro pi'.B$18]/[$'Cálculo L y C filtro pi'.B$17]) -> 915.898184057228
A661: 658 | B661: of:=2*PI()*[.A661] -> 4134.33593212417 | C661: of:=[.B661]/(2*PI()*[$Descripción.B$10]) -> 13.16 | D661: of:=POWER(IMABS(IMSQRT(1-POWER([.C661];2)));-1)*SQRT([$'Cálculo L y C filtro pi'.B$9]/[$'Cálculo L y C filtro pi'.B$8]) -> 45.724907568717 | E661: of:=POWER(IMABS(IMSQRT(1-POWER([.C661];2)));-1)*SQRT([$'Cálculo L y C filtro pi'.B$18]/[$'Cálculo L y C filtro pi'.B$17]) -> 914.49815137434
A662: 659 | B662: of:=2*PI()*[.A662] -> 4140.61911743135 | C662: of:=[.B662]/(2*PI()*[$Descripción.B$10]) -> 13.18 | D662: of:=POWER(IMABS(IMSQRT(1-POWER([.C662];2)));-1)*SQRT([$'Cálculo L y C filtro pi'.B$9]/[$'Cálculo L y C filtro pi'.B$8]) -> 45.6551202305452 | E662: of:=POWER(IMABS(IMSQRT(1-POWER([.C662];2)));-1)*SQRT([$'Cálculo L y C filtro pi'.B$18]/[$'Cálculo L y C filtro pi'.B$17]) -> 913.102404610904
A663: 660 | B663: of:=2*PI()*[.A663] -> 4146.90230273853 | C663: of:=[.B663]/(2*PI()*[$Descripción.B$10]) -> 13.2 | D663: of:=POWER(IMABS(IMSQRT(1-POWER([.C663];2)));-1)*SQRT([$'Cálculo L y C filtro pi'.B$9]/[$'Cálculo L y C filtro pi'.B$8]) -> 45.5855462030189 | E663: of:=POWER(IMABS(IMSQRT(1-POWER([.C663];2)));-1)*SQRT([$'Cálculo L y C filtro pi'.B$18]/[$'Cálculo L y C filtro pi'.B$17]) -> 911.710924060379
A664: 661 | B664: of:=2*PI()*[.A664] -> 4153.18548804571 | C664: of:=[.B664]/(2*PI()*[$Descripción.B$10]) -> 13.22 | D664: of:=POWER(IMABS(IMSQRT(1-POWER([.C664];2)));-1)*SQRT([$'Cálculo L y C filtro pi'.B$9]/[$'Cálculo L y C filtro pi'.B$8]) -> 45.5161845068585 | E664: of:=POWER(IMABS(IMSQRT(1-POWER([.C664];2)));-1)*SQRT([$'Cálculo L y C filtro pi'.B$18]/[$'Cálculo L y C filtro pi'.B$17]) -> 910.323690137171
A665: 662 | B665: of:=2*PI()*[.A665] -> 4159.46867335289 | C665: of:=[.B665]/(2*PI()*[$Descripción.B$10]) -> 13.24 | D665: of:=POWER(IMABS(IMSQRT(1-POWER([.C665];2)));-1)*SQRT([$'Cálculo L y C filtro pi'.B$9]/[$'Cálculo L y C filtro pi'.B$8]) -> 45.4470341687873 | E665: of:=POWER(IMABS(IMSQRT(1-POWER([.C665];2)));-1)*SQRT([$'Cálculo L y C filtro pi'.B$18]/[$'Cálculo L y C filtro pi'.B$17]) -> 908.940683375746
A666: 663 | B666: of:=2*PI()*[.A666] -> 4165.75185866007 | C666: of:=[.B666]/(2*PI()*[$Descripción.B$10]) -> 13.26 | D666: of:=POWER(IMABS(IMSQRT(1-POWER([.C666];2)));-1)*SQRT([$'Cálculo L y C filtro pi'.B$9]/[$'Cálculo L y C filtro pi'.B$8]) -> 45.3780942214837 | E666: of:=POWER(IMABS(IMSQRT(1-POWER([.C666];2)));-1)*SQRT([$'Cálculo L y C filtro pi'.B$18]/[$'Cálculo L y C filtro pi'.B$17]) -> 907.561884429674
A667: 664 | B667: of:=2*PI()*[.A667] -> 4172.03504396725 | C667: of:=[.B667]/(2*PI()*[$Descripción.B$10]) -> 13.28 | D667: of:=POWER(IMABS(IMSQRT(1-POWER([.C667];2)));-1)*SQRT([$'Cálculo L y C filtro pi'.B$9]/[$'Cálculo L y C filtro pi'.B$8]) -> 45.3093637035365 | E667: of:=POWER(IMABS(IMSQRT(1-POWER([.C667];2)));-1)*SQRT([$'Cálculo L y C filtro pi'.B$18]/[$'Cálculo L y C filtro pi'.B$17]) -> 906.18727407073
A668: 665 | B668: of:=2*PI()*[.A668] -> 4178.31822927443 | C668: of:=[.B668]/(2*PI()*[$Descripción.B$10]) -> 13.3 | D668: of:=POWER(IMABS(IMSQRT(1-POWER([.C668];2)));-1)*SQRT([$'Cálculo L y C filtro pi'.B$9]/[$'Cálculo L y C filtro pi'.B$8]) -> 45.2408416593991 | E668: of:=POWER(IMABS(IMSQRT(1-POWER([.C668];2)));-1)*SQRT([$'Cálculo L y C filtro pi'.B$18]/[$'Cálculo L y C filtro pi'.B$17]) -> 904.816833187981
A669: 666 | B669: of:=2*PI()*[.A669] -> 4184.6014145816 | C669: of:=[.B669]/(2*PI()*[$Descripción.B$10]) -> 13.32 | D669: of:=POWER(IMABS(IMSQRT(1-POWER([.C669];2)));-1)*SQRT([$'Cálculo L y C filtro pi'.B$9]/[$'Cálculo L y C filtro pi'.B$8]) -> 45.1725271393463 | E669: of:=POWER(IMABS(IMSQRT(1-POWER([.C669];2)));-1)*SQRT([$'Cálculo L y C filtro pi'.B$18]/[$'Cálculo L y C filtro pi'.B$17]) -> 903.450542786925
A670: 667 | B670: of:=2*PI()*[.A670] -> 4190.88459988878 | C670: of:=[.B670]/(2*PI()*[$Descripción.B$10]) -> 13.34 | D670: of:=POWER(IMABS(IMSQRT(1-POWER([.C670];2)));-1)*SQRT([$'Cálculo L y C filtro pi'.B$9]/[$'Cálculo L y C filtro pi'.B$8]) -> 45.1044191994274 | E670: of:=POWER(IMABS(IMSQRT(1-POWER([.C670];2)));-1)*SQRT([$'Cálculo L y C filtro pi'.B$18]/[$'Cálculo L y C filtro pi'.B$17]) -> 902.088383988548
A671: 668 | B671: of:=2*PI()*[.A671] -> 4197.16778519596 | C671: of:=[.B671]/(2*PI()*[$Descripción.B$10]) -> 13.36 | D671: of:=POWER(IMABS(IMSQRT(1-POWER([.C671];2)));-1)*SQRT([$'Cálculo L y C filtro pi'.B$9]/[$'Cálculo L y C filtro pi'.B$8]) -> 45.0365169014248 | E671: of:=POWER(IMABS(IMSQRT(1-POWER([.C671];2)));-1)*SQRT([$'Cálculo L y C filtro pi'.B$18]/[$'Cálculo L y C filtro pi'.B$17]) -> 900.730338028497
A672: 669 | B672: of:=2*PI()*[.A672] -> 4203.45097050314 | C672: of:=[.B672]/(2*PI()*[$Descripción.B$10]) -> 13.38 | D672: of:=POWER(IMABS(IMSQRT(1-POWER([.C672];2)));-1)*SQRT([$'Cálculo L y C filtro pi'.B$9]/[$'Cálculo L y C filtro pi'.B$8]) -> 44.9688193128084 | E672: of:=POWER(IMABS(IMSQRT(1-POWER([.C672];2)));-1)*SQRT([$'Cálculo L y C filtro pi'.B$18]/[$'Cálculo L y C filtro pi'.B$17]) -> 899.376386256169
A673: 670 | B673: of:=2*PI()*[.A673] -> 4209.73415581032 | C673: of:=[.B673]/(2*PI()*[$Descripción.B$10]) -> 13.4 | D673: of:=POWER(IMABS(IMSQRT(1-POWER([.C673];2)));-1)*SQRT([$'Cálculo L y C filtro pi'.B$9]/[$'Cálculo L y C filtro pi'.B$8]) -> 44.9013255066936 | E673: of:=POWER(IMABS(IMSQRT(1-POWER([.C673];2)));-1)*SQRT([$'Cálculo L y C filtro pi'.B$18]/[$'Cálculo L y C filtro pi'.B$17]) -> 898.026510133871
A674: 671 | B674: of:=2*PI()*[.A674] -> 4216.0173411175 | C674: of:=[.B674]/(2*PI()*[$Descripción.B$10]) -> 13.42 | D674: of:=POWER(IMABS(IMSQRT(1-POWER([.C674];2)));-1)*SQRT([$'Cálculo L y C filtro pi'.B$9]/[$'Cálculo L y C filtro pi'.B$8]) -> 44.8340345617985 | E674: of:=POWER(IMABS(IMSQRT(1-POWER([.C674];2)));-1)*SQRT([$'Cálculo L y C filtro pi'.B$18]/[$'Cálculo L y C filtro pi'.B$17]) -> 896.68069123597
A675: 672 | B675: of:=2*PI()*[.A675] -> 4222.30052642468 | C675: of:=[.B675]/(2*PI()*[$Descripción.B$10]) -> 13.44 | D675: of:=POWER(IMABS(IMSQRT(1-POWER([.C675];2)));-1)*SQRT([$'Cálculo L y C filtro pi'.B$9]/[$'Cálculo L y C filtro pi'.B$8]) -> 44.7669455624007 | E675: of:=POWER(IMABS(IMSQRT(1-POWER([.C675];2)));-1)*SQRT([$'Cálculo L y C filtro pi'.B$18]/[$'Cálculo L y C filtro pi'.B$17]) -> 895.338911248014
A676: 673 | B676: of:=2*PI()*[.A676] -> 4228.58371173186 | C676: of:=[.B676]/(2*PI()*[$Descripción.B$10]) -> 13.46 | D676: of:=POWER(IMABS(IMSQRT(1-POWER([.C676];2)));-1)*SQRT([$'Cálculo L y C filtro pi'.B$9]/[$'Cálculo L y C filtro pi'.B$8]) -> 44.7000575982964 | E676: of:=POWER(IMABS(IMSQRT(1-POWER([.C676];2)));-1)*SQRT([$'Cálculo L y C filtro pi'.B$18]/[$'Cálculo L y C filtro pi'.B$17]) -> 894.001151965927
A677: 674 | B677: of:=2*PI()*[.A677] -> 4234.86689703904 | C677: of:=[.B677]/(2*PI()*[$Descripción.B$10]) -> 13.48 | D677: of:=POWER(IMABS(IMSQRT(1-POWER([.C677];2)));-1)*SQRT([$'Cálculo L y C filtro pi'.B$9]/[$'Cálculo L y C filtro pi'.B$8]) -> 44.6333697647576 | E677: of:=POWER(IMABS(IMSQRT(1-POWER([.C677];2)));-1)*SQRT([$'Cálculo L y C filtro pi'.B$18]/[$'Cálculo L y C filtro pi'.B$17]) -> 892.667395295153
A678: 675 | B678: of:=2*PI()*[.A678] -> 4241.15008234622 | C678: of:=[.B678]/(2*PI()*[$Descripción.B$10]) -> 13.5 | D678: of:=POWER(IMABS(IMSQRT(1-POWER([.C678];2)));-1)*SQRT([$'Cálculo L y C filtro pi'.B$9]/[$'Cálculo L y C filtro pi'.B$8]) -> 44.5668811624923 | E678: of:=POWER(IMABS(IMSQRT(1-POWER([.C678];2)));-1)*SQRT([$'Cálculo L y C filtro pi'.B$18]/[$'Cálculo L y C filtro pi'.B$17]) -> 891.337623249846
A679: 676 | B679: of:=2*PI()*[.A679] -> 4247.4332676534 | C679: of:=[.B679]/(2*PI()*[$Descripción.B$10]) -> 13.52 | D679: of:=POWER(IMABS(IMSQRT(1-POWER([.C679];2)));-1)*SQRT([$'Cálculo L y C filtro pi'.B$9]/[$'Cálculo L y C filtro pi'.B$8]) -> 44.5005908976026 | E679: of:=POWER(IMABS(IMSQRT(1-POWER([.C679];2)));-1)*SQRT([$'Cálculo L y C filtro pi'.B$18]/[$'Cálculo L y C filtro pi'.B$17]) -> 890.011817952052
A680: 677 | B680: of:=2*PI()*[.A680] -> 4253.71645296058 | C680: of:=[.B680]/(2*PI()*[$Descripción.B$10]) -> 13.54 | D680: of:=POWER(IMABS(IMSQRT(1-POWER([.C680];2)));-1)*SQRT([$'Cálculo L y C filtro pi'.B$9]/[$'Cálculo L y C filtro pi'.B$8]) -> 44.434498081544 | E680: of:=POWER(IMABS(IMSQRT(1-POWER([.C680];2)));-1)*SQRT([$'Cálculo L y C filtro pi'.B$18]/[$'Cálculo L y C filtro pi'.B$17]) -> 888.68996163088
A681: 678 | B681: of:=2*PI()*[.A681] -> 4259.99963826776 | C681: of:=[.B681]/(2*PI()*[$Descripción.B$10]) -> 13.56 | D681: of:=POWER(IMABS(IMSQRT(1-POWER([.C681];2)));-1)*SQRT([$'Cálculo L y C filtro pi'.B$9]/[$'Cálculo L y C filtro pi'.B$8]) -> 44.3686018310859 | E681: of:=POWER(IMABS(IMSQRT(1-POWER([.C681];2)));-1)*SQRT([$'Cálculo L y C filtro pi'.B$18]/[$'Cálculo L y C filtro pi'.B$17]) -> 887.372036621718
A682: 679 | B682: of:=2*PI()*[.A682] -> 4266.28282357494 | C682: of:=[.B682]/(2*PI()*[$Descripción.B$10]) -> 13.58 | D682: of:=POWER(IMABS(IMSQRT(1-POWER([.C682];2)));-1)*SQRT([$'Cálculo L y C filtro pi'.B$9]/[$'Cálculo L y C filtro pi'.B$8]) -> 44.3029012682723 | E682: of:=POWER(IMABS(IMSQRT(1-POWER([.C682];2)));-1)*SQRT([$'Cálculo L y C filtro pi'.B$18]/[$'Cálculo L y C filtro pi'.B$17]) -> 886.058025365445
A683: 680 | B683: of:=2*PI()*[.A683] -> 4272.56600888212 | C683: of:=[.B683]/(2*PI()*[$Descripción.B$10]) -> 13.6 | D683: of:=POWER(IMABS(IMSQRT(1-POWER([.C683];2)));-1)*SQRT([$'Cálculo L y C filtro pi'.B$9]/[$'Cálculo L y C filtro pi'.B$8]) -> 44.2373955203808 | E683: of:=POWER(IMABS(IMSQRT(1-POWER([.C683];2)));-1)*SQRT([$'Cálculo L y C filtro pi'.B$18]/[$'Cálculo L y C filtro pi'.B$17]) -> 884.747910407616
A684: 681 | B684: of:=2*PI()*[.A684] -> 4278.8491941893 | C684: of:=[.B684]/(2*PI()*[$Descripción.B$10]) -> 13.62 | D684: of:=POWER(IMABS(IMSQRT(1-POWER([.C684];2)));-1)*SQRT([$'Cálculo L y C filtro pi'.B$9]/[$'Cálculo L y C filtro pi'.B$8]) -> 44.1720837198856 | E684: of:=POWER(IMABS(IMSQRT(1-POWER([.C684];2)));-1)*SQRT([$'Cálculo L y C filtro pi'.B$18]/[$'Cálculo L y C filtro pi'.B$17]) -> 883.441674397711
A685: 682 | B685: of:=2*PI()*[.A685] -> 4285.13237949648 | C685: of:=[.B685]/(2*PI()*[$Descripción.B$10]) -> 13.64 | D685: of:=POWER(IMABS(IMSQRT(1-POWER([.C685];2)));-1)*SQRT([$'Cálculo L y C filtro pi'.B$9]/[$'Cálculo L y C filtro pi'.B$8]) -> 44.1069650044163 | E685: of:=POWER(IMABS(IMSQRT(1-POWER([.C685];2)));-1)*SQRT([$'Cálculo L y C filtro pi'.B$18]/[$'Cálculo L y C filtro pi'.B$17]) -> 882.139300088326
A686: 683 | B686: of:=2*PI()*[.A686] -> 4291.41556480366 | C686: of:=[.B686]/(2*PI()*[$Descripción.B$10]) -> 13.66 | D686: of:=POWER(IMABS(IMSQRT(1-POWER([.C686];2)));-1)*SQRT([$'Cálculo L y C filtro pi'.B$9]/[$'Cálculo L y C filtro pi'.B$8]) -> 44.0420385167222 | E686: of:=POWER(IMABS(IMSQRT(1-POWER([.C686];2)));-1)*SQRT([$'Cálculo L y C filtro pi'.B$18]/[$'Cálculo L y C filtro pi'.B$17]) -> 880.840770334445
A687: 684 | B687: of:=2*PI()*[.A687] -> 4297.69875011084 | C687: of:=[.B687]/(2*PI()*[$Descripción.B$10]) -> 13.68 | D687: of:=POWER(IMABS(IMSQRT(1-POWER([.C687];2)));-1)*SQRT([$'Cálculo L y C filtro pi'.B$9]/[$'Cálculo L y C filtro pi'.B$8]) -> 43.9773034046327 | E687: of:=POWER(IMABS(IMSQRT(1-POWER([.C687];2)));-1)*SQRT([$'Cálculo L y C filtro pi'.B$18]/[$'Cálculo L y C filtro pi'.B$17]) -> 879.546068092653
A688: 685 | B688: of:=2*PI()*[.A688] -> 4303.98193541802 | C688: of:=[.B688]/(2*PI()*[$Descripción.B$10]) -> 13.7 | D688: of:=POWER(IMABS(IMSQRT(1-POWER([.C688];2)));-1)*SQRT([$'Cálculo L y C filtro pi'.B$9]/[$'Cálculo L y C filtro pi'.B$8]) -> 43.9127588210194 | E688: of:=POWER(IMABS(IMSQRT(1-POWER([.C688];2)));-1)*SQRT([$'Cálculo L y C filtro pi'.B$18]/[$'Cálculo L y C filtro pi'.B$17]) -> 878.255176420388
A689: 686 | B689: of:=2*PI()*[.A689] -> 4310.2651207252 | C689: of:=[.B689]/(2*PI()*[$Descripción.B$10]) -> 13.72 | D689: of:=POWER(IMABS(IMSQRT(1-POWER([.C689];2)));-1)*SQRT([$'Cálculo L y C filtro pi'.B$9]/[$'Cálculo L y C filtro pi'.B$8]) -> 43.8484039237598 | E689: of:=POWER(IMABS(IMSQRT(1-POWER([.C689];2)));-1)*SQRT([$'Cálculo L y C filtro pi'.B$18]/[$'Cálculo L y C filtro pi'.B$17]) -> 876.968078475197
A690: 687 | B690: of:=2*PI()*[.A690] -> 4316.54830603238 | C690: of:=[.B690]/(2*PI()*[$Descripción.B$10]) -> 13.74 | D690: of:=POWER(IMABS(IMSQRT(1-POWER([.C690];2)));-1)*SQRT([$'Cálculo L y C filtro pi'.B$9]/[$'Cálculo L y C filtro pi'.B$8]) -> 43.7842378756997 | E690: of:=POWER(IMABS(IMSQRT(1-POWER([.C690];2)));-1)*SQRT([$'Cálculo L y C filtro pi'.B$18]/[$'Cálculo L y C filtro pi'.B$17]) -> 875.684757513995
A691: 688 | B691: of:=2*PI()*[.A691] -> 4322.83149133956 | C691: of:=[.B691]/(2*PI()*[$Descripción.B$10]) -> 13.76 | D691: of:=POWER(IMABS(IMSQRT(1-POWER([.C691];2)));-1)*SQRT([$'Cálculo L y C filtro pi'.B$9]/[$'Cálculo L y C filtro pi'.B$8]) -> 43.7202598446167 | E691: of:=POWER(IMABS(IMSQRT(1-POWER([.C691];2)));-1)*SQRT([$'Cálculo L y C filtro pi'.B$18]/[$'Cálculo L y C filtro pi'.B$17]) -> 874.405196892333
A692: 689 | B692: of:=2*PI()*[.A692] -> 4329.11467664674 | C692: of:=[.B692]/(2*PI()*[$Descripción.B$10]) -> 13.78 | D692: of:=POWER(IMABS(IMSQRT(1-POWER([.C692];2)));-1)*SQRT([$'Cálculo L y C filtro pi'.B$9]/[$'Cálculo L y C filtro pi'.B$8]) -> 43.6564690031834 | E692: of:=POWER(IMABS(IMSQRT(1-POWER([.C692];2)));-1)*SQRT([$'Cálculo L y C filtro pi'.B$18]/[$'Cálculo L y C filtro pi'.B$17]) -> 873.129380063668
A693: 690 | B693: of:=2*PI()*[.A693] -> 4335.39786195392 | C693: of:=[.B693]/(2*PI()*[$Descripción.B$10]) -> 13.8 | D693: of:=POWER(IMABS(IMSQRT(1-POWER([.C693];2)));-1)*SQRT([$'Cálculo L y C filtro pi'.B$9]/[$'Cálculo L y C filtro pi'.B$8]) -> 43.5928645289322 | E693: of:=POWER(IMABS(IMSQRT(1-POWER([.C693];2)));-1)*SQRT([$'Cálculo L y C filtro pi'.B$18]/[$'Cálculo L y C filtro pi'.B$17]) -> 871.857290578645
A694: 691 | B694: of:=2*PI()*[.A694] -> 4341.68104726109 | C694: of:=[.B694]/(2*PI()*[$Descripción.B$10]) -> 13.82 | D694: of:=POWER(IMABS(IMSQRT(1-POWER([.C694];2)));-1)*SQRT([$'Cálculo L y C filtro pi'.B$9]/[$'Cálculo L y C filtro pi'.B$8]) -> 43.5294456042189 | E694: of:=POWER(IMABS(IMSQRT(1-POWER([.C694];2)));-1)*SQRT([$'Cálculo L y C filtro pi'.B$18]/[$'Cálculo L y C filtro pi'.B$17]) -> 870.588912084378
A695: 692 | B695: of:=2*PI()*[.A695] -> 4347.96423256827 | C695: of:=[.B695]/(2*PI()*[$Descripción.B$10]) -> 13.84 | D695: of:=POWER(IMABS(IMSQRT(1-POWER([.C695];2)));-1)*SQRT([$'Cálculo L y C filtro pi'.B$9]/[$'Cálculo L y C filtro pi'.B$8]) -> 43.4662114161873 | E695: of:=POWER(IMABS(IMSQRT(1-POWER([.C695];2)));-1)*SQRT([$'Cálculo L y C filtro pi'.B$18]/[$'Cálculo L y C filtro pi'.B$17]) -> 869.324228323746
A696: 693 | B696: of:=2*PI()*[.A696] -> 4354.24741787545 | C696: of:=[.B696]/(2*PI()*[$Descripción.B$10]) -> 13.86 | D696: of:=POWER(IMABS(IMSQRT(1-POWER([.C696];2)));-1)*SQRT([$'Cálculo L y C filtro pi'.B$9]/[$'Cálculo L y C filtro pi'.B$8]) -> 43.4031611567348 | E696: of:=POWER(IMABS(IMSQRT(1-POWER([.C696];2)));-1)*SQRT([$'Cálculo L y C filtro pi'.B$18]/[$'Cálculo L y C filtro pi'.B$17]) -> 868.063223134697
A697: 694 | B697: of:=2*PI()*[.A697] -> 4360.53060318263 | C697: of:=[.B697]/(2*PI()*[$Descripción.B$10]) -> 13.88 | D697: of:=POWER(IMABS(IMSQRT(1-POWER([.C697];2)));-1)*SQRT([$'Cálculo L y C filtro pi'.B$9]/[$'Cálculo L y C filtro pi'.B$8]) -> 43.3402940224764 | E697: of:=POWER(IMABS(IMSQRT(1-POWER([.C697];2)));-1)*SQRT([$'Cálculo L y C filtro pi'.B$18]/[$'Cálculo L y C filtro pi'.B$17]) -> 866.805880449529
A698: 695 | B698: of:=2*PI()*[.A698] -> 4366.81378848981 | C698: of:=[.B698]/(2*PI()*[$Descripción.B$10]) -> 13.9 | D698: of:=POWER(IMABS(IMSQRT(1-POWER([.C698];2)));-1)*SQRT([$'Cálculo L y C filtro pi'.B$9]/[$'Cálculo L y C filtro pi'.B$8]) -> 43.2776092147121 | E698: of:=POWER(IMABS(IMSQRT(1-POWER([.C698];2)));-1)*SQRT([$'Cálculo L y C filtro pi'.B$18]/[$'Cálculo L y C filtro pi'.B$17]) -> 865.552184294243
A699: 696 | B699: of:=2*PI()*[.A699] -> 4373.09697379699 | C699: of:=[.B699]/(2*PI()*[$Descripción.B$10]) -> 13.92 | D699: of:=POWER(IMABS(IMSQRT(1-POWER([.C699];2)));-1)*SQRT([$'Cálculo L y C filtro pi'.B$9]/[$'Cálculo L y C filtro pi'.B$8]) -> 43.2151059393906 | E699: of:=POWER(IMABS(IMSQRT(1-POWER([.C699];2)));-1)*SQRT([$'Cálculo L y C filtro pi'.B$18]/[$'Cálculo L y C filtro pi'.B$17]) -> 864.302118787813
A700: 697 | B700: of:=2*PI()*[.A700] -> 4379.38015910417 | C700: of:=[.B700]/(2*PI()*[$Descripción.B$10]) -> 13.94 | D700: of:=POWER(IMABS(IMSQRT(1-POWER([.C700];2)));-1)*SQRT([$'Cálculo L y C filtro pi'.B$9]/[$'Cálculo L y C filtro pi'.B$8]) -> 43.152783407077 | E700: of:=POWER(IMABS(IMSQRT(1-POWER([.C700];2)));-1)*SQRT([$'Cálculo L y C filtro pi'.B$18]/[$'Cálculo L y C filtro pi'.B$17]) -> 863.055668141539
A701: 698 | B701: of:=2*PI()*[.A701] -> 4385.66334441135 | C701: of:=[.B701]/(2*PI()*[$Descripción.B$10]) -> 13.96 | D701: of:=POWER(IMABS(IMSQRT(1-POWER([.C701];2)));-1)*SQRT([$'Cálculo L y C filtro pi'.B$9]/[$'Cálculo L y C filtro pi'.B$8]) -> 43.0906408329182 | E701: of:=POWER(IMABS(IMSQRT(1-POWER([.C701];2)));-1)*SQRT([$'Cálculo L y C filtro pi'.B$18]/[$'Cálculo L y C filtro pi'.B$17]) -> 861.812816658364
A702: 699 | B702: of:=2*PI()*[.A702] -> 4391.94652971853 | C702: of:=[.B702]/(2*PI()*[$Descripción.B$10]) -> 13.98 | D702: of:=POWER(IMABS(IMSQRT(1-POWER([.C702];2)));-1)*SQRT([$'Cálculo L y C filtro pi'.B$9]/[$'Cálculo L y C filtro pi'.B$8]) -> 43.0286774366107 | E702: of:=POWER(IMABS(IMSQRT(1-POWER([.C702];2)));-1)*SQRT([$'Cálculo L y C filtro pi'.B$18]/[$'Cálculo L y C filtro pi'.B$17]) -> 860.573548732213
A703: 700 | B703: of:=2*PI()*[.A703] -> 4398.22971502571 | C703: of:=[.B703]/(2*PI()*[$Descripción.B$10]) -> 14 | D703: of:=POWER(IMABS(IMSQRT(1-POWER([.C703];2)));-1)*SQRT([$'Cálculo L y C filtro pi'.B$9]/[$'Cálculo L y C filtro pi'.B$8]) -> 42.9668924423661 | E703: of:=POWER(IMABS(IMSQRT(1-POWER([.C703];2)));-1)*SQRT([$'Cálculo L y C filtro pi'.B$18]/[$'Cálculo L y C filtro pi'.B$17]) -> 859.337848847322
A704: 701 | B704: of:=2*PI()*[.A704] -> 4404.51290033289 | C704: of:=[.B704]/(2*PI()*[$Descripción.B$10]) -> 14.02 | D704: of:=POWER(IMABS(IMSQRT(1-POWER([.C704];2)));-1)*SQRT([$'Cálculo L y C filtro pi'.B$9]/[$'Cálculo L y C filtro pi'.B$8]) -> 42.9052850788799 | E704: of:=POWER(IMABS(IMSQRT(1-POWER([.C704];2)));-1)*SQRT([$'Cálculo L y C filtro pi'.B$18]/[$'Cálculo L y C filtro pi'.B$17]) -> 858.105701577599
A705: 702 | B705: of:=2*PI()*[.A705] -> 4410.79608564007 | C705: of:=[.B705]/(2*PI()*[$Descripción.B$10]) -> 14.04 | D705: of:=POWER(IMABS(IMSQRT(1-POWER([.C705];2)));-1)*SQRT([$'Cálculo L y C filtro pi'.B$9]/[$'Cálculo L y C filtro pi'.B$8]) -> 42.843854579299 | E705: of:=POWER(IMABS(IMSQRT(1-POWER([.C705];2)));-1)*SQRT([$'Cálculo L y C filtro pi'.B$18]/[$'Cálculo L y C filtro pi'.B$17]) -> 856.87709158598
A706: 703 | B706: of:=2*PI()*[.A706] -> 4417.07927094725 | C706: of:=[.B706]/(2*PI()*[$Descripción.B$10]) -> 14.06 | D706: of:=POWER(IMABS(IMSQRT(1-POWER([.C706];2)));-1)*SQRT([$'Cálculo L y C filtro pi'.B$9]/[$'Cálculo L y C filtro pi'.B$8]) -> 42.7826001811878 | E706: of:=POWER(IMABS(IMSQRT(1-POWER([.C706];2)));-1)*SQRT([$'Cálculo L y C filtro pi'.B$18]/[$'Cálculo L y C filtro pi'.B$17]) -> 855.652003623756
A707: 704 | B707: of:=2*PI()*[.A707] -> 4423.36245625443 | C707: of:=[.B707]/(2*PI()*[$Descripción.B$10]) -> 14.08 | D707: of:=POWER(IMABS(IMSQRT(1-POWER([.C707];2)));-1)*SQRT([$'Cálculo L y C filtro pi'.B$9]/[$'Cálculo L y C filtro pi'.B$8]) -> 42.7215211264984 | E707: of:=POWER(IMABS(IMSQRT(1-POWER([.C707];2)));-1)*SQRT([$'Cálculo L y C filtro pi'.B$18]/[$'Cálculo L y C filtro pi'.B$17]) -> 854.430422529968
A708: 705 | B708: of:=2*PI()*[.A708] -> 4429.64564156161 | C708: of:=[.B708]/(2*PI()*[$Descripción.B$10]) -> 14.1 | D708: of:=POWER(IMABS(IMSQRT(1-POWER([.C708];2)));-1)*SQRT([$'Cálculo L y C filtro pi'.B$9]/[$'Cálculo L y C filtro pi'.B$8]) -> 42.6606166615378 | E708: of:=POWER(IMABS(IMSQRT(1-POWER([.C708];2)));-1)*SQRT([$'Cálculo L y C filtro pi'.B$18]/[$'Cálculo L y C filtro pi'.B$17]) -> 853.212333230755
A709: 706 | B709: of:=2*PI()*[.A709] -> 4435.92882686879 | C709: of:=[.B709]/(2*PI()*[$Descripción.B$10]) -> 14.12 | D709: of:=POWER(IMABS(IMSQRT(1-POWER([.C709];2)));-1)*SQRT([$'Cálculo L y C filtro pi'.B$9]/[$'Cálculo L y C filtro pi'.B$8]) -> 42.5998860369372 | E709: of:=POWER(IMABS(IMSQRT(1-POWER([.C709];2)));-1)*SQRT([$'Cálculo L y C filtro pi'.B$18]/[$'Cálculo L y C filtro pi'.B$17]) -> 851.997720738744
A710: 707 | B710: of:=2*PI()*[.A710] -> 4442.21201217597 | C710: of:=[.B710]/(2*PI()*[$Descripción.B$10]) -> 14.14 | D710: of:=POWER(IMABS(IMSQRT(1-POWER([.C710];2)));-1)*SQRT([$'Cálculo L y C filtro pi'.B$9]/[$'Cálculo L y C filtro pi'.B$8]) -> 42.539328507621 | E710: of:=POWER(IMABS(IMSQRT(1-POWER([.C710];2)));-1)*SQRT([$'Cálculo L y C filtro pi'.B$18]/[$'Cálculo L y C filtro pi'.B$17]) -> 850.786570152419
A711: 708 | B711: of:=2*PI()*[.A711] -> 4448.49519748315 | C711: of:=[.B711]/(2*PI()*[$Descripción.B$10]) -> 14.16 | D711: of:=POWER(IMABS(IMSQRT(1-POWER([.C711];2)));-1)*SQRT([$'Cálculo L y C filtro pi'.B$9]/[$'Cálculo L y C filtro pi'.B$8]) -> 42.4789433327753 | E711: of:=POWER(IMABS(IMSQRT(1-POWER([.C711];2)));-1)*SQRT([$'Cálculo L y C filtro pi'.B$18]/[$'Cálculo L y C filtro pi'.B$17]) -> 849.578866655505
A712: 709 | B712: of:=2*PI()*[.A712] -> 4454.77838279033 | C712: of:=[.B712]/(2*PI()*[$Descripción.B$10]) -> 14.18 | D712: of:=POWER(IMABS(IMSQRT(1-POWER([.C712];2)));-1)*SQRT([$'Cálculo L y C filtro pi'.B$9]/[$'Cálculo L y C filtro pi'.B$8]) -> 42.4187297758177 | E712: of:=POWER(IMABS(IMSQRT(1-POWER([.C712];2)));-1)*SQRT([$'Cálculo L y C filtro pi'.B$18]/[$'Cálculo L y C filtro pi'.B$17]) -> 848.374595516355
A713: 710 | B713: of:=2*PI()*[.A713] -> 4461.06156809751 | C713: of:=[.B713]/(2*PI()*[$Descripción.B$10]) -> 14.2 | D713: of:=POWER(IMABS(IMSQRT(1-POWER([.C713];2)));-1)*SQRT([$'Cálculo L y C filtro pi'.B$9]/[$'Cálculo L y C filtro pi'.B$8]) -> 42.3586871043679 | E713: of:=POWER(IMABS(IMSQRT(1-POWER([.C713];2)));-1)*SQRT([$'Cálculo L y C filtro pi'.B$18]/[$'Cálculo L y C filtro pi'.B$17]) -> 847.173742087359
A714: 711 | B714: of:=2*PI()*[.A714] -> 4467.34475340469 | C714: of:=[.B714]/(2*PI()*[$Descripción.B$10]) -> 14.22 | D714: of:=POWER(IMABS(IMSQRT(1-POWER([.C714];2)));-1)*SQRT([$'Cálculo L y C filtro pi'.B$9]/[$'Cálculo L y C filtro pi'.B$8]) -> 42.2988145902165 | E714: of:=POWER(IMABS(IMSQRT(1-POWER([.C714];2)));-1)*SQRT([$'Cálculo L y C filtro pi'.B$18]/[$'Cálculo L y C filtro pi'.B$17]) -> 845.976291804331
A715: 712 | B715: of:=2*PI()*[.A715] -> 4473.62793871187 | C715: of:=[.B715]/(2*PI()*[$Descripción.B$10]) -> 14.24 | D715: of:=POWER(IMABS(IMSQRT(1-POWER([.C715];2)));-1)*SQRT([$'Cálculo L y C filtro pi'.B$9]/[$'Cálculo L y C filtro pi'.B$8]) -> 42.2391115092962 | E715: of:=POWER(IMABS(IMSQRT(1-POWER([.C715];2)));-1)*SQRT([$'Cálculo L y C filtro pi'.B$18]/[$'Cálculo L y C filtro pi'.B$17]) -> 844.782230185924
A716: 713 | B716: of:=2*PI()*[.A716] -> 4479.91112401905 | C716: of:=[.B716]/(2*PI()*[$Descripción.B$10]) -> 14.26 | D716: of:=POWER(IMABS(IMSQRT(1-POWER([.C716];2)));-1)*SQRT([$'Cálculo L y C filtro pi'.B$9]/[$'Cálculo L y C filtro pi'.B$8]) -> 42.1795771416514 | E716: of:=POWER(IMABS(IMSQRT(1-POWER([.C716];2)));-1)*SQRT([$'Cálculo L y C filtro pi'.B$18]/[$'Cálculo L y C filtro pi'.B$17]) -> 843.591542833029
A717: 714 | B717: of:=2*PI()*[.A717] -> 4486.19430932622 | C717: of:=[.B717]/(2*PI()*[$Descripción.B$10]) -> 14.28 | D717: of:=POWER(IMABS(IMSQRT(1-POWER([.C717];2)));-1)*SQRT([$'Cálculo L y C filtro pi'.B$9]/[$'Cálculo L y C filtro pi'.B$8]) -> 42.1202107714098 | E717: of:=POWER(IMABS(IMSQRT(1-POWER([.C717];2)));-1)*SQRT([$'Cálculo L y C filtro pi'.B$18]/[$'Cálculo L y C filtro pi'.B$17]) -> 842.404215428197
A718: 715 | B718: of:=2*PI()*[.A718] -> 4492.4774946334 | C718: of:=[.B718]/(2*PI()*[$Descripción.B$10]) -> 14.3 | D718: of:=POWER(IMABS(IMSQRT(1-POWER([.C718];2)));-1)*SQRT([$'Cálculo L y C filtro pi'.B$9]/[$'Cálculo L y C filtro pi'.B$8]) -> 42.0610116867536 | E718: of:=POWER(IMABS(IMSQRT(1-POWER([.C718];2)));-1)*SQRT([$'Cálculo L y C filtro pi'.B$18]/[$'Cálculo L y C filtro pi'.B$17]) -> 841.220233735072
A719: 716 | B719: of:=2*PI()*[.A719] -> 4498.76067994058 | C719: of:=[.B719]/(2*PI()*[$Descripción.B$10]) -> 14.32 | D719: of:=POWER(IMABS(IMSQRT(1-POWER([.C719];2)));-1)*SQRT([$'Cálculo L y C filtro pi'.B$9]/[$'Cálculo L y C filtro pi'.B$8]) -> 42.0019791798897 | E719: of:=POWER(IMABS(IMSQRT(1-POWER([.C719];2)));-1)*SQRT([$'Cálculo L y C filtro pi'.B$18]/[$'Cálculo L y C filtro pi'.B$17]) -> 840.039583597794
A720: 717 | B720: of:=2*PI()*[.A720] -> 4505.04386524776 | C720: of:=[.B720]/(2*PI()*[$Descripción.B$10]) -> 14.34 | D720: of:=POWER(IMABS(IMSQRT(1-POWER([.C720];2)));-1)*SQRT([$'Cálculo L y C filtro pi'.B$9]/[$'Cálculo L y C filtro pi'.B$8]) -> 41.9431125470217 | E720: of:=POWER(IMABS(IMSQRT(1-POWER([.C720];2)));-1)*SQRT([$'Cálculo L y C filtro pi'.B$18]/[$'Cálculo L y C filtro pi'.B$17]) -> 838.862250940434
A721: 718 | B721: of:=2*PI()*[.A721] -> 4511.32705055494 | C721: of:=[.B721]/(2*PI()*[$Descripción.B$10]) -> 14.36 | D721: of:=POWER(IMABS(IMSQRT(1-POWER([.C721];2)));-1)*SQRT([$'Cálculo L y C filtro pi'.B$9]/[$'Cálculo L y C filtro pi'.B$8]) -> 41.8844110883222 | E721: of:=POWER(IMABS(IMSQRT(1-POWER([.C721];2)));-1)*SQRT([$'Cálculo L y C filtro pi'.B$18]/[$'Cálculo L y C filtro pi'.B$17]) -> 837.688221766445
A722: 719 | B722: of:=2*PI()*[.A722] -> 4517.61023586212 | C722: of:=[.B722]/(2*PI()*[$Descripción.B$10]) -> 14.38 | D722: of:=POWER(IMABS(IMSQRT(1-POWER([.C722];2)));-1)*SQRT([$'Cálculo L y C filtro pi'.B$9]/[$'Cálculo L y C filtro pi'.B$8]) -> 41.8258741079045 | E722: of:=POWER(IMABS(IMSQRT(1-POWER([.C722];2)));-1)*SQRT([$'Cálculo L y C filtro pi'.B$18]/[$'Cálculo L y C filtro pi'.B$17]) -> 836.51748215809
A723: 720 | B723: of:=2*PI()*[.A723] -> 4523.8934211693 | C723: of:=[.B723]/(2*PI()*[$Descripción.B$10]) -> 14.4 | D723: of:=POWER(IMABS(IMSQRT(1-POWER([.C723];2)));-1)*SQRT([$'Cálculo L y C filtro pi'.B$9]/[$'Cálculo L y C filtro pi'.B$8]) -> 41.7675009137947 | E723: of:=POWER(IMABS(IMSQRT(1-POWER([.C723];2)));-1)*SQRT([$'Cálculo L y C filtro pi'.B$18]/[$'Cálculo L y C filtro pi'.B$17]) -> 835.350018275894
A724: 721 | B724: of:=2*PI()*[.A724] -> 4530.17660647648 | C724: of:=[.B724]/(2*PI()*[$Descripción.B$10]) -> 14.42 | D724: of:=POWER(IMABS(IMSQRT(1-POWER([.C724];2)));-1)*SQRT([$'Cálculo L y C filtro pi'.B$9]/[$'Cálculo L y C filtro pi'.B$8]) -> 41.7092908179036 | E724: of:=POWER(IMABS(IMSQRT(1-POWER([.C724];2)));-1)*SQRT([$'Cálculo L y C filtro pi'.B$18]/[$'Cálculo L y C filtro pi'.B$17]) -> 834.185816358073
A725: 722 | B725: of:=2*PI()*[.A725] -> 4536.45979178366 | C725: of:=[.B725]/(2*PI()*[$Descripción.B$10]) -> 14.44 | D725: of:=POWER(IMABS(IMSQRT(1-POWER([.C725];2)));-1)*SQRT([$'Cálculo L y C filtro pi'.B$9]/[$'Cálculo L y C filtro pi'.B$8]) -> 41.6512431360008 | E725: of:=POWER(IMABS(IMSQRT(1-POWER([.C725];2)));-1)*SQRT([$'Cálculo L y C filtro pi'.B$18]/[$'Cálculo L y C filtro pi'.B$17]) -> 833.024862720015
A726: 723 | B726: of:=2*PI()*[.A726] -> 4542.74297709084 | C726: of:=[.B726]/(2*PI()*[$Descripción.B$10]) -> 14.46 | D726: of:=POWER(IMABS(IMSQRT(1-POWER([.C726];2)));-1)*SQRT([$'Cálculo L y C filtro pi'.B$9]/[$'Cálculo L y C filtro pi'.B$8]) -> 41.5933571876862 | E726: of:=POWER(IMABS(IMSQRT(1-POWER([.C726];2)));-1)*SQRT([$'Cálculo L y C filtro pi'.B$18]/[$'Cálculo L y C filtro pi'.B$17]) -> 831.867143753723
A727: 724 | B727: of:=2*PI()*[.A727] -> 4549.02616239802 | C727: of:=[.B727]/(2*PI()*[$Descripción.B$10]) -> 14.48 | D727: of:=POWER(IMABS(IMSQRT(1-POWER([.C727];2)));-1)*SQRT([$'Cálculo L y C filtro pi'.B$9]/[$'Cálculo L y C filtro pi'.B$8]) -> 41.5356322963642 | E727: of:=POWER(IMABS(IMSQRT(1-POWER([.C727];2)));-1)*SQRT([$'Cálculo L y C filtro pi'.B$18]/[$'Cálculo L y C filtro pi'.B$17]) -> 830.712645927284
A728: 725 | B728: of:=2*PI()*[.A728] -> 4555.3093477052 | C728: of:=[.B728]/(2*PI()*[$Descripción.B$10]) -> 14.5 | D728: of:=POWER(IMABS(IMSQRT(1-POWER([.C728];2)));-1)*SQRT([$'Cálculo L y C filtro pi'.B$9]/[$'Cálculo L y C filtro pi'.B$8]) -> 41.4780677892171 | E728: of:=POWER(IMABS(IMSQRT(1-POWER([.C728];2)));-1)*SQRT([$'Cálculo L y C filtro pi'.B$18]/[$'Cálculo L y C filtro pi'.B$17]) -> 829.561355784342
A729: 726 | B729: of:=2*PI()*[.A729] -> 4561.59253301238 | C729: of:=[.B729]/(2*PI()*[$Descripción.B$10]) -> 14.52 | D729: of:=POWER(IMABS(IMSQRT(1-POWER([.C729];2)));-1)*SQRT([$'Cálculo L y C filtro pi'.B$9]/[$'Cálculo L y C filtro pi'.B$8]) -> 41.4206629971772 | E729: of:=POWER(IMABS(IMSQRT(1-POWER([.C729];2)));-1)*SQRT([$'Cálculo L y C filtro pi'.B$18]/[$'Cálculo L y C filtro pi'.B$17]) -> 828.413259943543
A730: 727 | B730: of:=2*PI()*[.A730] -> 4567.87571831956 | C730: of:=[.B730]/(2*PI()*[$Descripción.B$10]) -> 14.54 | D730: of:=POWER(IMABS(IMSQRT(1-POWER([.C730];2)));-1)*SQRT([$'Cálculo L y C filtro pi'.B$9]/[$'Cálculo L y C filtro pi'.B$8]) -> 41.3634172549029 | E730: of:=POWER(IMABS(IMSQRT(1-POWER([.C730];2)));-1)*SQRT([$'Cálculo L y C filtro pi'.B$18]/[$'Cálculo L y C filtro pi'.B$17]) -> 827.268345098057
A731: 728 | B731: of:=2*PI()*[.A731] -> 4574.15890362674 | C731: of:=[.B731]/(2*PI()*[$Descripción.B$10]) -> 14.56 | D731: of:=POWER(IMABS(IMSQRT(1-POWER([.C731];2)));-1)*SQRT([$'Cálculo L y C filtro pi'.B$9]/[$'Cálculo L y C filtro pi'.B$8]) -> 41.3063299007505 | E731: of:=POWER(IMABS(IMSQRT(1-POWER([.C731];2)));-1)*SQRT([$'Cálculo L y C filtro pi'.B$18]/[$'Cálculo L y C filtro pi'.B$17]) -> 826.126598015011
A732: 729 | B732: of:=2*PI()*[.A732] -> 4580.44208893392 | C732: of:=[.B732]/(2*PI()*[$Descripción.B$10]) -> 14.58 | D732: of:=POWER(IMABS(IMSQRT(1-POWER([.C732];2)));-1)*SQRT([$'Cálculo L y C filtro pi'.B$9]/[$'Cálculo L y C filtro pi'.B$8]) -> 41.2494002767508 | E732: of:=POWER(IMABS(IMSQRT(1-POWER([.C732];2)));-1)*SQRT([$'Cálculo L y C filtro pi'.B$18]/[$'Cálculo L y C filtro pi'.B$17]) -> 824.988005535017
A733: 730 | B733: of:=2*PI()*[.A733] -> 4586.7252742411 | C733: of:=[.B733]/(2*PI()*[$Descripción.B$10]) -> 14.6 | D733: of:=POWER(IMABS(IMSQRT(1-POWER([.C733];2)));-1)*SQRT([$'Cálculo L y C filtro pi'.B$9]/[$'Cálculo L y C filtro pi'.B$8]) -> 41.1926277285817 | E733: of:=POWER(IMABS(IMSQRT(1-POWER([.C733];2)));-1)*SQRT([$'Cálculo L y C filtro pi'.B$18]/[$'Cálculo L y C filtro pi'.B$17]) -> 823.852554571635
A734: 731 | B734: of:=2*PI()*[.A734] -> 4593.00845954828 | C734: of:=[.B734]/(2*PI()*[$Descripción.B$10]) -> 14.62 | D734: of:=POWER(IMABS(IMSQRT(1-POWER([.C734];2)));-1)*SQRT([$'Cálculo L y C filtro pi'.B$9]/[$'Cálculo L y C filtro pi'.B$8]) -> 41.1360116055434 | E734: of:=POWER(IMABS(IMSQRT(1-POWER([.C734];2)));-1)*SQRT([$'Cálculo L y C filtro pi'.B$18]/[$'Cálculo L y C filtro pi'.B$17]) -> 822.720232110868
A735: 732 | B735: of:=2*PI()*[.A735] -> 4599.29164485546 | C735: of:=[.B735]/(2*PI()*[$Descripción.B$10]) -> 14.64 | D735: of:=POWER(IMABS(IMSQRT(1-POWER([.C735];2)));-1)*SQRT([$'Cálculo L y C filtro pi'.B$9]/[$'Cálculo L y C filtro pi'.B$8]) -> 41.0795512605336 | E735: of:=POWER(IMABS(IMSQRT(1-POWER([.C735];2)));-1)*SQRT([$'Cálculo L y C filtro pi'.B$18]/[$'Cálculo L y C filtro pi'.B$17]) -> 821.591025210672
A736: 733 | B736: of:=2*PI()*[.A736] -> 4605.57483016264 | C736: of:=[.B736]/(2*PI()*[$Descripción.B$10]) -> 14.66 | D736: of:=POWER(IMABS(IMSQRT(1-POWER([.C736];2)));-1)*SQRT([$'Cálculo L y C filtro pi'.B$9]/[$'Cálculo L y C filtro pi'.B$8]) -> 41.0232460500227 | E736: of:=POWER(IMABS(IMSQRT(1-POWER([.C736];2)));-1)*SQRT([$'Cálculo L y C filtro pi'.B$18]/[$'Cálculo L y C filtro pi'.B$17]) -> 820.464921000455
A737: 734 | B737: of:=2*PI()*[.A737] -> 4611.85801546982 | C737: of:=[.B737]/(2*PI()*[$Descripción.B$10]) -> 14.68 | D737: of:=POWER(IMABS(IMSQRT(1-POWER([.C737];2)));-1)*SQRT([$'Cálculo L y C filtro pi'.B$9]/[$'Cálculo L y C filtro pi'.B$8]) -> 40.9670953340288 | E737: of:=POWER(IMABS(IMSQRT(1-POWER([.C737];2)));-1)*SQRT([$'Cálculo L y C filtro pi'.B$18]/[$'Cálculo L y C filtro pi'.B$17]) -> 819.341906680576
A738: 735 | B738: of:=2*PI()*[.A738] -> 4618.141200777 | C738: of:=[.B738]/(2*PI()*[$Descripción.B$10]) -> 14.7 | D738: of:=POWER(IMABS(IMSQRT(1-POWER([.C738];2)));-1)*SQRT([$'Cálculo L y C filtro pi'.B$9]/[$'Cálculo L y C filtro pi'.B$8]) -> 40.9110984760936 | E738: of:=POWER(IMABS(IMSQRT(1-POWER([.C738];2)));-1)*SQRT([$'Cálculo L y C filtro pi'.B$18]/[$'Cálculo L y C filtro pi'.B$17]) -> 818.221969521873
A739: 736 | B739: of:=2*PI()*[.A739] -> 4624.42438608418 | C739: of:=[.B739]/(2*PI()*[$Descripción.B$10]) -> 14.72 | D739: of:=POWER(IMABS(IMSQRT(1-POWER([.C739];2)));-1)*SQRT([$'Cálculo L y C filtro pi'.B$9]/[$'Cálculo L y C filtro pi'.B$8]) -> 40.855254843257 | E739: of:=POWER(IMABS(IMSQRT(1-POWER([.C739];2)));-1)*SQRT([$'Cálculo L y C filtro pi'.B$18]/[$'Cálculo L y C filtro pi'.B$17]) -> 817.105096865139
A740: 737 | B740: of:=2*PI()*[.A740] -> 4630.70757139136 | C740: of:=[.B740]/(2*PI()*[$Descripción.B$10]) -> 14.74 | D740: of:=POWER(IMABS(IMSQRT(1-POWER([.C740];2)));-1)*SQRT([$'Cálculo L y C filtro pi'.B$9]/[$'Cálculo L y C filtro pi'.B$8]) -> 40.7995638060353 | E740: of:=POWER(IMABS(IMSQRT(1-POWER([.C740];2)));-1)*SQRT([$'Cálculo L y C filtro pi'.B$18]/[$'Cálculo L y C filtro pi'.B$17]) -> 815.991276120705
A741: 738 | B741: of:=2*PI()*[.A741] -> 4636.99075669854 | C741: of:=[.B741]/(2*PI()*[$Descripción.B$10]) -> 14.76 | D741: of:=POWER(IMABS(IMSQRT(1-POWER([.C741];2)));-1)*SQRT([$'Cálculo L y C filtro pi'.B$9]/[$'Cálculo L y C filtro pi'.B$8]) -> 40.7440247383942 | E741: of:=POWER(IMABS(IMSQRT(1-POWER([.C741];2)));-1)*SQRT([$'Cálculo L y C filtro pi'.B$18]/[$'Cálculo L y C filtro pi'.B$17]) -> 814.880494767884
A742: 739 | B742: of:=2*PI()*[.A742] -> 4643.27394200571 | C742: of:=[.B742]/(2*PI()*[$Descripción.B$10]) -> 14.78 | D742: of:=POWER(IMABS(IMSQRT(1-POWER([.C742];2)));-1)*SQRT([$'Cálculo L y C filtro pi'.B$9]/[$'Cálculo L y C filtro pi'.B$8]) -> 40.6886370177291 | E742: of:=POWER(IMABS(IMSQRT(1-POWER([.C742];2)));-1)*SQRT([$'Cálculo L y C filtro pi'.B$18]/[$'Cálculo L y C filtro pi'.B$17]) -> 813.772740354581
A743: 740 | B743: of:=2*PI()*[.A743] -> 4649.55712731289 | C743: of:=[.B743]/(2*PI()*[$Descripción.B$10]) -> 14.8 | D743: of:=POWER(IMABS(IMSQRT(1-POWER([.C743];2)));-1)*SQRT([$'Cálculo L y C filtro pi'.B$9]/[$'Cálculo L y C filtro pi'.B$8]) -> 40.633400024837 | E743: of:=POWER(IMABS(IMSQRT(1-POWER([.C743];2)));-1)*SQRT([$'Cálculo L y C filtro pi'.B$18]/[$'Cálculo L y C filtro pi'.B$17]) -> 812.66800049674
A744: 741 | B744: of:=2*PI()*[.A744] -> 4655.84031262007 | C744: of:=[.B744]/(2*PI()*[$Descripción.B$10]) -> 14.82 | D744: of:=POWER(IMABS(IMSQRT(1-POWER([.C744];2)));-1)*SQRT([$'Cálculo L y C filtro pi'.B$9]/[$'Cálculo L y C filtro pi'.B$8]) -> 40.5783131438975 | E744: of:=POWER(IMABS(IMSQRT(1-POWER([.C744];2)));-1)*SQRT([$'Cálculo L y C filtro pi'.B$18]/[$'Cálculo L y C filtro pi'.B$17]) -> 811.56626287795
A745: 742 | B745: of:=2*PI()*[.A745] -> 4662.12349792725 | C745: of:=[.B745]/(2*PI()*[$Descripción.B$10]) -> 14.84 | D745: of:=POWER(IMABS(IMSQRT(1-POWER([.C745];2)));-1)*SQRT([$'Cálculo L y C filtro pi'.B$9]/[$'Cálculo L y C filtro pi'.B$8]) -> 40.5233757624466 | E745: of:=POWER(IMABS(IMSQRT(1-POWER([.C745];2)));-1)*SQRT([$'Cálculo L y C filtro pi'.B$18]/[$'Cálculo L y C filtro pi'.B$17]) -> 810.467515248932
A746: 743 | B746: of:=2*PI()*[.A746] -> 4668.40668323443 | C746: of:=[.B746]/(2*PI()*[$Descripción.B$10]) -> 14.86 | D746: of:=POWER(IMABS(IMSQRT(1-POWER([.C746];2)));-1)*SQRT([$'Cálculo L y C filtro pi'.B$9]/[$'Cálculo L y C filtro pi'.B$8]) -> 40.468587271356 | E746: of:=POWER(IMABS(IMSQRT(1-POWER([.C746];2)));-1)*SQRT([$'Cálculo L y C filtro pi'.B$18]/[$'Cálculo L y C filtro pi'.B$17]) -> 809.371745427119
A747: 744 | B747: of:=2*PI()*[.A747] -> 4674.68986854161 | C747: of:=[.B747]/(2*PI()*[$Descripción.B$10]) -> 14.88 | D747: of:=POWER(IMABS(IMSQRT(1-POWER([.C747];2)));-1)*SQRT([$'Cálculo L y C filtro pi'.B$9]/[$'Cálculo L y C filtro pi'.B$8]) -> 40.4139470648081 | E747: of:=POWER(IMABS(IMSQRT(1-POWER([.C747];2)));-1)*SQRT([$'Cálculo L y C filtro pi'.B$18]/[$'Cálculo L y C filtro pi'.B$17]) -> 808.278941296163
A748: 745 | B748: of:=2*PI()*[.A748] -> 4680.97305384879 | C748: of:=[.B748]/(2*PI()*[$Descripción.B$10]) -> 14.9 | D748: of:=POWER(IMABS(IMSQRT(1-POWER([.C748];2)));-1)*SQRT([$'Cálculo L y C filtro pi'.B$9]/[$'Cálculo L y C filtro pi'.B$8]) -> 40.3594545402765 | E748: of:=POWER(IMABS(IMSQRT(1-POWER([.C748];2)));-1)*SQRT([$'Cálculo L y C filtro pi'.B$18]/[$'Cálculo L y C filtro pi'.B$17]) -> 807.189090805531
A749: 746 | B749: of:=2*PI()*[.A749] -> 4687.25623915597 | C749: of:=[.B749]/(2*PI()*[$Descripción.B$10]) -> 14.92 | D749: of:=POWER(IMABS(IMSQRT(1-POWER([.C749];2)));-1)*SQRT([$'Cálculo L y C filtro pi'.B$9]/[$'Cálculo L y C filtro pi'.B$8]) -> 40.3051090985007 | E749: of:=POWER(IMABS(IMSQRT(1-POWER([.C749];2)));-1)*SQRT([$'Cálculo L y C filtro pi'.B$18]/[$'Cálculo L y C filtro pi'.B$17]) -> 806.102181970014
A750: 747 | B750: of:=2*PI()*[.A750] -> 4693.53942446315 | C750: of:=[.B750]/(2*PI()*[$Descripción.B$10]) -> 14.94 | D750: of:=POWER(IMABS(IMSQRT(1-POWER([.C750];2)));-1)*SQRT([$'Cálculo L y C filtro pi'.B$9]/[$'Cálculo L y C filtro pi'.B$8]) -> 40.2509101434651 | E750: of:=POWER(IMABS(IMSQRT(1-POWER([.C750];2)));-1)*SQRT([$'Cálculo L y C filtro pi'.B$18]/[$'Cálculo L y C filtro pi'.B$17]) -> 805.018202869303
A751: 748 | B751: of:=2*PI()*[.A751] -> 4699.82260977033 | C751: of:=[.B751]/(2*PI()*[$Descripción.B$10]) -> 14.96 | D751: of:=POWER(IMABS(IMSQRT(1-POWER([.C751];2)));-1)*SQRT([$'Cálculo L y C filtro pi'.B$9]/[$'Cálculo L y C filtro pi'.B$8]) -> 40.1968570823779 | E751: of:=POWER(IMABS(IMSQRT(1-POWER([.C751];2)));-1)*SQRT([$'Cálculo L y C filtro pi'.B$18]/[$'Cálculo L y C filtro pi'.B$17]) -> 803.937141647559
A752: 749 | B752: of:=2*PI()*[.A752] -> 4706.10579507751 | C752: of:=[.B752]/(2*PI()*[$Descripción.B$10]) -> 14.98 | D752: of:=POWER(IMABS(IMSQRT(1-POWER([.C752];2)));-1)*SQRT([$'Cálculo L y C filtro pi'.B$9]/[$'Cálculo L y C filtro pi'.B$8]) -> 40.142949325648 | E752: of:=POWER(IMABS(IMSQRT(1-POWER([.C752];2)));-1)*SQRT([$'Cálculo L y C filtro pi'.B$18]/[$'Cálculo L y C filtro pi'.B$17]) -> 802.858986512959
A753: 750 | B753: of:=2*PI()*[.A753] -> 4712.38898038469 | C753: of:=[.B753]/(2*PI()*[$Descripción.B$10]) -> 15 | D753: of:=POWER(IMABS(IMSQRT(1-POWER([.C753];2)));-1)*SQRT([$'Cálculo L y C filtro pi'.B$9]/[$'Cálculo L y C filtro pi'.B$8]) -> 40.0891862868636 | E753: of:=POWER(IMABS(IMSQRT(1-POWER([.C753];2)));-1)*SQRT([$'Cálculo L y C filtro pi'.B$18]/[$'Cálculo L y C filtro pi'.B$17]) -> 801.783725737271
A754: 751 | B754: of:=2*PI()*[.A754] -> 4718.67216569187 | C754: of:=[.B754]/(2*PI()*[$Descripción.B$10]) -> 15.02 | D754: of:=POWER(IMABS(IMSQRT(1-POWER([.C754];2)));-1)*SQRT([$'Cálculo L y C filtro pi'.B$9]/[$'Cálculo L y C filtro pi'.B$8]) -> 40.0355673827716 | E754: of:=POWER(IMABS(IMSQRT(1-POWER([.C754];2)));-1)*SQRT([$'Cálculo L y C filtro pi'.B$18]/[$'Cálculo L y C filtro pi'.B$17]) -> 800.711347655432
A755: 752 | B755: of:=2*PI()*[.A755] -> 4724.95535099905 | C755: of:=[.B755]/(2*PI()*[$Descripción.B$10]) -> 15.04 | D755: of:=POWER(IMABS(IMSQRT(1-POWER([.C755];2)));-1)*SQRT([$'Cálculo L y C filtro pi'.B$9]/[$'Cálculo L y C filtro pi'.B$8]) -> 39.9820920332555 | E755: of:=POWER(IMABS(IMSQRT(1-POWER([.C755];2)));-1)*SQRT([$'Cálculo L y C filtro pi'.B$18]/[$'Cálculo L y C filtro pi'.B$17]) -> 799.64184066511
A756: 753 | B756: of:=2*PI()*[.A756] -> 4731.23853630623 | C756: of:=[.B756]/(2*PI()*[$Descripción.B$10]) -> 15.06 | D756: of:=POWER(IMABS(IMSQRT(1-POWER([.C756];2)));-1)*SQRT([$'Cálculo L y C filtro pi'.B$9]/[$'Cálculo L y C filtro pi'.B$8]) -> 39.9287596613142 | E756: of:=POWER(IMABS(IMSQRT(1-POWER([.C756];2)));-1)*SQRT([$'Cálculo L y C filtro pi'.B$18]/[$'Cálculo L y C filtro pi'.B$17]) -> 798.575193226285
A757: 754 | B757: of:=2*PI()*[.A757] -> 4737.52172161341 | C757: of:=[.B757]/(2*PI()*[$Descripción.B$10]) -> 15.08 | D757: of:=POWER(IMABS(IMSQRT(1-POWER([.C757];2)));-1)*SQRT([$'Cálculo L y C filtro pi'.B$9]/[$'Cálculo L y C filtro pi'.B$8]) -> 39.8755696930419 | E757: of:=POWER(IMABS(IMSQRT(1-POWER([.C757];2)));-1)*SQRT([$'Cálculo L y C filtro pi'.B$18]/[$'Cálculo L y C filtro pi'.B$17]) -> 797.511393860838
A758: 755 | B758: of:=2*PI()*[.A758] -> 4743.80490692059 | C758: of:=[.B758]/(2*PI()*[$Descripción.B$10]) -> 15.1 | D758: of:=POWER(IMABS(IMSQRT(1-POWER([.C758];2)));-1)*SQRT([$'Cálculo L y C filtro pi'.B$9]/[$'Cálculo L y C filtro pi'.B$8]) -> 39.8225215576063 | E758: of:=POWER(IMABS(IMSQRT(1-POWER([.C758];2)));-1)*SQRT([$'Cálculo L y C filtro pi'.B$18]/[$'Cálculo L y C filtro pi'.B$17]) -> 796.450431152127
A759: 756 | B759: of:=2*PI()*[.A759] -> 4750.08809222777 | C759: of:=[.B759]/(2*PI()*[$Descripción.B$10]) -> 15.12 | D759: of:=POWER(IMABS(IMSQRT(1-POWER([.C759];2)));-1)*SQRT([$'Cálculo L y C filtro pi'.B$9]/[$'Cálculo L y C filtro pi'.B$8]) -> 39.7696146872293 | E759: of:=POWER(IMABS(IMSQRT(1-POWER([.C759];2)));-1)*SQRT([$'Cálculo L y C filtro pi'.B$18]/[$'Cálculo L y C filtro pi'.B$17]) -> 795.392293744586
A760: 757 | B760: of:=2*PI()*[.A760] -> 4756.37127753495 | C760: of:=[.B760]/(2*PI()*[$Descripción.B$10]) -> 15.14 | D760: of:=POWER(IMABS(IMSQRT(1-POWER([.C760];2)));-1)*SQRT([$'Cálculo L y C filtro pi'.B$9]/[$'Cálculo L y C filtro pi'.B$8]) -> 39.7168485171646 | E760: of:=POWER(IMABS(IMSQRT(1-POWER([.C760];2)));-1)*SQRT([$'Cálculo L y C filtro pi'.B$18]/[$'Cálculo L y C filtro pi'.B$17]) -> 794.336970343292
A761: 758 | B761: of:=2*PI()*[.A761] -> 4762.65446284213 | C761: of:=[.B761]/(2*PI()*[$Descripción.B$10]) -> 15.16 | D761: of:=POWER(IMABS(IMSQRT(1-POWER([.C761];2)));-1)*SQRT([$'Cálculo L y C filtro pi'.B$9]/[$'Cálculo L y C filtro pi'.B$8]) -> 39.66422248568 | E761: of:=POWER(IMABS(IMSQRT(1-POWER([.C761];2)));-1)*SQRT([$'Cálculo L y C filtro pi'.B$18]/[$'Cálculo L y C filtro pi'.B$17]) -> 793.2844497136
A762: 759 | B762: of:=2*PI()*[.A762] -> 4768.93764814931 | C762: of:=[.B762]/(2*PI()*[$Descripción.B$10]) -> 15.18 | D762: of:=POWER(IMABS(IMSQRT(1-POWER([.C762];2)));-1)*SQRT([$'Cálculo L y C filtro pi'.B$9]/[$'Cálculo L y C filtro pi'.B$8]) -> 39.6117360340349 | E762: of:=POWER(IMABS(IMSQRT(1-POWER([.C762];2)));-1)*SQRT([$'Cálculo L y C filtro pi'.B$18]/[$'Cálculo L y C filtro pi'.B$17]) -> 792.234720680698
A763: 760 | B763: of:=2*PI()*[.A763] -> 4775.22083345649 | C763: of:=[.B763]/(2*PI()*[$Descripción.B$10]) -> 15.2 | D763: of:=POWER(IMABS(IMSQRT(1-POWER([.C763];2)));-1)*SQRT([$'Cálculo L y C filtro pi'.B$9]/[$'Cálculo L y C filtro pi'.B$8]) -> 39.5593886064619 | E763: of:=POWER(IMABS(IMSQRT(1-POWER([.C763];2)));-1)*SQRT([$'Cálculo L y C filtro pi'.B$18]/[$'Cálculo L y C filtro pi'.B$17]) -> 791.187772129238
A764: 761 | B764: of:=2*PI()*[.A764] -> 4781.50401876367 | C764: of:=[.B764]/(2*PI()*[$Descripción.B$10]) -> 15.22 | D764: of:=POWER(IMABS(IMSQRT(1-POWER([.C764];2)));-1)*SQRT([$'Cálculo L y C filtro pi'.B$9]/[$'Cálculo L y C filtro pi'.B$8]) -> 39.5071796501461 | E764: of:=POWER(IMABS(IMSQRT(1-POWER([.C764];2)));-1)*SQRT([$'Cálculo L y C filtro pi'.B$18]/[$'Cálculo L y C filtro pi'.B$17]) -> 790.143593002922
A765: 762 | B765: of:=2*PI()*[.A765] -> 4787.78720407084 | C765: of:=[.B765]/(2*PI()*[$Descripción.B$10]) -> 15.24 | D765: of:=POWER(IMABS(IMSQRT(1-POWER([.C765];2)));-1)*SQRT([$'Cálculo L y C filtro pi'.B$9]/[$'Cálculo L y C filtro pi'.B$8]) -> 39.4551086152063 | E765: of:=POWER(IMABS(IMSQRT(1-POWER([.C765];2)));-1)*SQRT([$'Cálculo L y C filtro pi'.B$18]/[$'Cálculo L y C filtro pi'.B$17]) -> 789.102172304127
A766: 763 | B766: of:=2*PI()*[.A766] -> 4794.07038937802 | C766: of:=[.B766]/(2*PI()*[$Descripción.B$10]) -> 15.26 | D766: of:=POWER(IMABS(IMSQRT(1-POWER([.C766];2)));-1)*SQRT([$'Cálculo L y C filtro pi'.B$9]/[$'Cálculo L y C filtro pi'.B$8]) -> 39.4031749546746 | E766: of:=POWER(IMABS(IMSQRT(1-POWER([.C766];2)));-1)*SQRT([$'Cálculo L y C filtro pi'.B$18]/[$'Cálculo L y C filtro pi'.B$17]) -> 788.063499093492
A767: 764 | B767: of:=2*PI()*[.A767] -> 4800.3535746852 | C767: of:=[.B767]/(2*PI()*[$Descripción.B$10]) -> 15.28 | D767: of:=POWER(IMABS(IMSQRT(1-POWER([.C767];2)));-1)*SQRT([$'Cálculo L y C filtro pi'.B$9]/[$'Cálculo L y C filtro pi'.B$8]) -> 39.3513781244784 | E767: of:=POWER(IMABS(IMSQRT(1-POWER([.C767];2)));-1)*SQRT([$'Cálculo L y C filtro pi'.B$18]/[$'Cálculo L y C filtro pi'.B$17]) -> 787.027562489568
A768: 765 | B768: of:=2*PI()*[.A768] -> 4806.63675999238 | C768: of:=[.B768]/(2*PI()*[$Descripción.B$10]) -> 15.3 | D768: of:=POWER(IMABS(IMSQRT(1-POWER([.C768];2)));-1)*SQRT([$'Cálculo L y C filtro pi'.B$9]/[$'Cálculo L y C filtro pi'.B$8]) -> 39.2997175834193 | E768: of:=POWER(IMABS(IMSQRT(1-POWER([.C768];2)));-1)*SQRT([$'Cálculo L y C filtro pi'.B$18]/[$'Cálculo L y C filtro pi'.B$17]) -> 785.994351668387
A769: 766 | B769: of:=2*PI()*[.A769] -> 4812.91994529956 | C769: of:=[.B769]/(2*PI()*[$Descripción.B$10]) -> 15.32 | D769: of:=POWER(IMABS(IMSQRT(1-POWER([.C769];2)));-1)*SQRT([$'Cálculo L y C filtro pi'.B$9]/[$'Cálculo L y C filtro pi'.B$8]) -> 39.2481927931561 | E769: of:=POWER(IMABS(IMSQRT(1-POWER([.C769];2)));-1)*SQRT([$'Cálculo L y C filtro pi'.B$18]/[$'Cálculo L y C filtro pi'.B$17]) -> 784.963855863123
A770: 767 | B770: of:=2*PI()*[.A770] -> 4819.20313060674 | C770: of:=[.B770]/(2*PI()*[$Descripción.B$10]) -> 15.34 | D770: of:=POWER(IMABS(IMSQRT(1-POWER([.C770];2)));-1)*SQRT([$'Cálculo L y C filtro pi'.B$9]/[$'Cálculo L y C filtro pi'.B$8]) -> 39.1968032181848 | E770: of:=POWER(IMABS(IMSQRT(1-POWER([.C770];2)));-1)*SQRT([$'Cálculo L y C filtro pi'.B$18]/[$'Cálculo L y C filtro pi'.B$17]) -> 783.936064363695
A771: 768 | B771: of:=2*PI()*[.A771] -> 4825.48631591392 | C771: of:=[.B771]/(2*PI()*[$Descripción.B$10]) -> 15.36 | D771: of:=POWER(IMABS(IMSQRT(1-POWER([.C771];2)));-1)*SQRT([$'Cálculo L y C filtro pi'.B$9]/[$'Cálculo L y C filtro pi'.B$8]) -> 39.1455483258202 | E771: of:=POWER(IMABS(IMSQRT(1-POWER([.C771];2)));-1)*SQRT([$'Cálculo L y C filtro pi'.B$18]/[$'Cálculo L y C filtro pi'.B$17]) -> 782.910966516404
A772: 769 | B772: of:=2*PI()*[.A772] -> 4831.7695012211 | C772: of:=[.B772]/(2*PI()*[$Descripción.B$10]) -> 15.38 | D772: of:=POWER(IMABS(IMSQRT(1-POWER([.C772];2)));-1)*SQRT([$'Cálculo L y C filtro pi'.B$9]/[$'Cálculo L y C filtro pi'.B$8]) -> 39.0944275861767 | E772: of:=POWER(IMABS(IMSQRT(1-POWER([.C772];2)));-1)*SQRT([$'Cálculo L y C filtro pi'.B$18]/[$'Cálculo L y C filtro pi'.B$17]) -> 781.888551723533
A773: 770 | B773: of:=2*PI()*[.A773] -> 4838.05268652828 | C773: of:=[.B773]/(2*PI()*[$Descripción.B$10]) -> 15.4 | D773: of:=POWER(IMABS(IMSQRT(1-POWER([.C773];2)));-1)*SQRT([$'Cálculo L y C filtro pi'.B$9]/[$'Cálculo L y C filtro pi'.B$8]) -> 39.0434404721516 | E773: of:=POWER(IMABS(IMSQRT(1-POWER([.C773];2)));-1)*SQRT([$'Cálculo L y C filtro pi'.B$18]/[$'Cálculo L y C filtro pi'.B$17]) -> 780.868809443032
A774: 771 | B774: of:=2*PI()*[.A774] -> 4844.33587183546 | C774: of:=[.B774]/(2*PI()*[$Descripción.B$10]) -> 15.42 | D774: of:=POWER(IMABS(IMSQRT(1-POWER([.C774];2)));-1)*SQRT([$'Cálculo L y C filtro pi'.B$9]/[$'Cálculo L y C filtro pi'.B$8]) -> 38.9925864594046 | E774: of:=POWER(IMABS(IMSQRT(1-POWER([.C774];2)));-1)*SQRT([$'Cálculo L y C filtro pi'.B$18]/[$'Cálculo L y C filtro pi'.B$17]) -> 779.851729188093
A775: 772 | B775: of:=2*PI()*[.A775] -> 4850.61905714264 | C775: of:=[.B775]/(2*PI()*[$Descripción.B$10]) -> 15.44 | D775: of:=POWER(IMABS(IMSQRT(1-POWER([.C775];2)));-1)*SQRT([$'Cálculo L y C filtro pi'.B$9]/[$'Cálculo L y C filtro pi'.B$8]) -> 38.9418650263413 | E775: of:=POWER(IMABS(IMSQRT(1-POWER([.C775];2)));-1)*SQRT([$'Cálculo L y C filtro pi'.B$18]/[$'Cálculo L y C filtro pi'.B$17]) -> 778.837300526827
A776: 773 | B776: of:=2*PI()*[.A776] -> 4856.90224244982 | C776: of:=[.B776]/(2*PI()*[$Descripción.B$10]) -> 15.46 | D776: of:=POWER(IMABS(IMSQRT(1-POWER([.C776];2)));-1)*SQRT([$'Cálculo L y C filtro pi'.B$9]/[$'Cálculo L y C filtro pi'.B$8]) -> 38.8912756540948 | E776: of:=POWER(IMABS(IMSQRT(1-POWER([.C776];2)));-1)*SQRT([$'Cálculo L y C filtro pi'.B$18]/[$'Cálculo L y C filtro pi'.B$17]) -> 777.825513081897
A777: 774 | B777: of:=2*PI()*[.A777] -> 4863.185427757 | C777: of:=[.B777]/(2*PI()*[$Descripción.B$10]) -> 15.48 | D777: of:=POWER(IMABS(IMSQRT(1-POWER([.C777];2)));-1)*SQRT([$'Cálculo L y C filtro pi'.B$9]/[$'Cálculo L y C filtro pi'.B$8]) -> 38.8408178265078 | E777: of:=POWER(IMABS(IMSQRT(1-POWER([.C777];2)));-1)*SQRT([$'Cálculo L y C filtro pi'.B$18]/[$'Cálculo L y C filtro pi'.B$17]) -> 776.816356530156
A778: 775 | B778: of:=2*PI()*[.A778] -> 4869.46861306418 | C778: of:=[.B778]/(2*PI()*[$Descripción.B$10]) -> 15.5 | D778: of:=POWER(IMABS(IMSQRT(1-POWER([.C778];2)));-1)*SQRT([$'Cálculo L y C filtro pi'.B$9]/[$'Cálculo L y C filtro pi'.B$8]) -> 38.7904910301142 | E778: of:=POWER(IMABS(IMSQRT(1-POWER([.C778];2)));-1)*SQRT([$'Cálculo L y C filtro pi'.B$18]/[$'Cálculo L y C filtro pi'.B$17]) -> 775.809820602284
A779: 776 | B779: of:=2*PI()*[.A779] -> 4875.75179837136 | C779: of:=[.B779]/(2*PI()*[$Descripción.B$10]) -> 15.52 | D779: of:=POWER(IMABS(IMSQRT(1-POWER([.C779];2)));-1)*SQRT([$'Cálculo L y C filtro pi'.B$9]/[$'Cálculo L y C filtro pi'.B$8]) -> 38.7402947541229 | E779: of:=POWER(IMABS(IMSQRT(1-POWER([.C779];2)));-1)*SQRT([$'Cálculo L y C filtro pi'.B$18]/[$'Cálculo L y C filtro pi'.B$17]) -> 774.805895082457
A780: 777 | B780: of:=2*PI()*[.A780] -> 4882.03498367854 | C780: of:=[.B780]/(2*PI()*[$Descripción.B$10]) -> 15.54 | D780: of:=POWER(IMABS(IMSQRT(1-POWER([.C780];2)));-1)*SQRT([$'Cálculo L y C filtro pi'.B$9]/[$'Cálculo L y C filtro pi'.B$8]) -> 38.6902284903995 | E780: of:=POWER(IMABS(IMSQRT(1-POWER([.C780];2)));-1)*SQRT([$'Cálculo L y C filtro pi'.B$18]/[$'Cálculo L y C filtro pi'.B$17]) -> 773.80456980799
A781: 778 | B781: of:=2*PI()*[.A781] -> 4888.31816898572 | C781: of:=[.B781]/(2*PI()*[$Descripción.B$10]) -> 15.56 | D781: of:=POWER(IMABS(IMSQRT(1-POWER([.C781];2)));-1)*SQRT([$'Cálculo L y C filtro pi'.B$9]/[$'Cálculo L y C filtro pi'.B$8]) -> 38.6402917334492 | E781: of:=POWER(IMABS(IMSQRT(1-POWER([.C781];2)));-1)*SQRT([$'Cálculo L y C filtro pi'.B$18]/[$'Cálculo L y C filtro pi'.B$17]) -> 772.805834668985
A782: 779 | B782: of:=2*PI()*[.A782] -> 4894.6013542929 | C782: of:=[.B782]/(2*PI()*[$Descripción.B$10]) -> 15.58 | D782: of:=POWER(IMABS(IMSQRT(1-POWER([.C782];2)));-1)*SQRT([$'Cálculo L y C filtro pi'.B$9]/[$'Cálculo L y C filtro pi'.B$8]) -> 38.5904839803993 | E782: of:=POWER(IMABS(IMSQRT(1-POWER([.C782];2)));-1)*SQRT([$'Cálculo L y C filtro pi'.B$18]/[$'Cálculo L y C filtro pi'.B$17]) -> 771.809679607987
A783: 780 | B783: of:=2*PI()*[.A783] -> 4900.88453960008 | C783: of:=[.B783]/(2*PI()*[$Descripción.B$10]) -> 15.6 | D783: of:=POWER(IMABS(IMSQRT(1-POWER([.C783];2)));-1)*SQRT([$'Cálculo L y C filtro pi'.B$9]/[$'Cálculo L y C filtro pi'.B$8]) -> 38.5408047309831 | E783: of:=POWER(IMABS(IMSQRT(1-POWER([.C783];2)));-1)*SQRT([$'Cálculo L y C filtro pi'.B$18]/[$'Cálculo L y C filtro pi'.B$17]) -> 770.816094619662
A784: 781 | B784: of:=2*PI()*[.A784] -> 4907.16772490726 | C784: of:=[.B784]/(2*PI()*[$Descripción.B$10]) -> 15.62 | D784: of:=POWER(IMABS(IMSQRT(1-POWER([.C784];2)));-1)*SQRT([$'Cálculo L y C filtro pi'.B$9]/[$'Cálculo L y C filtro pi'.B$8]) -> 38.4912534875219 | E784: of:=POWER(IMABS(IMSQRT(1-POWER([.C784];2)));-1)*SQRT([$'Cálculo L y C filtro pi'.B$18]/[$'Cálculo L y C filtro pi'.B$17]) -> 769.825069750439
A785: 782 | B785: of:=2*PI()*[.A785] -> 4913.45091021444 | C785: of:=[.B785]/(2*PI()*[$Descripción.B$10]) -> 15.64 | D785: of:=POWER(IMABS(IMSQRT(1-POWER([.C785];2)));-1)*SQRT([$'Cálculo L y C filtro pi'.B$9]/[$'Cálculo L y C filtro pi'.B$8]) -> 38.4418297549092 | E785: of:=POWER(IMABS(IMSQRT(1-POWER([.C785];2)));-1)*SQRT([$'Cálculo L y C filtro pi'.B$18]/[$'Cálculo L y C filtro pi'.B$17]) -> 768.836595098185
A786: 783 | B786: of:=2*PI()*[.A786] -> 4919.73409552162 | C786: of:=[.B786]/(2*PI()*[$Descripción.B$10]) -> 15.66 | D786: of:=POWER(IMABS(IMSQRT(1-POWER([.C786];2)));-1)*SQRT([$'Cálculo L y C filtro pi'.B$9]/[$'Cálculo L y C filtro pi'.B$8]) -> 38.3925330405934 | E786: of:=POWER(IMABS(IMSQRT(1-POWER([.C786];2)));-1)*SQRT([$'Cálculo L y C filtro pi'.B$18]/[$'Cálculo L y C filtro pi'.B$17]) -> 767.850660811868
A787: 784 | B787: of:=2*PI()*[.A787] -> 4926.0172808288 | C787: of:=[.B787]/(2*PI()*[$Descripción.B$10]) -> 15.68 | D787: of:=POWER(IMABS(IMSQRT(1-POWER([.C787];2)));-1)*SQRT([$'Cálculo L y C filtro pi'.B$9]/[$'Cálculo L y C filtro pi'.B$8]) -> 38.3433628545615 | E787: of:=POWER(IMABS(IMSQRT(1-POWER([.C787];2)));-1)*SQRT([$'Cálculo L y C filtro pi'.B$18]/[$'Cálculo L y C filtro pi'.B$17]) -> 766.86725709123
A788: 785 | B788: of:=2*PI()*[.A788] -> 4932.30046613598 | C788: of:=[.B788]/(2*PI()*[$Descripción.B$10]) -> 15.7 | D788: of:=POWER(IMABS(IMSQRT(1-POWER([.C788];2)));-1)*SQRT([$'Cálculo L y C filtro pi'.B$9]/[$'Cálculo L y C filtro pi'.B$8]) -> 38.2943187093231 | E788: of:=POWER(IMABS(IMSQRT(1-POWER([.C788];2)));-1)*SQRT([$'Cálculo L y C filtro pi'.B$18]/[$'Cálculo L y C filtro pi'.B$17]) -> 765.886374186462
A789: 786 | B789: of:=2*PI()*[.A789] -> 4938.58365144316 | C789: of:=[.B789]/(2*PI()*[$Descripción.B$10]) -> 15.72 | D789: of:=POWER(IMABS(IMSQRT(1-POWER([.C789];2)));-1)*SQRT([$'Cálculo L y C filtro pi'.B$9]/[$'Cálculo L y C filtro pi'.B$8]) -> 38.2454001198936 | E789: of:=POWER(IMABS(IMSQRT(1-POWER([.C789];2)));-1)*SQRT([$'Cálculo L y C filtro pi'.B$18]/[$'Cálculo L y C filtro pi'.B$17]) -> 764.908002397873
A790: 787 | B790: of:=2*PI()*[.A790] -> 4944.86683675033 | C790: of:=[.B790]/(2*PI()*[$Descripción.B$10]) -> 15.74 | D790: of:=POWER(IMABS(IMSQRT(1-POWER([.C790];2)));-1)*SQRT([$'Cálculo L y C filtro pi'.B$9]/[$'Cálculo L y C filtro pi'.B$8]) -> 38.1966066037786 | E790: of:=POWER(IMABS(IMSQRT(1-POWER([.C790];2)));-1)*SQRT([$'Cálculo L y C filtro pi'.B$18]/[$'Cálculo L y C filtro pi'.B$17]) -> 763.932132075571
A791: 788 | B791: of:=2*PI()*[.A791] -> 4951.15002205751 | C791: of:=[.B791]/(2*PI()*[$Descripción.B$10]) -> 15.76 | D791: of:=POWER(IMABS(IMSQRT(1-POWER([.C791];2)));-1)*SQRT([$'Cálculo L y C filtro pi'.B$9]/[$'Cálculo L y C filtro pi'.B$8]) -> 38.1479376809573 | E791: of:=POWER(IMABS(IMSQRT(1-POWER([.C791];2)));-1)*SQRT([$'Cálculo L y C filtro pi'.B$18]/[$'Cálculo L y C filtro pi'.B$17]) -> 762.958753619146
A792: 789 | B792: of:=2*PI()*[.A792] -> 4957.43320736469 | C792: of:=[.B792]/(2*PI()*[$Descripción.B$10]) -> 15.78 | D792: of:=POWER(IMABS(IMSQRT(1-POWER([.C792];2)));-1)*SQRT([$'Cálculo L y C filtro pi'.B$9]/[$'Cálculo L y C filtro pi'.B$8]) -> 38.0993928738672 | E792: of:=POWER(IMABS(IMSQRT(1-POWER([.C792];2)));-1)*SQRT([$'Cálculo L y C filtro pi'.B$18]/[$'Cálculo L y C filtro pi'.B$17]) -> 761.987857477345
A793: 790 | B793: of:=2*PI()*[.A793] -> 4963.71639267187 | C793: of:=[.B793]/(2*PI()*[$Descripción.B$10]) -> 15.8 | D793: of:=POWER(IMABS(IMSQRT(1-POWER([.C793];2)));-1)*SQRT([$'Cálculo L y C filtro pi'.B$9]/[$'Cálculo L y C filtro pi'.B$8]) -> 38.0509717073881 | E793: of:=POWER(IMABS(IMSQRT(1-POWER([.C793];2)));-1)*SQRT([$'Cálculo L y C filtro pi'.B$18]/[$'Cálculo L y C filtro pi'.B$17]) -> 761.019434147763
A794: 791 | B794: of:=2*PI()*[.A794] -> 4969.99957797905 | C794: of:=[.B794]/(2*PI()*[$Descripción.B$10]) -> 15.82 | D794: of:=POWER(IMABS(IMSQRT(1-POWER([.C794];2)));-1)*SQRT([$'Cálculo L y C filtro pi'.B$9]/[$'Cálculo L y C filtro pi'.B$8]) -> 38.0026737088264 | E794: of:=POWER(IMABS(IMSQRT(1-POWER([.C794];2)));-1)*SQRT([$'Cálculo L y C filtro pi'.B$18]/[$'Cálculo L y C filtro pi'.B$17]) -> 760.053474176529
A795: 792 | B795: of:=2*PI()*[.A795] -> 4976.28276328623 | C795: of:=[.B795]/(2*PI()*[$Descripción.B$10]) -> 15.84 | D795: of:=POWER(IMABS(IMSQRT(1-POWER([.C795];2)));-1)*SQRT([$'Cálculo L y C filtro pi'.B$9]/[$'Cálculo L y C filtro pi'.B$8]) -> 37.9544984079002 | E795: of:=POWER(IMABS(IMSQRT(1-POWER([.C795];2)));-1)*SQRT([$'Cálculo L y C filtro pi'.B$18]/[$'Cálculo L y C filtro pi'.B$17]) -> 759.089968158004
A796: 793 | B796: of:=2*PI()*[.A796] -> 4982.56594859341 | C796: of:=[.B796]/(2*PI()*[$Descripción.B$10]) -> 15.86 | D796: of:=POWER(IMABS(IMSQRT(1-POWER([.C796];2)));-1)*SQRT([$'Cálculo L y C filtro pi'.B$9]/[$'Cálculo L y C filtro pi'.B$8]) -> 37.9064453367225 | E796: of:=POWER(IMABS(IMSQRT(1-POWER([.C796];2)));-1)*SQRT([$'Cálculo L y C filtro pi'.B$18]/[$'Cálculo L y C filtro pi'.B$17]) -> 758.12890673445
A797: 794 | B797: of:=2*PI()*[.A797] -> 4988.84913390059 | C797: of:=[.B797]/(2*PI()*[$Descripción.B$10]) -> 15.88 | D797: of:=POWER(IMABS(IMSQRT(1-POWER([.C797];2)));-1)*SQRT([$'Cálculo L y C filtro pi'.B$9]/[$'Cálculo L y C filtro pi'.B$8]) -> 37.858514029788 | E797: of:=POWER(IMABS(IMSQRT(1-POWER([.C797];2)));-1)*SQRT([$'Cálculo L y C filtro pi'.B$18]/[$'Cálculo L y C filtro pi'.B$17]) -> 757.17028059576
A798: 795 | B798: of:=2*PI()*[.A798] -> 4995.13231920777 | C798: of:=[.B798]/(2*PI()*[$Descripción.B$10]) -> 15.9 | D798: of:=POWER(IMABS(IMSQRT(1-POWER([.C798];2)));-1)*SQRT([$'Cálculo L y C filtro pi'.B$9]/[$'Cálculo L y C filtro pi'.B$8]) -> 37.8107040239557 | E798: of:=POWER(IMABS(IMSQRT(1-POWER([.C798];2)));-1)*SQRT([$'Cálculo L y C filtro pi'.B$18]/[$'Cálculo L y C filtro pi'.B$17]) -> 756.214080479115
A799: 796 | B799: of:=2*PI()*[.A799] -> 5001.41550451495 | C799: of:=[.B799]/(2*PI()*[$Descripción.B$10]) -> 15.92 | D799: of:=POWER(IMABS(IMSQRT(1-POWER([.C799];2)));-1)*SQRT([$'Cálculo L y C filtro pi'.B$9]/[$'Cálculo L y C filtro pi'.B$8]) -> 37.763014858436 | E799: of:=POWER(IMABS(IMSQRT(1-POWER([.C799];2)));-1)*SQRT([$'Cálculo L y C filtro pi'.B$18]/[$'Cálculo L y C filtro pi'.B$17]) -> 755.26029716872
A800: 797 | B800: of:=2*PI()*[.A800] -> 5007.69868982213 | C800: of:=[.B800]/(2*PI()*[$Descripción.B$10]) -> 15.94 | D800: of:=POWER(IMABS(IMSQRT(1-POWER([.C800];2)));-1)*SQRT([$'Cálculo L y C filtro pi'.B$9]/[$'Cálculo L y C filtro pi'.B$8]) -> 37.7154460747738 | E800: of:=POWER(IMABS(IMSQRT(1-POWER([.C800];2)));-1)*SQRT([$'Cálculo L y C filtro pi'.B$18]/[$'Cálculo L y C filtro pi'.B$17]) -> 754.308921495476
A801: 798 | B801: of:=2*PI()*[.A801] -> 5013.98187512931 | C801: of:=[.B801]/(2*PI()*[$Descripción.B$10]) -> 15.96 | D801: of:=POWER(IMABS(IMSQRT(1-POWER([.C801];2)));-1)*SQRT([$'Cálculo L y C filtro pi'.B$9]/[$'Cálculo L y C filtro pi'.B$8]) -> 37.6679972168354 | E801: of:=POWER(IMABS(IMSQRT(1-POWER([.C801];2)));-1)*SQRT([$'Cálculo L y C filtro pi'.B$18]/[$'Cálculo L y C filtro pi'.B$17]) -> 753.359944336708
A802: 799 | B802: of:=2*PI()*[.A802] -> 5020.26506043649 | C802: of:=[.B802]/(2*PI()*[$Descripción.B$10]) -> 15.98 | D802: of:=POWER(IMABS(IMSQRT(1-POWER([.C802];2)));-1)*SQRT([$'Cálculo L y C filtro pi'.B$9]/[$'Cálculo L y C filtro pi'.B$8]) -> 37.6206678307927 | E802: of:=POWER(IMABS(IMSQRT(1-POWER([.C802];2)));-1)*SQRT([$'Cálculo L y C filtro pi'.B$18]/[$'Cálculo L y C filtro pi'.B$17]) -> 752.413356615855
A803: 800 | B803: of:=2*PI()*[.A803] -> 5026.54824574367 | C803: of:=[.B803]/(2*PI()*[$Descripción.B$10]) -> 16 | D803: of:=POWER(IMABS(IMSQRT(1-POWER([.C803];2)));-1)*SQRT([$'Cálculo L y C filtro pi'.B$9]/[$'Cálculo L y C filtro pi'.B$8]) -> 37.573457465109 | E803: of:=POWER(IMABS(IMSQRT(1-POWER([.C803];2)));-1)*SQRT([$'Cálculo L y C filtro pi'.B$18]/[$'Cálculo L y C filtro pi'.B$17]) -> 751.46914930218
A804: 801 | B804: of:=2*PI()*[.A804] -> 5032.83143105085 | C804: of:=[.B804]/(2*PI()*[$Descripción.B$10]) -> 16.02 | D804: of:=POWER(IMABS(IMSQRT(1-POWER([.C804];2)));-1)*SQRT([$'Cálculo L y C filtro pi'.B$9]/[$'Cálculo L y C filtro pi'.B$8]) -> 37.5263656705245 | E804: of:=POWER(IMABS(IMSQRT(1-POWER([.C804];2)));-1)*SQRT([$'Cálculo L y C filtro pi'.B$18]/[$'Cálculo L y C filtro pi'.B$17]) -> 750.527313410491
A805: 802 | B805: of:=2*PI()*[.A805] -> 5039.11461635803 | C805: of:=[.B805]/(2*PI()*[$Descripción.B$10]) -> 16.04 | D805: of:=POWER(IMABS(IMSQRT(1-POWER([.C805];2)));-1)*SQRT([$'Cálculo L y C filtro pi'.B$9]/[$'Cálculo L y C filtro pi'.B$8]) -> 37.4793920000423 | E805: of:=POWER(IMABS(IMSQRT(1-POWER([.C805];2)));-1)*SQRT([$'Cálculo L y C filtro pi'.B$18]/[$'Cálculo L y C filtro pi'.B$17]) -> 749.587840000846
A806: 803 | B806: of:=2*PI()*[.A806] -> 5045.39780166521 | C806: of:=[.B806]/(2*PI()*[$Descripción.B$10]) -> 16.06 | D806: of:=POWER(IMABS(IMSQRT(1-POWER([.C806];2)));-1)*SQRT([$'Cálculo L y C filtro pi'.B$9]/[$'Cálculo L y C filtro pi'.B$8]) -> 37.4325360089133 | E806: of:=POWER(IMABS(IMSQRT(1-POWER([.C806];2)));-1)*SQRT([$'Cálculo L y C filtro pi'.B$18]/[$'Cálculo L y C filtro pi'.B$17]) -> 748.650720178266
A807: 804 | B807: of:=2*PI()*[.A807] -> 5051.68098697239 | C807: of:=[.B807]/(2*PI()*[$Descripción.B$10]) -> 16.08 | D807: of:=POWER(IMABS(IMSQRT(1-POWER([.C807];2)));-1)*SQRT([$'Cálculo L y C filtro pi'.B$9]/[$'Cálculo L y C filtro pi'.B$8]) -> 37.3857972546225 | E807: of:=POWER(IMABS(IMSQRT(1-POWER([.C807];2)));-1)*SQRT([$'Cálculo L y C filtro pi'.B$18]/[$'Cálculo L y C filtro pi'.B$17]) -> 747.715945092451
A808: 805 | B808: of:=2*PI()*[.A808] -> 5057.96417227957 | C808: of:=[.B808]/(2*PI()*[$Descripción.B$10]) -> 16.1 | D808: of:=POWER(IMABS(IMSQRT(1-POWER([.C808];2)));-1)*SQRT([$'Cálculo L y C filtro pi'.B$9]/[$'Cálculo L y C filtro pi'.B$8]) -> 37.3391752968758 | E808: of:=POWER(IMABS(IMSQRT(1-POWER([.C808];2)));-1)*SQRT([$'Cálculo L y C filtro pi'.B$18]/[$'Cálculo L y C filtro pi'.B$17]) -> 746.783505937516
A809: 806 | B809: of:=2*PI()*[.A809] -> 5064.24735758675 | C809: of:=[.B809]/(2*PI()*[$Descripción.B$10]) -> 16.12 | D809: of:=POWER(IMABS(IMSQRT(1-POWER([.C809];2)));-1)*SQRT([$'Cálculo L y C filtro pi'.B$9]/[$'Cálculo L y C filtro pi'.B$8]) -> 37.2926696975842 | E809: of:=POWER(IMABS(IMSQRT(1-POWER([.C809];2)));-1)*SQRT([$'Cálculo L y C filtro pi'.B$18]/[$'Cálculo L y C filtro pi'.B$17]) -> 745.853393951685
A810: 807 | B810: of:=2*PI()*[.A810] -> 5070.53054289393 | C810: of:=[.B810]/(2*PI()*[$Descripción.B$10]) -> 16.14 | D810: of:=POWER(IMABS(IMSQRT(1-POWER([.C810];2)));-1)*SQRT([$'Cálculo L y C filtro pi'.B$9]/[$'Cálculo L y C filtro pi'.B$8]) -> 37.246280020852 | E810: of:=POWER(IMABS(IMSQRT(1-POWER([.C810];2)));-1)*SQRT([$'Cálculo L y C filtro pi'.B$18]/[$'Cálculo L y C filtro pi'.B$17]) -> 744.92560041704
A811: 808 | B811: of:=2*PI()*[.A811] -> 5076.81372820111 | C811: of:=[.B811]/(2*PI()*[$Descripción.B$10]) -> 16.16 | D811: of:=POWER(IMABS(IMSQRT(1-POWER([.C811];2)));-1)*SQRT([$'Cálculo L y C filtro pi'.B$9]/[$'Cálculo L y C filtro pi'.B$8]) -> 37.2000058329613 | E811: of:=POWER(IMABS(IMSQRT(1-POWER([.C811];2)));-1)*SQRT([$'Cálculo L y C filtro pi'.B$18]/[$'Cálculo L y C filtro pi'.B$17]) -> 744.000116659226
A812: 809 | B812: of:=2*PI()*[.A812] -> 5083.09691350829 | C812: of:=[.B812]/(2*PI()*[$Descripción.B$10]) -> 16.18 | D812: of:=POWER(IMABS(IMSQRT(1-POWER([.C812];2)));-1)*SQRT([$'Cálculo L y C filtro pi'.B$9]/[$'Cálculo L y C filtro pi'.B$8]) -> 37.1538467023601 | E812: of:=POWER(IMABS(IMSQRT(1-POWER([.C812];2)));-1)*SQRT([$'Cálculo L y C filtro pi'.B$18]/[$'Cálculo L y C filtro pi'.B$17]) -> 743.076934047201
A813: 810 | B813: of:=2*PI()*[.A813] -> 5089.38009881546 | C813: of:=[.B813]/(2*PI()*[$Descripción.B$10]) -> 16.2 | D813: of:=POWER(IMABS(IMSQRT(1-POWER([.C813];2)));-1)*SQRT([$'Cálculo L y C filtro pi'.B$9]/[$'Cálculo L y C filtro pi'.B$8]) -> 37.107802199647 | E813: of:=POWER(IMABS(IMSQRT(1-POWER([.C813];2)));-1)*SQRT([$'Cálculo L y C filtro pi'.B$18]/[$'Cálculo L y C filtro pi'.B$17]) -> 742.15604399294
A814: 811 | B814: of:=2*PI()*[.A814] -> 5095.66328412264 | C814: of:=[.B814]/(2*PI()*[$Descripción.B$10]) -> 16.22 | D814: of:=POWER(IMABS(IMSQRT(1-POWER([.C814];2)));-1)*SQRT([$'Cálculo L y C filtro pi'.B$9]/[$'Cálculo L y C filtro pi'.B$8]) -> 37.0618718975593 | E814: of:=POWER(IMABS(IMSQRT(1-POWER([.C814];2)));-1)*SQRT([$'Cálculo L y C filtro pi'.B$18]/[$'Cálculo L y C filtro pi'.B$17]) -> 741.237437951187
A815: 812 | B815: of:=2*PI()*[.A815] -> 5101.94646942982 | C815: of:=[.B815]/(2*PI()*[$Descripción.B$10]) -> 16.24 | D815: of:=POWER(IMABS(IMSQRT(1-POWER([.C815];2)));-1)*SQRT([$'Cálculo L y C filtro pi'.B$9]/[$'Cálculo L y C filtro pi'.B$8]) -> 37.016055370959 | E815: of:=POWER(IMABS(IMSQRT(1-POWER([.C815];2)));-1)*SQRT([$'Cálculo L y C filtro pi'.B$18]/[$'Cálculo L y C filtro pi'.B$17]) -> 740.321107419181
A816: 813 | B816: of:=2*PI()*[.A816] -> 5108.229654737 | C816: of:=[.B816]/(2*PI()*[$Descripción.B$10]) -> 16.26 | D816: of:=POWER(IMABS(IMSQRT(1-POWER([.C816];2)));-1)*SQRT([$'Cálculo L y C filtro pi'.B$9]/[$'Cálculo L y C filtro pi'.B$8]) -> 36.9703521968193 | E816: of:=POWER(IMABS(IMSQRT(1-POWER([.C816];2)));-1)*SQRT([$'Cálculo L y C filtro pi'.B$18]/[$'Cálculo L y C filtro pi'.B$17]) -> 739.407043936385
A817: 814 | B817: of:=2*PI()*[.A817] -> 5114.51284004418 | C817: of:=[.B817]/(2*PI()*[$Descripción.B$10]) -> 16.28 | D817: of:=POWER(IMABS(IMSQRT(1-POWER([.C817];2)));-1)*SQRT([$'Cálculo L y C filtro pi'.B$9]/[$'Cálculo L y C filtro pi'.B$8]) -> 36.924761954212 | E817: of:=POWER(IMABS(IMSQRT(1-POWER([.C817];2)));-1)*SQRT([$'Cálculo L y C filtro pi'.B$18]/[$'Cálculo L y C filtro pi'.B$17]) -> 738.49523908424
A818: 815 | B818: of:=2*PI()*[.A818] -> 5120.79602535136 | C818: of:=[.B818]/(2*PI()*[$Descripción.B$10]) -> 16.3 | D818: of:=POWER(IMABS(IMSQRT(1-POWER([.C818];2)));-1)*SQRT([$'Cálculo L y C filtro pi'.B$9]/[$'Cálculo L y C filtro pi'.B$8]) -> 36.8792842242944 | E818: of:=POWER(IMABS(IMSQRT(1-POWER([.C818];2)));-1)*SQRT([$'Cálculo L y C filtro pi'.B$18]/[$'Cálculo L y C filtro pi'.B$17]) -> 737.585684485889
A819: 816 | B819: of:=2*PI()*[.A819] -> 5127.07921065854 | C819: of:=[.B819]/(2*PI()*[$Descripción.B$10]) -> 16.32 | D819: of:=POWER(IMABS(IMSQRT(1-POWER([.C819];2)));-1)*SQRT([$'Cálculo L y C filtro pi'.B$9]/[$'Cálculo L y C filtro pi'.B$8]) -> 36.8339185902964 | E819: of:=POWER(IMABS(IMSQRT(1-POWER([.C819];2)));-1)*SQRT([$'Cálculo L y C filtro pi'.B$18]/[$'Cálculo L y C filtro pi'.B$17]) -> 736.678371805929
A820: 817 | B820: of:=2*PI()*[.A820] -> 5133.36239596572 | C820: of:=[.B820]/(2*PI()*[$Descripción.B$10]) -> 16.34 | D820: of:=POWER(IMABS(IMSQRT(1-POWER([.C820];2)));-1)*SQRT([$'Cálculo L y C filtro pi'.B$9]/[$'Cálculo L y C filtro pi'.B$8]) -> 36.7886646375073 | E820: of:=POWER(IMABS(IMSQRT(1-POWER([.C820];2)));-1)*SQRT([$'Cálculo L y C filtro pi'.B$18]/[$'Cálculo L y C filtro pi'.B$17]) -> 735.773292750146
A821: 818 | B821: of:=2*PI()*[.A821] -> 5139.6455812729 | C821: of:=[.B821]/(2*PI()*[$Descripción.B$10]) -> 16.36 | D821: of:=POWER(IMABS(IMSQRT(1-POWER([.C821];2)));-1)*SQRT([$'Cálculo L y C filtro pi'.B$9]/[$'Cálculo L y C filtro pi'.B$8]) -> 36.7435219532635 | E821: of:=POWER(IMABS(IMSQRT(1-POWER([.C821];2)));-1)*SQRT([$'Cálculo L y C filtro pi'.B$18]/[$'Cálculo L y C filtro pi'.B$17]) -> 734.870439065271
A822: 819 | B822: of:=2*PI()*[.A822] -> 5145.92876658008 | C822: of:=[.B822]/(2*PI()*[$Descripción.B$10]) -> 16.38 | D822: of:=POWER(IMABS(IMSQRT(1-POWER([.C822];2)));-1)*SQRT([$'Cálculo L y C filtro pi'.B$9]/[$'Cálculo L y C filtro pi'.B$8]) -> 36.6984901269353 | E822: of:=POWER(IMABS(IMSQRT(1-POWER([.C822];2)));-1)*SQRT([$'Cálculo L y C filtro pi'.B$18]/[$'Cálculo L y C filtro pi'.B$17]) -> 733.969802538707
A823: 820 | B823: of:=2*PI()*[.A823] -> 5152.21195188726 | C823: of:=[.B823]/(2*PI()*[$Descripción.B$10]) -> 16.4 | D823: of:=POWER(IMABS(IMSQRT(1-POWER([.C823];2)));-1)*SQRT([$'Cálculo L y C filtro pi'.B$9]/[$'Cálculo L y C filtro pi'.B$8]) -> 36.6535687499157 | E823: of:=POWER(IMABS(IMSQRT(1-POWER([.C823];2)));-1)*SQRT([$'Cálculo L y C filtro pi'.B$18]/[$'Cálculo L y C filtro pi'.B$17]) -> 733.071374998314
A824: 821 | B824: of:=2*PI()*[.A824] -> 5158.49513719444 | C824: of:=[.B824]/(2*PI()*[$Descripción.B$10]) -> 16.42 | D824: of:=POWER(IMABS(IMSQRT(1-POWER([.C824];2)));-1)*SQRT([$'Cálculo L y C filtro pi'.B$9]/[$'Cálculo L y C filtro pi'.B$8]) -> 36.6087574156057 | E824: of:=POWER(IMABS(IMSQRT(1-POWER([.C824];2)));-1)*SQRT([$'Cálculo L y C filtro pi'.B$18]/[$'Cálculo L y C filtro pi'.B$17]) -> 732.175148312115
A825: 822 | B825: of:=2*PI()*[.A825] -> 5164.77832250162 | C825: of:=[.B825]/(2*PI()*[$Descripción.B$10]) -> 16.44 | D825: of:=POWER(IMABS(IMSQRT(1-POWER([.C825];2)));-1)*SQRT([$'Cálculo L y C filtro pi'.B$9]/[$'Cálculo L y C filtro pi'.B$8]) -> 36.5640557194045 | E825: of:=POWER(IMABS(IMSQRT(1-POWER([.C825];2)));-1)*SQRT([$'Cálculo L y C filtro pi'.B$18]/[$'Cálculo L y C filtro pi'.B$17]) -> 731.28111438809
A826: 823 | B826: of:=2*PI()*[.A826] -> 5171.0615078088 | C826: of:=[.B826]/(2*PI()*[$Descripción.B$10]) -> 16.46 | D826: of:=POWER(IMABS(IMSQRT(1-POWER([.C826];2)));-1)*SQRT([$'Cálculo L y C filtro pi'.B$9]/[$'Cálculo L y C filtro pi'.B$8]) -> 36.5194632586949 | E826: of:=POWER(IMABS(IMSQRT(1-POWER([.C826];2)));-1)*SQRT([$'Cálculo L y C filtro pi'.B$18]/[$'Cálculo L y C filtro pi'.B$17]) -> 730.389265173898
A827: 824 | B827: of:=2*PI()*[.A827] -> 5177.34469311598 | C827: of:=[.B827]/(2*PI()*[$Descripción.B$10]) -> 16.48 | D827: of:=POWER(IMABS(IMSQRT(1-POWER([.C827];2)));-1)*SQRT([$'Cálculo L y C filtro pi'.B$9]/[$'Cálculo L y C filtro pi'.B$8]) -> 36.4749796328329 | E827: of:=POWER(IMABS(IMSQRT(1-POWER([.C827];2)));-1)*SQRT([$'Cálculo L y C filtro pi'.B$18]/[$'Cálculo L y C filtro pi'.B$17]) -> 729.499592656658
A828: 825 | B828: of:=2*PI()*[.A828] -> 5183.62787842316 | C828: of:=[.B828]/(2*PI()*[$Descripción.B$10]) -> 16.5 | D828: of:=POWER(IMABS(IMSQRT(1-POWER([.C828];2)));-1)*SQRT([$'Cálculo L y C filtro pi'.B$9]/[$'Cálculo L y C filtro pi'.B$8]) -> 36.430604443135 | E828: of:=POWER(IMABS(IMSQRT(1-POWER([.C828];2)));-1)*SQRT([$'Cálculo L y C filtro pi'.B$18]/[$'Cálculo L y C filtro pi'.B$17]) -> 728.6120888627
A829: 826 | B829: of:=2*PI()*[.A829] -> 5189.91106373034 | C829: of:=[.B829]/(2*PI()*[$Descripción.B$10]) -> 16.52 | D829: of:=POWER(IMABS(IMSQRT(1-POWER([.C829];2)));-1)*SQRT([$'Cálculo L y C filtro pi'.B$9]/[$'Cálculo L y C filtro pi'.B$8]) -> 36.3863372928655 | E829: of:=POWER(IMABS(IMSQRT(1-POWER([.C829];2)));-1)*SQRT([$'Cálculo L y C filtro pi'.B$18]/[$'Cálculo L y C filtro pi'.B$17]) -> 727.726745857311
A830: 827 | B830: of:=2*PI()*[.A830] -> 5196.19424903752 | C830: of:=[.B830]/(2*PI()*[$Descripción.B$10]) -> 16.54 | D830: of:=POWER(IMABS(IMSQRT(1-POWER([.C830];2)));-1)*SQRT([$'Cálculo L y C filtro pi'.B$9]/[$'Cálculo L y C filtro pi'.B$8]) -> 36.3421777872257 | E830: of:=POWER(IMABS(IMSQRT(1-POWER([.C830];2)));-1)*SQRT([$'Cálculo L y C filtro pi'.B$18]/[$'Cálculo L y C filtro pi'.B$17]) -> 726.843555744513
A831: 828 | B831: of:=2*PI()*[.A831] -> 5202.4774343447 | C831: of:=[.B831]/(2*PI()*[$Descripción.B$10]) -> 16.56 | D831: of:=POWER(IMABS(IMSQRT(1-POWER([.C831];2)));-1)*SQRT([$'Cálculo L y C filtro pi'.B$9]/[$'Cálculo L y C filtro pi'.B$8]) -> 36.298125533341 | E831: of:=POWER(IMABS(IMSQRT(1-POWER([.C831];2)));-1)*SQRT([$'Cálculo L y C filtro pi'.B$18]/[$'Cálculo L y C filtro pi'.B$17]) -> 725.962510666821
A832: 829 | B832: of:=2*PI()*[.A832] -> 5208.76061965188 | C832: of:=[.B832]/(2*PI()*[$Descripción.B$10]) -> 16.58 | D832: of:=POWER(IMABS(IMSQRT(1-POWER([.C832];2)));-1)*SQRT([$'Cálculo L y C filtro pi'.B$9]/[$'Cálculo L y C filtro pi'.B$8]) -> 36.2541801402509 | E832: of:=POWER(IMABS(IMSQRT(1-POWER([.C832];2)));-1)*SQRT([$'Cálculo L y C filtro pi'.B$18]/[$'Cálculo L y C filtro pi'.B$17]) -> 725.083602805019
A833: 830 | B833: of:=2*PI()*[.A833] -> 5215.04380495906 | C833: of:=[.B833]/(2*PI()*[$Descripción.B$10]) -> 16.6 | D833: of:=POWER(IMABS(IMSQRT(1-POWER([.C833];2)));-1)*SQRT([$'Cálculo L y C filtro pi'.B$9]/[$'Cálculo L y C filtro pi'.B$8]) -> 36.210341218895 | E833: of:=POWER(IMABS(IMSQRT(1-POWER([.C833];2)));-1)*SQRT([$'Cálculo L y C filtro pi'.B$18]/[$'Cálculo L y C filtro pi'.B$17]) -> 724.206824377901
A834: 831 | B834: of:=2*PI()*[.A834] -> 5221.32699026624 | C834: of:=[.B834]/(2*PI()*[$Descripción.B$10]) -> 16.62 | D834: of:=POWER(IMABS(IMSQRT(1-POWER([.C834];2)));-1)*SQRT([$'Cálculo L y C filtro pi'.B$9]/[$'Cálculo L y C filtro pi'.B$8]) -> 36.1666083821034 | E834: of:=POWER(IMABS(IMSQRT(1-POWER([.C834];2)));-1)*SQRT([$'Cálculo L y C filtro pi'.B$18]/[$'Cálculo L y C filtro pi'.B$17]) -> 723.332167642067
A835: 832 | B835: of:=2*PI()*[.A835] -> 5227.61017557342 | C835: of:=[.B835]/(2*PI()*[$Descripción.B$10]) -> 16.64 | D835: of:=POWER(IMABS(IMSQRT(1-POWER([.C835];2)));-1)*SQRT([$'Cálculo L y C filtro pi'.B$9]/[$'Cálculo L y C filtro pi'.B$8]) -> 36.1229812445837 | E835: of:=POWER(IMABS(IMSQRT(1-POWER([.C835];2)));-1)*SQRT([$'Cálculo L y C filtro pi'.B$18]/[$'Cálculo L y C filtro pi'.B$17]) -> 722.459624891675
A836: 833 | B836: of:=2*PI()*[.A836] -> 5233.8933608806 | C836: of:=[.B836]/(2*PI()*[$Descripción.B$10]) -> 16.66 | D836: of:=POWER(IMABS(IMSQRT(1-POWER([.C836];2)));-1)*SQRT([$'Cálculo L y C filtro pi'.B$9]/[$'Cálculo L y C filtro pi'.B$8]) -> 36.0794594229114 | E836: of:=POWER(IMABS(IMSQRT(1-POWER([.C836];2)));-1)*SQRT([$'Cálculo L y C filtro pi'.B$18]/[$'Cálculo L y C filtro pi'.B$17]) -> 721.589188458229
A837: 834 | B837: of:=2*PI()*[.A837] -> 5240.17654618778 | C837: of:=[.B837]/(2*PI()*[$Descripción.B$10]) -> 16.68 | D837: of:=POWER(IMABS(IMSQRT(1-POWER([.C837];2)));-1)*SQRT([$'Cálculo L y C filtro pi'.B$9]/[$'Cálculo L y C filtro pi'.B$8]) -> 36.0360425355166 | E837: of:=POWER(IMABS(IMSQRT(1-POWER([.C837];2)));-1)*SQRT([$'Cálculo L y C filtro pi'.B$18]/[$'Cálculo L y C filtro pi'.B$17]) -> 720.720850710332
A838: 835 | B838: of:=2*PI()*[.A838] -> 5246.45973149495 | C838: of:=[.B838]/(2*PI()*[$Descripción.B$10]) -> 16.7 | D838: of:=POWER(IMABS(IMSQRT(1-POWER([.C838];2)));-1)*SQRT([$'Cálculo L y C filtro pi'.B$9]/[$'Cálculo L y C filtro pi'.B$8]) -> 35.9927302026746 | E838: of:=POWER(IMABS(IMSQRT(1-POWER([.C838];2)));-1)*SQRT([$'Cálculo L y C filtro pi'.B$18]/[$'Cálculo L y C filtro pi'.B$17]) -> 719.854604053492
A839: 836 | B839: of:=2*PI()*[.A839] -> 5252.74291680213 | C839: of:=[.B839]/(2*PI()*[$Descripción.B$10]) -> 16.72 | D839: of:=POWER(IMABS(IMSQRT(1-POWER([.C839];2)));-1)*SQRT([$'Cálculo L y C filtro pi'.B$9]/[$'Cálculo L y C filtro pi'.B$8]) -> 35.9495220464926 | E839: of:=POWER(IMABS(IMSQRT(1-POWER([.C839];2)));-1)*SQRT([$'Cálculo L y C filtro pi'.B$18]/[$'Cálculo L y C filtro pi'.B$17]) -> 718.990440929852
A840: 837 | B840: of:=2*PI()*[.A840] -> 5259.02610210931 | C840: of:=[.B840]/(2*PI()*[$Descripción.B$10]) -> 16.74 | D840: of:=POWER(IMABS(IMSQRT(1-POWER([.C840];2)));-1)*SQRT([$'Cálculo L y C filtro pi'.B$9]/[$'Cálculo L y C filtro pi'.B$8]) -> 35.9064176909011 | E840: of:=POWER(IMABS(IMSQRT(1-POWER([.C840];2)));-1)*SQRT([$'Cálculo L y C filtro pi'.B$18]/[$'Cálculo L y C filtro pi'.B$17]) -> 718.128353818022
A841: 838 | B841: of:=2*PI()*[.A841] -> 5265.30928741649 | C841: of:=[.B841]/(2*PI()*[$Descripción.B$10]) -> 16.76 | D841: of:=POWER(IMABS(IMSQRT(1-POWER([.C841];2)));-1)*SQRT([$'Cálculo L y C filtro pi'.B$9]/[$'Cálculo L y C filtro pi'.B$8]) -> 35.8634167616413 | E841: of:=POWER(IMABS(IMSQRT(1-POWER([.C841];2)));-1)*SQRT([$'Cálculo L y C filtro pi'.B$18]/[$'Cálculo L y C filtro pi'.B$17]) -> 717.268335232826
A842: 839 | B842: of:=2*PI()*[.A842] -> 5271.59247272367 | C842: of:=[.B842]/(2*PI()*[$Descripción.B$10]) -> 16.78 | D842: of:=POWER(IMABS(IMSQRT(1-POWER([.C842];2)));-1)*SQRT([$'Cálculo L y C filtro pi'.B$9]/[$'Cálculo L y C filtro pi'.B$8]) -> 35.8205188862546 | E842: of:=POWER(IMABS(IMSQRT(1-POWER([.C842];2)));-1)*SQRT([$'Cálculo L y C filtro pi'.B$18]/[$'Cálculo L y C filtro pi'.B$17]) -> 716.410377725092
A843: 840 | B843: of:=2*PI()*[.A843] -> 5277.87565803085 | C843: of:=[.B843]/(2*PI()*[$Descripción.B$10]) -> 16.8 | D843: of:=POWER(IMABS(IMSQRT(1-POWER([.C843];2)));-1)*SQRT([$'Cálculo L y C filtro pi'.B$9]/[$'Cálculo L y C filtro pi'.B$8]) -> 35.7777236940718 | E843: of:=POWER(IMABS(IMSQRT(1-POWER([.C843];2)));-1)*SQRT([$'Cálculo L y C filtro pi'.B$18]/[$'Cálculo L y C filtro pi'.B$17]) -> 715.554473881436
A844: 841 | B844: of:=2*PI()*[.A844] -> 5284.15884333803 | C844: of:=[.B844]/(2*PI()*[$Descripción.B$10]) -> 16.82 | D844: of:=POWER(IMABS(IMSQRT(1-POWER([.C844];2)));-1)*SQRT([$'Cálculo L y C filtro pi'.B$9]/[$'Cálculo L y C filtro pi'.B$8]) -> 35.7350308162019 | E844: of:=POWER(IMABS(IMSQRT(1-POWER([.C844];2)));-1)*SQRT([$'Cálculo L y C filtro pi'.B$18]/[$'Cálculo L y C filtro pi'.B$17]) -> 714.700616324038
A845: 842 | B845: of:=2*PI()*[.A845] -> 5290.44202864521 | C845: of:=[.B845]/(2*PI()*[$Descripción.B$10]) -> 16.84 | D845: of:=POWER(IMABS(IMSQRT(1-POWER([.C845];2)));-1)*SQRT([$'Cálculo L y C filtro pi'.B$9]/[$'Cálculo L y C filtro pi'.B$8]) -> 35.6924398855227 | E845: of:=POWER(IMABS(IMSQRT(1-POWER([.C845];2)));-1)*SQRT([$'Cálculo L y C filtro pi'.B$18]/[$'Cálculo L y C filtro pi'.B$17]) -> 713.848797710453
A846: 843 | B846: of:=2*PI()*[.A846] -> 5296.72521395239 | C846: of:=[.B846]/(2*PI()*[$Descripción.B$10]) -> 16.86 | D846: of:=POWER(IMABS(IMSQRT(1-POWER([.C846];2)));-1)*SQRT([$'Cálculo L y C filtro pi'.B$9]/[$'Cálculo L y C filtro pi'.B$8]) -> 35.6499505366687 | E846: of:=POWER(IMABS(IMSQRT(1-POWER([.C846];2)));-1)*SQRT([$'Cálculo L y C filtro pi'.B$18]/[$'Cálculo L y C filtro pi'.B$17]) -> 712.999010733375
A847: 844 | B847: of:=2*PI()*[.A847] -> 5303.00839925957 | C847: of:=[.B847]/(2*PI()*[$Descripción.B$10]) -> 16.88 | D847: of:=POWER(IMABS(IMSQRT(1-POWER([.C847];2)));-1)*SQRT([$'Cálculo L y C filtro pi'.B$9]/[$'Cálculo L y C filtro pi'.B$8]) -> 35.6075624060213 | E847: of:=POWER(IMABS(IMSQRT(1-POWER([.C847];2)));-1)*SQRT([$'Cálculo L y C filtro pi'.B$18]/[$'Cálculo L y C filtro pi'.B$17]) -> 712.151248120426
A848: 845 | B848: of:=2*PI()*[.A848] -> 5309.29158456675 | C848: of:=[.B848]/(2*PI()*[$Descripción.B$10]) -> 16.9 | D848: of:=POWER(IMABS(IMSQRT(1-POWER([.C848];2)));-1)*SQRT([$'Cálculo L y C filtro pi'.B$9]/[$'Cálculo L y C filtro pi'.B$8]) -> 35.5652751316986 | E848: of:=POWER(IMABS(IMSQRT(1-POWER([.C848];2)));-1)*SQRT([$'Cálculo L y C filtro pi'.B$18]/[$'Cálculo L y C filtro pi'.B$17]) -> 711.305502633971
A849: 846 | B849: of:=2*PI()*[.A849] -> 5315.57476987393 | C849: of:=[.B849]/(2*PI()*[$Descripción.B$10]) -> 16.92 | D849: of:=POWER(IMABS(IMSQRT(1-POWER([.C849];2)));-1)*SQRT([$'Cálculo L y C filtro pi'.B$9]/[$'Cálculo L y C filtro pi'.B$8]) -> 35.5230883535445 | E849: of:=POWER(IMABS(IMSQRT(1-POWER([.C849];2)));-1)*SQRT([$'Cálculo L y C filtro pi'.B$18]/[$'Cálculo L y C filtro pi'.B$17]) -> 710.46176707089
A850: 847 | B850: of:=2*PI()*[.A850] -> 5321.85795518111 | C850: of:=[.B850]/(2*PI()*[$Descripción.B$10]) -> 16.94 | D850: of:=POWER(IMABS(IMSQRT(1-POWER([.C850];2)));-1)*SQRT([$'Cálculo L y C filtro pi'.B$9]/[$'Cálculo L y C filtro pi'.B$8]) -> 35.4810017131185 | E850: of:=POWER(IMABS(IMSQRT(1-POWER([.C850];2)));-1)*SQRT([$'Cálculo L y C filtro pi'.B$18]/[$'Cálculo L y C filtro pi'.B$17]) -> 709.620034262369
A851: 848 | B851: of:=2*PI()*[.A851] -> 5328.14114048829 | C851: of:=[.B851]/(2*PI()*[$Descripción.B$10]) -> 16.96 | D851: of:=POWER(IMABS(IMSQRT(1-POWER([.C851];2)));-1)*SQRT([$'Cálculo L y C filtro pi'.B$9]/[$'Cálculo L y C filtro pi'.B$8]) -> 35.4390148536857 | E851: of:=POWER(IMABS(IMSQRT(1-POWER([.C851];2)));-1)*SQRT([$'Cálculo L y C filtro pi'.B$18]/[$'Cálculo L y C filtro pi'.B$17]) -> 708.780297073714
A852: 849 | B852: of:=2*PI()*[.A852] -> 5334.42432579547 | C852: of:=[.B852]/(2*PI()*[$Descripción.B$10]) -> 16.98 | D852: of:=POWER(IMABS(IMSQRT(1-POWER([.C852];2)));-1)*SQRT([$'Cálculo L y C filtro pi'.B$9]/[$'Cálculo L y C filtro pi'.B$8]) -> 35.3971274202068 | E852: of:=POWER(IMABS(IMSQRT(1-POWER([.C852];2)));-1)*SQRT([$'Cálculo L y C filtro pi'.B$18]/[$'Cálculo L y C filtro pi'.B$17]) -> 707.942548404136
A853: 850 | B853: of:=2*PI()*[.A853] -> 5340.70751110265 | C853: of:=[.B853]/(2*PI()*[$Descripción.B$10]) -> 17 | D853: of:=POWER(IMABS(IMSQRT(1-POWER([.C853];2)));-1)*SQRT([$'Cálculo L y C filtro pi'.B$9]/[$'Cálculo L y C filtro pi'.B$8]) -> 35.3553390593275 | E853: of:=POWER(IMABS(IMSQRT(1-POWER([.C853];2)));-1)*SQRT([$'Cálculo L y C filtro pi'.B$18]/[$'Cálculo L y C filtro pi'.B$17]) -> 707.106781186549
A854: 851 | B854: of:=2*PI()*[.A854] -> 5346.99069640983 | C854: of:=[.B854]/(2*PI()*[$Descripción.B$10]) -> 17.02 | D854: of:=POWER(IMABS(IMSQRT(1-POWER([.C854];2)));-1)*SQRT([$'Cálculo L y C filtro pi'.B$9]/[$'Cálculo L y C filtro pi'.B$8]) -> 35.3136494193685 | E854: of:=POWER(IMABS(IMSQRT(1-POWER([.C854];2)));-1)*SQRT([$'Cálculo L y C filtro pi'.B$18]/[$'Cálculo L y C filtro pi'.B$17]) -> 706.272988387371
A855: 852 | B855: of:=2*PI()*[.A855] -> 5353.27388171701 | C855: of:=[.B855]/(2*PI()*[$Descripción.B$10]) -> 17.04 | D855: of:=POWER(IMABS(IMSQRT(1-POWER([.C855];2)));-1)*SQRT([$'Cálculo L y C filtro pi'.B$9]/[$'Cálculo L y C filtro pi'.B$8]) -> 35.2720581503168 | E855: of:=POWER(IMABS(IMSQRT(1-POWER([.C855];2)));-1)*SQRT([$'Cálculo L y C filtro pi'.B$18]/[$'Cálculo L y C filtro pi'.B$17]) -> 705.441163006335
A856: 853 | B856: of:=2*PI()*[.A856] -> 5359.55706702419 | C856: of:=[.B856]/(2*PI()*[$Descripción.B$10]) -> 17.06 | D856: of:=POWER(IMABS(IMSQRT(1-POWER([.C856];2)));-1)*SQRT([$'Cálculo L y C filtro pi'.B$9]/[$'Cálculo L y C filtro pi'.B$8]) -> 35.2305649038136 | E856: of:=POWER(IMABS(IMSQRT(1-POWER([.C856];2)));-1)*SQRT([$'Cálculo L y C filtro pi'.B$18]/[$'Cálculo L y C filtro pi'.B$17]) -> 704.611298076272
A857: 854 | B857: of:=2*PI()*[.A857] -> 5365.84025233137 | C857: of:=[.B857]/(2*PI()*[$Descripción.B$10]) -> 17.08 | D857: of:=POWER(IMABS(IMSQRT(1-POWER([.C857];2)));-1)*SQRT([$'Cálculo L y C filtro pi'.B$9]/[$'Cálculo L y C filtro pi'.B$8]) -> 35.189169333147 | E857: of:=POWER(IMABS(IMSQRT(1-POWER([.C857];2)));-1)*SQRT([$'Cálculo L y C filtro pi'.B$18]/[$'Cálculo L y C filtro pi'.B$17]) -> 703.78338666294
A858: 855 | B858: of:=2*PI()*[.A858] -> 5372.12343763855 | C858: of:=[.B858]/(2*PI()*[$Descripción.B$10]) -> 17.1 | D858: of:=POWER(IMABS(IMSQRT(1-POWER([.C858];2)));-1)*SQRT([$'Cálculo L y C filtro pi'.B$9]/[$'Cálculo L y C filtro pi'.B$8]) -> 35.14787109324 | E858: of:=POWER(IMABS(IMSQRT(1-POWER([.C858];2)));-1)*SQRT([$'Cálculo L y C filtro pi'.B$18]/[$'Cálculo L y C filtro pi'.B$17]) -> 702.9574218648
A859: 856 | B859: of:=2*PI()*[.A859] -> 5378.40662294573 | C859: of:=[.B859]/(2*PI()*[$Descripción.B$10]) -> 17.12 | D859: of:=POWER(IMABS(IMSQRT(1-POWER([.C859];2)));-1)*SQRT([$'Cálculo L y C filtro pi'.B$9]/[$'Cálculo L y C filtro pi'.B$8]) -> 35.1066698406426 | E859: of:=POWER(IMABS(IMSQRT(1-POWER([.C859];2)));-1)*SQRT([$'Cálculo L y C filtro pi'.B$18]/[$'Cálculo L y C filtro pi'.B$17]) -> 702.133396812853
A860: 857 | B860: of:=2*PI()*[.A860] -> 5384.68980825291 | C860: of:=[.B860]/(2*PI()*[$Descripción.B$10]) -> 17.14 | D860: of:=POWER(IMABS(IMSQRT(1-POWER([.C860];2)));-1)*SQRT([$'Cálculo L y C filtro pi'.B$9]/[$'Cálculo L y C filtro pi'.B$8]) -> 35.0655652335213 | E860: of:=POWER(IMABS(IMSQRT(1-POWER([.C860];2)));-1)*SQRT([$'Cálculo L y C filtro pi'.B$18]/[$'Cálculo L y C filtro pi'.B$17]) -> 701.311304670427
A861: 858 | B861: of:=2*PI()*[.A861] -> 5390.97299356009 | C861: of:=[.B861]/(2*PI()*[$Descripción.B$10]) -> 17.16 | D861: of:=POWER(IMABS(IMSQRT(1-POWER([.C861];2)));-1)*SQRT([$'Cálculo L y C filtro pi'.B$9]/[$'Cálculo L y C filtro pi'.B$8]) -> 35.0245569316498 | E861: of:=POWER(IMABS(IMSQRT(1-POWER([.C861];2)));-1)*SQRT([$'Cálculo L y C filtro pi'.B$18]/[$'Cálculo L y C filtro pi'.B$17]) -> 700.491138632997
A862: 859 | B862: of:=2*PI()*[.A862] -> 5397.25617886726 | C862: of:=[.B862]/(2*PI()*[$Descripción.B$10]) -> 17.18 | D862: of:=POWER(IMABS(IMSQRT(1-POWER([.C862];2)));-1)*SQRT([$'Cálculo L y C filtro pi'.B$9]/[$'Cálculo L y C filtro pi'.B$8]) -> 34.9836445963998 | E862: of:=POWER(IMABS(IMSQRT(1-POWER([.C862];2)));-1)*SQRT([$'Cálculo L y C filtro pi'.B$18]/[$'Cálculo L y C filtro pi'.B$17]) -> 699.672891927996
A863: 860 | B863: of:=2*PI()*[.A863] -> 5403.53936417444 | C863: of:=[.B863]/(2*PI()*[$Descripción.B$10]) -> 17.2 | D863: of:=POWER(IMABS(IMSQRT(1-POWER([.C863];2)));-1)*SQRT([$'Cálculo L y C filtro pi'.B$9]/[$'Cálculo L y C filtro pi'.B$8]) -> 34.9428278907307 | E863: of:=POWER(IMABS(IMSQRT(1-POWER([.C863];2)));-1)*SQRT([$'Cálculo L y C filtro pi'.B$18]/[$'Cálculo L y C filtro pi'.B$17]) -> 698.856557814613
A864: 861 | B864: of:=2*PI()*[.A864] -> 5409.82254948162 | C864: of:=[.B864]/(2*PI()*[$Descripción.B$10]) -> 17.22 | D864: of:=POWER(IMABS(IMSQRT(1-POWER([.C864];2)));-1)*SQRT([$'Cálculo L y C filtro pi'.B$9]/[$'Cálculo L y C filtro pi'.B$8]) -> 34.9021064791815 | E864: of:=POWER(IMABS(IMSQRT(1-POWER([.C864];2)));-1)*SQRT([$'Cálculo L y C filtro pi'.B$18]/[$'Cálculo L y C filtro pi'.B$17]) -> 698.04212958363
A865: 862 | B865: of:=2*PI()*[.A865] -> 5416.1057347888 | C865: of:=[.B865]/(2*PI()*[$Descripción.B$10]) -> 17.24 | D865: of:=POWER(IMABS(IMSQRT(1-POWER([.C865];2)));-1)*SQRT([$'Cálculo L y C filtro pi'.B$9]/[$'Cálculo L y C filtro pi'.B$8]) -> 34.861480027861 | E865: of:=POWER(IMABS(IMSQRT(1-POWER([.C865];2)));-1)*SQRT([$'Cálculo L y C filtro pi'.B$18]/[$'Cálculo L y C filtro pi'.B$17]) -> 697.22960055722
A866: 863 | B866: of:=2*PI()*[.A866] -> 5422.38892009598 | C866: of:=[.B866]/(2*PI()*[$Descripción.B$10]) -> 17.26 | D866: of:=POWER(IMABS(IMSQRT(1-POWER([.C866];2)));-1)*SQRT([$'Cálculo L y C filtro pi'.B$9]/[$'Cálculo L y C filtro pi'.B$8]) -> 34.8209482044385 | E866: of:=POWER(IMABS(IMSQRT(1-POWER([.C866];2)));-1)*SQRT([$'Cálculo L y C filtro pi'.B$18]/[$'Cálculo L y C filtro pi'.B$17]) -> 696.41896408877
A867: 864 | B867: of:=2*PI()*[.A867] -> 5428.67210540316 | C867: of:=[.B867]/(2*PI()*[$Descripción.B$10]) -> 17.28 | D867: of:=POWER(IMABS(IMSQRT(1-POWER([.C867];2)));-1)*SQRT([$'Cálculo L y C filtro pi'.B$9]/[$'Cálculo L y C filtro pi'.B$8]) -> 34.7805106781346 | E867: of:=POWER(IMABS(IMSQRT(1-POWER([.C867];2)));-1)*SQRT([$'Cálculo L y C filtro pi'.B$18]/[$'Cálculo L y C filtro pi'.B$17]) -> 695.610213562693
A868: 865 | B868: of:=2*PI()*[.A868] -> 5434.95529071034 | C868: of:=[.B868]/(2*PI()*[$Descripción.B$10]) -> 17.3 | D868: of:=POWER(IMABS(IMSQRT(1-POWER([.C868];2)));-1)*SQRT([$'Cálculo L y C filtro pi'.B$9]/[$'Cálculo L y C filtro pi'.B$8]) -> 34.7401671197129 | E868: of:=POWER(IMABS(IMSQRT(1-POWER([.C868];2)));-1)*SQRT([$'Cálculo L y C filtro pi'.B$18]/[$'Cálculo L y C filtro pi'.B$17]) -> 694.803342394257
A869: 866 | B869: of:=2*PI()*[.A869] -> 5441.23847601752 | C869: of:=[.B869]/(2*PI()*[$Descripción.B$10]) -> 17.32 | D869: of:=POWER(IMABS(IMSQRT(1-POWER([.C869];2)));-1)*SQRT([$'Cálculo L y C filtro pi'.B$9]/[$'Cálculo L y C filtro pi'.B$8]) -> 34.6999172014698 | E869: of:=POWER(IMABS(IMSQRT(1-POWER([.C869];2)));-1)*SQRT([$'Cálculo L y C filtro pi'.B$18]/[$'Cálculo L y C filtro pi'.B$17]) -> 693.998344029396
A870: 867 | B870: of:=2*PI()*[.A870] -> 5447.5216613247 | C870: of:=[.B870]/(2*PI()*[$Descripción.B$10]) -> 17.34 | D870: of:=POWER(IMABS(IMSQRT(1-POWER([.C870];2)));-1)*SQRT([$'Cálculo L y C filtro pi'.B$9]/[$'Cálculo L y C filtro pi'.B$8]) -> 34.6597605972263 | E870: of:=POWER(IMABS(IMSQRT(1-POWER([.C870];2)));-1)*SQRT([$'Cálculo L y C filtro pi'.B$18]/[$'Cálculo L y C filtro pi'.B$17]) -> 693.195211944527
A871: 868 | B871: of:=2*PI()*[.A871] -> 5453.80484663188 | C871: of:=[.B871]/(2*PI()*[$Descripción.B$10]) -> 17.36 | D871: of:=POWER(IMABS(IMSQRT(1-POWER([.C871];2)));-1)*SQRT([$'Cálculo L y C filtro pi'.B$9]/[$'Cálculo L y C filtro pi'.B$8]) -> 34.6196969823193 | E871: of:=POWER(IMABS(IMSQRT(1-POWER([.C871];2)));-1)*SQRT([$'Cálculo L y C filtro pi'.B$18]/[$'Cálculo L y C filtro pi'.B$17]) -> 692.393939646386
A872: 869 | B872: of:=2*PI()*[.A872] -> 5460.08803193906 | C872: of:=[.B872]/(2*PI()*[$Descripción.B$10]) -> 17.38 | D872: of:=POWER(IMABS(IMSQRT(1-POWER([.C872];2)));-1)*SQRT([$'Cálculo L y C filtro pi'.B$9]/[$'Cálculo L y C filtro pi'.B$8]) -> 34.5797260335926 | E872: of:=POWER(IMABS(IMSQRT(1-POWER([.C872];2)));-1)*SQRT([$'Cálculo L y C filtro pi'.B$18]/[$'Cálculo L y C filtro pi'.B$17]) -> 691.594520671853
A873: 870 | B873: of:=2*PI()*[.A873] -> 5466.37121724624 | C873: of:=[.B873]/(2*PI()*[$Descripción.B$10]) -> 17.4 | D873: of:=POWER(IMABS(IMSQRT(1-POWER([.C873];2)));-1)*SQRT([$'Cálculo L y C filtro pi'.B$9]/[$'Cálculo L y C filtro pi'.B$8]) -> 34.5398474293877 | E873: of:=POWER(IMABS(IMSQRT(1-POWER([.C873];2)));-1)*SQRT([$'Cálculo L y C filtro pi'.B$18]/[$'Cálculo L y C filtro pi'.B$17]) -> 690.796948587755
A874: 871 | B874: of:=2*PI()*[.A874] -> 5472.65440255342 | C874: of:=[.B874]/(2*PI()*[$Descripción.B$10]) -> 17.42 | D874: of:=POWER(IMABS(IMSQRT(1-POWER([.C874];2)));-1)*SQRT([$'Cálculo L y C filtro pi'.B$9]/[$'Cálculo L y C filtro pi'.B$8]) -> 34.500060849536 | E874: of:=POWER(IMABS(IMSQRT(1-POWER([.C874];2)));-1)*SQRT([$'Cálculo L y C filtro pi'.B$18]/[$'Cálculo L y C filtro pi'.B$17]) -> 690.00121699072
A875: 872 | B875: of:=2*PI()*[.A875] -> 5478.9375878606 | C875: of:=[.B875]/(2*PI()*[$Descripción.B$10]) -> 17.44 | D875: of:=POWER(IMABS(IMSQRT(1-POWER([.C875];2)));-1)*SQRT([$'Cálculo L y C filtro pi'.B$9]/[$'Cálculo L y C filtro pi'.B$8]) -> 34.460365975349 | E875: of:=POWER(IMABS(IMSQRT(1-POWER([.C875];2)));-1)*SQRT([$'Cálculo L y C filtro pi'.B$18]/[$'Cálculo L y C filtro pi'.B$17]) -> 689.20731950698
A876: 873 | B876: of:=2*PI()*[.A876] -> 5485.22077316778 | C876: of:=[.B876]/(2*PI()*[$Descripción.B$10]) -> 17.46 | D876: of:=POWER(IMABS(IMSQRT(1-POWER([.C876];2)));-1)*SQRT([$'Cálculo L y C filtro pi'.B$9]/[$'Cálculo L y C filtro pi'.B$8]) -> 34.420762489611 | E876: of:=POWER(IMABS(IMSQRT(1-POWER([.C876];2)));-1)*SQRT([$'Cálculo L y C filtro pi'.B$18]/[$'Cálculo L y C filtro pi'.B$17]) -> 688.41524979222
A877: 874 | B877: of:=2*PI()*[.A877] -> 5491.50395847496 | C877: of:=[.B877]/(2*PI()*[$Descripción.B$10]) -> 17.48 | D877: of:=POWER(IMABS(IMSQRT(1-POWER([.C877];2)));-1)*SQRT([$'Cálculo L y C filtro pi'.B$9]/[$'Cálculo L y C filtro pi'.B$8]) -> 34.3812500765698 | E877: of:=POWER(IMABS(IMSQRT(1-POWER([.C877];2)));-1)*SQRT([$'Cálculo L y C filtro pi'.B$18]/[$'Cálculo L y C filtro pi'.B$17]) -> 687.625001531397
A878: 875 | B878: of:=2*PI()*[.A878] -> 5497.78714378214 | C878: of:=[.B878]/(2*PI()*[$Descripción.B$10]) -> 17.5 | D878: of:=POWER(IMABS(IMSQRT(1-POWER([.C878];2)));-1)*SQRT([$'Cálculo L y C filtro pi'.B$9]/[$'Cálculo L y C filtro pi'.B$8]) -> 34.3418284219286 | E878: of:=POWER(IMABS(IMSQRT(1-POWER([.C878];2)));-1)*SQRT([$'Cálculo L y C filtro pi'.B$18]/[$'Cálculo L y C filtro pi'.B$17]) -> 686.836568438573
A879: 876 | B879: of:=2*PI()*[.A879] -> 5504.07032908932 | C879: of:=[.B879]/(2*PI()*[$Descripción.B$10]) -> 17.52 | D879: of:=POWER(IMABS(IMSQRT(1-POWER([.C879];2)));-1)*SQRT([$'Cálculo L y C filtro pi'.B$9]/[$'Cálculo L y C filtro pi'.B$8]) -> 34.302497212837 | E879: of:=POWER(IMABS(IMSQRT(1-POWER([.C879];2)));-1)*SQRT([$'Cálculo L y C filtro pi'.B$18]/[$'Cálculo L y C filtro pi'.B$17]) -> 686.049944256739
A880: 877 | B880: of:=2*PI()*[.A880] -> 5510.3535143965 | C880: of:=[.B880]/(2*PI()*[$Descripción.B$10]) -> 17.54 | D880: of:=POWER(IMABS(IMSQRT(1-POWER([.C880];2)));-1)*SQRT([$'Cálculo L y C filtro pi'.B$9]/[$'Cálculo L y C filtro pi'.B$8]) -> 34.2632561378836 | E880: of:=POWER(IMABS(IMSQRT(1-POWER([.C880];2)));-1)*SQRT([$'Cálculo L y C filtro pi'.B$18]/[$'Cálculo L y C filtro pi'.B$17]) -> 685.265122757673
A881: 878 | B881: of:=2*PI()*[.A881] -> 5516.63669970368 | C881: of:=[.B881]/(2*PI()*[$Descripción.B$10]) -> 17.56 | D881: of:=POWER(IMABS(IMSQRT(1-POWER([.C881];2)));-1)*SQRT([$'Cálculo L y C filtro pi'.B$9]/[$'Cálculo L y C filtro pi'.B$8]) -> 34.2241048870871 | E881: of:=POWER(IMABS(IMSQRT(1-POWER([.C881];2)));-1)*SQRT([$'Cálculo L y C filtro pi'.B$18]/[$'Cálculo L y C filtro pi'.B$17]) -> 684.482097741742
A882: 879 | B882: of:=2*PI()*[.A882] -> 5522.91988501086 | C882: of:=[.B882]/(2*PI()*[$Descripción.B$10]) -> 17.58 | D882: of:=POWER(IMABS(IMSQRT(1-POWER([.C882];2)));-1)*SQRT([$'Cálculo L y C filtro pi'.B$9]/[$'Cálculo L y C filtro pi'.B$8]) -> 34.1850431518884 | E882: of:=POWER(IMABS(IMSQRT(1-POWER([.C882];2)));-1)*SQRT([$'Cálculo L y C filtro pi'.B$18]/[$'Cálculo L y C filtro pi'.B$17]) -> 683.700863037768
A883: 880 | B883: of:=2*PI()*[.A883] -> 5529.20307031804 | C883: of:=[.B883]/(2*PI()*[$Descripción.B$10]) -> 17.6 | D883: of:=POWER(IMABS(IMSQRT(1-POWER([.C883];2)));-1)*SQRT([$'Cálculo L y C filtro pi'.B$9]/[$'Cálculo L y C filtro pi'.B$8]) -> 34.1460706251422 | E883: of:=POWER(IMABS(IMSQRT(1-POWER([.C883];2)));-1)*SQRT([$'Cálculo L y C filtro pi'.B$18]/[$'Cálculo L y C filtro pi'.B$17]) -> 682.921412502844
A884: 881 | B884: of:=2*PI()*[.A884] -> 5535.48625562522 | C884: of:=[.B884]/(2*PI()*[$Descripción.B$10]) -> 17.62 | D884: of:=POWER(IMABS(IMSQRT(1-POWER([.C884];2)));-1)*SQRT([$'Cálculo L y C filtro pi'.B$9]/[$'Cálculo L y C filtro pi'.B$8]) -> 34.1071870011087 | E884: of:=POWER(IMABS(IMSQRT(1-POWER([.C884];2)));-1)*SQRT([$'Cálculo L y C filtro pi'.B$18]/[$'Cálculo L y C filtro pi'.B$17]) -> 682.143740022174
A885: 882 | B885: of:=2*PI()*[.A885] -> 5541.7694409324 | C885: of:=[.B885]/(2*PI()*[$Descripción.B$10]) -> 17.64 | D885: of:=POWER(IMABS(IMSQRT(1-POWER([.C885];2)));-1)*SQRT([$'Cálculo L y C filtro pi'.B$9]/[$'Cálculo L y C filtro pi'.B$8]) -> 34.0683919754465 | E885: of:=POWER(IMABS(IMSQRT(1-POWER([.C885];2)));-1)*SQRT([$'Cálculo L y C filtro pi'.B$18]/[$'Cálculo L y C filtro pi'.B$17]) -> 681.36783950893
A886: 883 | B886: of:=2*PI()*[.A886] -> 5548.05262623957 | C886: of:=[.B886]/(2*PI()*[$Descripción.B$10]) -> 17.66 | D886: of:=POWER(IMABS(IMSQRT(1-POWER([.C886];2)));-1)*SQRT([$'Cálculo L y C filtro pi'.B$9]/[$'Cálculo L y C filtro pi'.B$8]) -> 34.0296852452034 | E886: of:=POWER(IMABS(IMSQRT(1-POWER([.C886];2)));-1)*SQRT([$'Cálculo L y C filtro pi'.B$18]/[$'Cálculo L y C filtro pi'.B$17]) -> 680.593704904069
A887: 884 | B887: of:=2*PI()*[.A887] -> 5554.33581154675 | C887: of:=[.B887]/(2*PI()*[$Descripción.B$10]) -> 17.68 | D887: of:=POWER(IMABS(IMSQRT(1-POWER([.C887];2)));-1)*SQRT([$'Cálculo L y C filtro pi'.B$9]/[$'Cálculo L y C filtro pi'.B$8]) -> 33.9910665088093 | E887: of:=POWER(IMABS(IMSQRT(1-POWER([.C887];2)));-1)*SQRT([$'Cálculo L y C filtro pi'.B$18]/[$'Cálculo L y C filtro pi'.B$17]) -> 679.821330176187
A888: 885 | B888: of:=2*PI()*[.A888] -> 5560.61899685393 | C888: of:=[.B888]/(2*PI()*[$Descripción.B$10]) -> 17.7 | D888: of:=POWER(IMABS(IMSQRT(1-POWER([.C888];2)));-1)*SQRT([$'Cálculo L y C filtro pi'.B$9]/[$'Cálculo L y C filtro pi'.B$8]) -> 33.9525354660678 | E888: of:=POWER(IMABS(IMSQRT(1-POWER([.C888];2)));-1)*SQRT([$'Cálculo L y C filtro pi'.B$18]/[$'Cálculo L y C filtro pi'.B$17]) -> 679.050709321357
A889: 886 | B889: of:=2*PI()*[.A889] -> 5566.90218216111 | C889: of:=[.B889]/(2*PI()*[$Descripción.B$10]) -> 17.72 | D889: of:=POWER(IMABS(IMSQRT(1-POWER([.C889];2)));-1)*SQRT([$'Cálculo L y C filtro pi'.B$9]/[$'Cálculo L y C filtro pi'.B$8]) -> 33.914091818149 | E889: of:=POWER(IMABS(IMSQRT(1-POWER([.C889];2)));-1)*SQRT([$'Cálculo L y C filtro pi'.B$18]/[$'Cálculo L y C filtro pi'.B$17]) -> 678.281836362979
A890: 887 | B890: of:=2*PI()*[.A890] -> 5573.18536746829 | C890: of:=[.B890]/(2*PI()*[$Descripción.B$10]) -> 17.74 | D890: of:=POWER(IMABS(IMSQRT(1-POWER([.C890];2)));-1)*SQRT([$'Cálculo L y C filtro pi'.B$9]/[$'Cálculo L y C filtro pi'.B$8]) -> 33.8757352675807 | E890: of:=POWER(IMABS(IMSQRT(1-POWER([.C890];2)));-1)*SQRT([$'Cálculo L y C filtro pi'.B$18]/[$'Cálculo L y C filtro pi'.B$17]) -> 677.514705351614
A891: 888 | B891: of:=2*PI()*[.A891] -> 5579.46855277547 | C891: of:=[.B891]/(2*PI()*[$Descripción.B$10]) -> 17.76 | D891: of:=POWER(IMABS(IMSQRT(1-POWER([.C891];2)));-1)*SQRT([$'Cálculo L y C filtro pi'.B$9]/[$'Cálculo L y C filtro pi'.B$8]) -> 33.8374655182421 | E891: of:=POWER(IMABS(IMSQRT(1-POWER([.C891];2)));-1)*SQRT([$'Cálculo L y C filtro pi'.B$18]/[$'Cálculo L y C filtro pi'.B$17]) -> 676.749310364843
A892: 889 | B892: of:=2*PI()*[.A892] -> 5585.75173808265 | C892: of:=[.B892]/(2*PI()*[$Descripción.B$10]) -> 17.78 | D892: of:=POWER(IMABS(IMSQRT(1-POWER([.C892];2)));-1)*SQRT([$'Cálculo L y C filtro pi'.B$9]/[$'Cálculo L y C filtro pi'.B$8]) -> 33.7992822753546 | E892: of:=POWER(IMABS(IMSQRT(1-POWER([.C892];2)));-1)*SQRT([$'Cálculo L y C filtro pi'.B$18]/[$'Cálculo L y C filtro pi'.B$17]) -> 675.985645507093
A893: 890 | B893: of:=2*PI()*[.A893] -> 5592.03492338983 | C893: of:=[.B893]/(2*PI()*[$Descripción.B$10]) -> 17.8 | D893: of:=POWER(IMABS(IMSQRT(1-POWER([.C893];2)));-1)*SQRT([$'Cálculo L y C filtro pi'.B$9]/[$'Cálculo L y C filtro pi'.B$8]) -> 33.7611852454759 | E893: of:=POWER(IMABS(IMSQRT(1-POWER([.C893];2)));-1)*SQRT([$'Cálculo L y C filtro pi'.B$18]/[$'Cálculo L y C filtro pi'.B$17]) -> 675.223704909517
A894: 891 | B894: of:=2*PI()*[.A894] -> 5598.31810869701 | C894: of:=[.B894]/(2*PI()*[$Descripción.B$10]) -> 17.82 | D894: of:=POWER(IMABS(IMSQRT(1-POWER([.C894];2)));-1)*SQRT([$'Cálculo L y C filtro pi'.B$9]/[$'Cálculo L y C filtro pi'.B$8]) -> 33.7231741364902 | E894: of:=POWER(IMABS(IMSQRT(1-POWER([.C894];2)));-1)*SQRT([$'Cálculo L y C filtro pi'.B$18]/[$'Cálculo L y C filtro pi'.B$17]) -> 674.463482729804
A895: 892 | B895: of:=2*PI()*[.A895] -> 5604.60129400419 | C895: of:=[.B895]/(2*PI()*[$Descripción.B$10]) -> 17.84 | D895: of:=POWER(IMABS(IMSQRT(1-POWER([.C895];2)));-1)*SQRT([$'Cálculo L y C filtro pi'.B$9]/[$'Cálculo L y C filtro pi'.B$8]) -> 33.6852486576027 | E895: of:=POWER(IMABS(IMSQRT(1-POWER([.C895];2)));-1)*SQRT([$'Cálculo L y C filtro pi'.B$18]/[$'Cálculo L y C filtro pi'.B$17]) -> 673.704973152054
A896: 893 | B896: of:=2*PI()*[.A896] -> 5610.88447931137 | C896: of:=[.B896]/(2*PI()*[$Descripción.B$10]) -> 17.86 | D896: of:=POWER(IMABS(IMSQRT(1-POWER([.C896];2)));-1)*SQRT([$'Cálculo L y C filtro pi'.B$9]/[$'Cálculo L y C filtro pi'.B$8]) -> 33.6474085193316 | E896: of:=POWER(IMABS(IMSQRT(1-POWER([.C896];2)));-1)*SQRT([$'Cálculo L y C filtro pi'.B$18]/[$'Cálculo L y C filtro pi'.B$17]) -> 672.948170386633
A897: 894 | B897: of:=2*PI()*[.A897] -> 5617.16766461855 | C897: of:=[.B897]/(2*PI()*[$Descripción.B$10]) -> 17.88 | D897: of:=POWER(IMABS(IMSQRT(1-POWER([.C897];2)));-1)*SQRT([$'Cálculo L y C filtro pi'.B$9]/[$'Cálculo L y C filtro pi'.B$8]) -> 33.6096534335002 | E897: of:=POWER(IMABS(IMSQRT(1-POWER([.C897];2)));-1)*SQRT([$'Cálculo L y C filtro pi'.B$18]/[$'Cálculo L y C filtro pi'.B$17]) -> 672.193068670004
A898: 895 | B898: of:=2*PI()*[.A898] -> 5623.45084992573 | C898: of:=[.B898]/(2*PI()*[$Descripción.B$10]) -> 17.9 | D898: of:=POWER(IMABS(IMSQRT(1-POWER([.C898];2)));-1)*SQRT([$'Cálculo L y C filtro pi'.B$9]/[$'Cálculo L y C filtro pi'.B$8]) -> 33.5719831132295 | E898: of:=POWER(IMABS(IMSQRT(1-POWER([.C898];2)));-1)*SQRT([$'Cálculo L y C filtro pi'.B$18]/[$'Cálculo L y C filtro pi'.B$17]) -> 671.439662264591
A899: 896 | B899: of:=2*PI()*[.A899] -> 5629.73403523291 | C899: of:=[.B899]/(2*PI()*[$Descripción.B$10]) -> 17.92 | D899: of:=POWER(IMABS(IMSQRT(1-POWER([.C899];2)));-1)*SQRT([$'Cálculo L y C filtro pi'.B$9]/[$'Cálculo L y C filtro pi'.B$8]) -> 33.5343972729319 | E899: of:=POWER(IMABS(IMSQRT(1-POWER([.C899];2)));-1)*SQRT([$'Cálculo L y C filtro pi'.B$18]/[$'Cálculo L y C filtro pi'.B$17]) -> 670.687945458639
A900: 897 | B900: of:=2*PI()*[.A900] -> 5636.01722054009 | C900: of:=[.B900]/(2*PI()*[$Descripción.B$10]) -> 17.94 | D900: of:=POWER(IMABS(IMSQRT(1-POWER([.C900];2)));-1)*SQRT([$'Cálculo L y C filtro pi'.B$9]/[$'Cálculo L y C filtro pi'.B$8]) -> 33.4968956283024 | E900: of:=POWER(IMABS(IMSQRT(1-POWER([.C900];2)));-1)*SQRT([$'Cálculo L y C filtro pi'.B$18]/[$'Cálculo L y C filtro pi'.B$17]) -> 669.937912566048
A901: 898 | B901: of:=2*PI()*[.A901] -> 5642.30040584727 | C901: of:=[.B901]/(2*PI()*[$Descripción.B$10]) -> 17.96 | D901: of:=POWER(IMABS(IMSQRT(1-POWER([.C901];2)));-1)*SQRT([$'Cálculo L y C filtro pi'.B$9]/[$'Cálculo L y C filtro pi'.B$8]) -> 33.4594778963131 | E901: of:=POWER(IMABS(IMSQRT(1-POWER([.C901];2)));-1)*SQRT([$'Cálculo L y C filtro pi'.B$18]/[$'Cálculo L y C filtro pi'.B$17]) -> 669.189557926262
A902: 899 | B902: of:=2*PI()*[.A902] -> 5648.58359115445 | C902: of:=[.B902]/(2*PI()*[$Descripción.B$10]) -> 17.98 | D902: of:=POWER(IMABS(IMSQRT(1-POWER([.C902];2)));-1)*SQRT([$'Cálculo L y C filtro pi'.B$9]/[$'Cálculo L y C filtro pi'.B$8]) -> 33.4221437952044 | E902: of:=POWER(IMABS(IMSQRT(1-POWER([.C902];2)));-1)*SQRT([$'Cálculo L y C filtro pi'.B$18]/[$'Cálculo L y C filtro pi'.B$17]) -> 668.442875904088
A903: 900 | B903: of:=2*PI()*[.A903] -> 5654.86677646163 | C903: of:=[.B903]/(2*PI()*[$Descripción.B$10]) -> 18 | D903: of:=POWER(IMABS(IMSQRT(1-POWER([.C903];2)));-1)*SQRT([$'Cálculo L y C filtro pi'.B$9]/[$'Cálculo L y C filtro pi'.B$8]) -> 33.3848930444795 | E903: of:=POWER(IMABS(IMSQRT(1-POWER([.C903];2)));-1)*SQRT([$'Cálculo L y C filtro pi'.B$18]/[$'Cálculo L y C filtro pi'.B$17]) -> 667.69786088959
A904: 901 | B904: of:=2*PI()*[.A904] -> 5661.14996176881 | C904: of:=[.B904]/(2*PI()*[$Descripción.B$10]) -> 18.02 | D904: of:=POWER(IMABS(IMSQRT(1-POWER([.C904];2)));-1)*SQRT([$'Cálculo L y C filtro pi'.B$9]/[$'Cálculo L y C filtro pi'.B$8]) -> 33.3477253648956 | E904: of:=POWER(IMABS(IMSQRT(1-POWER([.C904];2)));-1)*SQRT([$'Cálculo L y C filtro pi'.B$18]/[$'Cálculo L y C filtro pi'.B$17]) -> 666.954507297912
A905: 902 | B905: of:=2*PI()*[.A905] -> 5667.43314707599 | C905: of:=[.B905]/(2*PI()*[$Descripción.B$10]) -> 18.04 | D905: of:=POWER(IMABS(IMSQRT(1-POWER([.C905];2)));-1)*SQRT([$'Cálculo L y C filtro pi'.B$9]/[$'Cálculo L y C filtro pi'.B$8]) -> 33.3106404784582 | E905: of:=POWER(IMABS(IMSQRT(1-POWER([.C905];2)));-1)*SQRT([$'Cálculo L y C filtro pi'.B$18]/[$'Cálculo L y C filtro pi'.B$17]) -> 666.212809569164
A906: 903 | B906: of:=2*PI()*[.A906] -> 5673.71633238317 | C906: of:=[.B906]/(2*PI()*[$Descripción.B$10]) -> 18.06 | D906: of:=POWER(IMABS(IMSQRT(1-POWER([.C906];2)));-1)*SQRT([$'Cálculo L y C filtro pi'.B$9]/[$'Cálculo L y C filtro pi'.B$8]) -> 33.2736381084139 | E906: of:=POWER(IMABS(IMSQRT(1-POWER([.C906];2)));-1)*SQRT([$'Cálculo L y C filtro pi'.B$18]/[$'Cálculo L y C filtro pi'.B$17]) -> 665.472762168278
A907: 904 | B907: of:=2*PI()*[.A907] -> 5679.99951769035 | C907: of:=[.B907]/(2*PI()*[$Descripción.B$10]) -> 18.08 | D907: of:=POWER(IMABS(IMSQRT(1-POWER([.C907];2)));-1)*SQRT([$'Cálculo L y C filtro pi'.B$9]/[$'Cálculo L y C filtro pi'.B$8]) -> 33.2367179792429 | E907: of:=POWER(IMABS(IMSQRT(1-POWER([.C907];2)));-1)*SQRT([$'Cálculo L y C filtro pi'.B$18]/[$'Cálculo L y C filtro pi'.B$17]) -> 664.734359584857
A908: 905 | B908: of:=2*PI()*[.A908] -> 5686.28270299753 | C908: of:=[.B908]/(2*PI()*[$Descripción.B$10]) -> 18.1 | D908: of:=POWER(IMABS(IMSQRT(1-POWER([.C908];2)));-1)*SQRT([$'Cálculo L y C filtro pi'.B$9]/[$'Cálculo L y C filtro pi'.B$8]) -> 33.1998798166527 | E908: of:=POWER(IMABS(IMSQRT(1-POWER([.C908];2)));-1)*SQRT([$'Cálculo L y C filtro pi'.B$18]/[$'Cálculo L y C filtro pi'.B$17]) -> 663.997596333054
A909: 906 | B909: of:=2*PI()*[.A909] -> 5692.56588830471 | C909: of:=[.B909]/(2*PI()*[$Descripción.B$10]) -> 18.12 | D909: of:=POWER(IMABS(IMSQRT(1-POWER([.C909];2)));-1)*SQRT([$'Cálculo L y C filtro pi'.B$9]/[$'Cálculo L y C filtro pi'.B$8]) -> 33.1631233475707 | E909: of:=POWER(IMABS(IMSQRT(1-POWER([.C909];2)));-1)*SQRT([$'Cálculo L y C filtro pi'.B$18]/[$'Cálculo L y C filtro pi'.B$17]) -> 663.262466951414
A910: 907 | B910: of:=2*PI()*[.A910] -> 5698.84907361188 | C910: of:=[.B910]/(2*PI()*[$Descripción.B$10]) -> 18.14 | D910: of:=POWER(IMABS(IMSQRT(1-POWER([.C910];2)));-1)*SQRT([$'Cálculo L y C filtro pi'.B$9]/[$'Cálculo L y C filtro pi'.B$8]) -> 33.1264483001384 | E910: of:=POWER(IMABS(IMSQRT(1-POWER([.C910];2)));-1)*SQRT([$'Cálculo L y C filtro pi'.B$18]/[$'Cálculo L y C filtro pi'.B$17]) -> 662.528966002768
A911: 908 | B911: of:=2*PI()*[.A911] -> 5705.13225891906 | C911: of:=[.B911]/(2*PI()*[$Descripción.B$10]) -> 18.16 | D911: of:=POWER(IMABS(IMSQRT(1-POWER([.C911];2)));-1)*SQRT([$'Cálculo L y C filtro pi'.B$9]/[$'Cálculo L y C filtro pi'.B$8]) -> 33.0898544037036 | E911: of:=POWER(IMABS(IMSQRT(1-POWER([.C911];2)));-1)*SQRT([$'Cálculo L y C filtro pi'.B$18]/[$'Cálculo L y C filtro pi'.B$17]) -> 661.797088074072
A912: 909 | B912: of:=2*PI()*[.A912] -> 5711.41544422624 | C912: of:=[.B912]/(2*PI()*[$Descripción.B$10]) -> 18.18 | D912: of:=POWER(IMABS(IMSQRT(1-POWER([.C912];2)));-1)*SQRT([$'Cálculo L y C filtro pi'.B$9]/[$'Cálculo L y C filtro pi'.B$8]) -> 33.053341388814 | E912: of:=POWER(IMABS(IMSQRT(1-POWER([.C912];2)));-1)*SQRT([$'Cálculo L y C filtro pi'.B$18]/[$'Cálculo L y C filtro pi'.B$17]) -> 661.066827776279
A913: 910 | B913: of:=2*PI()*[.A913] -> 5717.69862953342 | C913: of:=[.B913]/(2*PI()*[$Descripción.B$10]) -> 18.2 | D913: of:=POWER(IMABS(IMSQRT(1-POWER([.C913];2)));-1)*SQRT([$'Cálculo L y C filtro pi'.B$9]/[$'Cálculo L y C filtro pi'.B$8]) -> 33.0169089872109 | E913: of:=POWER(IMABS(IMSQRT(1-POWER([.C913];2)));-1)*SQRT([$'Cálculo L y C filtro pi'.B$18]/[$'Cálculo L y C filtro pi'.B$17]) -> 660.338179744217
A914: 911 | B914: of:=2*PI()*[.A914] -> 5723.9818148406 | C914: of:=[.B914]/(2*PI()*[$Descripción.B$10]) -> 18.22 | D914: of:=POWER(IMABS(IMSQRT(1-POWER([.C914];2)));-1)*SQRT([$'Cálculo L y C filtro pi'.B$9]/[$'Cálculo L y C filtro pi'.B$8]) -> 32.9805569318224 | E914: of:=POWER(IMABS(IMSQRT(1-POWER([.C914];2)));-1)*SQRT([$'Cálculo L y C filtro pi'.B$18]/[$'Cálculo L y C filtro pi'.B$17]) -> 659.611138636449
A915: 912 | B915: of:=2*PI()*[.A915] -> 5730.26500014778 | C915: of:=[.B915]/(2*PI()*[$Descripción.B$10]) -> 18.24 | D915: of:=POWER(IMABS(IMSQRT(1-POWER([.C915];2)));-1)*SQRT([$'Cálculo L y C filtro pi'.B$9]/[$'Cálculo L y C filtro pi'.B$8]) -> 32.9442849567568 | E915: of:=POWER(IMABS(IMSQRT(1-POWER([.C915];2)));-1)*SQRT([$'Cálculo L y C filtro pi'.B$18]/[$'Cálculo L y C filtro pi'.B$17]) -> 658.885699135136
A916: 913 | B916: of:=2*PI()*[.A916] -> 5736.54818545496 | C916: of:=[.B916]/(2*PI()*[$Descripción.B$10]) -> 18.26 | D916: of:=POWER(IMABS(IMSQRT(1-POWER([.C916];2)));-1)*SQRT([$'Cálculo L y C filtro pi'.B$9]/[$'Cálculo L y C filtro pi'.B$8]) -> 32.9080927972959 | E916: of:=POWER(IMABS(IMSQRT(1-POWER([.C916];2)));-1)*SQRT([$'Cálculo L y C filtro pi'.B$18]/[$'Cálculo L y C filtro pi'.B$17]) -> 658.161855945917
A917: 914 | B917: of:=2*PI()*[.A917] -> 5742.83137076214 | C917: of:=[.B917]/(2*PI()*[$Descripción.B$10]) -> 18.28 | D917: of:=POWER(IMABS(IMSQRT(1-POWER([.C917];2)));-1)*SQRT([$'Cálculo L y C filtro pi'.B$9]/[$'Cálculo L y C filtro pi'.B$8]) -> 32.8719801898885 | E917: of:=POWER(IMABS(IMSQRT(1-POWER([.C917];2)));-1)*SQRT([$'Cálculo L y C filtro pi'.B$18]/[$'Cálculo L y C filtro pi'.B$17]) -> 657.439603797771
A918: 915 | B918: of:=2*PI()*[.A918] -> 5749.11455606932 | C918: of:=[.B918]/(2*PI()*[$Descripción.B$10]) -> 18.3 | D918: of:=POWER(IMABS(IMSQRT(1-POWER([.C918];2)));-1)*SQRT([$'Cálculo L y C filtro pi'.B$9]/[$'Cálculo L y C filtro pi'.B$8]) -> 32.8359468721449 | E918: of:=POWER(IMABS(IMSQRT(1-POWER([.C918];2)));-1)*SQRT([$'Cálculo L y C filtro pi'.B$18]/[$'Cálculo L y C filtro pi'.B$17]) -> 656.718937442898
A919: 916 | B919: of:=2*PI()*[.A919] -> 5755.3977413765 | C919: of:=[.B919]/(2*PI()*[$Descripción.B$10]) -> 18.32 | D919: of:=POWER(IMABS(IMSQRT(1-POWER([.C919];2)));-1)*SQRT([$'Cálculo L y C filtro pi'.B$9]/[$'Cálculo L y C filtro pi'.B$8]) -> 32.7999925828291 | E919: of:=POWER(IMABS(IMSQRT(1-POWER([.C919];2)));-1)*SQRT([$'Cálculo L y C filtro pi'.B$18]/[$'Cálculo L y C filtro pi'.B$17]) -> 655.999851656583
A920: 917 | B920: of:=2*PI()*[.A920] -> 5761.68092668368 | C920: of:=[.B920]/(2*PI()*[$Descripción.B$10]) -> 18.34 | D920: of:=POWER(IMABS(IMSQRT(1-POWER([.C920];2)));-1)*SQRT([$'Cálculo L y C filtro pi'.B$9]/[$'Cálculo L y C filtro pi'.B$8]) -> 32.7641170618535 | E920: of:=POWER(IMABS(IMSQRT(1-POWER([.C920];2)));-1)*SQRT([$'Cálculo L y C filtro pi'.B$18]/[$'Cálculo L y C filtro pi'.B$17]) -> 655.28234123707
A921: 918 | B921: of:=2*PI()*[.A921] -> 5767.96411199086 | C921: of:=[.B921]/(2*PI()*[$Descripción.B$10]) -> 18.36 | D921: of:=POWER(IMABS(IMSQRT(1-POWER([.C921];2)));-1)*SQRT([$'Cálculo L y C filtro pi'.B$9]/[$'Cálculo L y C filtro pi'.B$8]) -> 32.7283200502718 | E921: of:=POWER(IMABS(IMSQRT(1-POWER([.C921];2)));-1)*SQRT([$'Cálculo L y C filtro pi'.B$18]/[$'Cálculo L y C filtro pi'.B$17]) -> 654.566401005436
A922: 919 | B922: of:=2*PI()*[.A922] -> 5774.24729729804 | C922: of:=[.B922]/(2*PI()*[$Descripción.B$10]) -> 18.38 | D922: of:=POWER(IMABS(IMSQRT(1-POWER([.C922];2)));-1)*SQRT([$'Cálculo L y C filtro pi'.B$9]/[$'Cálculo L y C filtro pi'.B$8]) -> 32.6926012902734 | E922: of:=POWER(IMABS(IMSQRT(1-POWER([.C922];2)));-1)*SQRT([$'Cálculo L y C filtro pi'.B$18]/[$'Cálculo L y C filtro pi'.B$17]) -> 653.852025805469
A923: 920 | B923: of:=2*PI()*[.A923] -> 5780.53048260522 | C923: of:=[.B923]/(2*PI()*[$Descripción.B$10]) -> 18.4 | D923: of:=POWER(IMABS(IMSQRT(1-POWER([.C923];2)));-1)*SQRT([$'Cálculo L y C filtro pi'.B$9]/[$'Cálculo L y C filtro pi'.B$8]) -> 32.6569605251771 | E923: of:=POWER(IMABS(IMSQRT(1-POWER([.C923];2)));-1)*SQRT([$'Cálculo L y C filtro pi'.B$18]/[$'Cálculo L y C filtro pi'.B$17]) -> 653.139210503542
A924: 921 | B924: of:=2*PI()*[.A924] -> 5786.8136679124 | C924: of:=[.B924]/(2*PI()*[$Descripción.B$10]) -> 18.42 | D924: of:=POWER(IMABS(IMSQRT(1-POWER([.C924];2)));-1)*SQRT([$'Cálculo L y C filtro pi'.B$9]/[$'Cálculo L y C filtro pi'.B$8]) -> 32.6213974994244 | E924: of:=POWER(IMABS(IMSQRT(1-POWER([.C924];2)));-1)*SQRT([$'Cálculo L y C filtro pi'.B$18]/[$'Cálculo L y C filtro pi'.B$17]) -> 652.427949988489
A925: 922 | B925: of:=2*PI()*[.A925] -> 5793.09685321958 | C925: of:=[.B925]/(2*PI()*[$Descripción.B$10]) -> 18.44 | D925: of:=POWER(IMABS(IMSQRT(1-POWER([.C925];2)));-1)*SQRT([$'Cálculo L y C filtro pi'.B$9]/[$'Cálculo L y C filtro pi'.B$8]) -> 32.5859119585739 | E925: of:=POWER(IMABS(IMSQRT(1-POWER([.C925];2)));-1)*SQRT([$'Cálculo L y C filtro pi'.B$18]/[$'Cálculo L y C filtro pi'.B$17]) -> 651.718239171478
A926: 923 | B926: of:=2*PI()*[.A926] -> 5799.38003852676 | C926: of:=[.B926]/(2*PI()*[$Descripción.B$10]) -> 18.46 | D926: of:=POWER(IMABS(IMSQRT(1-POWER([.C926];2)));-1)*SQRT([$'Cálculo L y C filtro pi'.B$9]/[$'Cálculo L y C filtro pi'.B$8]) -> 32.5505036492949 | E926: of:=POWER(IMABS(IMSQRT(1-POWER([.C926];2)));-1)*SQRT([$'Cálculo L y C filtro pi'.B$18]/[$'Cálculo L y C filtro pi'.B$17]) -> 651.010072985899
A927: 924 | B927: of:=2*PI()*[.A927] -> 5805.66322383394 | C927: of:=[.B927]/(2*PI()*[$Descripción.B$10]) -> 18.48 | D927: of:=POWER(IMABS(IMSQRT(1-POWER([.C927];2)));-1)*SQRT([$'Cálculo L y C filtro pi'.B$9]/[$'Cálculo L y C filtro pi'.B$8]) -> 32.5151723193613 | E927: of:=POWER(IMABS(IMSQRT(1-POWER([.C927];2)));-1)*SQRT([$'Cálculo L y C filtro pi'.B$18]/[$'Cálculo L y C filtro pi'.B$17]) -> 650.303446387226
A928: 925 | B928: of:=2*PI()*[.A928] -> 5811.94640914112 | C928: of:=[.B928]/(2*PI()*[$Descripción.B$10]) -> 18.5 | D928: of:=POWER(IMABS(IMSQRT(1-POWER([.C928];2)));-1)*SQRT([$'Cálculo L y C filtro pi'.B$9]/[$'Cálculo L y C filtro pi'.B$8]) -> 32.4799177176459 | E928: of:=POWER(IMABS(IMSQRT(1-POWER([.C928];2)));-1)*SQRT([$'Cálculo L y C filtro pi'.B$18]/[$'Cálculo L y C filtro pi'.B$17]) -> 649.598354352919
A929: 926 | B929: of:=2*PI()*[.A929] -> 5818.2295944483 | C929: of:=[.B929]/(2*PI()*[$Descripción.B$10]) -> 18.52 | D929: of:=POWER(IMABS(IMSQRT(1-POWER([.C929];2)));-1)*SQRT([$'Cálculo L y C filtro pi'.B$9]/[$'Cálculo L y C filtro pi'.B$8]) -> 32.4447395941143 | E929: of:=POWER(IMABS(IMSQRT(1-POWER([.C929];2)));-1)*SQRT([$'Cálculo L y C filtro pi'.B$18]/[$'Cálculo L y C filtro pi'.B$17]) -> 648.894791882285
A930: 927 | B930: of:=2*PI()*[.A930] -> 5824.51277975548 | C930: of:=[.B930]/(2*PI()*[$Descripción.B$10]) -> 18.54 | D930: of:=POWER(IMABS(IMSQRT(1-POWER([.C930];2)));-1)*SQRT([$'Cálculo L y C filtro pi'.B$9]/[$'Cálculo L y C filtro pi'.B$8]) -> 32.4096376998185 | E930: of:=POWER(IMABS(IMSQRT(1-POWER([.C930];2)));-1)*SQRT([$'Cálculo L y C filtro pi'.B$18]/[$'Cálculo L y C filtro pi'.B$17]) -> 648.19275399637
A931: 928 | B931: of:=2*PI()*[.A931] -> 5830.79596506266 | C931: of:=[.B931]/(2*PI()*[$Descripción.B$10]) -> 18.56 | D931: of:=POWER(IMABS(IMSQRT(1-POWER([.C931];2)));-1)*SQRT([$'Cálculo L y C filtro pi'.B$9]/[$'Cálculo L y C filtro pi'.B$8]) -> 32.3746117868917 | E931: of:=POWER(IMABS(IMSQRT(1-POWER([.C931];2)));-1)*SQRT([$'Cálculo L y C filtro pi'.B$18]/[$'Cálculo L y C filtro pi'.B$17]) -> 647.492235737834
A932: 929 | B932: of:=2*PI()*[.A932] -> 5837.07915036984 | C932: of:=[.B932]/(2*PI()*[$Descripción.B$10]) -> 18.58 | D932: of:=POWER(IMABS(IMSQRT(1-POWER([.C932];2)));-1)*SQRT([$'Cálculo L y C filtro pi'.B$9]/[$'Cálculo L y C filtro pi'.B$8]) -> 32.3396616085417 | E932: of:=POWER(IMABS(IMSQRT(1-POWER([.C932];2)));-1)*SQRT([$'Cálculo L y C filtro pi'.B$18]/[$'Cálculo L y C filtro pi'.B$17]) -> 646.793232170834
A933: 930 | B933: of:=2*PI()*[.A933] -> 5843.36233567702 | C933: of:=[.B933]/(2*PI()*[$Descripción.B$10]) -> 18.6 | D933: of:=POWER(IMABS(IMSQRT(1-POWER([.C933];2)));-1)*SQRT([$'Cálculo L y C filtro pi'.B$9]/[$'Cálculo L y C filtro pi'.B$8]) -> 32.304786919046 | E933: of:=POWER(IMABS(IMSQRT(1-POWER([.C933];2)));-1)*SQRT([$'Cálculo L y C filtro pi'.B$18]/[$'Cálculo L y C filtro pi'.B$17]) -> 646.09573838092
A934: 931 | B934: of:=2*PI()*[.A934] -> 5849.6455209842 | C934: of:=[.B934]/(2*PI()*[$Descripción.B$10]) -> 18.62 | D934: of:=POWER(IMABS(IMSQRT(1-POWER([.C934];2)));-1)*SQRT([$'Cálculo L y C filtro pi'.B$9]/[$'Cálculo L y C filtro pi'.B$8]) -> 32.2699874737453 | E934: of:=POWER(IMABS(IMSQRT(1-POWER([.C934];2)));-1)*SQRT([$'Cálculo L y C filtro pi'.B$18]/[$'Cálculo L y C filtro pi'.B$17]) -> 645.399749474905
A935: 932 | B935: of:=2*PI()*[.A935] -> 5855.92870629137 | C935: of:=[.B935]/(2*PI()*[$Descripción.B$10]) -> 18.64 | D935: of:=POWER(IMABS(IMSQRT(1-POWER([.C935];2)));-1)*SQRT([$'Cálculo L y C filtro pi'.B$9]/[$'Cálculo L y C filtro pi'.B$8]) -> 32.2352630290374 | E935: of:=POWER(IMABS(IMSQRT(1-POWER([.C935];2)));-1)*SQRT([$'Cálculo L y C filtro pi'.B$18]/[$'Cálculo L y C filtro pi'.B$17]) -> 644.705260580748
A936: 933 | B936: of:=2*PI()*[.A936] -> 5862.21189159855 | C936: of:=[.B936]/(2*PI()*[$Descripción.B$10]) -> 18.66 | D936: of:=POWER(IMABS(IMSQRT(1-POWER([.C936];2)));-1)*SQRT([$'Cálculo L y C filtro pi'.B$9]/[$'Cálculo L y C filtro pi'.B$8]) -> 32.2006133423727 | E936: of:=POWER(IMABS(IMSQRT(1-POWER([.C936];2)));-1)*SQRT([$'Cálculo L y C filtro pi'.B$18]/[$'Cálculo L y C filtro pi'.B$17]) -> 644.012266847454
A937: 934 | B937: of:=2*PI()*[.A937] -> 5868.49507690573 | C937: of:=[.B937]/(2*PI()*[$Descripción.B$10]) -> 18.68 | D937: of:=POWER(IMABS(IMSQRT(1-POWER([.C937];2)));-1)*SQRT([$'Cálculo L y C filtro pi'.B$9]/[$'Cálculo L y C filtro pi'.B$8]) -> 32.1660381722477 | E937: of:=POWER(IMABS(IMSQRT(1-POWER([.C937];2)));-1)*SQRT([$'Cálculo L y C filtro pi'.B$18]/[$'Cálculo L y C filtro pi'.B$17]) -> 643.320763444954
A938: 935 | B938: of:=2*PI()*[.A938] -> 5874.77826221291 | C938: of:=[.B938]/(2*PI()*[$Descripción.B$10]) -> 18.7 | D938: of:=POWER(IMABS(IMSQRT(1-POWER([.C938];2)));-1)*SQRT([$'Cálculo L y C filtro pi'.B$9]/[$'Cálculo L y C filtro pi'.B$8]) -> 32.1315372781988 | E938: of:=POWER(IMABS(IMSQRT(1-POWER([.C938];2)));-1)*SQRT([$'Cálculo L y C filtro pi'.B$18]/[$'Cálculo L y C filtro pi'.B$17]) -> 642.630745563976
A939: 936 | B939: of:=2*PI()*[.A939] -> 5881.06144752009 | C939: of:=[.B939]/(2*PI()*[$Descripción.B$10]) -> 18.72 | D939: of:=POWER(IMABS(IMSQRT(1-POWER([.C939];2)));-1)*SQRT([$'Cálculo L y C filtro pi'.B$9]/[$'Cálculo L y C filtro pi'.B$8]) -> 32.0971104207983 | E939: of:=POWER(IMABS(IMSQRT(1-POWER([.C939];2)));-1)*SQRT([$'Cálculo L y C filtro pi'.B$18]/[$'Cálculo L y C filtro pi'.B$17]) -> 641.942208415966
A940: 937 | B940: of:=2*PI()*[.A940] -> 5887.34463282727 | C940: of:=[.B940]/(2*PI()*[$Descripción.B$10]) -> 18.74 | D940: of:=POWER(IMABS(IMSQRT(1-POWER([.C940];2)));-1)*SQRT([$'Cálculo L y C filtro pi'.B$9]/[$'Cálculo L y C filtro pi'.B$8]) -> 32.0627573616472 | E940: of:=POWER(IMABS(IMSQRT(1-POWER([.C940];2)));-1)*SQRT([$'Cálculo L y C filtro pi'.B$18]/[$'Cálculo L y C filtro pi'.B$17]) -> 641.255147232945
A941: 938 | B941: of:=2*PI()*[.A941] -> 5893.62781813445 | C941: of:=[.B941]/(2*PI()*[$Descripción.B$10]) -> 18.76 | D941: of:=POWER(IMABS(IMSQRT(1-POWER([.C941];2)));-1)*SQRT([$'Cálculo L y C filtro pi'.B$9]/[$'Cálculo L y C filtro pi'.B$8]) -> 32.0284778633711 | E941: of:=POWER(IMABS(IMSQRT(1-POWER([.C941];2)));-1)*SQRT([$'Cálculo L y C filtro pi'.B$18]/[$'Cálculo L y C filtro pi'.B$17]) -> 640.569557267422
A942: 939 | B942: of:=2*PI()*[.A942] -> 5899.91100344163 | C942: of:=[.B942]/(2*PI()*[$Descripción.B$10]) -> 18.78 | D942: of:=POWER(IMABS(IMSQRT(1-POWER([.C942];2)));-1)*SQRT([$'Cálculo L y C filtro pi'.B$9]/[$'Cálculo L y C filtro pi'.B$8]) -> 31.994271689613 | E942: of:=POWER(IMABS(IMSQRT(1-POWER([.C942];2)));-1)*SQRT([$'Cálculo L y C filtro pi'.B$18]/[$'Cálculo L y C filtro pi'.B$17]) -> 639.885433792261
A943: 940 | B943: of:=2*PI()*[.A943] -> 5906.19418874881 | C943: of:=[.B943]/(2*PI()*[$Descripción.B$10]) -> 18.8 | D943: of:=POWER(IMABS(IMSQRT(1-POWER([.C943];2)));-1)*SQRT([$'Cálculo L y C filtro pi'.B$9]/[$'Cálculo L y C filtro pi'.B$8]) -> 31.9601386050297 | E943: of:=POWER(IMABS(IMSQRT(1-POWER([.C943];2)));-1)*SQRT([$'Cálculo L y C filtro pi'.B$18]/[$'Cálculo L y C filtro pi'.B$17]) -> 639.202772100594
A944: 941 | B944: of:=2*PI()*[.A944] -> 5912.47737405599 | C944: of:=[.B944]/(2*PI()*[$Descripción.B$10]) -> 18.82 | D944: of:=POWER(IMABS(IMSQRT(1-POWER([.C944];2)));-1)*SQRT([$'Cálculo L y C filtro pi'.B$9]/[$'Cálculo L y C filtro pi'.B$8]) -> 31.9260783752848 | E944: of:=POWER(IMABS(IMSQRT(1-POWER([.C944];2)));-1)*SQRT([$'Cálculo L y C filtro pi'.B$18]/[$'Cálculo L y C filtro pi'.B$17]) -> 638.521567505696
A945: 942 | B945: of:=2*PI()*[.A945] -> 5918.76055936317 | C945: of:=[.B945]/(2*PI()*[$Descripción.B$10]) -> 18.84 | D945: of:=POWER(IMABS(IMSQRT(1-POWER([.C945];2)));-1)*SQRT([$'Cálculo L y C filtro pi'.B$9]/[$'Cálculo L y C filtro pi'.B$8]) -> 31.8920907670447 | E945: of:=POWER(IMABS(IMSQRT(1-POWER([.C945];2)));-1)*SQRT([$'Cálculo L y C filtro pi'.B$18]/[$'Cálculo L y C filtro pi'.B$17]) -> 637.841815340894
A946: 943 | B946: of:=2*PI()*[.A946] -> 5925.04374467035 | C946: of:=[.B946]/(2*PI()*[$Descripción.B$10]) -> 18.86 | D946: of:=POWER(IMABS(IMSQRT(1-POWER([.C946];2)));-1)*SQRT([$'Cálculo L y C filtro pi'.B$9]/[$'Cálculo L y C filtro pi'.B$8]) -> 31.8581755479718 | E946: of:=POWER(IMABS(IMSQRT(1-POWER([.C946];2)));-1)*SQRT([$'Cálculo L y C filtro pi'.B$18]/[$'Cálculo L y C filtro pi'.B$17]) -> 637.163510959437
A947: 944 | B947: of:=2*PI()*[.A947] -> 5931.32692997753 | C947: of:=[.B947]/(2*PI()*[$Descripción.B$10]) -> 18.88 | D947: of:=POWER(IMABS(IMSQRT(1-POWER([.C947];2)));-1)*SQRT([$'Cálculo L y C filtro pi'.B$9]/[$'Cálculo L y C filtro pi'.B$8]) -> 31.8243324867204 | E947: of:=POWER(IMABS(IMSQRT(1-POWER([.C947];2)));-1)*SQRT([$'Cálculo L y C filtro pi'.B$18]/[$'Cálculo L y C filtro pi'.B$17]) -> 636.486649734408
A948: 945 | B948: of:=2*PI()*[.A948] -> 5937.61011528471 | C948: of:=[.B948]/(2*PI()*[$Descripción.B$10]) -> 18.9 | D948: of:=POWER(IMABS(IMSQRT(1-POWER([.C948];2)));-1)*SQRT([$'Cálculo L y C filtro pi'.B$9]/[$'Cálculo L y C filtro pi'.B$8]) -> 31.7905613529305 | E948: of:=POWER(IMABS(IMSQRT(1-POWER([.C948];2)));-1)*SQRT([$'Cálculo L y C filtro pi'.B$18]/[$'Cálculo L y C filtro pi'.B$17]) -> 635.811227058611
A949: 946 | B949: of:=2*PI()*[.A949] -> 5943.89330059189 | C949: of:=[.B949]/(2*PI()*[$Descripción.B$10]) -> 18.92 | D949: of:=POWER(IMABS(IMSQRT(1-POWER([.C949];2)));-1)*SQRT([$'Cálculo L y C filtro pi'.B$9]/[$'Cálculo L y C filtro pi'.B$8]) -> 31.7568619172235 | E949: of:=POWER(IMABS(IMSQRT(1-POWER([.C949];2)));-1)*SQRT([$'Cálculo L y C filtro pi'.B$18]/[$'Cálculo L y C filtro pi'.B$17]) -> 635.13723834447
A950: 947 | B950: of:=2*PI()*[.A950] -> 5950.17648589907 | C950: of:=[.B950]/(2*PI()*[$Descripción.B$10]) -> 18.94 | D950: of:=POWER(IMABS(IMSQRT(1-POWER([.C950];2)));-1)*SQRT([$'Cálculo L y C filtro pi'.B$9]/[$'Cálculo L y C filtro pi'.B$8]) -> 31.723233951196 | E950: of:=POWER(IMABS(IMSQRT(1-POWER([.C950];2)));-1)*SQRT([$'Cálculo L y C filtro pi'.B$18]/[$'Cálculo L y C filtro pi'.B$17]) -> 634.464679023921
A951: 948 | B951: of:=2*PI()*[.A951] -> 5956.45967120625 | C951: of:=[.B951]/(2*PI()*[$Descripción.B$10]) -> 18.96 | D951: of:=POWER(IMABS(IMSQRT(1-POWER([.C951];2)));-1)*SQRT([$'Cálculo L y C filtro pi'.B$9]/[$'Cálculo L y C filtro pi'.B$8]) -> 31.6896772274153 | E951: of:=POWER(IMABS(IMSQRT(1-POWER([.C951];2)));-1)*SQRT([$'Cálculo L y C filtro pi'.B$18]/[$'Cálculo L y C filtro pi'.B$17]) -> 633.793544548305
A952: 949 | B952: of:=2*PI()*[.A952] -> 5962.74285651343 | C952: of:=[.B952]/(2*PI()*[$Descripción.B$10]) -> 18.98 | D952: of:=POWER(IMABS(IMSQRT(1-POWER([.C952];2)));-1)*SQRT([$'Cálculo L y C filtro pi'.B$9]/[$'Cálculo L y C filtro pi'.B$8]) -> 31.6561915194136 | E952: of:=POWER(IMABS(IMSQRT(1-POWER([.C952];2)));-1)*SQRT([$'Cálculo L y C filtro pi'.B$18]/[$'Cálculo L y C filtro pi'.B$17]) -> 633.123830388272
A953: 950 | B953: of:=2*PI()*[.A953] -> 5969.02604182061 | C953: of:=[.B953]/(2*PI()*[$Descripción.B$10]) -> 19 | D953: of:=POWER(IMABS(IMSQRT(1-POWER([.C953];2)));-1)*SQRT([$'Cálculo L y C filtro pi'.B$9]/[$'Cálculo L y C filtro pi'.B$8]) -> 31.6227766016837 | E953: of:=POWER(IMABS(IMSQRT(1-POWER([.C953];2)));-1)*SQRT([$'Cálculo L y C filtro pi'.B$18]/[$'Cálculo L y C filtro pi'.B$17]) -> 632.455532033675
A954: 951 | B954: of:=2*PI()*[.A954] -> 5975.30922712779 | C954: of:=[.B954]/(2*PI()*[$Descripción.B$10]) -> 19.02 | D954: of:=POWER(IMABS(IMSQRT(1-POWER([.C954];2)));-1)*SQRT([$'Cálculo L y C filtro pi'.B$9]/[$'Cálculo L y C filtro pi'.B$8]) -> 31.5894322496735 | E954: of:=POWER(IMABS(IMSQRT(1-POWER([.C954];2)));-1)*SQRT([$'Cálculo L y C filtro pi'.B$18]/[$'Cálculo L y C filtro pi'.B$17]) -> 631.788644993471
A955: 952 | B955: of:=2*PI()*[.A955] -> 5981.59241243497 | C955: of:=[.B955]/(2*PI()*[$Descripción.B$10]) -> 19.04 | D955: of:=POWER(IMABS(IMSQRT(1-POWER([.C955];2)));-1)*SQRT([$'Cálculo L y C filtro pi'.B$9]/[$'Cálculo L y C filtro pi'.B$8]) -> 31.5561582397806 | E955: of:=POWER(IMABS(IMSQRT(1-POWER([.C955];2)));-1)*SQRT([$'Cálculo L y C filtro pi'.B$18]/[$'Cálculo L y C filtro pi'.B$17]) -> 631.123164795612
A956: 953 | B956: of:=2*PI()*[.A956] -> 5987.87559774215 | C956: of:=[.B956]/(2*PI()*[$Descripción.B$10]) -> 19.06 | D956: of:=POWER(IMABS(IMSQRT(1-POWER([.C956];2)));-1)*SQRT([$'Cálculo L y C filtro pi'.B$9]/[$'Cálculo L y C filtro pi'.B$8]) -> 31.5229543493476 | E956: of:=POWER(IMABS(IMSQRT(1-POWER([.C956];2)));-1)*SQRT([$'Cálculo L y C filtro pi'.B$18]/[$'Cálculo L y C filtro pi'.B$17]) -> 630.459086986952
A957: 954 | B957: of:=2*PI()*[.A957] -> 5994.15878304933 | C957: of:=[.B957]/(2*PI()*[$Descripción.B$10]) -> 19.08 | D957: of:=POWER(IMABS(IMSQRT(1-POWER([.C957];2)));-1)*SQRT([$'Cálculo L y C filtro pi'.B$9]/[$'Cálculo L y C filtro pi'.B$8]) -> 31.4898203566575 | E957: of:=POWER(IMABS(IMSQRT(1-POWER([.C957];2)));-1)*SQRT([$'Cálculo L y C filtro pi'.B$18]/[$'Cálculo L y C filtro pi'.B$17]) -> 629.796407133151
A958: 955 | B958: of:=2*PI()*[.A958] -> 6000.44196835651 | C958: of:=[.B958]/(2*PI()*[$Descripción.B$10]) -> 19.1 | D958: of:=POWER(IMABS(IMSQRT(1-POWER([.C958];2)));-1)*SQRT([$'Cálculo L y C filtro pi'.B$9]/[$'Cálculo L y C filtro pi'.B$8]) -> 31.4567560409278 | E958: of:=POWER(IMABS(IMSQRT(1-POWER([.C958];2)));-1)*SQRT([$'Cálculo L y C filtro pi'.B$18]/[$'Cálculo L y C filtro pi'.B$17]) -> 629.135120818556
A959: 956 | B959: of:=2*PI()*[.A959] -> 6006.72515366368 | C959: of:=[.B959]/(2*PI()*[$Descripción.B$10]) -> 19.12 | D959: of:=POWER(IMABS(IMSQRT(1-POWER([.C959];2)));-1)*SQRT([$'Cálculo L y C filtro pi'.B$9]/[$'Cálculo L y C filtro pi'.B$8]) -> 31.4237611823068 | E959: of:=POWER(IMABS(IMSQRT(1-POWER([.C959];2)));-1)*SQRT([$'Cálculo L y C filtro pi'.B$18]/[$'Cálculo L y C filtro pi'.B$17]) -> 628.475223646136
A960: 957 | B960: of:=2*PI()*[.A960] -> 6013.00833897086 | C960: of:=[.B960]/(2*PI()*[$Descripción.B$10]) -> 19.14 | D960: of:=POWER(IMABS(IMSQRT(1-POWER([.C960];2)));-1)*SQRT([$'Cálculo L y C filtro pi'.B$9]/[$'Cálculo L y C filtro pi'.B$8]) -> 31.3908355618673 | E960: of:=POWER(IMABS(IMSQRT(1-POWER([.C960];2)));-1)*SQRT([$'Cálculo L y C filtro pi'.B$18]/[$'Cálculo L y C filtro pi'.B$17]) -> 627.816711237346
A961: 958 | B961: of:=2*PI()*[.A961] -> 6019.29152427804 | C961: of:=[.B961]/(2*PI()*[$Descripción.B$10]) -> 19.16 | D961: of:=POWER(IMABS(IMSQRT(1-POWER([.C961];2)));-1)*SQRT([$'Cálculo L y C filtro pi'.B$9]/[$'Cálculo L y C filtro pi'.B$8]) -> 31.3579789616029 | E961: of:=POWER(IMABS(IMSQRT(1-POWER([.C961];2)));-1)*SQRT([$'Cálculo L y C filtro pi'.B$18]/[$'Cálculo L y C filtro pi'.B$17]) -> 627.159579232058
A962: 959 | B962: of:=2*PI()*[.A962] -> 6025.57470958522 | C962: of:=[.B962]/(2*PI()*[$Descripción.B$10]) -> 19.18 | D962: of:=POWER(IMABS(IMSQRT(1-POWER([.C962];2)));-1)*SQRT([$'Cálculo L y C filtro pi'.B$9]/[$'Cálculo L y C filtro pi'.B$8]) -> 31.3251911644223 | E962: of:=POWER(IMABS(IMSQRT(1-POWER([.C962];2)));-1)*SQRT([$'Cálculo L y C filtro pi'.B$18]/[$'Cálculo L y C filtro pi'.B$17]) -> 626.503823288446
A963: 960 | B963: of:=2*PI()*[.A963] -> 6031.8578948924 | C963: of:=[.B963]/(2*PI()*[$Descripción.B$10]) -> 19.2 | D963: of:=POWER(IMABS(IMSQRT(1-POWER([.C963];2)));-1)*SQRT([$'Cálculo L y C filtro pi'.B$9]/[$'Cálculo L y C filtro pi'.B$8]) -> 31.2924719541454 | E963: of:=POWER(IMABS(IMSQRT(1-POWER([.C963];2)));-1)*SQRT([$'Cálculo L y C filtro pi'.B$18]/[$'Cálculo L y C filtro pi'.B$17]) -> 625.849439082908
A964: 961 | B964: of:=2*PI()*[.A964] -> 6038.14108019958 | C964: of:=[.B964]/(2*PI()*[$Descripción.B$10]) -> 19.22 | D964: of:=POWER(IMABS(IMSQRT(1-POWER([.C964];2)));-1)*SQRT([$'Cálculo L y C filtro pi'.B$9]/[$'Cálculo L y C filtro pi'.B$8]) -> 31.2598211154977 | E964: of:=POWER(IMABS(IMSQRT(1-POWER([.C964];2)));-1)*SQRT([$'Cálculo L y C filtro pi'.B$18]/[$'Cálculo L y C filtro pi'.B$17]) -> 625.196422309954
A965: 962 | B965: of:=2*PI()*[.A965] -> 6044.42426550676 | C965: of:=[.B965]/(2*PI()*[$Descripción.B$10]) -> 19.24 | D965: of:=POWER(IMABS(IMSQRT(1-POWER([.C965];2)));-1)*SQRT([$'Cálculo L y C filtro pi'.B$9]/[$'Cálculo L y C filtro pi'.B$8]) -> 31.2272384341061 | E965: of:=POWER(IMABS(IMSQRT(1-POWER([.C965];2)));-1)*SQRT([$'Cálculo L y C filtro pi'.B$18]/[$'Cálculo L y C filtro pi'.B$17]) -> 624.544768682123
A966: 963 | B966: of:=2*PI()*[.A966] -> 6050.70745081394 | C966: of:=[.B966]/(2*PI()*[$Descripción.B$10]) -> 19.26 | D966: of:=POWER(IMABS(IMSQRT(1-POWER([.C966];2)));-1)*SQRT([$'Cálculo L y C filtro pi'.B$9]/[$'Cálculo L y C filtro pi'.B$8]) -> 31.1947236964936 | E966: of:=POWER(IMABS(IMSQRT(1-POWER([.C966];2)));-1)*SQRT([$'Cálculo L y C filtro pi'.B$18]/[$'Cálculo L y C filtro pi'.B$17]) -> 623.894473929871
A967: 964 | B967: of:=2*PI()*[.A967] -> 6056.99063612112 | C967: of:=[.B967]/(2*PI()*[$Descripción.B$10]) -> 19.28 | D967: of:=POWER(IMABS(IMSQRT(1-POWER([.C967];2)));-1)*SQRT([$'Cálculo L y C filtro pi'.B$9]/[$'Cálculo L y C filtro pi'.B$8]) -> 31.162276690075 | E967: of:=POWER(IMABS(IMSQRT(1-POWER([.C967];2)));-1)*SQRT([$'Cálculo L y C filtro pi'.B$18]/[$'Cálculo L y C filtro pi'.B$17]) -> 623.245533801501
A968: 965 | B968: of:=2*PI()*[.A968] -> 6063.2738214283 | C968: of:=[.B968]/(2*PI()*[$Descripción.B$10]) -> 19.3 | D968: of:=POWER(IMABS(IMSQRT(1-POWER([.C968];2)));-1)*SQRT([$'Cálculo L y C filtro pi'.B$9]/[$'Cálculo L y C filtro pi'.B$8]) -> 31.1298972031529 | E968: of:=POWER(IMABS(IMSQRT(1-POWER([.C968];2)));-1)*SQRT([$'Cálculo L y C filtro pi'.B$18]/[$'Cálculo L y C filtro pi'.B$17]) -> 622.597944063058
A969: 966 | B969: of:=2*PI()*[.A969] -> 6069.55700673548 | C969: of:=[.B969]/(2*PI()*[$Descripción.B$10]) -> 19.32 | D969: of:=POWER(IMABS(IMSQRT(1-POWER([.C969];2)));-1)*SQRT([$'Cálculo L y C filtro pi'.B$9]/[$'Cálculo L y C filtro pi'.B$8]) -> 31.0975850249114 | E969: of:=POWER(IMABS(IMSQRT(1-POWER([.C969];2)));-1)*SQRT([$'Cálculo L y C filtro pi'.B$18]/[$'Cálculo L y C filtro pi'.B$17]) -> 621.951700498228
A970: 967 | B970: of:=2*PI()*[.A970] -> 6075.84019204266 | C970: of:=[.B970]/(2*PI()*[$Descripción.B$10]) -> 19.34 | D970: of:=POWER(IMABS(IMSQRT(1-POWER([.C970];2)));-1)*SQRT([$'Cálculo L y C filtro pi'.B$9]/[$'Cálculo L y C filtro pi'.B$8]) -> 31.0653399454133 | E970: of:=POWER(IMABS(IMSQRT(1-POWER([.C970];2)));-1)*SQRT([$'Cálculo L y C filtro pi'.B$18]/[$'Cálculo L y C filtro pi'.B$17]) -> 621.306798908265
A971: 968 | B971: of:=2*PI()*[.A971] -> 6082.12337734984 | C971: of:=[.B971]/(2*PI()*[$Descripción.B$10]) -> 19.36 | D971: of:=POWER(IMABS(IMSQRT(1-POWER([.C971];2)));-1)*SQRT([$'Cálculo L y C filtro pi'.B$9]/[$'Cálculo L y C filtro pi'.B$8]) -> 31.033161755594 | E971: of:=POWER(IMABS(IMSQRT(1-POWER([.C971];2)));-1)*SQRT([$'Cálculo L y C filtro pi'.B$18]/[$'Cálculo L y C filtro pi'.B$17]) -> 620.663235111881
A972: 969 | B972: of:=2*PI()*[.A972] -> 6088.40656265702 | C972: of:=[.B972]/(2*PI()*[$Descripción.B$10]) -> 19.38 | D972: of:=POWER(IMABS(IMSQRT(1-POWER([.C972];2)));-1)*SQRT([$'Cálculo L y C filtro pi'.B$9]/[$'Cálculo L y C filtro pi'.B$8]) -> 31.0010502472583 | E972: of:=POWER(IMABS(IMSQRT(1-POWER([.C972];2)));-1)*SQRT([$'Cálculo L y C filtro pi'.B$18]/[$'Cálculo L y C filtro pi'.B$17]) -> 620.021004945166
A973: 970 | B973: of:=2*PI()*[.A973] -> 6094.6897479642 | C973: of:=[.B973]/(2*PI()*[$Descripción.B$10]) -> 19.4 | D973: of:=POWER(IMABS(IMSQRT(1-POWER([.C973];2)));-1)*SQRT([$'Cálculo L y C filtro pi'.B$9]/[$'Cálculo L y C filtro pi'.B$8]) -> 30.9690052130751 | E973: of:=POWER(IMABS(IMSQRT(1-POWER([.C973];2)));-1)*SQRT([$'Cálculo L y C filtro pi'.B$18]/[$'Cálculo L y C filtro pi'.B$17]) -> 619.380104261502
A974: 971 | B974: of:=2*PI()*[.A974] -> 6100.97293327138 | C974: of:=[.B974]/(2*PI()*[$Descripción.B$10]) -> 19.42 | D974: of:=POWER(IMABS(IMSQRT(1-POWER([.C974];2)));-1)*SQRT([$'Cálculo L y C filtro pi'.B$9]/[$'Cálculo L y C filtro pi'.B$8]) -> 30.9370264465725 | E974: of:=POWER(IMABS(IMSQRT(1-POWER([.C974];2)));-1)*SQRT([$'Cálculo L y C filtro pi'.B$18]/[$'Cálculo L y C filtro pi'.B$17]) -> 618.74052893145
A975: 972 | B975: of:=2*PI()*[.A975] -> 6107.25611857856 | C975: of:=[.B975]/(2*PI()*[$Descripción.B$10]) -> 19.44 | D975: of:=POWER(IMABS(IMSQRT(1-POWER([.C975];2)));-1)*SQRT([$'Cálculo L y C filtro pi'.B$9]/[$'Cálculo L y C filtro pi'.B$8]) -> 30.9051137421349 | E975: of:=POWER(IMABS(IMSQRT(1-POWER([.C975];2)));-1)*SQRT([$'Cálculo L y C filtro pi'.B$18]/[$'Cálculo L y C filtro pi'.B$17]) -> 618.102274842697
A976: 973 | B976: of:=2*PI()*[.A976] -> 6113.53930388574 | C976: of:=[.B976]/(2*PI()*[$Descripción.B$10]) -> 19.46 | D976: of:=POWER(IMABS(IMSQRT(1-POWER([.C976];2)));-1)*SQRT([$'Cálculo L y C filtro pi'.B$9]/[$'Cálculo L y C filtro pi'.B$8]) -> 30.8732668949967 | E976: of:=POWER(IMABS(IMSQRT(1-POWER([.C976];2)));-1)*SQRT([$'Cálculo L y C filtro pi'.B$18]/[$'Cálculo L y C filtro pi'.B$17]) -> 617.465337899934
A977: 974 | B977: of:=2*PI()*[.A977] -> 6119.82248919292 | C977: of:=[.B977]/(2*PI()*[$Descripción.B$10]) -> 19.48 | D977: of:=POWER(IMABS(IMSQRT(1-POWER([.C977];2)));-1)*SQRT([$'Cálculo L y C filtro pi'.B$9]/[$'Cálculo L y C filtro pi'.B$8]) -> 30.8414857012392 | E977: of:=POWER(IMABS(IMSQRT(1-POWER([.C977];2)));-1)*SQRT([$'Cálculo L y C filtro pi'.B$18]/[$'Cálculo L y C filtro pi'.B$17]) -> 616.829714024785
A978: 975 | B978: of:=2*PI()*[.A978] -> 6126.1056745001 | C978: of:=[.B978]/(2*PI()*[$Descripción.B$10]) -> 19.5 | D978: of:=POWER(IMABS(IMSQRT(1-POWER([.C978];2)));-1)*SQRT([$'Cálculo L y C filtro pi'.B$9]/[$'Cálculo L y C filtro pi'.B$8]) -> 30.8097699577859 | E978: of:=POWER(IMABS(IMSQRT(1-POWER([.C978];2)));-1)*SQRT([$'Cálculo L y C filtro pi'.B$18]/[$'Cálculo L y C filtro pi'.B$17]) -> 616.195399155718
A979: 976 | B979: of:=2*PI()*[.A979] -> 6132.38885980728 | C979: of:=[.B979]/(2*PI()*[$Descripción.B$10]) -> 19.52 | D979: of:=POWER(IMABS(IMSQRT(1-POWER([.C979];2)));-1)*SQRT([$'Cálculo L y C filtro pi'.B$9]/[$'Cálculo L y C filtro pi'.B$8]) -> 30.7781194623976 | E979: of:=POWER(IMABS(IMSQRT(1-POWER([.C979];2)));-1)*SQRT([$'Cálculo L y C filtro pi'.B$18]/[$'Cálculo L y C filtro pi'.B$17]) -> 615.562389247952
A980: 977 | B980: of:=2*PI()*[.A980] -> 6138.67204511446 | C980: of:=[.B980]/(2*PI()*[$Descripción.B$10]) -> 19.54 | D980: of:=POWER(IMABS(IMSQRT(1-POWER([.C980];2)));-1)*SQRT([$'Cálculo L y C filtro pi'.B$9]/[$'Cálculo L y C filtro pi'.B$8]) -> 30.7465340136693 | E980: of:=POWER(IMABS(IMSQRT(1-POWER([.C980];2)));-1)*SQRT([$'Cálculo L y C filtro pi'.B$18]/[$'Cálculo L y C filtro pi'.B$17]) -> 614.930680273385
A981: 978 | B981: of:=2*PI()*[.A981] -> 6144.95523042164 | C981: of:=[.B981]/(2*PI()*[$Descripción.B$10]) -> 19.56 | D981: of:=POWER(IMABS(IMSQRT(1-POWER([.C981];2)));-1)*SQRT([$'Cálculo L y C filtro pi'.B$9]/[$'Cálculo L y C filtro pi'.B$8]) -> 30.7150134110241 | E981: of:=POWER(IMABS(IMSQRT(1-POWER([.C981];2)));-1)*SQRT([$'Cálculo L y C filtro pi'.B$18]/[$'Cálculo L y C filtro pi'.B$17]) -> 614.300268220481
A982: 979 | B982: of:=2*PI()*[.A982] -> 6151.23841572882 | C982: of:=[.B982]/(2*PI()*[$Descripción.B$10]) -> 19.58 | D982: of:=POWER(IMABS(IMSQRT(1-POWER([.C982];2)));-1)*SQRT([$'Cálculo L y C filtro pi'.B$9]/[$'Cálculo L y C filtro pi'.B$8]) -> 30.683557454711 | E982: of:=POWER(IMABS(IMSQRT(1-POWER([.C982];2)));-1)*SQRT([$'Cálculo L y C filtro pi'.B$18]/[$'Cálculo L y C filtro pi'.B$17]) -> 613.671149094219
A983: 980 | B983: of:=2*PI()*[.A983] -> 6157.52160103599 | C983: of:=[.B983]/(2*PI()*[$Descripción.B$10]) -> 19.6 | D983: of:=POWER(IMABS(IMSQRT(1-POWER([.C983];2)));-1)*SQRT([$'Cálculo L y C filtro pi'.B$9]/[$'Cálculo L y C filtro pi'.B$8]) -> 30.6521659457991 | E983: of:=POWER(IMABS(IMSQRT(1-POWER([.C983];2)));-1)*SQRT([$'Cálculo L y C filtro pi'.B$18]/[$'Cálculo L y C filtro pi'.B$17]) -> 613.043318915983
A984: 981 | B984: of:=2*PI()*[.A984] -> 6163.80478634317 | C984: of:=[.B984]/(2*PI()*[$Descripción.B$10]) -> 19.62 | D984: of:=POWER(IMABS(IMSQRT(1-POWER([.C984];2)));-1)*SQRT([$'Cálculo L y C filtro pi'.B$9]/[$'Cálculo L y C filtro pi'.B$8]) -> 30.6208386861739 | E984: of:=POWER(IMABS(IMSQRT(1-POWER([.C984];2)));-1)*SQRT([$'Cálculo L y C filtro pi'.B$18]/[$'Cálculo L y C filtro pi'.B$17]) -> 612.416773723478
A985: 982 | B985: of:=2*PI()*[.A985] -> 6170.08797165035 | C985: of:=[.B985]/(2*PI()*[$Descripción.B$10]) -> 19.64 | D985: of:=POWER(IMABS(IMSQRT(1-POWER([.C985];2)));-1)*SQRT([$'Cálculo L y C filtro pi'.B$9]/[$'Cálculo L y C filtro pi'.B$8]) -> 30.5895754785333 | E985: of:=POWER(IMABS(IMSQRT(1-POWER([.C985];2)));-1)*SQRT([$'Cálculo L y C filtro pi'.B$18]/[$'Cálculo L y C filtro pi'.B$17]) -> 611.791509570667
A986: 983 | B986: of:=2*PI()*[.A986] -> 6176.37115695753 | C986: of:=[.B986]/(2*PI()*[$Descripción.B$10]) -> 19.66 | D986: of:=POWER(IMABS(IMSQRT(1-POWER([.C986];2)));-1)*SQRT([$'Cálculo L y C filtro pi'.B$9]/[$'Cálculo L y C filtro pi'.B$8]) -> 30.558376126383 | E986: of:=POWER(IMABS(IMSQRT(1-POWER([.C986];2)));-1)*SQRT([$'Cálculo L y C filtro pi'.B$18]/[$'Cálculo L y C filtro pi'.B$17]) -> 611.16752252766
A987: 984 | B987: of:=2*PI()*[.A987] -> 6182.65434226471 | C987: of:=[.B987]/(2*PI()*[$Descripción.B$10]) -> 19.68 | D987: of:=POWER(IMABS(IMSQRT(1-POWER([.C987];2)));-1)*SQRT([$'Cálculo L y C filtro pi'.B$9]/[$'Cálculo L y C filtro pi'.B$8]) -> 30.5272404340331 | E987: of:=POWER(IMABS(IMSQRT(1-POWER([.C987];2)));-1)*SQRT([$'Cálculo L y C filtro pi'.B$18]/[$'Cálculo L y C filtro pi'.B$17]) -> 610.544808680661
A988: 985 | B988: of:=2*PI()*[.A988] -> 6188.93752757189 | C988: of:=[.B988]/(2*PI()*[$Descripción.B$10]) -> 19.7 | D988: of:=POWER(IMABS(IMSQRT(1-POWER([.C988];2)));-1)*SQRT([$'Cálculo L y C filtro pi'.B$9]/[$'Cálculo L y C filtro pi'.B$8]) -> 30.4961682065931 | E988: of:=POWER(IMABS(IMSQRT(1-POWER([.C988];2)));-1)*SQRT([$'Cálculo L y C filtro pi'.B$18]/[$'Cálculo L y C filtro pi'.B$17]) -> 609.923364131862
A989: 986 | B989: of:=2*PI()*[.A989] -> 6195.22071287907 | C989: of:=[.B989]/(2*PI()*[$Descripción.B$10]) -> 19.72 | D989: of:=POWER(IMABS(IMSQRT(1-POWER([.C989];2)));-1)*SQRT([$'Cálculo L y C filtro pi'.B$9]/[$'Cálculo L y C filtro pi'.B$8]) -> 30.4651592499683 | E989: of:=POWER(IMABS(IMSQRT(1-POWER([.C989];2)));-1)*SQRT([$'Cálculo L y C filtro pi'.B$18]/[$'Cálculo L y C filtro pi'.B$17]) -> 609.303184999366
A990: 987 | B990: of:=2*PI()*[.A990] -> 6201.50389818625 | C990: of:=[.B990]/(2*PI()*[$Descripción.B$10]) -> 19.74 | D990: of:=POWER(IMABS(IMSQRT(1-POWER([.C990];2)));-1)*SQRT([$'Cálculo L y C filtro pi'.B$9]/[$'Cálculo L y C filtro pi'.B$8]) -> 30.4342133708558 | E990: of:=POWER(IMABS(IMSQRT(1-POWER([.C990];2)));-1)*SQRT([$'Cálculo L y C filtro pi'.B$18]/[$'Cálculo L y C filtro pi'.B$17]) -> 608.684267417115
A991: 988 | B991: of:=2*PI()*[.A991] -> 6207.78708349343 | C991: of:=[.B991]/(2*PI()*[$Descripción.B$10]) -> 19.76 | D991: of:=POWER(IMABS(IMSQRT(1-POWER([.C991];2)));-1)*SQRT([$'Cálculo L y C filtro pi'.B$9]/[$'Cálculo L y C filtro pi'.B$8]) -> 30.4033303767402 | E991: of:=POWER(IMABS(IMSQRT(1-POWER([.C991];2)));-1)*SQRT([$'Cálculo L y C filtro pi'.B$18]/[$'Cálculo L y C filtro pi'.B$17]) -> 608.066607534804
A992: 989 | B992: of:=2*PI()*[.A992] -> 6214.07026880061 | C992: of:=[.B992]/(2*PI()*[$Descripción.B$10]) -> 19.78 | D992: of:=POWER(IMABS(IMSQRT(1-POWER([.C992];2)));-1)*SQRT([$'Cálculo L y C filtro pi'.B$9]/[$'Cálculo L y C filtro pi'.B$8]) -> 30.3725100758899 | E992: of:=POWER(IMABS(IMSQRT(1-POWER([.C992];2)));-1)*SQRT([$'Cálculo L y C filtro pi'.B$18]/[$'Cálculo L y C filtro pi'.B$17]) -> 607.450201517798
A993: 990 | B993: of:=2*PI()*[.A993] -> 6220.35345410779 | C993: of:=[.B993]/(2*PI()*[$Descripción.B$10]) -> 19.8 | D993: of:=POWER(IMABS(IMSQRT(1-POWER([.C993];2)));-1)*SQRT([$'Cálculo L y C filtro pi'.B$9]/[$'Cálculo L y C filtro pi'.B$8]) -> 30.3417522773526 | E993: of:=POWER(IMABS(IMSQRT(1-POWER([.C993];2)));-1)*SQRT([$'Cálculo L y C filtro pi'.B$18]/[$'Cálculo L y C filtro pi'.B$17]) -> 606.835045547052
A994: 991 | B994: of:=2*PI()*[.A994] -> 6226.63663941497 | C994: of:=[.B994]/(2*PI()*[$Descripción.B$10]) -> 19.82 | D994: of:=POWER(IMABS(IMSQRT(1-POWER([.C994];2)));-1)*SQRT([$'Cálculo L y C filtro pi'.B$9]/[$'Cálculo L y C filtro pi'.B$8]) -> 30.3110567909519 | E994: of:=POWER(IMABS(IMSQRT(1-POWER([.C994];2)));-1)*SQRT([$'Cálculo L y C filtro pi'.B$18]/[$'Cálculo L y C filtro pi'.B$17]) -> 606.221135819039
A995: 992 | B995: of:=2*PI()*[.A995] -> 6232.91982472215 | C995: of:=[.B995]/(2*PI()*[$Descripción.B$10]) -> 19.84 | D995: of:=POWER(IMABS(IMSQRT(1-POWER([.C995];2)));-1)*SQRT([$'Cálculo L y C filtro pi'.B$9]/[$'Cálculo L y C filtro pi'.B$8]) -> 30.2804234272831 | E995: of:=POWER(IMABS(IMSQRT(1-POWER([.C995];2)));-1)*SQRT([$'Cálculo L y C filtro pi'.B$18]/[$'Cálculo L y C filtro pi'.B$17]) -> 605.608468545662
A996: 993 | B996: of:=2*PI()*[.A996] -> 6239.20301002933 | C996: of:=[.B996]/(2*PI()*[$Descripción.B$10]) -> 19.86 | D996: of:=POWER(IMABS(IMSQRT(1-POWER([.C996];2)));-1)*SQRT([$'Cálculo L y C filtro pi'.B$9]/[$'Cálculo L y C filtro pi'.B$8]) -> 30.2498519977094 | E996: of:=POWER(IMABS(IMSQRT(1-POWER([.C996];2)));-1)*SQRT([$'Cálculo L y C filtro pi'.B$18]/[$'Cálculo L y C filtro pi'.B$17]) -> 604.997039954189
A997: 994 | B997: of:=2*PI()*[.A997] -> 6245.48619533651 | C997: of:=[.B997]/(2*PI()*[$Descripción.B$10]) -> 19.88 | D997: of:=POWER(IMABS(IMSQRT(1-POWER([.C997];2)));-1)*SQRT([$'Cálculo L y C filtro pi'.B$9]/[$'Cálculo L y C filtro pi'.B$8]) -> 30.2193423143577 | E997: of:=POWER(IMABS(IMSQRT(1-POWER([.C997];2)));-1)*SQRT([$'Cálculo L y C filtro pi'.B$18]/[$'Cálculo L y C filtro pi'.B$17]) -> 604.386846287154
A998: 995 | B998: of:=2*PI()*[.A998] -> 6251.76938064369 | C998: of:=[.B998]/(2*PI()*[$Descripción.B$10]) -> 19.9 | D998: of:=POWER(IMABS(IMSQRT(1-POWER([.C998];2)));-1)*SQRT([$'Cálculo L y C filtro pi'.B$9]/[$'Cálculo L y C filtro pi'.B$8]) -> 30.188894190115 | E998: of:=POWER(IMABS(IMSQRT(1-POWER([.C998];2)));-1)*SQRT([$'Cálculo L y C filtro pi'.B$18]/[$'Cálculo L y C filtro pi'.B$17]) -> 603.777883802301
A999: 996 | B999: of:=2*PI()*[.A999] -> 6258.05256595087 | C999: of:=[.B999]/(2*PI()*[$Descripción.B$10]) -> 19.92 | D999: of:=POWER(IMABS(IMSQRT(1-POWER([.C999];2)));-1)*SQRT([$'Cálculo L y C filtro pi'.B$9]/[$'Cálculo L y C filtro pi'.B$8]) -> 30.1585074386247 | E999: of:=POWER(IMABS(IMSQRT(1-POWER([.C999];2)));-1)*SQRT([$'Cálculo L y C filtro pi'.B$18]/[$'Cálculo L y C filtro pi'.B$17]) -> 603.170148772494
A1000: 997 | B1000: of:=2*PI()*[.A1000] -> 6264.33575125805 | C1000: of:=[.B1000]/(2*PI()*[$Descripción.B$10]) -> 19.94 | D1000: of:=POWER(IMABS(IMSQRT(1-POWER([.C1000];2)));-1)*SQRT([$'Cálculo L y C filtro pi'.B$9]/[$'Cálculo L y C filtro pi'.B$8]) -> 30.1281818742823 | E1000: of:=POWER(IMABS(IMSQRT(1-POWER([.C1000];2)));-1)*SQRT([$'Cálculo L y C filtro pi'.B$18]/[$'Cálculo L y C filtro pi'.B$17]) -> 602.563637485647
A1001: 998 | B1001: of:=2*PI()*[.A1001] -> 6270.61893656523 | C1001: of:=[.B1001]/(2*PI()*[$Descripción.B$10]) -> 19.96 | D1001: of:=POWER(IMABS(IMSQRT(1-POWER([.C1001];2)));-1)*SQRT([$'Cálculo L y C filtro pi'.B$9]/[$'Cálculo L y C filtro pi'.B$8]) -> 30.0979173122322 | E1001: of:=POWER(IMABS(IMSQRT(1-POWER([.C1001];2)));-1)*SQRT([$'Cálculo L y C filtro pi'.B$18]/[$'Cálculo L y C filtro pi'.B$17]) -> 601.958346244643
A1002: 999 | B1002: of:=2*PI()*[.A1002] -> 6276.90212187241 | C1002: of:=[.B1002]/(2*PI()*[$Descripción.B$10]) -> 19.98 | D1002: of:=POWER(IMABS(IMSQRT(1-POWER([.C1002];2)));-1)*SQRT([$'Cálculo L y C filtro pi'.B$9]/[$'Cálculo L y C filtro pi'.B$8]) -> 30.0677135683632 | E1002: of:=POWER(IMABS(IMSQRT(1-POWER([.C1002];2)));-1)*SQRT([$'Cálculo L y C filtro pi'.B$18]/[$'Cálculo L y C filtro pi'.B$17]) -> 601.354271367263
A1003: 1000 | B1003: of:=2*PI()*[.A1003] -> 6283.18530717959 | C1003: of:=[.B1003]/(2*PI()*[$Descripción.B$10]) -> 20 | D1003: of:=POWER(IMABS(IMSQRT(1-POWER([.C1003];2)));-1)*SQRT([$'Cálculo L y C filtro pi'.B$9]/[$'Cálculo L y C filtro pi'.B$8]) -> 30.0375704593055 | E1003: of:=POWER(IMABS(IMSQRT(1-POWER([.C1003];2)));-1)*SQRT([$'Cálculo L y C filtro pi'.B$18]/[$'Cálculo L y C filtro pi'.B$17]) -> 600.75140918611